id	Username	Text	Date	Retweets	Favorites	Mentions	Hashtags	Geo	Permalink
22218856462286848	LSnowden	 gma entertainment pete postlethwaite dies cancer david arquette checks rehab alcohol depression culkin kunis split	2011-01-04	0	0				https://twitter.com/LSnowden/status/22218856462286848
22064755992698880	Tru_ManOfSteel	 zodiacfacts zodiacfacts cancer personality traits kind sensitive nurturing imaginative patriotic so true	2011-01-03	0	0	@ZodiacFacts	#ZodiacFacts #Cancer		https://twitter.com/Tru_ManOfSteel/status/22064755992698880
151758708421042176	35125	 alabama soldier returns home finds son cancer http bitlyvc t x via http outsidein 	2011-12-27	0	0				https://twitter.com/35125/status/151758708421042176
150753610471452672	SydRebMon	 mom gets cancer sort called it	2011-12-24	1	0				https://twitter.com/SydRebMon/status/150753610471452672
150753443529764865	SydRebMon	 dont blame him smoking nasty would want take minutes life get lung cancer bingo	2011-12-24	0	0				https://twitter.com/SydRebMon/status/150753443529764865
148486632042008576	LazyBaked	 xstrology cancer emotional accept accept them its never going change canigetanamen 	2011-12-18	0	0	@XSTROLOGY	#Cancer #canigetanamen		https://twitter.com/LazyBaked/status/148486632042008576
148246329284501504	aclingan25	 sosterbind mouth cancer hurts hahaha	2011-12-17	0	0	@sosterbind27			https://twitter.com/aclingan25/status/148246329284501504
147710398026616832	daddysbadnurse	 u dont smoke green leafs cant smoke u ill pass lung cancer thx	2011-12-16	0	0				https://twitter.com/daddysbadnurse/status/147710398026616832
147147987070615552	Its_Key_Air_Ra	 zodiacfacts libra strange attractors cancer capricorn	2011-12-14	0	0	@ZodiacFacts	#Libra		https://twitter.com/Its_Key_Air_Ra/status/147147987070615552
144827656133820417	mattfowler	 blood test monitor cancer full waiting room might miss lunch firstworldpains http sqcomvofynn	2011-12-08	0	0		#firstworldpains		https://twitter.com/mattfowler/status/144827656133820417
144820224565313536	jessie_wallace7	 two hour discussion skin cancer im concerned freckles approblems	2011-12-08	0	0		#approblems		https://twitter.com/jessie_wallace7/status/144820224565313536
144432223645470721	1000Hearts	 sitting friend the cancer center huntsville http sqcomur oid	2011-12-07	0	0	@The			https://twitter.com/1000Hearts/status/144432223645470721
143803861885386752	profcalhounasu	 o_magazine increase cancer related something used many people baby bottles canned soups staples globally	2011-12-05	0	0	@O_Magazine			https://twitter.com/profcalhounasu/status/143803861885386752
142101941613375488	pamrainh2o	 suzidk know prayers continue guys cancer beast god bigger	2011-11-30	0	0	@Suzidk			https://twitter.com/pamrainh2o/status/142101941613375488
141022044216238080	Tyshizzlee	 princesstiny a year old girl terminal w cancer made bucket list one wishes trend twitter	2011-11-28	0	0	@PrincessTiny13			https://twitter.com/Tyshizzlee/status/141022044216238080
141020811896164352	ThtBxAint_KECHA	 accessdenied__ cancer around ur vaginal area	2011-11-28	0	0	@AccessDenied__			https://twitter.com/ThtBxAint_KECHA/status/141020811896164352
140557805538131968	JaycezMom	 rt toyawright year old girl terminal w cancer made bucket list wishes cont http tlgded g 	2011-11-26	0	0	@ToyaWright			https://twitter.com/JaycezMom/status/140557805538131968
139570971928567808	savkumke1	 miilkkk disney make hairless princess little girls cancer feel beautiful sotrue everyoneisbeautifultho	2011-11-24	0	0	@miilkkk	#sotrue #everyoneisbeautifultho		https://twitter.com/savkumke1/status/139570971928567808
139107981760528385	ThtBxAint_KECHA	 doc said strong chance havinq cervical cancer got mad bc said idnt care 	2011-11-22	0	0				https://twitter.com/ThtBxAint_KECHA/status/139107981760528385
138636555559501824	heckhelm	 pride spiritual cancer eats every possibility love contentment even common sense cs lewis	2011-11-21	0	0				https://twitter.com/heckhelm/status/138636555559501824
137395257624117248	Ayo_Erin	 oomf going get throat cancer 	2011-11-18	0	0		#oomf		https://twitter.com/Ayo_Erin/status/137395257624117248
136887469835694081	QueenBrinae	 so gma years breast cancer survival 	2011-11-16	0	0				https://twitter.com/QueenBrinae/status/136887469835694081
136643968959127552	kaitbrooke_	 hate cancer 	2011-11-15	0	0				https://twitter.com/kaitbrooke_/status/136643968959127552
136538731963359232	TKALLENN	 _itstayputman_ oh shiddd im glad bet feels better knowing cancer 	2011-11-15	0	0	@_ItsTayPutman_			https://twitter.com/TKALLENN/status/136538731963359232
136504161717071872	kaitbrooke_	 hate cancer jesus name uncle bobby gonna perfectly finen	2011-11-15	0	0				https://twitter.com/kaitbrooke_/status/136504161717071872
136098544267440128	BruceLBryant	 barbermotorpark accelerate cancer cure http tinyurlcom pcok http fbme qilcscij fb	2011-11-14	0	0	@BarberMotorPark	#fb		https://twitter.com/BruceLBryant/status/136098544267440128
135252832931688448	drewnorriss	 emmaktowers cancer	2011-11-12	0	0	@emmaktowers			https://twitter.com/drewnorriss/status/135252832931688448
134387235301761024	TheRealEfo	 nickimlinaj cancer	2011-11-09	0	0	@NICKIMlINAJ	#Cancer		https://twitter.com/TheRealEfo/status/134387235301761024
134155988566687744	TheRealEfo	 nickiminaj cancer 	2011-11-09	0	0	@NICKIMINAJ			https://twitter.com/TheRealEfo/status/134155988566687744
134053472566915072	LOVEme_ke	 xstrology cancer s make fall blink eye	2011-11-08	0	0	@XSTROLOGY	#Cancer		https://twitter.com/LOVEme_ke/status/134053472566915072
133782051982819328	LOVEme_ke	 xstrology cancer best sex capricorn scorpio pisces virgo 	2011-11-08	0	0	@XSTROLOGY	#CANCER		https://twitter.com/LOVEme_ke/status/133782051982819328
133657148977709057	kyleeeee_	 itsayysian thats cigarette thats cancer stick form harley_nicolee _juliamatthews_ omg made life 	2011-11-07	0	0	@ItsAYYSIAN @Harley_Nicolee @_juliamatthews_			https://twitter.com/kyleeeee_/status/133657148977709057
133431857076379649	_NotURAverage	 factsaboutme sensative cancer	2011-11-07	0	0		#FACTSABOUTME #cancer		https://twitter.com/_NotURAverage/status/133431857076379649
132893860438347776	johnalexg_	 _courtneyyjones john throat cancer 	2011-11-05	0	0	@_CourtneyyJones			https://twitter.com/johnalexg_/status/132893860438347776
132870289892716544	TheRealEfo	 zodiacfacts cancer need tune mood swings learn hold back proactive	2011-11-05	0	0	@ZodiacFacts	#Cancer		https://twitter.com/TheRealEfo/status/132870289892716544
132828547839569920	Bridge_Garner	 breast cancer affects patient affects family well	2011-11-05	0	0				https://twitter.com/Bridge_Garner/status/132828547839569920
132827170996359168	Bridge_Garner	 grammie breast cancer fighter lost battle years ago sadmoment	2011-11-05	0	0		#SadMoment		https://twitter.com/Bridge_Garner/status/132827170996359168
132826184122777601	Bridge_Garner	 everytime watch something breast cancer cry itzreal	2011-11-05	0	0		#ItzReal		https://twitter.com/Bridge_Garner/status/132826184122777601
132825970494275585	Bridge_Garner	 back breast cancer near dear heart	2011-11-05	0	0				https://twitter.com/Bridge_Garner/status/132825970494275585
132825188780867584	Bridge_Garner	 breast cancer real getchecked	2011-11-05	0	0		#GetChecked		https://twitter.com/Bridge_Garner/status/132825188780867584
131887000516177920	johnalexg_	 _courtneyyjones know its gonna suck bad cancer though wouldnt know id myself	2011-11-02	0	0	@_CourtneyyJones			https://twitter.com/johnalexg_/status/131887000516177920
131328093796319232	kc_gibson1	 pink chs breast cancer awareness	2011-11-01	0	0	@CHS	#PINK		https://twitter.com/kc_gibson1/status/131328093796319232
130974026511286272	dejNOloaf__	 happy halloween wearing pink support breast cancer today 	2011-10-31	0	0				https://twitter.com/dejNOloaf__/status/130974026511286272
130854910400008193	topix_al	 breast cancer cant keep local woman http bitlyvr hso attalla alabama	2011-10-30	0	0		#Attalla #Alabama		https://twitter.com/topix_al/status/130854910400008193
130771157489156096	AshleeDelaine	 awkward moment everyone thinks adele cancer not vocal cord hemorrhage prayforadele	2011-10-30	0	0		#prayforadele		https://twitter.com/AshleeDelaine/status/130771157489156096
130367282537963520	mckinley_rae14	 what marry bald guy cancer sarah d	2011-10-29	0	1				https://twitter.com/mckinley_rae14/status/130367282537963520
130277423529988096	codyg1985	 ginny k breast cancer research guntersville civitan park horseshoes http sqcomvvxrbs	2011-10-29	0	0	@Guntersville			https://twitter.com/codyg1985/status/130277423529988096
130122794192211968	jtt91	 damn swear relationship sagitarius cancer aint meant cancer femalesome weird sensitive wtrwaijs	2011-10-28	0	0				https://twitter.com/jtt91/status/130122794192211968
129979847907868672	rhgraves65	 b match benefitting canine cancer agribition center http sqcomud pis	2011-10-28	0	0	@Agribition			https://twitter.com/rhgraves65/status/129979847907868672
129694944326721536	cindyannemassey	 im sick cancer wish would go away prayforpuff 	2011-10-27	0	0		#prayforpuff		https://twitter.com/cindyannemassey/status/129694944326721536
129579538719064064	nixmandy	 omgmt holy crap cancer popcorn stuff fumes pretty important thing hr lecture	2011-10-27	0	0	@omgmt			https://twitter.com/nixmandy/status/129579538719064064
129459736499335168	topix_al	 breast cancer awarenes http bitlyvdwmth centre alabama	2011-10-27	0	0		#Centre #Alabama		https://twitter.com/topix_al/status/129459736499335168
129021916332826624	SpottieOttie__	 showwillyotitties october brest cancer awareness proud fun bags willy_auto	2011-10-25	1	0	@Willy_auto	#ShowWillYoTitties		https://twitter.com/SpottieOttie__/status/129021916332826624
128916516107321344	di_adams5	 foxnews yes boys girls alike continue letting cancer causing virus spread	2011-10-25	0	0	@FoxNews			https://twitter.com/di_adams5/status/128916516107321344
128899764971503616	ryno6604	 fight oursoaps believe its wig since breast cancer completed chemo return u lose hair chemo times	2011-10-25	0	0	@Fight4OurSoaps @times			https://twitter.com/ryno6604/status/128899764971503616
128666890053746688	ChasingConcrete	 crownmisscece maams breast cancer pics	2011-10-24	0	0	@CROWNMissCeCe			https://twitter.com/ChasingConcrete/status/128666890053746688
128510708534091776	StephanieEQuinn	 real_niclewis hah sorry cant money goes breast cancer foundation its worth 	2011-10-24	0	0	@real_NicLewis			https://twitter.com/StephanieEQuinn/status/128510708534091776
128267444874788866	topix_ga	 locals turn show support breast cancer awareness http bitlyopsqy rome georgia	2011-10-23	0	0		#Rome #Georgia		https://twitter.com/topix_ga/status/128267444874788866
128083658857918464	hiphealthychick	 kris_carr supersoulsunday talking cancer journey know is conquered stage inspiration	2011-10-23	0	0	@Kris_Carr @SuperSoulSunday	#inspiration		https://twitter.com/hiphealthychick/status/128083658857918464
127058805518376961	Gezzy_Said	 comin walk breast cancer awareness campus isupportbreastcancer	2011-10-20	0	0		#IsupportBreastCancer		https://twitter.com/Gezzy_Said/status/127058805518376961
126754545576579072	Gezzy_Said	 need breast cancer tshirt wear walk tomorrow	2011-10-19	0	0				https://twitter.com/Gezzy_Said/status/126754545576579072
126492437903446016	ApolloKid01	 im wearing pink rest month honor nana yr breast cancer survivor im glad shes still here	2011-10-18	0	0				https://twitter.com/ApolloKid01/status/126492437903446016
126387574192349184	ryno6604	 brookeburke many thanks supporting breast cancer awareness getting word	2011-10-18	0	0	@brookeburke			https://twitter.com/ryno6604/status/126387574192349184
126096568842592257	JosephDPuckett	 rt eonline es giuliana rancic reveals battle breast cancer http eonlineqplw u fb	2011-10-17	0	0	@eonline	#fb		https://twitter.com/JosephDPuckett/status/126096568842592257
126019033022742528	ryno6604	 opry next weekend celebrate yr survivor breast cancer ill husband lovemethroughit	2011-10-17	0	0	@opry	#lovemethroughit		https://twitter.com/ryno6604/status/126019033022742528
125759322528546816	ipsycho10	 cancer really grandma u gone like that	2011-10-16	0	0				https://twitter.com/ipsycho10/status/125759322528546816
125423649971908608	ChasingConcrete	 rt ohlala_madamjas chasingconcrete u able schedule dancin divas breast cancer awareness pics yes lord	2011-10-16	0	0	@OhLaLa_MadamJas @ChasingConcrete			https://twitter.com/ChasingConcrete/status/125423649971908608
125118297481027584	ChasingConcrete	 cant wait support breast cancer events tomorrow liz hurley event female rap show warmer	2011-10-15	0	0				https://twitter.com/ChasingConcrete/status/125118297481027584
125039405453934592	itsmevikkitee	 zodiacfacts definitely cancer leo cusp	2011-10-14	0	0	@ZodiacFacts			https://twitter.com/itsmevikkitee/status/125039405453934592
125039005925523456	itsmevikkitee	 zodiacfacts definitely cancer leo cusp	2011-10-14	0	0	@ZodiacFacts			https://twitter.com/itsmevikkitee/status/125039005925523456
124858902620811265	Bdiamond42	 stuartscott tyler hansbrough raisin cancer research http yfrogcomoec kwj best heels ever	2011-10-14	0	0	@StuartScott			https://twitter.com/Bdiamond42/status/124858902620811265
124174493328490497	Gezzy_Said	 uhmmm womanwants walk around naked woman front whole shirt bc back says support breast cancer ijs	2011-10-12	0	0		#ijs		https://twitter.com/Gezzy_Said/status/124174493328490497
124174235060015104	Gezzy_Said	 ok u selling shirts support beast cancer bc half naked woman def wont buy	2011-10-12	0	0				https://twitter.com/Gezzy_Said/status/124174235060015104
124145885763469312	Gezzy_Said	 think im going get breast cancer tag next car random	2011-10-12	0	0		#random		https://twitter.com/Gezzy_Said/status/124145885763469312
124145561254375426	Gezzy_Said	 support breast cancer add twibbon ur profile tcotbyv zm	2011-10-12	0	0		#twibbon		https://twitter.com/Gezzy_Said/status/124145561254375426
124139461071212544	JL24601	 hey october breast cancer awareness monthfeel boobies	2011-10-12	0	0				https://twitter.com/JL24601/status/124139461071212544
123810520447987712	MrWhteChocolate	 uadennychimes every follower connectcrimson gets month donating breast cancer research rt follow	2011-10-11	0	0	@UADennyChimes @ConnectCrimson			https://twitter.com/MrWhteChocolate/status/123810520447987712
123788324509990914	brolenejo	 taylor_downey uncle ive never met bc aunt remarried died past year shrinks brain caused cancer	2011-10-11	0	0	@taylor_downey			https://twitter.com/brolenejo/status/123788324509990914
123743393904992256	ryno6604	 knowjr heykim thanks supporting breast cancer survivor u dance well	2011-10-11	0	0	@knowjr @heykim			https://twitter.com/ryno6604/status/123743393904992256
123607137728462849	DiVa_Red19	 yea movie five tearsbreast cancer jokethr harm getting check knowing inspiredmovie	2011-10-10	0	0		#inspiredmovie		https://twitter.com/DiVa_Red19/status/123607137728462849
123498264828977152	TheRealEfo	 early detection best fight breast cancer 	2011-10-10	0	0				https://twitter.com/TheRealEfo/status/123498264828977152
122861746686926848	Bruno244	 think nolan ryan skin cancer 	2011-10-08	0	0				https://twitter.com/Bruno244/status/122861746686926848
122692915599392768	ChasingConcrete	 rt diirty_d chasingconcrete hello p almost ready ur breast cancer shoot	2011-10-08	0	0	@DiiRtY_D33 @ChasingConcrete			https://twitter.com/ChasingConcrete/status/122692915599392768
122046195198726144	FilmNeThangENT	 slogan breast cancer awareness month we stare cause care	2011-10-06	0	0				https://twitter.com/FilmNeThangENT/status/122046195198726144
121943694797578240	topix_al	 huntsville madison fire departments going pink tshirts fight breast cancer http bitlyqxev g huntsville alabama	2011-10-06	0	0		#Huntsville #Alabama		https://twitter.com/topix_al/status/121943694797578240
121750264096096257	DonaldHarmon	 gamecrashers fuck pancreatic cancer well said sir	2011-10-05	0	0	@Gamecrashers			https://twitter.com/DonaldHarmon/status/121750264096096257
121258947905732610	topix_ga	 information exchange pilot change cancer care http bitlynzowql rome georgia	2011-10-04	0	0		#Rome #Georgia		https://twitter.com/topix_ga/status/121258947905732610
121044402897555456	ChasingConcrete	 im something benefit breast cancer look come simply take picture donate money http lockerzcoms 	2011-10-03	1	0				https://twitter.com/ChasingConcrete/status/121044402897555456
120963255328968704	TheRealEfo	 captainramshack save da tatas breast cancer awareness month	2011-10-03	0	0	@CaptainRamshack			https://twitter.com/TheRealEfo/status/120963255328968704
120847639376957440	yatown_news	 ovarian cancer eludes early testing videothe birmingham news alcom blog lakehighlands birmingham http yatowncomnewslakehigh landsbirminghamalovariancancereludesearlytestingvideopbthebirminghamnewsalcom blog lolakehighlands cbirmingham calsnbyhannahwolfsonthebirminghamnewssusanleightonknewshewasintroublewhentheothercancerpatientsfeltbadforherleightonjoinedasupportgroupsoonafterbeingdiagnosedwithovariancancerin and casmemberswentaroundthe cb e c fb eviytiovariancancereludesearlytesting video xuhttp a f fblogalcom flivingnews f f fovarian_cancer_eludes_early_tehtmlimhttp a f fmediaalcom flivingnews fphoto f smalljpgsrctw 	2011-10-03	0	0		#LakeHighlands #Birmingham		https://twitter.com/yatown_news/status/120847639376957440
120621106901168128	yatown_news	 breast cancer survivors form bond sunday school classalcom blog englishterrace huntsville http yatowncomnewsenglisht erracehuntsvillealbreastcancersurvivorsformbondinsamesundayschoolclasspbalcom blog loenglishterrace chuntsville calsnbypaulgattis cthehuntsvilletimesdorothycoleman cmaryhagerandjoycourtney lefttoright arebreastcancersurvivorswhoshareaspecialbondbybeinginthesamesundayschoolclassatcrosspointechurch thehuntsvilletimes fericschultz cb e c fb eviytibreastcancersurvivorsformbondinsamesundayschoolclassxuhttp a f fblogalcom fbreaking f f fbreast_cancer_survivors_form_bhtmlimhttp a f fmediaalcom fbreaking fphoto f largejpgsrctw 	2011-10-02	0	0		#EnglishTerrace #Huntsville		https://twitter.com/yatown_news/status/120621106901168128
120619229111271425	ryno6604	 alainaxlove thanks riding breast cancer survivor breast cancer warrio	2011-10-02	0	0	@AlainaxLove			https://twitter.com/ryno6604/status/120619229111271425
120597892833619969	TheRealEfo	 breast cancer awareness month	2011-10-02	0	0				https://twitter.com/TheRealEfo/status/120597892833619969
120382166394863616	Its_Key_Air_Ra	 collegekidjones oct _ whatyoushouldknowaboutme cancer survivor god good amen	2011-10-02	0	0	@collegekidjones @Oct1_	#whatyoushouldknowaboutme		https://twitter.com/Its_Key_Air_Ra/status/120382166394863616
120380999090704384	Its_Key_Air_Ra	 whatyoushouldknowaboutme cancer survivor	2011-10-02	0	0		#whatyoushouldknowaboutme		https://twitter.com/Its_Key_Air_Ra/status/120380999090704384
120353245620219904	WhitJanay	 new avi bodies breast cancer awareness	2011-10-02	0	0				https://twitter.com/WhitJanay/status/120353245620219904
120233404678676480	Its_Key_Air_Ra	 wear breast cancer pin proudly	2011-10-01	0	0				https://twitter.com/Its_Key_Air_Ra/status/120233404678676480
120163371034218497	Its_Key_Air_Ra	 breast cancer awareness month	2011-10-01	0	0				https://twitter.com/Its_Key_Air_Ra/status/120163371034218497
119908264409448448	HIGGS2WATCHEZ	 missprettym u cancer	2011-09-30	0	0	@MissPrettyM2U			https://twitter.com/HIGGS2WATCHEZ/status/119908264409448448
119184758742851585	SoaRinGaBov3	 rt xstrology cancer gets irritated feel ignored unappreciated	2011-09-28	0	0	@XSTROLOGY	#Cancer		https://twitter.com/SoaRinGaBov3/status/119184758742851585
119065753306660865	topix_ga	 floyd medical center kickoff breast cancer awareness month sept http bitlyn wdz rome georgia	2011-09-28	0	0		#Rome #Georgia		https://twitter.com/topix_ga/status/119065753306660865
119048633218891776	SoaRinGaBov3	 rt xstrology cancer s sensitive take things heartthis	2011-09-28	0	0	@XSTROLOGY	#Cancer		https://twitter.com/SoaRinGaBov3/status/119048633218891776
117977691264794624	topix_ga	 pink ride hits trail rein cancer http bitlyqldi rome georgia	2011-09-25	0	0		#Rome #Georgia		https://twitter.com/topix_ga/status/117977691264794624
117789665427337217	TheRealEfo	 bedroom cancer man likes command master manual clitoral manipulation	2011-09-24	0	0		#Cancer		https://twitter.com/TheRealEfo/status/117789665427337217
117053194592452608	wikimapper	 dashindoll youre cancer free whats next you	2011-09-22	0	0	@dashindoll			https://twitter.com/wikimapper/status/117053194592452608
116518388431458304	Thoughts2Tweet	 yay lung cancer please feel free smoke front door wallacestate obviously cant read	2011-09-21	0	0	@wallacestate			https://twitter.com/Thoughts2Tweet/status/116518388431458304
114011258902151168	raymanchevy	 dad treating skin cancer harbin clinic dermatology http sqcomp fhvr	2011-09-14	0	0	@Harbin			https://twitter.com/raymanchevy/status/114011258902151168
113644139886821376	ImReallyTrilly	 slow ending relationships like cancer 	2011-09-13	0	0				https://twitter.com/ImReallyTrilly/status/113644139886821376
113348108427067392	TheRealEfo	 zodiacfacts cancer sometimes dont like people see emotional side personality try hide it	2011-09-12	0	0		#ZodiacFacts #Cancer		https://twitter.com/TheRealEfo/status/113348108427067392
113085354143264768	JarquiseLuvJosh	 blkbarbie_gw choir director college past cancer buried friday	2011-09-11	0	0	@BlkBarBie_GW			https://twitter.com/JarquiseLuvJosh/status/113085354143264768
112730038675316736	scobberer	 gritsgal join beer brains bryansbbq mon great food beer raise wbrain cancer http blogsphoenixnewtimescombella bryans_black_mountain_barbecuephp 	2011-09-10	0	0	@GRITSGAL @beer4brains @bryansbbq			https://twitter.com/scobberer/status/112730038675316736
112644192051798016	topix_ga	 sin far deadly cancer http bitlymzzueb rome georgia	2011-09-10	0	0		#Rome #Georgia		https://twitter.com/topix_ga/status/112644192051798016
110726867543261184	topix_al	 administrator says friends family help cancer battle http bitlyotxf a dora alabama	2011-09-05	0	0		#Dora #Alabama		https://twitter.com/topix_al/status/110726867543261184
110659993811959809	30124	 run lemonade stand help fight childhood cancer http bitlypri zv via http outsidein 	2011-09-05	0	0				https://twitter.com/30124/status/110659993811959809
110142837512880128	FindMeWitStacks	 try mother diagnosed breast cancer gradma badlysick ericka didnt give afuck orcall cont http tlgdcs gv 	2011-09-03	0	0				https://twitter.com/FindMeWitStacks/status/110142837512880128
109633433017393152	_Shunterika_	 soo lil breast cancer game fb people really think im weeks	2011-09-02	0	0				https://twitter.com/_Shunterika_/status/109633433017393152
109228673525231617	cstar_golden12	 would buy product cause serious alerfic reactictions seizuresmigranesand increased chance cancer dumbcommercial	2011-09-01	0	0		#Dumbcommercial		https://twitter.com/cstar_golden12/status/109228673525231617
107877392143482880	joshhhsays	 hurricaneireneshouldhavetaken steve jobs cancer 	2011-08-28	0	0		#HurricaneIreneshouldhavetaken		https://twitter.com/joshhhsays/status/107877392143482880
107614209755459585	1003theriver	 white linen wine tonight clearview cancer institute http sqcompxl nq	2011-08-27	0	0	@Clearview			https://twitter.com/1003theriver/status/107614209755459585
107289551290109952	bamamuscle63	 like catch eyelid cancer something	2011-08-26	0	0				https://twitter.com/bamamuscle63/status/107289551290109952
105709809743044608	topix_al	 dine fight cancer support operation education strike pose http bitlypwm l huntsville alabama	2011-08-22	0	0		#Huntsville #Alabama		https://twitter.com/topix_al/status/105709809743044608
104809539823616000	topix_al	 longtime area pastor loses battle cancer http bitlyp wu e jasper alabama	2011-08-20	0	0		#Jasper #Alabama		https://twitter.com/topix_al/status/104809539823616000
104747326811291648	Abigail_TuckJ	 moms surgery went well obvi signs lung cancer thankgoodness	2011-08-19	0	0		#thankgoodness		https://twitter.com/Abigail_TuckJ/status/104747326811291648
104310808049221632	35756	 increased estrogen production could increase risk breast cancer http bitlyriqyu via http outsidein 	2011-08-18	0	0				https://twitter.com/35756/status/104310808049221632
100537555707105280	DustyMcLemore	 courageous woman jean b is obedience midst cancer set tone gods great spirit fall yesterday thx jean	2011-08-08	0	0				https://twitter.com/DustyMcLemore/status/100537555707105280
100473134972538880	35235	 roller skating event helps fight cancer httpbitlyntltgb via httpoutsidein 	2011-08-08	0	0				https://twitter.com/35235/status/100473134972538880
100473134846705664	35126	 roller skating event helps fight cancer httpbitlynvtk a via httpoutsidein 	2011-08-08	0	0				https://twitter.com/35126/status/100473134846705664
100001258840141824	daddysbadnurse	 bitchimamazzin halo appears head noooo wouldnt heart cancer remember lol	2011-08-06	0	0	@BitchImAmazzin			https://twitter.com/daddysbadnurse/status/100001258840141824
98762824137965568	topix_al	 friends holding benefit athens yearold diagnosed rare form cancer httpbitlyqemruv athens alabama	2011-08-03	0	0		#Athens #Alabama		https://twitter.com/topix_al/status/98762824137965568
96793485813886976	ksmith4751	 sexstrology cancer scorpio pisces protective feelings scsims true us case night loves	2011-07-29	0	0	@sexstrology @SCSims	#Cancer		https://twitter.com/ksmith4751/status/96793485813886976
96050175956623360	ksmith4751	 piscesareus pisces cancer shared connection love family scsims lol loves	2011-07-26	0	0	@PiscesAreUs @SCSims	#Pisces #Cancer		https://twitter.com/ksmith4751/status/96050175956623360
93520398897000448	Retata	 bretmichaels awesome person help diabetes cancer survivor know gods help continue work	2011-07-19	0	0	@bretmichaels			https://twitter.com/Retata/status/93520398897000448
