id	Username	Text	Date	Retweets	Favorites	Mentions	Hashtags	Geo	Permalink
23227132138	08861	 perth amboy walk breast cancer spread early detection message httpbitlydtiowr via httpoutsidein 	2010-09-07	0	0				https://twitter.com/08861/status/23227132138
23227131902	08863	 perth amboy walk breast cancer spread early detection message httpbitlybz qfd via httpoutsidein 	2010-09-07	0	0				https://twitter.com/08863/status/23227131902
23227131682	08861	 perth amboy walk breast cancer spread early detection message httpbitlyaegr v via httpoutsidein 	2010-09-07	0	0				https://twitter.com/08861/status/23227131682
23227131421	08861	 perth amboy walk breast cancer spread early detection message httpbitlydrnaqm via httpoutsidein 	2010-09-07	0	0				https://twitter.com/08861/status/23227131421
21471860948	fulmetalartimis	 ieyesis battle watch cancer im going guns blazing wont let take cont httptlgd vg 	2010-08-18	0	0	@ieyesis			https://twitter.com/fulmetalartimis/status/21471860948
21141886577	08901	 cancer institute names new clinical trial leader httpbitlya rcck via httpoutsidein 	2010-08-14	0	0				https://twitter.com/08901/status/21141886577
21131467467	08901	 cancer institute names new clinical trial leader httpbitlydxmcti via httpoutsidein 	2010-08-14	0	0				https://twitter.com/08901/status/21131467467
20356206892	GinaCalandriell	 cancer freeee	2010-08-04	0	0				https://twitter.com/GinaCalandriell/status/20356206892
20232006820	fulmetalartimis	 blackberries packed vitamin k fights prostate cancer fb	2010-08-03	0	0		#fb		https://twitter.com/fulmetalartimis/status/20232006820
19329937165	08863	 colonia athlete tim gigl races past cancer httpbitlydcibvm via httpoutsidein 	2010-07-23	0	0				https://twitter.com/08863/status/19329937165
19329928468	07095	 colonia athlete tim gigl races past cancer httpbitlybct as via httpoutsidein 	2010-07-23	0	0				https://twitter.com/07095/status/19329928468
18174014306	08861	 perth amboy city clerks image billboards raise awareness breast cancer httpbitlybrrbhy via httpoutsidein 	2010-07-10	0	0				https://twitter.com/08861/status/18174014306
17420663707	fulmetalartimis	 coustomer year old x stripperjust stopped years ago due cancer nascar fan knee surgery fb	2010-06-30	0	0		#fb		https://twitter.com/fulmetalartimis/status/17420663707
17141927357	dLinkPhoto	 shooting pm cancer survivor bday party time load pictures sleep	2010-06-27	0	0				https://twitter.com/dLinkPhoto/status/17141927357
16818932903	08901	 north brunswick chilis helping former arson investigator fight cancer httpbitlybcbgdr via httpoutsidein 	2010-06-22	0	0				https://twitter.com/08901/status/16818932903
16516419980	08901	 music moorland a day hope cancer survivors httpbitlyax sua via httpoutsidein 	2010-06-18	0	0				https://twitter.com/08901/status/16516419980
15980652291	08882	 monroe woman battling cancer thanks community hundreds buy tickets fundraiser httpbitlybncdq via httpoutsidein 	2010-06-12	0	0				https://twitter.com/08882/status/15980652291
15980650530	08872	 monroe woman battling cancer thanks community hundreds buy tickets fundraiser httpbitlyawzki via httpoutsidein 	2010-06-12	0	0				https://twitter.com/08872/status/15980650530
15199961330	08837	 free ymca program cancer survivors httpbitlybomleo via httpoutsidein 	2010-06-01	0	0				https://twitter.com/08837/status/15199961330
14745267759	topix_nj	 hair cutathon pancreatic cancer httpbitlydd fcv parlin newjersey	2010-05-26	0	0		#Parlin #NewJersey		https://twitter.com/topix_nj/status/14745267759
14652793484	08879	 hair cutathon pancreatic cancer httpbitly fznwk via httpoutsidein 	2010-05-24	0	0				https://twitter.com/08879/status/14652793484
14652791751	08872	 hair cutathon pancreatic cancer httpbitlyb g uc via httpoutsidein 	2010-05-24	0	0				https://twitter.com/08872/status/14652791751
14652791475	08859	 hair cutathon pancreatic cancer httpbitlya gxen via httpoutsidein 	2010-05-24	0	0				https://twitter.com/08859/status/14652791475
14463424630	08863	 cancer resources offered ymca branches edison metuchen woodbridge httpbitlycopahq via httpoutsidein 	2010-05-21	0	0				https://twitter.com/08863/status/14463424630
14463423817	08837	 cancer resources offered ymca branches edison metuchen woodbridge httpbitlydsg ue via httpoutsidein 	2010-05-21	0	0				https://twitter.com/08837/status/14463423817
14390321671	08901	 former lpga champion promotes awareness breast cancer httpbitlydgcmi via httpoutsidein 	2010-05-20	0	0				https://twitter.com/08901/status/14390321671
13961693037	08901	 young cancer patient lead walk benefit new brunswick hospital httpbitly bnjqr via httpoutsidein 	2010-05-14	0	0				https://twitter.com/08901/status/13961693037
13524645538	08901	 somerset patriots host breast cancer awareness day sunday httpbitlyap x e via httpoutsidein 	2010-05-06	0	0				https://twitter.com/08901/status/13524645538
13159169110	MrCAnderson	 theres still hope rt zodiacfacts zodiacfacts gemini chance scorpio pisces cancer	2010-04-30	0	0	@ZodiacFacts	#ZodiacFacts #Gemini		https://twitter.com/MrCAnderson/status/13159169110
12480505363	07095	 woodbridge nonprofit organizes free bowling games families battling cancer httpbitlyaknddp via httpoutsidein html	2010-04-19	0	0				https://twitter.com/07095/status/12480505363
11326516463	xoBethxo	 httpmainacseventsorgsitetrpx fr_id pgpersonal please wont donate help battle cancer 	2010-03-30	0	0				https://twitter.com/xoBethxo/status/11326516463
10544240242	KenVercammen	 delay diagnose cancer legal representation httpbitlycm my posted oodle	2010-03-15	1	0	@Oodle			https://twitter.com/KenVercammen/status/10544240242
20001863776600064	08901	 allstate new jersey raises cancer fight quotes cure insuran httpbitlyebiwxf via httpoutsidein 	2010-12-29	0	0				https://twitter.com/08901/status/20001863776600064
19906033803591680	08873	 allstate new jersey raises cancer fight quotes cure insuran httpbitlyhjlilv via httpoutsidein 	2010-12-28	0	0				https://twitter.com/08873/status/19906033803591680
18154337175867392	topix_nj	 downmodulation cancer targets using locked nucleic acid httpbitlyezk ah piscataway newjersey	2010-12-23	0	0		#Piscataway #NewJersey		https://twitter.com/topix_nj/status/18154337175867392
17369709582229505	08901	 santa claus new brunswick cops spread cheer cancer institute nj httpbitlyht hrp via httpoutsidein 	2010-12-21	0	0				https://twitter.com/08901/status/17369709582229505
17369707900305408	08873	 santa claus new brunswick cops spread cheer cancer institute nj httpbitlygt usq via httpoutsidein 	2010-12-21	0	0				https://twitter.com/08873/status/17369707900305408
15651183859335168	08901	 keller williams elite realtors collects teddy bears robert wood johnson cancer patients httpbitlygsuccu via httpoutsidein 	2010-12-17	0	0				https://twitter.com/08901/status/15651183859335168
15651166020964353	08901	 keller williams elite realtors collects teddy bears robert wood johnson cancer patients httpbitlyeoagxh via httpoutsidein 	2010-12-17	0	0				https://twitter.com/08901/status/15651166020964353
5138759406325760	08873	 cancer patients nj ny likely aggressively fight disease die hos httpbitlybt ahl via httpoutsidein 	2010-11-18	0	0				https://twitter.com/08873/status/5138759406325760
5046450715099136	08901	 cancer patients nj ny likely aggressively fight disease die hos httpbitlyd hjoo via httpoutsidein 	2010-11-17	0	0				https://twitter.com/08901/status/5046450715099136
4895414314598400	08904	 new brunswick prostate cancer survivor gives back httpbitlycmyp v via httpoutsidein 	2010-11-17	0	0				https://twitter.com/08904/status/4895414314598400
4054664576245760	08901	 new brunswick prostate cancer survivor gives back httpbitlyalllwi via httpoutsidein 	2010-11-15	0	0				https://twitter.com/08901/status/4054664576245760
3959049787805696	08873	 new brunswick prostate cancer survivor gives back httpbitlyarncib via httpoutsidein 	2010-11-14	0	0				https://twitter.com/08873/status/3959049787805696
1931431068573696	topix_nj	 smoking may raise risk death women breast cancer httpbitlychutfx piscataway newjersey	2010-11-09	0	0		#Piscataway #NewJersey		https://twitter.com/topix_nj/status/1931431068573696
27318231646	08824	 charity walk new brunswick park honors womans fight cancer httpbitlycihfsc via httpoutsidein 	2010-10-14	0	0				https://twitter.com/08824/status/27318231646
27312458753	08904	 edison ymcas program helps cancer patients rebuild strength confidence httpbitly ypq via httpoutsidein 	2010-10-14	0	0				https://twitter.com/08904/status/27312458753
27008537248	08873	 charity walk new brunswick park honors womans fight cancer httpbitlya andm via httpoutsidein 	2010-10-11	0	0				https://twitter.com/08873/status/27008537248
26507971026	bigsleep1414	 rj_ support breast cancer awarenessa titty terrible thing waste realtalk right time true	2010-10-05	0	0	@RJ_22	#realtalk		https://twitter.com/bigsleep1414/status/26507971026
26245734678	08904	 running helps breast cancer survivors heal physically emotionally httpbitlyaa gnq via httpoutsidein 	2010-10-03	0	0				https://twitter.com/08904/status/26245734678
25828011099	08850	 heartbeats popular run chases cure cancer httpbitlyaxuv via httpoutsidein 	2010-09-28	0	0				https://twitter.com/08850/status/25828011099
25791640527	topix_nj	 heartbeats popular run chases cure cancer httpbitlyc ehmy hillsborough newjersey	2010-09-28	0	0		#Hillsborough #NewJersey		https://twitter.com/topix_nj/status/25791640527
25382347323	08901	 former home news reporter celizic dies cancer httpbitlyb nhpe via httpoutsidein 	2010-09-24	0	0				https://twitter.com/08901/status/25382347323
24465300751	08873	 putting best foot forward cancer patients httpbitlybruz l via httpoutsidein 	2010-09-14	0	0				https://twitter.com/08873/status/24465300751
24361550943	08901	 u community walks local cancer institute httpbitlyaeyp m via httpoutsidein 	2010-09-13	0	0				https://twitter.com/08901/status/24361550943
23859588035	08901	 perth amboy walk breast cancer spread early detection message httpbitlyc n ga via httpoutsidein 	2010-09-07	0	0				https://twitter.com/08901/status/23859588035
23253559411	08904	 perth amboy walk breast cancer spread early detection message httpbitlycnjrj via httpoutsidein 	2010-09-07	0	0				https://twitter.com/08904/status/23253559411
22002026149	topix_nj	 heartbeats danceathon benefits breast cancer research httpbitly dovcu newbrunswick newjersey	2010-08-24	0	0		#NewBrunswick #NewJersey		https://twitter.com/topix_nj/status/22002026149
21141886577	08901	 cancer institute names new clinical trial leader httpbitlya rcck via httpoutsidein 	2010-08-14	0	0				https://twitter.com/08901/status/21141886577
21141885015	08873	 cancer institute names new clinical trial leader httpbitlycrh xh via httpoutsidein 	2010-08-14	0	0				https://twitter.com/08873/status/21141885015
21131467467	08901	 cancer institute names new clinical trial leader httpbitlydxmcti via httpoutsidein 	2010-08-14	0	0				https://twitter.com/08901/status/21131467467
21131467429	08873	 cancer institute names new clinical trial leader httpbitlydilt o via httpoutsidein 	2010-08-14	0	0				https://twitter.com/08873/status/21131467429
20307861794	infoarchitect	 adamschwabe sure cancer battling glad hear new album	2010-08-04	0	0	@AdamSchwabe			https://twitter.com/infoarchitect/status/20307861794
16818932903	08901	 north brunswick chilis helping former arson investigator fight cancer httpbitlybcbgdr via httpoutsidein 	2010-06-22	0	0				https://twitter.com/08901/status/16818932903
16818932099	08873	 north brunswick chilis helping former arson investigator fight cancer httpbitlybi cpu via httpoutsidein 	2010-06-22	0	0				https://twitter.com/08873/status/16818932099
16523254607	08873	 music moorland a day hope cancer survivors httpbitlycbkzvr via httpoutsidein 	2010-06-19	0	0				https://twitter.com/08873/status/16523254607
16516419980	08901	 music moorland a day hope cancer survivors httpbitlyax sua via httpoutsidein 	2010-06-18	0	0				https://twitter.com/08901/status/16516419980
14390321671	08901	 former lpga champion promotes awareness breast cancer httpbitlydgcmi via httpoutsidein 	2010-05-20	0	0				https://twitter.com/08901/status/14390321671
14390318991	08873	 former lpga champion promotes awareness breast cancer httpbitlyabnvuk via httpoutsidein 	2010-05-20	0	0				https://twitter.com/08873/status/14390318991
13961693037	08901	 young cancer patient lead walk benefit new brunswick hospital httpbitly bnjqr via httpoutsidein 	2010-05-14	0	0				https://twitter.com/08901/status/13961693037
13961691705	08873	 young cancer patient lead walk benefit new brunswick hospital httpbitlycixzuh via httpoutsidein 	2010-05-14	0	0				https://twitter.com/08873/status/13961691705
13524645538	08901	 somerset patriots host breast cancer awareness day sunday httpbitlyap x e via httpoutsidein 	2010-05-06	0	0				https://twitter.com/08901/status/13524645538
13524642940	08873	 somerset patriots host breast cancer awareness day sunday httpbitlydoducl via httpoutsidein 	2010-05-06	0	0				https://twitter.com/08873/status/13524642940
13442611627	topix_nj	 somerset county kicks cancer awareness month httpbitlyd isqt somerset newjersey	2010-05-05	0	0		#Somerset #NewJersey		https://twitter.com/topix_nj/status/13442611627
10945424137	robbynoname	 get prostate cancer im going pissed	2010-03-23	0	0				https://twitter.com/robbynoname/status/10945424137
21724280404	08558	 lemonade stand raises money aid cancer research httpbitlybdqvem via httpoutsidein 	2010-08-21	0	0				https://twitter.com/08558/status/21724280404
20115184298	08558	 lemonade stand raises money aid cancer research httpbitlycsqarz via httpoutsidein 	2010-08-02	0	0				https://twitter.com/08558/status/20115184298
13340652124	EllenHoenig	 women take time focus u rt dranasyounes usatodayhealth american cancer society kicks choose you httpbitlybuke n hcsm	2010-05-03	0	0	@DrAnasYounes @USATODAYhealth	#hcsm		https://twitter.com/EllenHoenig/status/13340652124
13181679289	EllenHoenig	 rt dranasyounes rt aacr may national cancer research month learn please spread word aacr ncrm httpowly fxeo	2010-05-01	0	0	@DrAnasYounes @AACR	#AACR #NCRM		https://twitter.com/EllenHoenig/status/13181679289
2977976287236096	08530	 sundays holiday art exhibition sale benefits fox chase cancer center httpbitlyc ejps via httpoutsidein 	2010-11-12	0	0				https://twitter.com/08530/status/2977976287236096
26592502629	08530	 fox chase cancer center announces th annual holiday art exhibition httpbitly jm l via httpoutsidein 	2010-10-06	0	0				https://twitter.com/08530/status/26592502629
26456450240	BrittanyFricke	 msleamichele please rt its breast cancer awareness month donate every fan fans httpowly ob r	2010-10-05	0	0	@msleamichele			https://twitter.com/BrittanyFricke/status/26456450240
26456420829	BrittanyFricke	 jaclaurita please rt its breast cancer awareness month donate every fan fans httpowly ob r	2010-10-05	0	0	@JacLaurita			https://twitter.com/BrittanyFricke/status/26456420829
26456408583	BrittanyFricke	 kendrawilkinson pls rt its breast cancer awareness month donate every fan fans httpowly ob r	2010-10-05	0	0	@KendraWilkinson			https://twitter.com/BrittanyFricke/status/26456408583
26456383916	BrittanyFricke	 jenniwoww please rt its breast cancer awareness month donate every fan fans httpowly ob r	2010-10-05	0	0	@JENNIWOWW			https://twitter.com/BrittanyFricke/status/26456383916
26456357984	BrittanyFricke	 teresa_giudice please rt its breast cancer awareness month donate every fan fans httpowly ob r	2010-10-05	0	0	@Teresa_Giudice			https://twitter.com/BrittanyFricke/status/26456357984
26456340732	BrittanyFricke	 vinnyguadagnino pls rt its breast cancer awareness month donate every fan fans httpowly ob r	2010-10-05	0	0	@VINNYGUADAGNINO			https://twitter.com/BrittanyFricke/status/26456340732
26456309669	BrittanyFricke	 itsmeleighton please rt its breast cancer awareness month donate every fan fans httpowly ob r	2010-10-05	0	0	@itsmeleighton			https://twitter.com/BrittanyFricke/status/26456309669
26456294677	BrittanyFricke	 itsthesituation pls rt its breast cancer awareness month donate every fan fans httpowly ob r	2010-10-05	0	0	@ItsTheSituation			https://twitter.com/BrittanyFricke/status/26456294677
26456246707	BrittanyFricke	 matt_morrison please rt its breast cancer awareness month donate every fan fans httpowly ob r	2010-10-05	0	0	@Matt_Morrison			https://twitter.com/BrittanyFricke/status/26456246707
26456230946	BrittanyFricke	 lucyyhale please rt its breast cancer awareness month donate every fan fans httpowly ob r	2010-10-05	0	0	@lucyyhale			https://twitter.com/BrittanyFricke/status/26456230946
26456215913	BrittanyFricke	 djpaulyd please rt its breast cancer awareness month donate every fan fans httpowly ob r	2010-10-05	0	0	@DJPaulyD			https://twitter.com/BrittanyFricke/status/26456215913
26456196004	BrittanyFricke	 brittanysnow please rt its breast cancer awareness month donate every fan fans httpowly ob r	2010-10-05	0	0	@Brittanysnow			https://twitter.com/BrittanyFricke/status/26456196004
26456179825	BrittanyFricke	 leodicaprio please rt its breast cancer awareness month donate every fan fans httpowly ob r	2010-10-05	0	0	@LeoDiCaprio			https://twitter.com/BrittanyFricke/status/26456179825
26456163295	BrittanyFricke	 aus nichols please rt its breast cancer awareness month donate every fan fans httpowly ob r	2010-10-05	0	0	@AUS10NICHOLS			https://twitter.com/BrittanyFricke/status/26456163295
26456143669	BrittanyFricke	 jtimberlake please rt its breast cancer awareness month donate every fan fans httpowly ob r	2010-10-05	0	0	@jtimberlake			https://twitter.com/BrittanyFricke/status/26456143669
26456128226	BrittanyFricke	 nottinafey please rt its breast cancer awareness month donate every fan fans httpowly ob r	2010-10-05	0	0	@NotTinaFey			https://twitter.com/BrittanyFricke/status/26456128226
26456111070	BrittanyFricke	 mrskutcher please rt its breast cancer awareness month donate every fan fans httpowly ob r	2010-10-05	0	0	@mrskutcher			https://twitter.com/BrittanyFricke/status/26456111070
26456092671	BrittanyFricke	 justinbieber please rt its breast cancer awareness month donate every fan fans httpowly ob r	2010-10-05	0	0	@justinbieber			https://twitter.com/BrittanyFricke/status/26456092671
26456043565	BrittanyFricke	 amberonistevens pls rt its breast cancer awareness month donate every fan fans httpowly ob r	2010-10-05	1	0	@AmberoniStevens			https://twitter.com/BrittanyFricke/status/26456043565
26455969440	BrittanyFricke	 kara_dioguardi please rt its breast cancer awareness month donate every fan fans httpowly ob r	2010-10-05	0	0	@kara_dioguardi			https://twitter.com/BrittanyFricke/status/26455969440
26455931802	BrittanyFricke	 joeylawrence please rt its breast cancer awareness month donate every fan fans httpowly ob r	2010-10-05	0	0	@joeylawrence			https://twitter.com/BrittanyFricke/status/26455931802
26455914325	BrittanyFricke	 greekbeaver please rt its breast cancer awareness month donate every fan fans httpowly ob r	2010-10-05	2	0	@GreekBeaver			https://twitter.com/BrittanyFricke/status/26455914325
26455896470	BrittanyFricke	 hughhefner please rt its breast cancer awareness month donate every fan fans httpowly ob r	2010-10-05	0	0	@hughhefner			https://twitter.com/BrittanyFricke/status/26455896470
26455868197	BrittanyFricke	 carolinemanzo please rt its breast cancer awareness month donate every fan fans httpowly ob r	2010-10-05	0	0	@CarolineManzo			https://twitter.com/BrittanyFricke/status/26455868197
26455852240	BrittanyFricke	 idinamenzel please rt its breast cancer awareness month donate every fan fans httpowly ob r	2010-10-05	0	0	@idinamenzel			https://twitter.com/BrittanyFricke/status/26455852240
26455816430	BrittanyFricke	 bunnybridget please rt its breast cancer awareness month donate every fan fans httpowly ob r	2010-10-05	0	0	@BunnyBridget			https://twitter.com/BrittanyFricke/status/26455816430
26396582000	BrittanyFricke	 sophiabush pls rt its breast cancer awareness month donate every fan fans httpowly ob r	2010-10-04	0	0	@SophiaBush			https://twitter.com/BrittanyFricke/status/26396582000
26386906443	BrittanyFricke	 mellyjhart please rt its breast cancer awareness month donate every fan fans httpowly ob u	2010-10-04	14	0	@MellyJHart			https://twitter.com/BrittanyFricke/status/26386906443
26386834457	BrittanyFricke	 bethenny please rt its breast cancer awareness month donate every fan fans httpowly ob u	2010-10-04	0	0	@Bethenny			https://twitter.com/BrittanyFricke/status/26386834457
26386820292	BrittanyFricke	 sn ki please rt its breast cancer awareness month donate every fan fans httpowly ob u	2010-10-04	0	0	@Sn00ki			https://twitter.com/BrittanyFricke/status/26386820292
26386793389	BrittanyFricke	 kendrawilkinson please rt breast cancer awareness month donate every fan fans httpowly ob u	2010-10-04	0	0	@KendraWilkinson			https://twitter.com/BrittanyFricke/status/26386793389
26386775672	BrittanyFricke	 theellenshow please rt its breast cancer awareness month donate every fan fans httpowly ob u	2010-10-04	0	0	@TheEllenShow			https://twitter.com/BrittanyFricke/status/26386775672
26386680674	BrittanyFricke	 mtvsammi please rt its breast cancer awareness month donate every fan fans httpowly ob r	2010-10-04	0	0	@MTVsammi			https://twitter.com/BrittanyFricke/status/26386680674
26386614771	BrittanyFricke	 mark_salling please rt its breast cancer awareness month donate every fan fans httpowly ob r	2010-10-04	0	0	@Mark_Salling			https://twitter.com/BrittanyFricke/status/26386614771
26386590600	BrittanyFricke	 ashbenzo please rt its breast cancer awareness month donate every fan fans httpowly ob r	2010-10-04	0	0	@AshBenzo			https://twitter.com/BrittanyFricke/status/26386590600
26386531750	BrittanyFricke	 mindyweiss please rt its breast cancer awareness month donate every fan fans httpowly ob r	2010-10-04	0	0	@MindyWeiss			https://twitter.com/BrittanyFricke/status/26386531750
26386218027	BrittanyFricke	 bccare please rt its breast cancer awareness month donate every fan fans httpowly ob r	2010-10-04	0	0	@BCCare			https://twitter.com/BrittanyFricke/status/26386218027
26386117228	BrittanyFricke	 katewalsh please rt its breast cancer awareness month donate every fan fans httpowly ob r	2010-10-04	0	0	@katewalsh			https://twitter.com/BrittanyFricke/status/26386117228
1320166721847296	topix_nj	 fundraiser set family delaware township girl second cancer httpbitlyaq izm sergeantsville newjersey	2010-11-07	0	0		#Sergeantsville #NewJersey		https://twitter.com/topix_nj/status/1320166721847296
6516151395819520	wrongleftturn	 riri american cancer society generous her	2010-11-21	0	0				https://twitter.com/wrongleftturn/status/6516151395819520
19090347635	08848	 cancer patients june wedding created nj branch association bridal consultan httpbitlybopvos via httpoutsidein 	2010-07-21	0	0				https://twitter.com/08848/status/19090347635
9574126893146112	topix_nj	 cyclists ride toward cure cancer raise httpbitlyhqqvrk threebridges newjersey	2010-11-30	0	0		#ThreeBridges #NewJersey		https://twitter.com/topix_nj/status/9574126893146112
28510324239	ErinLathrop	 greatgrandchildren wouldnt cancer god bless you thoncanning	2010-10-23	0	0		#THONcanning		https://twitter.com/ErinLathrop/status/28510324239
20923659921	08822	 walgreens flemington host alexs lemonade stand help fund cancer research assis httpbitly amrqk via httpoutsidein 	2010-08-11	0	0				https://twitter.com/08822/status/20923659921
19086268913	Zangani	 unlocking secrets cellular energy holds promise obesity diabetes cancer zanganicom httpwwwzanganicomnode 	2010-07-21	0	0				https://twitter.com/Zangani/status/19086268913
19085723619	Zangani	 yale scientists discover new genetic marker ovarian cancer risk check post zanganicom httpwwwzanganicomnode 	2010-07-21	0	0				https://twitter.com/Zangani/status/19085723619
19084904189	Zangani	 unlocking secrets cellular energy holds promise obesity diabetes cancer httpwwwzanganicomnode 	2010-07-21	0	0				https://twitter.com/Zangani/status/19084904189
15489865668	Zangani	 green tea extract appears keep cancer check majority cll patients zanganicom httpwwwzanganicomnode 	2010-06-05	0	0				https://twitter.com/Zangani/status/15489865668
14875744964	Zangani	 mcgill team discovers piece puzzle individualized cancer therapy via gene silencing httpwwwzanganicomnode 	2010-05-27	0	0				https://twitter.com/Zangani/status/14875744964
12596991624216576	08865	 help easton boy cancer make paper cranes httpbitlye beur via httpoutsidein 	2010-12-08	0	0				https://twitter.com/08865/status/12596991624216576
10241395679821824	08865	 phillipsburg high school club raising money cancer research greenwich township apple httpbitlyijiipz via httpoutsidein 	2010-12-02	0	0				https://twitter.com/08865/status/10241395679821824
9395452558450688	07882	 fda reviews new glaxo merck drugs reduce prostate cancer httpbitlyerhbum via httpoutsidein 	2010-11-29	0	0				https://twitter.com/07882/status/9395452558450688
18851548705	07882	 fda says breast cancer drug extend lives httpbitly ltjtb via httpoutsidein 	2010-07-18	0	0				https://twitter.com/07882/status/18851548705
11189896693	07882	 cancer question complicates compensation deal dailyrecordcom httpbitly qjac via httpoutsidein 	2010-03-28	0	0				https://twitter.com/07882/status/11189896693
12596991624216576	08865	 help easton boy cancer make paper cranes httpbitlye beur via httpoutsidein 	2010-12-08	0	0				https://twitter.com/08865/status/12596991624216576
10241395679821824	08865	 phillipsburg high school club raising money cancer research greenwich township apple httpbitlyijiipz via httpoutsidein 	2010-12-02	0	0				https://twitter.com/08865/status/10241395679821824
19090347635	08848	 cancer patients june wedding created nj branch association bridal consultan httpbitlybopvos via httpoutsidein 	2010-07-21	0	0				https://twitter.com/08848/status/19090347635
