id	Username	Text	Date	Retweets	Favorites	Mentions	Hashtags	Geo	Permalink
20162725392949248	deadcatguy	 cant really angry someone cancer 	2010-12-29	0	0				https://twitter.com/deadcatguy/status/20162725392949248
20001850061234176	08876	 allstate new jersey raises cancer fight quotes cure insuran httpbitlyfaixzk via httpoutsidein 	2010-12-29	0	0				https://twitter.com/08876/status/20001850061234176
20001632993415170	07103	 allstate new jersey raises cancer fight quotes cure insuran httpbitlyhnrnjt via httpoutsidein 	2010-12-29	0	0				https://twitter.com/07103/status/20001632993415170
20001486977114112	07044	 allstate new jersey raises cancer fight quotes cure insuran httpbitlygsuqvw via httpoutsidein 	2010-12-29	0	0				https://twitter.com/07044/status/20001486977114112
19932739067187200	HashTagAbuser	 im carol g simon cancer center madison ave morristown http sqcome foua	2010-12-28	0	0				https://twitter.com/HashTagAbuser/status/19932739067187200
19906036018188288	08869	 allstate new jersey raises cancer fight quotes cure insuran httpbitlyg k oa via httpoutsidein 	2010-12-28	0	0				https://twitter.com/08869/status/19906036018188288
19905987536232448	07092	 allstate new jersey raises cancer fight quotes cure insuran httpbitlyhvldca via httpoutsidein 	2010-12-28	0	0				https://twitter.com/07092/status/19905987536232448
19757640519254017	HashTagAbuser	 im carol g simon cancer center madison ave morristown http sqcomfoaqkh	2010-12-28	0	0				https://twitter.com/HashTagAbuser/status/19757640519254017
19249887463874560	_shesxcountry	 thought shaun white couldnt cuter commercial cancer patient puts hair kid like wig	2010-12-26	0	0				https://twitter.com/_shesxcountry/status/19249887463874560
19160830855618560	aqueen7	 factsaboutboys female taurus cancer virgo pisces labeled sheiswifey make best ones wifey material	2010-12-26	0	0	@FactsAboutBoys	#sheiswifey		https://twitter.com/aqueen7/status/19160830855618560
18758463500845056	07885	 dover students rally around randolph girl cancer httpbitlyi cui via httpoutsidein 	2010-12-25	0	0				https://twitter.com/07885/status/18758463500845056
18683343214215168	07869	 dover students rally around randolph girl cancer httpbitlyg gnoh via httpoutsidein 	2010-12-25	0	0				https://twitter.com/07869/status/18683343214215168
18683342643789825	07853	 long valley agency donates cancer research httpbitlyg ezvg via httpoutsidein 	2010-12-25	0	0				https://twitter.com/07853/status/18683342643789825
18683342601854976	07830	 long valley agency donates cancer research httpbitlyhupipm via httpoutsidein 	2010-12-25	0	0				https://twitter.com/07830/status/18683342601854976
18670343828807680	07801	 dover students rally around randolph girl cancer httpbitlydxtrr via httpoutsidein 	2010-12-25	0	0				https://twitter.com/07801/status/18670343828807680
18551781919297536	topix_nj	 dover nj students rally around randolph girl cancer httpbitlyf eajd dover newjersey	2010-12-25	0	0		#Dover #NewJersey		https://twitter.com/topix_nj/status/18551781919297536
17852953553534976	08876	 hunterdon county boy cancer seeks paper cranes httpbitlyeavnwv via httpoutsidein 	2010-12-23	0	0				https://twitter.com/08876/status/17852953553534976
17732260887273472	08869	 hunterdon county boy cancer seeks paper cranes httpbitlyi rzx via httpoutsidein 	2010-12-22	0	0				https://twitter.com/08869/status/17732260887273472
16120349737361408	nicolasln	 got full pat tsa addition new cancer scan morning official reason suspect crotchal protuberance	2010-12-18	0	0				https://twitter.com/nicolasln/status/16120349737361408
15651122781884417	08846	 keller williams elite realtors collects teddy bears robert wood johnson cancer patients httpbitlyhnqecw via httpoutsidein 	2010-12-17	0	0				https://twitter.com/08846/status/15651122781884417
15651119397076992	08846	 keller williams elite realtors collects teddy bears robert wood johnson cancer patients httpbitlyenpys via httpoutsidein 	2010-12-17	0	0				https://twitter.com/08846/status/15651119397076992
15210871101853697	xtrusca	 mitchellaneum see article guy cancer hiv stem cell transplant doesnt hiv lol	2010-12-15	0	0	@Mitchellaneum			https://twitter.com/xtrusca/status/15210871101853697
14927205297553408	07052	 cancer centers saint barnabas medical center first receive cancer care recognitio httpbitlyebfnxk via httpoutsidein 	2010-12-15	0	0				https://twitter.com/07052/status/14927205297553408
14898381587484672	Love_Simba_85	 im ill enough kill cancer baby im kemo	2010-12-14	0	0				https://twitter.com/Love_Simba_85/status/14898381587484672
14832173915836416	07039	 cancer centers saint barnabas medical center first receive cancer care recognitio httpbitlyfvgeti via httpoutsidein 	2010-12-14	0	0				https://twitter.com/07039/status/14832173915836416
14556009091563520	sir_obii	 fuck derz sumfn like anal cancer wtf	2010-12-14	0	0				https://twitter.com/sir_obii/status/14556009091563520
14409194866221056	07039	 cycling cure cancer httpbitlydkiqs via httpoutsidein 	2010-12-13	0	0				https://twitter.com/07039/status/14409194866221056
14379180787507201	07901	 quilters meet home new providence stitch comfort gifts simon cancer center httpbitlye n f via httpoutsidein 	2010-12-13	0	0				https://twitter.com/07901/status/14379180787507201
14318635321393152	07041	 shala holds annual benefit sale ovarian cancer research httpbitlyef p via httpoutsidein 	2010-12-13	0	0				https://twitter.com/07041/status/14318635321393152
13927017485443073	07078	 support ovarian cancer research shala httpbitlydi dgu via httpoutsidein 	2010-12-12	0	0				https://twitter.com/07078/status/13927017485443073
13839804022132736	07076	 brief saturday morning kicking cancer httpbitlyh lbzg via httpoutsidein 	2010-12-12	0	0				https://twitter.com/07076/status/13839804022132736
13839779556757505	07041	 support ovarian cancer research shala httpbitlyhgww d via httpoutsidein 	2010-12-12	0	0				https://twitter.com/07041/status/13839779556757505
13839777740619776	07039	 support ovarian cancer research shala httpbitlyhshf t via httpoutsidein 	2010-12-12	0	0				https://twitter.com/07039/status/13839777740619776
13321761865076736	07416	 comments aretha franklin pancreatic cancer httpbitlyfks iw via httpoutsidein 	2010-12-10	0	0				https://twitter.com/07416/status/13321761865076736
13156698097192960	topix_nj	 insured women skipping breast cancer screenings httpbitlye w m franklinlakes newjersey	2010-12-10	0	0		#FranklinLakes #NewJersey		https://twitter.com/topix_nj/status/13156698097192960
13141083085086720	07871	 comments aretha franklin pancreatic cancer httpbitlyhc eoy via httpoutsidein 	2010-12-10	0	0				https://twitter.com/07871/status/13141083085086720
13141053330685952	07419	 comments aretha franklin pancreatic cancer httpbitlyf twxw via httpoutsidein 	2010-12-10	0	0				https://twitter.com/07419/status/13141053330685952
13058482131443712	topix_nj	 ymcas cancer survivor fitness program holds graduation ceremony httpbitlyg ktl ridgewood newjersey	2010-12-09	0	0		#Ridgewood #NewJersey		https://twitter.com/topix_nj/status/13058482131443712
12763361838104576	07901	 lecture colon cancer awareness httpbitlyfyn via httpoutsidein 	2010-12-09	0	0				https://twitter.com/07901/status/12763361838104576
12763357996126208	07871	 aretha franklin diagnosed cancer sad news httpbitlyeg zvw via httpoutsidein 	2010-12-09	0	0				https://twitter.com/07871/status/12763357996126208
12763357597667328	07871	 reports aretha franklin pancreatic cancer httpbitlyfxqgho via httpoutsidein 	2010-12-09	0	0				https://twitter.com/07871/status/12763357597667328
12763327046356992	07419	 aretha franklin diagnosed cancer sad news httpbitlyi ucmt via httpoutsidein 	2010-12-09	0	0				https://twitter.com/07419/status/12763327046356992
12763326866001921	07419	 reports aretha franklin pancreatic cancer httpbitlyhel dr via httpoutsidein 	2010-12-09	0	0				https://twitter.com/07419/status/12763326866001921
12748843372249088	08801	 clinton teacher takes award national cancer survivor art show httpbitlyi wznd via httpoutsidein 	2010-12-09	0	0				https://twitter.com/08801/status/12748843372249088
12748814490279936	07416	 aretha franklin diagnosed cancer sad news httpbitlygfo v via httpoutsidein 	2010-12-09	0	0				https://twitter.com/07416/status/12748814490279936
12748812804165632	07416	 reports aretha franklin pancreatic cancer httpbitlyfirqap via httpoutsidein 	2010-12-09	0	0				https://twitter.com/07416/status/12748812804165632
12596988688203776	08809	 clinton teacher takes award national cancer survivor art show httpbitlygjeska via httpoutsidein 	2010-12-08	0	0				https://twitter.com/08809/status/12596988688203776
12416530868346880	08801	 clinton teacher takes award national cancer survivor art show httpbitlygq jvc via httpoutsidein 	2010-12-08	0	0				https://twitter.com/08801/status/12416530868346880
12416493761331200	07924	 bernardsville scientist gets cancer research httpbitlygsnry via httpoutsidein 	2010-12-08	0	0				https://twitter.com/07924/status/12416493761331200
12416435242401792	07039	 letter editor sp resident takes charge fight pancreatic cancer httpbitlydsh u via httpoutsidein 	2010-12-08	0	0				https://twitter.com/07039/status/12416435242401792
12390339448934400	08809	 clinton teacher takes award national cancer survivor art show httpbitlyi l fi via httpoutsidein 	2010-12-08	0	0				https://twitter.com/08809/status/12390339448934400
12390258062655489	07931	 bernardsville scientist gets cancer research httpbitlyeklyes via httpoutsidein 	2010-12-08	0	0				https://twitter.com/07931/status/12390258062655489
12390252341628928	07920	 bernardsville scientist gets cancer research httpbitlyi l u via httpoutsidein 	2010-12-08	0	0				https://twitter.com/07920/status/12390252341628928
12390147710517248	07041	 holiday shopping party benefitting ovarian cancer research httpbitlygo re via httpoutsidein 	2010-12-08	0	0				https://twitter.com/07041/status/12390147710517248
12334002564235265	topix_nj	 clinton teacher takes award national cancer survivor art show httpbitlyibrnyo clinton newjersey	2010-12-07	0	0		#Clinton #NewJersey		https://twitter.com/topix_nj/status/12334002564235265
12193235887718400	djdirect84	 call damn love cancer lmao httpmylocmef ph	2010-12-07	0	0		#69		https://twitter.com/djdirect84/status/12193235887718400
12169737316339712	topix_nj	 bernardsville scientist gets cancer research httpbitlyf o s bernardsville newjersey	2010-12-07	0	0		#Bernardsville #NewJersey		https://twitter.com/topix_nj/status/12169737316339712
12113670792286208	07960	 prostate cancer support group meeting morristown memorial hospital httpbitlyh zt u via httpoutsidein 	2010-12-07	0	0				https://twitter.com/07960/status/12113670792286208
11905781788053506	capablesteve	 im umdnj cancer center http sqcomab kx	2010-12-06	0	0				https://twitter.com/capablesteve/status/11905781788053506
10887021534904320	CleopatraThaII	 labella_vitaxo lvsuitcase yummy_brownie neck got big could cancer idk yet got get taken out	2010-12-03	0	0	@LABELLA_Vitaxo @LVsuitcase @yummy_brownie			https://twitter.com/CleopatraThaII/status/10887021534904320
9939141781364736	07924	 cyclists ride toward cure cancer raise httpbitlyfm ojq via httpoutsidein 	2010-12-01	0	0				https://twitter.com/07924/status/9939141781364736
9878919251501056	07931	 cyclists ride toward cure cancer raise httpbitlyfhkm via httpoutsidein 	2010-12-01	0	0				https://twitter.com/07931/status/9878919251501056
9818077457813504	07920	 cyclists ride toward cure cancer raise httpbitlyf j r via httpoutsidein 	2010-11-30	0	0				https://twitter.com/07920/status/9818077457813504
9706571936305152	tweetie999	 httpadagecomgoodworkspostarticle_id master card supports cure cancer times square nyc	2010-11-30	0	0				https://twitter.com/tweetie999/status/9706571936305152
9395452558450688	07882	 fda reviews new glaxo merck drugs reduce prostate cancer httpbitlyerhbum via httpoutsidein 	2010-11-29	0	0				https://twitter.com/07882/status/9395452558450688
9393190515777536	capablesteve	 im umdnj cancer center http sqcomab kx	2010-11-29	0	0				https://twitter.com/capablesteve/status/9393190515777536
8007434656284672	natenakao	 rt tiffy brad smith going cure cancer tomorrow theres nothing cant do	2010-11-25	0	0	@tiffy643			https://twitter.com/natenakao/status/8007434656284672
7975891028152320	07029	 red bank guinness oyster festival raises cancer funds httpbitlygoyb r via httpoutsidein 	2010-11-25	0	0				https://twitter.com/07029/status/7975891028152320
7855002647269376	07105	 red bank guinness oyster festival raises cancer funds httpbitlygttesi via httpoutsidein 	2010-11-25	0	0				https://twitter.com/07105/status/7855002647269376
7855000445259778	07032	 red bank guinness oyster festival raises cancer funds httpbitlyfamfsm via httpoutsidein 	2010-11-25	0	0				https://twitter.com/07032/status/7855000445259778
7676707876114432	08809	 clinton cancer survivor wins third place national oncology art contest httpbitlyfuqqmn via httpoutsidein 	2010-11-25	0	0				https://twitter.com/08809/status/7676707876114432
7676703677612032	08801	 clinton cancer survivor wins third place national oncology art contest httpbitlyeqdpuf via httpoutsidein 	2010-11-25	0	0				https://twitter.com/08801/status/7676703677612032
7314299034800129	07066	 clarknative remembers dad raises pancreatic cancer awareness httpbitlyh shdy via httpoutsidein 	2010-11-24	0	0				https://twitter.com/07066/status/7314299034800129
7216041461547008	crazy4mars42	 found dont breast cancer im happy kelly crazy mars 	2010-11-23	0	0				https://twitter.com/crazy4mars42/status/7216041461547008
6952165746671617	07044	 verona salon supports breast cancer foundation cutathon httpbitlyehilch via httpoutsidein 	2010-11-23	0	0				https://twitter.com/07044/status/6952165746671617
6952152538816512	07009	 verona salon supports breast cancer foundation cutathon httpbitlyfvrczs via httpoutsidein 	2010-11-23	0	0				https://twitter.com/07009/status/6952152538816512
6858408128946176	07041	 hair cuts raise money breast cancer foundation httpbitlydpssua via httpoutsidein 	2010-11-22	0	0				https://twitter.com/07041/status/6858408128946176
6516151395819520	wrongleftturn	 riri american cancer society generous her	2010-11-21	0	0				https://twitter.com/wrongleftturn/status/6516151395819520
6160262834946048	VBX2010	 tsa patdown leaves bladder cancer survivor covered urine barackobama fucktsa httponmsnbccombalg f	2010-11-20	0	0	@BarackObama	#fucktsa		https://twitter.com/VBX2010/status/6160262834946048
6039708886892544	JerseyJen4Ever	 its great cause october may still find ways donate help find cure breast cancer wwwcupsofhopecom	2010-11-20	0	0				https://twitter.com/JerseyJen4Ever/status/6039708886892544
6039341797216256	JerseyJen4Ever	 helped donate towards national breast cancer foundation eating yogurt its simple that wwwcupsofhopecom	2010-11-20	0	0				https://twitter.com/JerseyJen4Ever/status/6039341797216256
5892267453710336	07041	 fight breast cancer cutathon httpbitlyb olq via httpoutsidein 	2010-11-20	0	0				https://twitter.com/07041/status/5892267453710336
5863037340753920	07039	 fight breast cancer cutathon httpbitlybpwd w via httpoutsidein 	2010-11-20	0	0				https://twitter.com/07039/status/5863037340753920
5526708534906880	topix_nj	 pamela morgan lost battle endometrial cancer httpbitlydcvwhj milford newjersey	2010-11-19	0	0		#Milford #NewJersey		https://twitter.com/topix_nj/status/5526708534906880
4959043193937922	deadcatguy	 four loko must remove caffeine formula wonder philip morris ordered remove cancer cigarettes	2010-11-17	0	0				https://twitter.com/deadcatguy/status/4959043193937922
4701827689881600	Devl31	 samsarcinella dad feeding tube in finished radiadion oral cancer left tube open times boost lol	2010-11-16	0	0	@SamSarcinella			https://twitter.com/Devl31/status/4701827689881600
4699676557180928	IAMAaronRose	 rt sexstrology pisces cancer scorpio known deep sexual intensity	2010-11-16	0	0	@Sexstrology			https://twitter.com/IAMAaronRose/status/4699676557180928
4684432166359040	07940	 cancer screening offered tomorrow httpbitlybv lw via httpoutsidein 	2010-11-16	0	0				https://twitter.com/07940/status/4684432166359040
4561072430260224	topix_nj	 diva day program pampers cancer patients httpbitlybbyapb baskingridge newjersey	2010-11-16	0	0		#BaskingRidge #NewJersey		https://twitter.com/topix_nj/status/4561072430260224
4362329982504960	ChrisPacia	 pinkelephantpun lol ya groping better cancer 	2010-11-15	0	0	@pinkelephantpun			https://twitter.com/ChrisPacia/status/4362329982504960
3355563966599168	07840	 centenary college fraternity mission help fight cancer httpbitly lhvmm via httpoutsidein 	2010-11-13	0	0				https://twitter.com/07840/status/3355563966599168
3042216847089666	topix_nj	 pancreatic cancer survivor beats odds httpbitly c f landing newjersey	2010-11-12	0	0		#Landing #NewJersey		https://twitter.com/topix_nj/status/3042216847089666
2762030788378624	Devl31	 abolishcancer found today dad cancer free tumor gone oral cancer best day	2010-11-11	0	0	@abolishcancer			https://twitter.com/Devl31/status/2762030788378624
2601398516588544	07044	 cutting cause salon holding cutathon breast cancer foundation httpbitlyczy x via httpoutsidein 	2010-11-11	0	0				https://twitter.com/07044/status/2601398516588544
2601368246288384	07009	 cutting cause salon holding cutathon breast cancer foundation httpbitlycjthcn via httpoutsidein 	2010-11-11	0	0				https://twitter.com/07009/status/2601368246288384
2477689256542210	topix_nj	 cancer recovery fitness class start berkeley heights httpbitlycmay s berkeleyheights newjersey	2010-11-10	0	0		#BerkeleyHeights #NewJersey		https://twitter.com/topix_nj/status/2477689256542210
2405223570087936	DawnRuete	 help donate mm fight breast cancer httpcupsofhopecom	2010-11-10	0	0				https://twitter.com/DawnRuete/status/2405223570087936
2129141537181696	santorusso	 excuses like assholes everyones got one case rich cioffe rectal cancer 	2010-11-09	0	0				https://twitter.com/santorusso/status/2129141537181696
1931431068573696	topix_nj	 smoking may raise risk death women breast cancer httpbitlychutfx piscataway newjersey	2010-11-09	0	0		#Piscataway #NewJersey		https://twitter.com/topix_nj/status/1931431068573696
1831586081280000	CNJBrownBear	 brothers its month movember grow mustache raise awareness testicular cancer mens health wwwfeelyourballstodayorg	2010-11-08	1	0				https://twitter.com/CNJBrownBear/status/1831586081280000
1754389064720386	capablesteve	 im umdnj cancer center http sqcomab kx	2010-11-08	0	0				https://twitter.com/capablesteve/status/1754389064720386
1528504923459586	07039	 walking support pancreatic cancer research httpbitly hqo x via httpoutsidein 	2010-11-08	0	0				https://twitter.com/07039/status/1528504923459586
842337106268160	topix_nj	 making purplestrides pancreatic cancer httpbitlyczkppc millburn newjersey	2010-11-06	0	0		#Millburn #NewJersey		https://twitter.com/topix_nj/status/842337106268160
774295475200000	07039	 making purplestrides pancreatic cancer httpbitlyarylvh via httpoutsidein 	2010-11-06	0	0				https://twitter.com/07039/status/774295475200000
682988060807168	07928	 play benefit families children cancer httpbitly sv zh via httpoutsidein 	2010-11-05	0	0				https://twitter.com/07928/status/682988060807168
29683363381	07039	 making purplestrides pancreatic cancer httpbitlybagefe via httpoutsidein 	2010-11-04	0	0				https://twitter.com/07039/status/29683363381
29640168305	knicksfan821	 kevin garnnet called vinuela cancer patientharsh kg di	2010-11-04	0	0				https://twitter.com/knicksfan821/status/29640168305
29582358533	alexzeller	 sure nba much classier now nothing screams class like kevin garnett mocking cancer patients	2010-11-03	0	0				https://twitter.com/alexzeller/status/29582358533
29510128790	jacobLpeck	 donated movember too please support men diagnosed w cancer httpusmovembercomdonate	2010-11-02	0	0		#Movember		https://twitter.com/jacobLpeck/status/29510128790
29442155158	08836	 sopranos star loses battle liver cancer httpbitlybalyqu via httpoutsidein 	2010-11-02	0	0				https://twitter.com/08836/status/29442155158
29442120043	07039	 november pancreatic cancer awareness month millburn httpbitlya g vs via httpoutsidein 	2010-11-02	0	0				https://twitter.com/07039/status/29442120043
29413948313	07410	 tj middle school group breast cancer research fundraising httpbitly r i a via httpoutsidein 	2010-11-01	0	0				https://twitter.com/07410/status/29413948313
29413942282	07059	 sopranos star loses battle liver cancer httpbitly ugchk via httpoutsidein 	2010-11-01	0	0				https://twitter.com/07059/status/29413942282
29396357134	robjtweets	 ive donated face movember aid men suffer cancer pls donate movember httpusmovembercommospace 	2010-11-01	0	0		#Movember		https://twitter.com/robjtweets/status/29396357134
29350077506	topix_nj	 struggle grows difficult young pompton lakes mom cancer httpbitlya wvbt pomptonlakes newjersey	2010-11-01	0	0		#PomptonLakes #NewJersey		https://twitter.com/topix_nj/status/29350077506
29195424243	dizberiq	 ran k cervical cancer woo just jakes http sqcom m dka	2010-10-30	0	0	@Just			https://twitter.com/dizberiq/status/29195424243
29128353174	VaVaVa_Voom	 wow miss nana wish cancer would get cancer die	2010-10-29	0	0				https://twitter.com/VaVaVa_Voom/status/29128353174
28981988397	topix_nj	 k runwalk cervical cancer research httpbitly fyk bloomfield newjersey	2010-10-28	0	0		#Bloomfield #NewJersey		https://twitter.com/topix_nj/status/28981988397
28973222749	topix_nj	 web company joins fight breast cancer httpbitlyar b newton newjersey	2010-10-28	0	0		#Newton #NewJersey		https://twitter.com/topix_nj/status/28973222749
28959949867	07960	 human side cancer httpbitly gkuja via httpoutsidein 	2010-10-28	0	0				https://twitter.com/07960/status/28959949867
28959875811	07083	 officials proclaim november pancreatic cancer awareness month httpbitlycaomex via httpoutsidein 	2010-10-28	0	0				https://twitter.com/07083/status/28959875811
28907019829	07901	 officials proclaim november pancreatic cancer awareness month httpbitlycg dlb via httpoutsidein 	2010-10-27	0	0				https://twitter.com/07901/status/28907019829
28907017647	07076	 torok says power positive thinking helped fight breast cancer httpbitlycqxwqc via httpoutsidein 	2010-10-27	0	0				https://twitter.com/07076/status/28907017647
28907016506	07076	 plainfield schoolchildren walk cancer honor classmate httpbitlyasz g via httpoutsidein 	2010-10-27	0	0				https://twitter.com/07076/status/28907016506
28907014854	07060	 plainfield schoolchildren walk cancer honor classmate httpbitlyajc fq via httpoutsidein 	2010-10-27	0	0				https://twitter.com/07060/status/28907014854
28907014168	07081	 officials proclaim november pancreatic cancer awareness month httpbitlycjsmde via httpoutsidein 	2010-10-27	0	0				https://twitter.com/07081/status/28907014168
28866980900	07090	 torok says power positive thinking helped fight breast cancer httpbitlyb ba q via httpoutsidein 	2010-10-27	0	0				https://twitter.com/07090/status/28866980900
28861449850	07901	 cancer recovery fitness program pathways httpbitlya w ph via httpoutsidein 	2010-10-27	0	0				https://twitter.com/07901/status/28861449850
28814935895	mynxggae	 rt futurejetsetter rt ddgii httptwitpiccom dmm d swallowing semen prevent breast cancer httptmime bz b	2010-10-26	0	0	@FutureJetSetter @DDGII			https://twitter.com/mynxggae/status/28814935895
28599774261	xohsosuper	 bra decide unhook breat cancer walk httpmylocmedqqra	2010-10-24	0	0				https://twitter.com/xohsosuper/status/28599774261
28596524735	xohsosuper	 im supporting ta tas breast cancer walk bccc httpmylocmedqjnb	2010-10-24	0	0				https://twitter.com/xohsosuper/status/28596524735
28568518435	topix_nj	 painting avenue pink breast cancer awareness httpbitlydvg xd maplewood newjersey	2010-10-24	0	0		#Maplewood #NewJersey		https://twitter.com/topix_nj/status/28568518435
28501986975	petesarabia	 raising money kids cancer milburn nj	2010-10-23	0	0				https://twitter.com/petesarabia/status/28501986975
28501506126	petesarabia	 elalaine basically soliciting money children cancer 	2010-10-23	0	0	@elalaine			https://twitter.com/petesarabia/status/28501506126
28444983611	RashadSun	 let flow poetry show oct pm bloomfield ave bloomfield nj b after support breast cancer awareness	2010-10-22	1	0				https://twitter.com/RashadSun/status/28444983611
28444180558	RashadSun	 let flow poetry show oct pm bloomfield ave blmfd b after support breast cancer awareness	2010-10-22	0	0				https://twitter.com/RashadSun/status/28444180558
28434214934	Zewdy	 full moon tonight social networks going crazy p im cancer its sun sets o	2010-10-22	0	0				https://twitter.com/Zewdy/status/28434214934
28401224657	07060	 north plainfield fire department dons pink breast cancer awareness httpbitly lg pq via httpoutsidein 	2010-10-22	0	0				https://twitter.com/07060/status/28401224657
28381116370	07090	 tebbetts shave head breast cancer research httpbitlyczunhw via httpoutsidein 	2010-10-22	0	0				https://twitter.com/07090/status/28381116370
28381114547	07076	 north plainfield fire department dons pink breast cancer awareness httpbitlybnkafd via httpoutsidein 	2010-10-22	0	0				https://twitter.com/07076/status/28381114547
28375365326	07060	 north plainfield fire department dons pink breast cancer awareness httpbitlydqjbhk via httpoutsidein 	2010-10-22	0	0				https://twitter.com/07060/status/28375365326
28366006850	RashadSun	 let flow poetry show oct pm bloomfield ave bloomfield nj b after support breast cancer awareness month	2010-10-21	0	0				https://twitter.com/RashadSun/status/28366006850
28365939139	RashadSun	 let flow poetry show oct pm bloomfield ave bloomfield nj b after support breast cancer awareness month	2010-10-21	0	0		#Poetry		https://twitter.com/RashadSun/status/28365939139
