id	Username	Text	Date	Retweets	Favorites	Mentions	Hashtags	Geo	Permalink
17007438876123136	07712	 ray catena auto group gives g komen cancer foundation httpbitlyf d js via httpoutsidein 	2010-12-20	0	0				https://twitter.com/07712/status/17007438876123136
16102314104328192	07712	 edisons ray catena auto group presents donation breast cancer foundation httpbitlyesko q via httpoutsidein 	2010-12-18	0	0				https://twitter.com/07712/status/16102314104328192
16025838243811328	07755	 edisons ray catena auto group presents donation breast cancer foundation httpbitlyfdn k via httpoutsidein 	2010-12-18	0	0				https://twitter.com/07755/status/16025838243811328
13290123374362624	Stacey0428	 rt nj_news gov christie signs teen cancer awareness week law httpbitlyejtdfq httpmylocmef pi 	2010-12-10	0	0	@NJ_News			https://twitter.com/Stacey0428/status/13290123374362624
11947764338397184	Stacey0428	 rt reuters study finds daily aspirin cuts many cancer risks httpreutrsepnnbq httpmylocmeezeti	2010-12-06	0	0	@Reuters			https://twitter.com/Stacey0428/status/11947764338397184
11578459331497984	dylanschenker	 ergs reunion cancer sucks asbury lanes w szabl http sqcom mhmk	2010-12-05	0	0	@Asbury @szabl			https://twitter.com/dylanschenker/status/11578459331497984
7975897395105794	07712	 red bank guinness oyster festival raises cancer funds httpbitlyfxhzcg via httpoutsidein 	2010-11-25	0	0				https://twitter.com/07712/status/7975897395105794
7794674148319232	07753	 red bank guinness oyster festival raises cancer funds httpbitlygze sb via httpoutsidein 	2010-11-25	0	0				https://twitter.com/07753/status/7794674148319232
1451692222578688	murderoflife	 thehangingsun dooood chariot cancer bats stray path hangar 	2010-11-07	0	0	@thehangingsun			https://twitter.com/murderoflife/status/1451692222578688
413178232053761	07712	 ocean howell gymboree play music supports emmanuel cancer foundation santaholiday httpbitlyawwn a via httpoutsidein 	2010-11-05	0	0				https://twitter.com/07712/status/413178232053761
334736157315073	07719	 ocean howell gymboree play music supports emmanuel cancer foundation santaholiday httpbitlybcqmoz via httpoutsidein 	2010-11-04	0	0				https://twitter.com/07719/status/334736157315073
29683373782	07753	 ocean howell gymboree play music supports emmanuel cancer foundation santaholiday httpbitly lzaud via httpoutsidein 	2010-11-04	0	0				https://twitter.com/07753/status/29683373782
28439351106	topix_nj	 us girls race saturday sea girt annual breast cancer fundraiser httpbitlyboaq y seagirt newjersey	2010-10-22	0	0		#SeaGirt #NewJersey		https://twitter.com/topix_nj/status/28439351106
27706310324	08742	 thousands come breast cancer walk httpbitlyb uskz via httpoutsidein 	2010-10-18	0	0				https://twitter.com/08742/status/27706310324
27652083546	djtech	 walked five miles american cancer society favorite team name saw saving second baseall good cause	2010-10-17	0	0				https://twitter.com/djtech/status/27652083546
27640320791	toneisharenae	 breast cancer walk sassy divas jenks beach w others http sqcombxxixg	2010-10-17	0	0	@Jenks			https://twitter.com/toneisharenae/status/27640320791
27637127397	cbarlo	 mmmmm getting ready breast cancer walk ppb favorite boobs starting point grill w jmbrick http sqcomdqv ji	2010-10-17	0	0	@Starting @jmbrick27			https://twitter.com/cbarlo/status/27637127397
27631956585	Mayhem4music	 breast cancer walk jenks beach http sqcombxxixg	2010-10-17	0	0	@Jenks			https://twitter.com/Mayhem4music/status/27631956585
27553310598	candy156sweet	 working wocc table fellow djs harvest festival kids cancer occ college center http sqcombyygwg	2010-10-16	0	0	@OCC			https://twitter.com/candy156sweet/status/27553310598
27551773262	friedtracey	 little would us government like know doctor texas curing cancer years httptinyurlcom yhcfcd	2010-10-16	0	0				https://twitter.com/friedtracey/status/27551773262
27519348455	07719	 making strides breast cancer walk woodbridge sunday httpbitly dib s via httpoutsidein 	2010-10-16	0	0				https://twitter.com/07719/status/27519348455
27516316508	07753	 making strides breast cancer walk woodbridge sunday httpbitlyarmztu via httpoutsidein 	2010-10-16	0	0				https://twitter.com/07753/status/27516316508
27512834646	07712	 making strides breast cancer walk woodbridge sunday httpbitlyapg bi via httpoutsidein 	2010-10-16	0	0				https://twitter.com/07712/status/27512834646
27142572342	MrN1CEGUY1337	 much aware breast cancer weekend nfl footballdue fumbles breast cancer awareness footballs irony	2010-10-12	1	0				https://twitter.com/MrN1CEGUY1337/status/27142572342
27049741109	OceanEdu	 eat surftaco today am pm help occ nj stars raise money cancer info flier must bring httponfbmedlvmop pink	2010-10-11	0	0	@SurfTaco	#OCC #pink		https://twitter.com/OceanEdu/status/27049741109
26898986303	rescueridge	 adopt chevy black labrador retriever petfinder httpshares z ho owner diagnosed aggressive cancer downsize pets	2010-10-09	4	0	@Petfinder			https://twitter.com/rescueridge/status/26898986303
26868028060	REALTOR_JOENJ	 lot kids wearing pink socks laces honor breast cancer awareness month theyre even cont httptlgd dfnua	2010-10-09	0	0				https://twitter.com/REALTOR_JOENJ/status/26868028060
26859103778	08742	 breast cancer dance support activist httpbitlycdlaki via httpoutsidein 	2010-10-09	0	0				https://twitter.com/08742/status/26859103778
26775072451	MrN1CEGUY1337	 johndee _ ight sent ya emm breat cancer awareness packs eppics fail	2010-10-08	0	0	@johndee22_			https://twitter.com/MrN1CEGUY1337/status/26775072451
26684327104	IAM_NvrTrending	 dis nigga mista_rip jus said walked mile breast cancer socks httpplixicomp 	2010-10-07	0	0	@Mista_RIP			https://twitter.com/IAM_NvrTrending/status/26684327104
26679262055	OceanEdu	 zumba cancer occ nj stars tonight pm health human performance building reserve space httponfbmeanttyi	2010-10-07	0	0		#OCC #19		https://twitter.com/OceanEdu/status/26679262055
26668482640	IAM_NvrTrending	 breastcancer joke support cause everyone lost mom cancer make effort httpmylocmecsv t	2010-10-07	0	0		#BreastCancer		https://twitter.com/IAM_NvrTrending/status/26668482640
26524027402	07753	 fight breast cancer needs help possible httpbitly x wmr via httpoutsidein 	2010-10-06	0	0				https://twitter.com/07753/status/26524027402
26524025324	07712	 fight breast cancer needs help possible httpbitlyb vq x via httpoutsidein 	2010-10-06	0	0				https://twitter.com/07712/status/26524025324
26280229520	GlbNet4Humanity	 completed k run followed k walk six flags great adventurerace cure breast cancer	2010-10-03	0	0	@SIX			https://twitter.com/GlbNet4Humanity/status/26280229520
26245730679	08527	 running helps breast cancer survivors heal physically emotionally httpbitlyccoet via httpoutsidein 	2010-10-03	0	0				https://twitter.com/08527/status/26245730679
26245730577	08527	 monroe woman survives thrives youthful battle breast cancer httpbitlycygisa via httpoutsidein 	2010-10-03	0	0				https://twitter.com/08527/status/26245730577
26167431105	topix_nj	 local national business report auxiliary donates k cancer pavilion httpbitlyavtnmn coltsneck newjersey	2010-10-02	0	0		#ColtsNeck #NewJersey		https://twitter.com/topix_nj/status/26167431105
26114467651	_thedobbins	 celebration breast cancer awareness month wear keepabreast foundation bracelet zumiez entire month	2010-10-01	0	0	@zumiez			https://twitter.com/_thedobbins/status/26114467651
25920889971	MrN1CEGUY1337	 josh_looman going special mut pack breast cancer awareness gaurenteed pull ovrn players	2010-09-29	0	0	@Josh_Looman			https://twitter.com/MrN1CEGUY1337/status/25920889971
25821736664	OnTrendMelissaG	 sept ovarian cancer awareness month join electrolux kelly ripa supporting important cause httpbitlyrumpled runway	2010-09-28	0	0				https://twitter.com/OnTrendMelissaG/status/25821736664
25463873313	MrN1CEGUY1337	 josh_looman october breast cancer awareness month make special limited edition pink cards unless thats possible	2010-09-24	0	0	@Josh_Looman			https://twitter.com/MrN1CEGUY1337/status/25463873313
24784444621	topix_nj	 exkiss drummer peter criss survivor breast cancer raising funds walkathon httpbitlybnhaj pointpleasantbeach	2010-09-17	0	0		#PointPleasantBeach		https://twitter.com/topix_nj/status/24784444621
24722150013	InternatTan	 ramonasinger didnt like comment regarding tanning skin cancer say pride researchpractice u preech	2010-09-16	0	0	@ramonasinger			https://twitter.com/InternatTan/status/24722150013
24588913024	BigStevie	 petzrawr gotta choose cancer girls give sympathy fucks aids patients	2010-09-15	0	0	@petzrawr			https://twitter.com/BigStevie/status/24588913024
24525560811	goodiesfrmnj	 abolishcancer grandmother fought bone cancer early s passed late s missed much	2010-09-14	0	0	@abolishcancer			https://twitter.com/goodiesfrmnj/status/24525560811
24284139271	topix_nj	 ovarian cancer walkathons raise funds awareness disease httpbitly nzdys howell newjersey	2010-09-12	0	0		#Howell #NewJersey		https://twitter.com/topix_nj/status/24284139271
24208758520	MarkeyRicciardi	 adopt cause help support american cancer society httpwww dayorg its free click support please rt	2010-09-11	0	0				https://twitter.com/MarkeyRicciardi/status/24208758520
24147549338	donsimmonsrocks	 new cnncom fran drescher douglas cancer fight httpbitlyd xs cnn	2010-09-10	0	0		#cnn		https://twitter.com/donsimmonsrocks/status/24147549338
24093642305	topix_nj	 bottinos raises k fight cancer httpbitlycvyvuw freehold newjersey	2010-09-10	0	0		#Freehold #NewJersey		https://twitter.com/topix_nj/status/24093642305
24051319108	SKYsthalymit	 rt shashu nohomo zodiacfacts zodiacfacts sex taurus cancer intense sensual httpmylocmebit n	2010-09-09	0	0	@shashu29 @ZodiacFacts	#NOHomo #ZodiacFacts #Taurus #Cancer		https://twitter.com/SKYsthalymit/status/24051319108
23231584737	JCJerseyShore	 study home pesticides linked childhood cancer httpbitlyauztzf via addthis	2010-09-07	0	0	@addthis			https://twitter.com/JCJerseyShore/status/23231584737
23180643963	alexston	 dont know id say hes suffering throat cancer hes minorly inconvenienced by throat cancer 	2010-09-06	0	0				https://twitter.com/alexston/status/23180643963
23087497275	AndrewLenaghan	 rip robert schimmel beat cancer died injuries sustained car accident comedy world lost one its great ones	2010-09-05	0	0				https://twitter.com/AndrewLenaghan/status/23087497275
22972128359	Jdenito	 walk ovarian cancer veterans park http sqcombf fgc	2010-09-04	0	0	@Veterans			https://twitter.com/Jdenito/status/22972128359
22660816754	drkenkidneyca	 pinkpilatestere ride live spokes hopea cancer advocacy ride wwwactivecom nynj	2010-08-31	0	0	@PinkPilatesTere			https://twitter.com/drkenkidneyca/status/22660816754
22629811470	drkenkidneyca	 spokes hope cancer advocacy ride things loverideeatspread hoperaise funds fight cancerwwwactivecomregister	2010-08-31	1	0				https://twitter.com/drkenkidneyca/status/22629811470
22130037152	SuperMutant2099	 sad satoshi kon died anime fan sucks someone family die cancer members still alive	2010-08-25	0	0				https://twitter.com/SuperMutant2099/status/22130037152
21755402917	08732	 bar hold fundraiser local man brain cancer httpbitlybwgtfq via httpoutsidein 	2010-08-21	0	0				https://twitter.com/08732/status/21755402917
21724319425	08742	 sunset beach yoga class benefits avon walk breast cancer httpbitlybqa h via httpoutsidein 	2010-08-21	0	0				https://twitter.com/08742/status/21724319425
21507367148	TurningHeads07	 breast cancer kickoff ampeter criss kiss therenice join team make donation help us raise thx	2010-08-18	0	0				https://twitter.com/TurningHeads07/status/21507367148
21396654139	LAlzado77	 michaelombardi mike sorry hear loss momlost mine age she passed cancer yrs ago	2010-08-17	0	0	@michaelombardi			https://twitter.com/LAlzado77/status/21396654139
21360252358	08742	 sunset beach yoga class benefits avon walk breast cancer httpbitly r v via httpoutsidein 	2010-08-16	0	0				https://twitter.com/08742/status/21360252358
20729204274	08742	 doo wop event benefit prostate cancer fund httpbitlycwbx c via httpoutsidein 	2010-08-09	0	0				https://twitter.com/08742/status/20729204274
20600089636	SKYsthalymit	 rt zodiacfacts zodiacfacts taurus cancer come together its generally good combinationthey cont httptlgd vvgv 	2010-08-07	0	0	@ZodiacFacts	#ZodiacFacts #Taurus #Cancer		https://twitter.com/SKYsthalymit/status/20600089636
20519770630	08701	 doo wop event benefit prostate cancer fund httpbitlybga dw via httpoutsidein 	2010-08-06	0	0				https://twitter.com/08701/status/20519770630
20519770068	08736	 doo wop event benefit prostate cancer fund httpbitlyc klym via httpoutsidein 	2010-08-06	0	0				https://twitter.com/08736/status/20519770068
20507159531	topix_nj	 doo wop event benefit prostate cancer fund httpbitlycdlugi brick newjersey	2010-08-06	0	0		#Brick #NewJersey		https://twitter.com/topix_nj/status/20507159531
20504718341	08730	 doo wop event benefit prostate cancer fund httpbitly gif via httpoutsidein 	2010-08-06	0	0				https://twitter.com/08730/status/20504718341
20385495711	07727	 cancer awareness night returns td bank ballpark httpbitlyagocgh via httpoutsidein 	2010-08-05	0	0				https://twitter.com/07727/status/20385495711
20285595378	08732	 bar hold fundraiser local man brain cancer httpbitlyaejlrm via httpoutsidein 	2010-08-04	0	0				https://twitter.com/08732/status/20285595378
20251337760	topix_nj	 bar hold fundraiser local man brain cancer httpbitlyadw y islandheights newjersey	2010-08-03	0	0		#IslandHeights #NewJersey		https://twitter.com/topix_nj/status/20251337760
20235376851	08750	 bayshore community hospital beaches skin cancer free screening httpbitlyd je via httpoutsidein 	2010-08-03	0	0				https://twitter.com/08750/status/20235376851
20235369289	07762	 bayshore community hospital beaches skin cancer free screening httpbitlyc xhby via httpoutsidein 	2010-08-03	0	0				https://twitter.com/07762/status/20235369289
19999888225	Jhodgebeats	 dont cure cancer hivaids solved erectile disfunction hair loss	2010-07-31	0	0				https://twitter.com/Jhodgebeats/status/19999888225
19647751582	07753	 oceanside pillowcases cancer patients httpbitlya kkdm via httpoutsidein 	2010-07-27	0	0				https://twitter.com/07753/status/19647751582
19647742187	07719	 oceanside pillowcases cancer patients httpbitlyd b ll via httpoutsidein 	2010-07-27	0	0				https://twitter.com/07719/status/19647742187
19647742131	07712	 oceanside pillowcases cancer patients httpbitlya am via httpoutsidein 	2010-07-27	0	0				https://twitter.com/07712/status/19647742131
19314627412	BigStevie	 oh got awesome cancer bats sunglasses httptweetphotocom 	2010-07-23	0	0				https://twitter.com/BigStevie/status/19314627412
19090344107	08701	 cancer patients june wedding created nj branch association bridal consultan httpbitly dhkgy via httpoutsidein 	2010-07-21	0	0				https://twitter.com/08701/status/19090344107
19090339473	08050	 cancer patients june wedding created nj branch association bridal consultan httpbitlycx n via httpoutsidein 	2010-07-21	0	0				https://twitter.com/08050/status/19090339473
19090339228	08005	 cancer patients june wedding created nj branch association bridal consultan httpbitlyd nb via httpoutsidein 	2010-07-21	0	0				https://twitter.com/08005/status/19090339228
19090335391	07719	 cancer patients june wedding created nj branch association bridal consultan httpbitly irnil via httpoutsidein 	2010-07-21	0	0				https://twitter.com/07719/status/19090335391
19090334481	07712	 cancer patients june wedding created nj branch association bridal consultan httpbitly x an via httpoutsidein 	2010-07-21	0	0				https://twitter.com/07712/status/19090334481
19073817003	07753	 cancer patients june wedding created nj branch association bridal consultan httpbitlybtfdfr via httpoutsidein 	2010-07-21	0	0				https://twitter.com/07753/status/19073817003
18593223606	07753	 entertainment pink martini benefits breast cancer patients httpbitlybu uos via httpoutsidein 	2010-07-15	0	0				https://twitter.com/07753/status/18593223606
18593222702	07712	 entertainment pink martini benefits breast cancer patients httpbitlybdgezd via httpoutsidein 	2010-07-15	0	0				https://twitter.com/07712/status/18593222702
18593222649	07719	 entertainment pink martini benefits breast cancer patients httpbitlycqge a via httpoutsidein 	2010-07-15	0	0				https://twitter.com/07719/status/18593222649
18577228707	08750	 free skin cancer screening httpbitlycu fzv via httpoutsidein 	2010-07-15	0	0				https://twitter.com/08750/status/18577228707
18577228290	08736	 free skin cancer screening httpbitlyaqkd o via httpoutsidein 	2010-07-15	0	0				https://twitter.com/08736/status/18577228290
18577221273	07762	 free skin cancer screening httpbitlybyjkgl via httpoutsidein 	2010-07-15	0	0				https://twitter.com/07762/status/18577221273
18562956975	topix_nj	 free skin cancer screening httpbitlyatznm bradleybeach newjersey	2010-07-14	0	0		#BradleyBeach #NewJersey		https://twitter.com/topix_nj/status/18562956975
18501165631	08006	 rainbow connection annual cancer survivor party earns research httpbitly c j via httpoutsidein 	2010-07-14	0	0				https://twitter.com/08006/status/18501165631
18501165625	08006	 rainbow connection annual cancer survivor party earns research httpbitlycw apa via httpoutsidein 	2010-07-14	0	0				https://twitter.com/08006/status/18501165625
18451187554	08742	 help fight breast cancer smile httpbitlyasswa via httpoutsidein 	2010-07-13	0	0				https://twitter.com/08742/status/18451187554
18153263068	07756	 marys place ocean grove women undergoing cancer treatment find respite httpbitlybhi zj via httpoutsidein 	2010-07-09	0	0				https://twitter.com/07756/status/18153263068
18153262876	07753	 marys place ocean grove women undergoing cancer treatment find respite httpbitlya iu k via httpoutsidein 	2010-07-09	0	0				https://twitter.com/07753/status/18153262876
18153261542	07720	 marys place ocean grove women undergoing cancer treatment find respite httpbitlybgsud via httpoutsidein 	2010-07-09	0	0				https://twitter.com/07720/status/18153261542
18153261389	07719	 marys place ocean grove women undergoing cancer treatment find respite httpbitlydbpjlg via httpoutsidein 	2010-07-09	0	0				https://twitter.com/07719/status/18153261389
18153261318	07712	 marys place ocean grove women undergoing cancer treatment find respite httpbitlybl opd via httpoutsidein 	2010-07-09	0	0				https://twitter.com/07712/status/18153261318
18088450850	topix_nj	 women treated cancer find respite ocean grove inn httpbitlybyxadu interlaken newjersey	2010-07-08	0	0		#Interlaken #NewJersey		https://twitter.com/topix_nj/status/18088450850
17859240720	08742	 family fun night july breast cancer fundraiser httpbitly ff z via httpoutsidein 	2010-07-06	0	0				https://twitter.com/08742/status/17859240720
17389828841	DynamicDarling	 happy birthday poloduude joined s club cancer s life	2010-06-30	0	0	@PoloDuuDe			https://twitter.com/DynamicDarling/status/17389828841
17285890257	08691	 us sen frank lautenberg nj says hes cancer free lymphoma diagnosis february httpbitlybscgpx via httpoutsidein 	2010-06-28	0	0				https://twitter.com/08691/status/17285890257
17285889381	08691	 us sen lautenberg says hes cancer free httpbitly msir via httpoutsidein 	2010-06-28	0	0				https://twitter.com/08691/status/17285889381
16920688746	07720	 ocean grove concert help women fighting cancer httpbitly noajh via httpoutsidein 	2010-06-24	0	0				https://twitter.com/07720/status/16920688746
16656298624	07753	 retreat women cancer get boost concert httpbitlybtogiu via httpoutsidein 	2010-06-20	0	0				https://twitter.com/07753/status/16656298624
16656298441	07712	 retreat women cancer get boost concert httpbitlycsulhc via httpoutsidein 	2010-06-20	0	0				https://twitter.com/07712/status/16656298441
16341487550	08701	 nj branch association bridal consultants announces team cancer patients june httpbitlyca cub via httpoutsidein 	2010-06-16	0	0				https://twitter.com/08701/status/16341487550
16052719628	07726	 golf fundraiser honors late north brunswick volunteer young east brunswick cancer victim httpbitlyddo lg via httpoutsidein 	2010-06-13	0	0				https://twitter.com/07726/status/16052719628
15967195490	07753	 central jersey woman business honored cancer fight httpbitlyb xba via httpoutsidein 	2010-06-11	0	0				https://twitter.com/07753/status/15967195490
15393353153	08742	 manville councilwoman breast cancer survivor walk research httpbitlybtiynl via httpoutsidein 	2010-06-04	0	0				https://twitter.com/08742/status/15393353153
15386351848	08691	 sponsored trentons capital health jersey ovarian cancer forum set next weekend httpbitlycnpwbv via httpoutsidein 	2010-06-03	0	0				https://twitter.com/08691/status/15386351848
15020479518	rofflecopter316	 elizadushku celebrating family here mother diagnosed cancer free quite bit thankful for	2010-05-30	0	0	@elizadushku			https://twitter.com/rofflecopter316/status/15020479518
14793467220	STEFNAMI	 retweeeet thissss rt every new follower singforacure gets theyll donate cancer researchawareness	2010-05-26	0	0	@singforacure			https://twitter.com/STEFNAMI/status/14793467220
14733029911	Sabatino0h	 i tatas therefore ill allstarz breast cancer fundraiser boobies lmfao httpmylocme r lc	2010-05-25	0	0				https://twitter.com/Sabatino0h/status/14733029911
14711382079	08742	 radiation needed many older breast cancer patients httpbitlydcjwlf via httpoutsidein 	2010-05-25	0	0				https://twitter.com/08742/status/14711382079
14672629974	kellyissanti	 helpdonate help find cure childhood cancer httpwwwalexslemonadeorgmypage rt please alexslemonadestand	2010-05-25	4	0		#alexslemonadestand		https://twitter.com/kellyissanti/status/14672629974
14641642701	07762	 paying forward join nj cancer study httpbitlycpy d via httpoutsidein 	2010-05-24	0	0				https://twitter.com/07762/status/14641642701
14641641632	07719	 paying forward join nj cancer study httpbitlycwsrhh via httpoutsidein 	2010-05-24	0	0				https://twitter.com/07719/status/14641641632
14244759745	don29002	 frandrescher awarded dgc dame grand cross of british empireby hm_the_queen cancer work nanny	2010-05-18	0	0	@frandrescher @hm_the_queen			https://twitter.com/don29002/status/14244759745
13943810393	oldtimemovies	 frandrescher nyc much cancer schmancer events events	2010-05-13	0	0	@frandrescher			https://twitter.com/oldtimemovies/status/13943810393
13106543325	07726	 matawan boutique comes aid freehold township bride cancer httpbitlyazz via httpoutsidein 	2010-04-29	0	0				https://twitter.com/07726/status/13106543325
12938564207	08742	 manville woman ready walk breast cancer research httpbitlydigf o via httpoutsidein 	2010-04-27	0	0				https://twitter.com/08742/status/12938564207
12935353570	don29002	 officialcancer follow frandrescher cancer schmancer organization	2010-04-27	0	0	@officialCANCER @frandrescher			https://twitter.com/don29002/status/12935353570
12794171917	BigStevie	 long_drive meechone afraid little heat making fun retards cancer patients	2010-04-24	0	0	@LONG_DRIVE @meechone			https://twitter.com/BigStevie/status/12794171917
12170806482	lordskulldragon	 found last month father breast cancer lets hope its hereditary	2010-04-14	0	0				https://twitter.com/lordskulldragon/status/12170806482
12097769556	08701	 cancer concern center offe cancer concern center offers support hope fighting cancer camaraderie httpbitlybfoil via html	2010-04-13	0	0				https://twitter.com/08701/status/12097769556
11959776112	08691	 roberts franks roberts franks former nj congressman state gop chairman succumbs cancer httpbitly zry f via html	2010-04-10	0	0				https://twitter.com/08691/status/11959776112
11838679148	08742	 women honored ovarian cancer fundraising e women honored ovarian cancer fundraising efforts httpbitlybna a via html	2010-04-08	0	0				https://twitter.com/08742/status/11838679148
11838273027	07726	 bridal shops closing disrupts cancer patients bridal shops closing disrupts cancer patients dream httpbitlyandywx via html	2010-04-08	0	0				https://twitter.com/07726/status/11838273027
11794110293	chriscann0n	 dled new cancer batsso damn good	2010-04-07	0	0				https://twitter.com/chriscann0n/status/11794110293
11603260257	07753	 bridal shops closing disrupts cancer patients dream appcom httpbitlydxjz s via httpoutsidein 	2010-04-04	0	0				https://twitter.com/07753/status/11603260257
11603256177	07719	 bridal shops closing disrupts cancer patients dream appcom httpbitly wrylt via httpoutsidein 	2010-04-04	0	0				https://twitter.com/07719/status/11603256177
11603255991	07728	 bridal shops closing disrupts cancer patients dream appcom httpbitlyd wjiq via httpoutsidein 	2010-04-04	0	0				https://twitter.com/07728/status/11603255991
11603255113	07712	 bridal shops closing disrupts cancer patients dream appcom httpbitlybskp c via httpoutsidein 	2010-04-04	0	0				https://twitter.com/07712/status/11603255113
11603252931	07726	 bridal shops closing disrupts cancer patients dream appcom httpbitlyakcaps via httpoutsidein 	2010-04-04	0	0				https://twitter.com/07726/status/11603252931
11493314465	_thedobbins	 think im going guy pemberton ride pink grips breast cancer 	2010-04-02	0	0				https://twitter.com/_thedobbins/status/11493314465
11258757751	08701	 cancer concern center plans fundraising dinner dance appcom httpbitlyacylsk via httpoutsidein 	2010-03-29	0	0				https://twitter.com/08701/status/11258757751
10910782632	08742	 local dunellen resident joins fight end breast cancer avon found mycentraljersey httpbitlyck ujq via httpoutsidein 	2010-03-23	0	0				https://twitter.com/08742/status/10910782632
20117515984183297	08540	 allstate new jersey raises cancer fight quotes cure insuran httpbitlyhhol h via httpoutsidein 	2010-12-29	0	0				https://twitter.com/08540/status/20117515984183297
