id	Username	Text	Date	Retweets	Favorites	Mentions	Hashtags	Geo	Permalink
18172333491486720	seanbuckley	 marymare mexicans always crazy remedies everything lemons cure cancer toothpaste zits srry puerto rican whatever	2010-12-24	0	0	@Marymare03			https://twitter.com/seanbuckley/status/18172333491486720
16463633038966784	79415	 local marine returns home fight battle cancer httpbitlydis ca via httpoutsidein 	2010-12-19	0	0				https://twitter.com/79415/status/16463633038966784
16463630996344832	79415	 local marine returns home fight battle cancer httpbitlygpwonw via httpoutsidein 	2010-12-19	0	0				https://twitter.com/79415/status/16463630996344832
16463630652407809	79407	 local marine returns home fight battle cancer httpbitlyewbtq via httpoutsidein 	2010-12-19	0	0				https://twitter.com/79407/status/16463630652407809
16463627410214912	79407	 local marine returns home fight battle cancer httpbitlyhuvyab via httpoutsidein 	2010-12-19	0	0				https://twitter.com/79407/status/16463627410214912
16463623358513153	79403	 local marine returns home fight battle cancer httpbitlyi x aw via httpoutsidein 	2010-12-19	0	0				https://twitter.com/79403/status/16463623358513153
16463621760483328	79403	 local marine returns home fight battle cancer httpbitlyekcdbj via httpoutsidein 	2010-12-19	0	0				https://twitter.com/79403/status/16463621760483328
15740398584471552	79423	 doctors guitars cancer httpbitlyghwjgz via httpoutsidein 	2010-12-17	0	0				https://twitter.com/79423/status/15740398584471552
15071401765511169	Rickym11	 im lubbock cancer center lubbock http sqcomfathej	2010-12-15	0	0				https://twitter.com/Rickym11/status/15071401765511169
14832106312048641	ihate_buffering	 found good friend samantha lost battle cervical cancer makes everything seem insignificant	2010-12-14	0	0				https://twitter.com/ihate_buffering/status/14832106312048641
12823665334812672	79525	 lisa snow k event help fight cancer httpbitlyhvhqvm via httpoutsidein 	2010-12-09	0	0				https://twitter.com/79525/status/12823665334812672
7734877357088768	79782	 mustaches november raising money cancer awareness httpbitlyhtnsbn via httpoutsidein 	2010-11-25	0	0				https://twitter.com/79782/status/7734877357088768
470785265246208	79601	 hawley football coach cancer grateful day httpbitly pq kr via httpoutsidein 	2010-11-05	0	0				https://twitter.com/79601/status/470785265246208
470774624292864	79525	 hawley football coach cancer grateful day httpbitlyaisrhw via httpoutsidein 	2010-11-05	0	0				https://twitter.com/79525/status/470774624292864
29417627888	GypsyHeartRescu	 please pray angel rg one adopters healed loved precious abused horse back health cancer worry	2010-11-01	0	0				https://twitter.com/GypsyHeartRescu/status/29417627888
28968311333	79601	 breast cancer victim made many hard decisions httpbitlydfl ii via httpoutsidein 	2010-10-28	0	0				https://twitter.com/79601/status/28968311333
28869688471	79601	 bunco breast cancer httpbitlybu t via httpoutsidein 	2010-10-27	0	0				https://twitter.com/79601/status/28869688471
28441405730	Misconstrued20	 two major events attend tonight carnival pm pm up til dawn fundraiser kids w cancer pm am	2010-10-22	0	0		#EVENTS		https://twitter.com/Misconstrued20/status/28441405730
27522340685	79381	 teen race car driver raising cancer awareness httpbitlycrpw h via httpoutsidein 	2010-10-16	0	0				https://twitter.com/79381/status/27522340685
27522339763	79373	 teen race car driver raising cancer awareness httpbitlycabzva via httpoutsidein 	2010-10-16	0	0				https://twitter.com/79373/status/27522339763
27061112552	TeamRedBeard49	 thinking bout ordering ers sideline breast cancer hat im feeling pretty sharp good cause thoughts	2010-10-11	0	0				https://twitter.com/TeamRedBeard49/status/27061112552
26345426384	79407	 thousands race find cure breast cancer httpbitlyd dlln via httpoutsidein 	2010-10-04	0	0				https://twitter.com/79407/status/26345426384
26251336287	79415	 thousands race find cure breast cancer httpbitlyci x via httpoutsidein 	2010-10-03	0	0				https://twitter.com/79415/status/26251336287
26251336015	79403	 thousands race find cure breast cancer httpbitly xsy via httpoutsidein 	2010-10-03	0	0				https://twitter.com/79403/status/26251336015
26251336009	79415	 thousands support breast cancer fight lubbocks komen race cure httpbitlya ns n via httpoutsidein 	2010-10-03	0	0				https://twitter.com/79415/status/26251336009
26251335723	79403	 thousands support breast cancer fight lubbocks komen race cure httpbitlybubvir via httpoutsidein 	2010-10-03	0	0				https://twitter.com/79403/status/26251335723
26251335369	79415	 thousands race find cure breast cancer httpbitly xurk via httpoutsidein 	2010-10-03	0	0				https://twitter.com/79415/status/26251335369
26251335198	79403	 thousands race find cure breast cancer httpbitlycomqci via httpoutsidein 	2010-10-03	0	0				https://twitter.com/79403/status/26251335198
25042429538	ihate_buffering	 repunlicans would assisinatert almightygod would think scientist discovered cure cancer kept secret	2010-09-20	0	0	@almightygod			https://twitter.com/ihate_buffering/status/25042429538
24643368783	79407	 raise funds breast cancer httpbitlyabhyyz via httpoutsidein 	2010-09-16	0	0				https://twitter.com/79407/status/24643368783
24643367776	79403	 raise funds breast cancer httpbitly xhgix via httpoutsidein 	2010-09-16	0	0				https://twitter.com/79403/status/24643367776
22162491634	79782	 local filmmakers spearhead benefit cancer society httpbitlyb ws c via httpoutsidein 	2010-08-26	0	0				https://twitter.com/79782/status/22162491634
20693464109	79248	 casey smithson cure cancer concert today httpbitlyapjcr via httpoutsidein 	2010-08-09	0	0				https://twitter.com/79248/status/20693464109
20125646054	79356	 mans best friend fight cancer bark life httpbitlycf rrz via httpoutsidein 	2010-08-02	0	0				https://twitter.com/79356/status/20125646054
19896004645	79248	 cure cancer concert benefit casey smithson httpbitlyadvtoz via httpoutsidein 	2010-07-30	0	0				https://twitter.com/79248/status/19896004645
18897556387	79261	 duxbury boy takes mound cancer curveball httpbitly mn uq via httpoutsidein 	2010-07-19	0	0				https://twitter.com/79261/status/18897556387
18602128961	lenire	 osubecc team tan called team cancer 	2010-07-15	0	0	@osubecc			https://twitter.com/lenire/status/18602128961
18588195100	79423	 american cancer society hands awards httpbitly f gse via httpoutsidein 	2010-07-15	0	0				https://twitter.com/79423/status/18588195100
18340870972	79782	 midland sheriffs office needs communitys help corporal cancer httpbitlydmpjbo via httpoutsidein 	2010-07-12	0	0				https://twitter.com/79782/status/18340870972
18340857582	79411	 levelland fire chief laid rest losing battle cancer httpbitly vzhzg via httpoutsidein 	2010-07-12	0	0				https://twitter.com/79411/status/18340857582
18340856982	79401	 levelland fire chief laid rest losing battle cancer httpbitlyavhkor via httpoutsidein 	2010-07-12	0	0				https://twitter.com/79401/status/18340856982
14483825180	79415	 broadway church christ bring cancer prayer day lubbock httpbitlyafo ce via httpoutsidein 	2010-05-22	0	0				https://twitter.com/79415/status/14483825180
14483824490	79407	 broadway church christ bring cancer prayer day lubbock httpbitlyaglhkc via httpoutsidein 	2010-05-22	0	0				https://twitter.com/79407/status/14483824490
14483822961	79403	 broadway church christ bring cancer prayer day lubbock httpbitlycg jsg via httpoutsidein 	2010-05-22	0	0				https://twitter.com/79403/status/14483822961
13292068167	79415	 latest technology excellent care help patient beat cancer second time httpbitlybb lbo via httpoutsidein 	2010-05-03	0	0				https://twitter.com/79415/status/13292068167
13292064306	79407	 latest technology excellent care help patient beat cancer second time httpbitlychasso via httpoutsidein 	2010-05-03	0	0				https://twitter.com/79407/status/13292064306
13292064048	79403	 latest technology excellent care help patient beat cancer second time httpbitlycjjnrs via httpoutsidein 	2010-05-03	0	0				https://twitter.com/79403/status/13292064048
12703211512	ChiefLink	 rt dvice years well tell whether cellphones cause cancer httpbitlydnmef so long see results time fine	2010-04-23	0	0	@dvice			https://twitter.com/ChiefLink/status/12703211512
12600790113	jlowens6646	 rt erinandrewsespn rt pleasre please ineed help raise million kids battling cancer go cont httptlgdvcrde	2010-04-21	0	0	@ErinAndrewsESPN			https://twitter.com/jlowens6646/status/12600790113
12563197177	79410	 twin sisters breast cancer survivors get personalized care wellness lubbock httpbitlyaeeq via httpoutsidein html	2010-04-21	0	0				https://twitter.com/79410/status/12563197177
12510484451	tayvitothunder	 child ends cancer zodiac sign make think her even moreplease due date	2010-04-20	0	0				https://twitter.com/tayvitothunder/status/12510484451
12509525902	tayvitothunder	 mikenerikner thats going happen going say ive killed cancer its time keep on	2010-04-20	0	0	@MikenerIkner			https://twitter.com/tayvitothunder/status/12509525902
12442763190	79415	 twin sisters breast cancer survivors get personalized care wellness lubbock httpbitlydharc via httpoutsidein html	2010-04-19	0	0				https://twitter.com/79415/status/12442763190
12442762326	79410	 twin sisters breast cancer survivors get personalized care wellness lubbock httpbitlya dzpq via httpoutsidein html	2010-04-19	0	0				https://twitter.com/79410/status/12442762326
12150340740	79373	 former congresswoman thyroid cancer former congresswoman thyroid cancer httpbitlyakrdyv via html	2010-04-14	0	0				https://twitter.com/79373/status/12150340740
12150340620	79381	 former congresswoman thyroid cancer former congresswoman thyroid cancer httpbitlycadize via html	2010-04-14	0	0				https://twitter.com/79381/status/12150340620
11875905316	79410	 annual mammograms annual mammograms breast mri help catch cancer early family makes big difference httpbitlybjxjjg via html	2010-04-09	0	0				https://twitter.com/79410/status/11875905316
11827413759	krenayw	 going see grandparents tomorrow mammaw diagnosed breast cancer tuesday going surgeon tomorrow	2010-04-08	0	0				https://twitter.com/krenayw/status/11827413759
20231315454427136	_HectorGarcia_	 sexstrology cancer s learn reach emotional balance since tend overly sensitive moody	2010-12-29	0	0	@Sexstrology	#Cancer		https://twitter.com/_HectorGarcia_/status/20231315454427136
19652799885213696	iHateMontay	 actualexcusesiveusedtobreakupwithsomeone cut hair wanted date bald girl would went cancer unit parkland	2010-12-28	0	0		#actualexcusesiveusedtobreakupwithsomeone		https://twitter.com/iHateMontay/status/19652799885213696
19522897634660352	_MsUnderstood_x	 abortion killed african american cancer hivaids diabetes put together need stop	2010-12-27	0	0				https://twitter.com/_MsUnderstood_x/status/19522897634660352
19168112129613824	DAK0225	 cyberpixie youre gym yourself thatll keep going worked year friend died panc cancer	2010-12-26	0	0	@cyberpixie			https://twitter.com/DAK0225/status/19168112129613824
18781721755385856	pickettfurnitur	 gebomana second helpings a food bank hometown grind life provides assistance skateboarders cancer you	2010-12-25	0	0	@GeboMana			https://twitter.com/pickettfurnitur/status/18781721755385856
18458500246011904	freeeeewifi	 grandpa battling cancer months hes amazing im glad hes another christmas	2010-12-24	0	0				https://twitter.com/freeeeewifi/status/18458500246011904
18066978186989569	midagasm	 im cmc center cancer blood disorders medical district dr harry hines dallas http sqcomhuseow	2010-12-23	0	0				https://twitter.com/midagasm/status/18066978186989569
17871627530272769	iHateMontay	 swear coolgreys must cure cancer sum dont even wear jays	2010-12-23	0	0		#coolgreys		https://twitter.com/iHateMontay/status/17871627530272769
17476086212337664	76262	 cancer puts keller mans life fast forward httpbitlyiadz via httpoutsidein 	2010-12-22	0	0				https://twitter.com/76262/status/17476086212337664
17476084509450240	76180	 cancer puts keller mans life fast forward httpbitlyefjqfd via httpoutsidein 	2010-12-22	0	0				https://twitter.com/76180/status/17476084509450240
17476084333289474	76248	 cancer puts keller mans life fast forward httpbitlyeoomc via httpoutsidein 	2010-12-22	0	0				https://twitter.com/76248/status/17476084333289474
17476079539200000	76118	 cancer puts keller mans life fast forward httpbitlydfbqpd via httpoutsidein 	2010-12-22	0	0				https://twitter.com/76118/status/17476079539200000
17273759685681153	ochibasan	 evilzug its like giving roids lab rat soon get cancer die lol	2010-12-21	0	0	@evilzug			https://twitter.com/ochibasan/status/17273759685681153
17232796716113920	lexiet0asters	 fox weird scientists breed mouse chirps httpbitlyg utbw really give cancer thing guys	2010-12-21	0	0	@FOX4			https://twitter.com/lexiet0asters/status/17232796716113920
17057174215725056	LaKOOLgiirl	 sexstrology cancer aquarius compatible	2010-12-20	0	0	@Sexstrology	#cancer #aquarius		https://twitter.com/LaKOOLgiirl/status/17057174215725056
17017377153613824	Whareagle	 spin mrc studio gutted relief easy xfer donsky gym joy seeing one favorite spinners come back cancer priceless	2010-12-20	0	0				https://twitter.com/Whareagle/status/17017377153613824
16704621611319296	therealjorge	 oh guess never publicly stated taras mom breast cancer bad yall shouldnt assume followers know rhonda	2010-12-19	0	0				https://twitter.com/therealjorge/status/16704621611319296
16700429517725696	therealjorge	 heading bed long day ahead taras moms mastectomy tomorrow thoughts prayers appreciated ready kick cancer s a	2010-12-19	0	0				https://twitter.com/therealjorge/status/16700429517725696
16433242508890112	justintx88	 krudy dad went xavier r huge nd fans beat cancer get rt man	2010-12-19	0	0	@krudy9			https://twitter.com/justintx88/status/16433242508890112
16215417286565888	iohcreative	 im looking breast cancer survivors art experiment please put word out	2010-12-18	0	0				https://twitter.com/iohcreative/status/16215417286565888
15140584599592961	x0__tLa	 truth rt sexstrology cancer controlled moon since moon changes its shape daily cancer s mood changes daily too	2010-12-15	0	0	@Sexstrology	#Cancer		https://twitter.com/x0__tLa/status/15140584599592961
14832106312048641	ihate_buffering	 found good friend samantha lost battle cervical cancer makes everything seem insignificant	2010-12-14	0	0				https://twitter.com/ihate_buffering/status/14832106312048641
14470312255037440	KareemJWilliams	 every seconds someone somewhere world dies lung cancer	2010-12-13	0	0				https://twitter.com/KareemJWilliams/status/14470312255037440
13674736903000064	THEdaninicole	 trevortv ha right oh well guess know its spread like cancer uk belong	2010-12-11	0	0	@trevortv			https://twitter.com/THEdaninicole/status/13674736903000064
13629176372269058	HEAUXS_HateTee	 rt sexstrology cancer love sex go together show love open httpmylocmefayma	2010-12-11	0	0	@Sexstrology			https://twitter.com/HEAUXS_HateTee/status/13629176372269058
13441104607182848	BarbellBmbshell	 rt justjoshchat teacher told us yesterday smoking marijuana cause lung cancer eventuallynot surprised	2010-12-10	0	0	@JustJoshChat			https://twitter.com/BarbellBmbshell/status/13441104607182848
13125996202958848	HEAUXS_HateTee	 rt sexstrology cancer signs range shy timid dull outright brilliant geniuses stardom httpmylocmef wyr	2010-12-10	0	0	@Sexstrology	#Cancer		https://twitter.com/HEAUXS_HateTee/status/13125996202958848
12823665334812672	79525	 lisa snow k event help fight cancer httpbitlyhvhqvm via httpoutsidein 	2010-12-09	0	0				https://twitter.com/79525/status/12823665334812672
12630925087084544	HEAUXS_HateTee	 rt sexstrology cancer hates see pain suffering others httpmylocmef r i	2010-12-08	0	0	@Sexstrology	#Cancer		https://twitter.com/HEAUXS_HateTee/status/12630925087084544
12546306207645696	Snaxxzy	 kut juz culd broski culd da sensitive cancer lmao wtf 	2010-12-08	0	0	@2kut4juz1			https://twitter.com/Snaxxzy/status/12546306207645696
12272019898892288	scottyperkins	 tragic need much less kind news nytimes elizabeth edwards dies cancer httpnytimshoeezk	2010-12-07	0	0	@nytimes			https://twitter.com/scottyperkins/status/12272019898892288
12205005813583874	75201	 young texans cancer holiday happy hour httpbitlygu xt via httpoutsidein 	2010-12-07	0	0				https://twitter.com/75201/status/12205005813583874
11731759305592832	CajunDave	 mmflint maddow great nhs morons motherofthree dies eleven doctors fail diagnose stomach cancer httpdlvrit q zz	2010-12-06	0	0	@MMFlint @maddow			https://twitter.com/CajunDave/status/11731759305592832
11543523664859137	HEAUXS_HateTee	 rt sexstrology cancer soothing love maker httpmylocmeexkmk	2010-12-05	0	0	@Sexstrology	#Cancer		https://twitter.com/HEAUXS_HateTee/status/11543523664859137
11185086766514176	HEAUXS_HateTee	 rt sexstrology cancer emotionally sensitive lover dont mean httpmylocmeevefj	2010-12-04	0	0	@Sexstrology	#Cancer		https://twitter.com/HEAUXS_HateTee/status/11185086766514176
11093845445967874	BRealz	 keeping cancer alive cigarette city http sqcombtwcw 	2010-12-04	0	0	@Cigarette			https://twitter.com/BRealz/status/11093845445967874
10951207241650176	HEAUXS_HateTee	 rt sexstrology cancer sweetest lovers httpmylocmeetqik	2010-12-04	0	0	@Sexstrology	#Cancer		https://twitter.com/HEAUXS_HateTee/status/10951207241650176
10869056370380800	HEAUXS_HateTee	 rt sexyasstoni rt sexstrology cancer signs superficial may like body like heart even more	2010-12-03	0	0	@sexyasstoni @Sexstrology	#Cancer		https://twitter.com/HEAUXS_HateTee/status/10869056370380800
10479411748933632	anthonygerhart	 facebook friends putting cartoon profile picture stops child abuse much playing trauma center stops cancer 	2010-12-02	2	0				https://twitter.com/anthonygerhart/status/10479411748933632
10185583896825856	TheMammaryClan	 abby dayatlanta went ahead mastectomy getting results bc scared cancer reasons walk	2010-12-01	0	0	@abby3dayatlanta			https://twitter.com/TheMammaryClan/status/10185583896825856
10056551653965824	mrkilmister	 cancer bitch rowlett cancer center httpgowallac zuk	2010-12-01	0	0				https://twitter.com/mrkilmister/status/10056551653965824
9818370392203264	joselizacarias	 pagarle pork le aga un examen de cancer 	2010-11-30	0	0				https://twitter.com/joselizacarias/status/9818370392203264
9757454019596289	tomatoepie	 going breast cancer surgery dec st thank prayers janice pistek	2010-11-30	0	0				https://twitter.com/tomatoepie/status/9757454019596289
9464184643256320	outerspacekate	 tweet mr idom mhss beloved physics teacher diagnosed stage lung cancer today	2010-11-29	0	0				https://twitter.com/outerspacekate/status/9464184643256320
9432336567373826	topix_tx	 owner landmark local country music club loses battle cancer httpbitlyfosxbr waco texas	2010-11-29	0	0		#Waco #Texas		https://twitter.com/topix_tx/status/9432336567373826
9395888220798977	75034	 texas breast specialists expands breast cancer treatment services httpbitlyfu nss via httpoutsidein 	2010-11-29	0	0				https://twitter.com/75034/status/9395888220798977
9214657738833921	76712	 wacoarea hospitals fare well handling cancer patients poor prognoses httpbitlyejipks via httpoutsidein 	2010-11-29	0	0				https://twitter.com/76712/status/9214657738833921
9214656623153153	76712	 wacoarea hospitals fare well handling cancer patients poor prognoses httpbitlyfiqibs via httpoutsidein 	2010-11-29	0	0				https://twitter.com/76712/status/9214656623153153
9214650285563904	76657	 wacoarea hospitals fare well handling cancer patients poor prognoses httpbitlyex z o via httpoutsidein 	2010-11-29	0	0				https://twitter.com/76657/status/9214650285563904
9214648146468864	76657	 wacoarea hospitals fare well handling cancer patients poor prognoses httpbitlygdgbgg via httpoutsidein 	2010-11-29	0	0				https://twitter.com/76657/status/9214648146468864
9105785711759361	WetoddNation	 tsa makes cancer victim remove prosthetic breast httpwwwcbsnewscomstories nationalmain shtml	2010-11-28	0	0				https://twitter.com/WetoddNation/status/9105785711759361
9087047331487744	Exxclusive81	 rt _naturalbeauty_ sexstrology aries cancer libra capricorn sense love choose start deny it im libra	2010-11-28	0	0	@_NaturalBeauty_ @Sexstrology			https://twitter.com/Exxclusive81/status/9087047331487744
8596104396414976	BarbellBmbshell	 lipslikepoww omg lol pray god nevr get cancer i definitely wouldnt broadcast twitter lol thank god health	2010-11-27	0	0	@LipsLikePOWW			https://twitter.com/BarbellBmbshell/status/8596104396414976
8594079860391936	BarbellBmbshell	 ii hate cancer sometimes damn emotion arghhh	2010-11-27	0	0				https://twitter.com/BarbellBmbshell/status/8594079860391936
8106250642395136	topix_tx	 young pastor turns struggle cancer year teachable moments httpbitlydq sn flowermound texas	2010-11-26	0	0		#FlowerMound #Texas		https://twitter.com/topix_tx/status/8106250642395136
6206780753317888	topix_tx	 lucinda breeding cancer support bras httpbitlycu wrx whitney texas	2010-11-20	0	0		#Whitney #Texas		https://twitter.com/topix_tx/status/6206780753317888
5560338741207040	76036	 vaccine could stop cancer growth httpbitlybywunk via httpoutsidein 	2010-11-19	0	0				https://twitter.com/76036/status/5560338741207040
5076908639256576	76028	 vaccine could stop cancer growth httpbitly h orv via httpoutsidein 	2010-11-17	0	0				https://twitter.com/76028/status/5076908639256576
4996033281003520	thebetterbrit	 support gaso sponsored american cancer society dad quit anyone can proud him	2010-11-17	0	0		#GASO		https://twitter.com/thebetterbrit/status/4996033281003520
4609951364284416	mrkilmister	 chemo again rowlett regional cancer center http sqcomcp bcq	2010-11-16	0	0	@Rowlett			https://twitter.com/mrkilmister/status/4609951364284416
4295163241304064	BikerForgiven	 elbow room leather clad old school bikers cancer benefit httpexmnralrrxi	2010-11-15	0	0				https://twitter.com/BikerForgiven/status/4295163241304064
4038837101666304	LaKOOLgiirl	 would cure cancer would eat tres leches cake outta crooked mouths vajj	2010-11-15	0	0				https://twitter.com/LaKOOLgiirl/status/4038837101666304
3876794176376832	sasysoutherngal	 come_il_mare went too huge lump removed negative cancer know waiting worst	2010-11-14	0	0	@come_il_mare			https://twitter.com/sasysoutherngal/status/3876794176376832
3703321399398401	75067	 cancer poker run big c ft worth tx httpbitlycpz kn via httpoutsidein 	2010-11-14	0	0				https://twitter.com/75067/status/3703321399398401
3492166143840256	Zens7s	 gwingrimes hey lady moms new anti cancer diet requires processedwhite flour think need take trip artisanbreadco 	2010-11-13	0	0	@gwingrimes @artisanbreadco			https://twitter.com/Zens7s/status/3492166143840256
3173884429860864	75010	 cancer poker run big c ft worth tx httpbitlyax ryk via httpoutsidein 	2010-11-12	0	0				https://twitter.com/75010/status/3173884429860864
3009421407952897	75056	 cancer poker run big c ft worth tx httpbitlycjfhdy via httpoutsidein 	2010-11-12	0	0				https://twitter.com/75056/status/3009421407952897
3008225112756224	75007	 cancer poker run big c ft worth tx httpbitlycvuqbd via httpoutsidein 	2010-11-12	0	0				https://twitter.com/75007/status/3008225112756224
2902862824734720	75225	 park cities going green mom fighting cancer httpbitlyducoaq via httpoutsidein 	2010-11-11	0	0				https://twitter.com/75225/status/2902862824734720
2884264261591040	JeffCarrington	 watching due date cancer andy noncancer christine studio movie grill w others http sqcom vaxlo	2010-11-11	0	0	@Studio			https://twitter.com/JeffCarrington/status/2884264261591040
2661439944790016	75150	 park cities going green mom fighting cancer httpbitlyahot n via httpoutsidein 	2010-11-11	0	0				https://twitter.com/75150/status/2661439944790016
2661380322758657	75043	 park cities going green mom fighting cancer httpbitlyb b zy via httpoutsidein 	2010-11-11	0	0				https://twitter.com/75043/status/2661380322758657
2057429449707520	76008	 cancer poker run big c ft worth tx httpbitlybibg via httpoutsidein 	2010-11-09	0	0				https://twitter.com/76008/status/2057429449707520
2008242779594752	mrkilmister	 seeing oncologist rowlett regional cancer center http sqcomcp bcq	2010-11-09	0	0	@Rowlett			https://twitter.com/mrkilmister/status/2008242779594752
1648347693711360	adventurous_sc	 rt almightygod preacher ridicules breast exams cancer victims youll die gawd tells die httpisgdgpvhq subtitles	2010-11-08	0	0	@almightygod			https://twitter.com/adventurous_sc/status/1648347693711360
1527918601699328	76126	 cancer poker run big c ft worth tx httpbitlyabzsqb via httpoutsidein 	2010-11-08	0	0				https://twitter.com/76126/status/1527918601699328
1271172754841600	76116	 cancer poker run big c ft worth tx httpbitlycaxcph via httpoutsidein 	2010-11-07	0	0				https://twitter.com/76116/status/1271172754841600
985651247841280	kfurguson	 dannywood glad wasnt there lost another victim breast cancer week cousin died thursday morning	2010-11-06	0	0	@dannywood			https://twitter.com/kfurguson/status/985651247841280
470785265246208	79601	 hawley football coach cancer grateful day httpbitly pq kr via httpoutsidein 	2010-11-05	0	0				https://twitter.com/79601/status/470785265246208
470774624292864	79525	 hawley football coach cancer grateful day httpbitlyaisrhw via httpoutsidein 	2010-11-05	0	0				https://twitter.com/79525/status/470774624292864
426596590682113	76266	 yearold battles cancer treatments httpbitlydatp via httpoutsidein 	2010-11-05	0	0				https://twitter.com/76266/status/426596590682113
29604404436	HimOva__There	 mr_diplomat titans bout pick moss n bills pick merriman n kg calls villanueva cancer patient funny shit	2010-11-03	0	0	@Mr_Diplomat			https://twitter.com/HimOva__There/status/29604404436
