id	Username	Text	Date	Retweets	Favorites	Mentions	Hashtags	Geo	Permalink
24542203450	NickiRaye	 thats right rt zodiacfacts zodiacfacts judge cancer fully chance httptmime owhd	2010-09-15	0	0	@ZodiacFacts	#ZodiacFacts #Cancer		https://twitter.com/NickiRaye/status/24542203450
24542173668	NickiRaye	 thats right lol rt zodiacfacts zodiacfacts cancer remarkable person everyone emotional httpmylocmebzgbg	2010-09-15	0	0	@ZodiacFacts	#ZodiacFacts #Cancer		https://twitter.com/NickiRaye/status/24542173668
24517320902	VMERCEDESV	 selenagomez ive always wanted know ever time meet found cancer dream meet ily	2010-09-14	0	0	@selenagomez			https://twitter.com/VMERCEDESV/status/24517320902
24499243893	SolRichey	 congrats kristi_richey snagging second interview american cancer society go get em bad ass sis twentysomethingxcore	2010-09-14	0	0	@Kristi_Richey	#twentysomethingXcore		https://twitter.com/SolRichey/status/24499243893
24492707590	77493	 cancer survivor offers hope others httpbitly iqbv via httpoutsidein 	2010-09-14	0	0				https://twitter.com/77493/status/24492707590
24474088702	MeghanTwitty	 rt mrsmade meghantwitty th cancer believe ur rte shes cute da bd win u cumin bak visit htwn	2010-09-14	0	0	@MrsMade @MeghanTwitty			https://twitter.com/MeghanTwitty/status/24474088702
24302642924	selbybush	 volunteer training m d anderson cancer center http sqcom cuupg	2010-09-12	0	0	@M			https://twitter.com/selbybush/status/24302642924
24255981778	midkeyelise	 omggg spacecadetmaddys sister when peter there kinda wished cancer could go there shes terrribleeeee p	2010-09-12	0	0	@spacecadetmaddy			https://twitter.com/midkeyelise/status/24255981778
24154509872	NickiRaye	 haha yep rt astrologybee go cancer theyll step backretreatyou wont know whats going onunt httptmime fkpp	2010-09-10	0	0	@astrologybee	#Cancer		https://twitter.com/NickiRaye/status/24154509872
24148831875	nma_83	 im watchin stand cancer cure cancer wso many restrictions research greedy drug companies trust im researcher	2010-09-10	0	0				https://twitter.com/nma_83/status/24148831875
24129254935	dressgirl200	 standup cancer memory mother suzanne lost battle breast cancer age years ago october st	2010-09-10	0	0		#StandUp2Cancer		https://twitter.com/dressgirl200/status/24129254935
24106518879	ONEWORLDSTRONG	 md anderson cancer center uses videos blogs podcasts communicate w employees organization communicate w people	2010-09-10	0	0				https://twitter.com/ONEWORLDSTRONG/status/24106518879
24066774321	ShabazPlaytime	 cancer liver	2010-09-09	0	0				https://twitter.com/ShabazPlaytime/status/24066774321
23981261358	77515	 big love gives children cancer year round httpbitlyd atp via httpoutsidein 	2010-09-09	0	0				https://twitter.com/77515/status/23981261358
23981260710	77449	 overcome ovarian cancer walk httpbitlyarvxx via httpoutsidein 	2010-09-09	0	0				https://twitter.com/77449/status/23981260710
23874708397	NickiRaye	 rt astrologybee cancer s r much different othertheir moon sign big influence personality astrologybee	2010-09-07	0	0	@astrologybee	#Cancer #astrologybee		https://twitter.com/NickiRaye/status/23874708397
23874689913	NickiRaye	 rt astrologybee gauge emotional health cancer learning relationship mothe httptmime i b	2010-09-07	0	0	@astrologybee	#Cancer		https://twitter.com/NickiRaye/status/23874689913
23874670410	NickiRaye	 rt astrologybee cancer s live worlds biggest mansionsbut even live tiny shacks stil httptmime i w	2010-09-07	0	0	@astrologybee	#Cancer		https://twitter.com/NickiRaye/status/23874670410
23859761377	77494	 committed cure breast cancer httpbitlyccurxv via httpoutsidein 	2010-09-07	0	0				https://twitter.com/77494/status/23859761377
23859760593	77493	 committed cure breast cancer httpbitlybukxc via httpoutsidein 	2010-09-07	0	0				https://twitter.com/77493/status/23859760593
23259065509	rmommaerts	 blood levels good got go dosage increase starting tomorrow night die cancer diiiiieeeeee waiting rx now	2010-09-07	0	0				https://twitter.com/rmommaerts/status/23259065509
23101995251	MDAnderson_GAP	 rt teamoncology dr mienchie hung md anderson cancer center nominated honorary president taiwan breast cancer society	2010-09-05	0	0	@teamoncology			https://twitter.com/MDAnderson_GAP/status/23101995251
23088147665	KCTheBearded	 holy shit robert schimmel died sad great comedian battled cancer like mad man sad	2010-09-05	0	0				https://twitter.com/KCTheBearded/status/23088147665
23082435317	taz3cat	 pharmagossip true live long enough bullet cause cancer serious risk	2010-09-05	0	0	@pharmagossip			https://twitter.com/taz3cat/status/23082435317
23017812886	Mister_Simms	 wit freeky selflol wassup keeey rt kijones rt sexstrology pisces cancer scorpio known deep sexual intensity	2010-09-04	0	0	@KiJones87 @Sexstrology			https://twitter.com/Mister_Simms/status/23017812886
23016947744	NickiRaye	 rt sexstrology pisces cancer scorpio known deep sexual intensity httpmylocmebta 	2010-09-04	0	0	@Sexstrology			https://twitter.com/NickiRaye/status/23016947744
22973539177	GeorgeOggero	 damn survived cancer too comedian robert schimmel dies httpwwwexaminercomhowardsterninnationalcomedianrobertschimmeldies	2010-09-04	0	0				https://twitter.com/GeorgeOggero/status/22973539177
22893792740	JeremyGundling	 mom surgerydoc said tumor smaller expected got clean area cancer lymph nodes home afternoon	2010-09-03	0	0				https://twitter.com/JeremyGundling/status/22893792740
22867722055	NickiRaye	 sure going lol rt truluvhoroscope cancer manicure pedicure whatever pamper little bit httpmylocmeboy o	2010-09-03	0	0	@TruLuvHoroscope	#Cancer		https://twitter.com/NickiRaye/status/22867722055
22864981089	NickiRaye	 wow isnt truth hate conflict except reach limit rt sexstrology cancer signs hide httptmimezfpe	2010-09-03	0	0	@Sexstrology			https://twitter.com/NickiRaye/status/22864981089
22788689484	NickiRaye	 rt truluvhoroscope cancer feel quiet reflective may want stay close home loved ones	2010-09-02	0	0	@TruLuvHoroscope	#Cancer		https://twitter.com/NickiRaye/status/22788689484
22740216489	NickiRaye	 rt sexstrology cancer receptive sensitive defensive httpmylocmebliof	2010-09-01	0	0	@Sexstrology			https://twitter.com/NickiRaye/status/22740216489
22687810431	NickiRaye	 rt truluvhoroscope cancer greet life fresh attitude easy forgive forget httpmylocmebjdxi	2010-09-01	0	0	@TruLuvHoroscope	#Cancer		https://twitter.com/NickiRaye/status/22687810431
22680577899	bbothe	 check cancerforward were good cancer survivors httpwwwcancerforwardorg	2010-09-01	1	0				https://twitter.com/bbothe/status/22680577899
22554790157	NickiRaye	 rt sexstrology haha someone pointed cancer signs best lips cause symbol httpmylocmebfo x	2010-08-30	0	0	@Sexstrology			https://twitter.com/NickiRaye/status/22554790157
22521682683	Sushi_B	 time make doughnuts m d anderson cancer center pickens academic tower http sqcombciead	2010-08-30	0	0	@M			https://twitter.com/Sushi_B/status/22521682683
22480127926	Rammajammer	 work work work hour sundays fun m d anderson cancer center http sqcom cuupg	2010-08-29	0	0	@M			https://twitter.com/Rammajammer/status/22480127926
22450939790	NickiRaye	 rt astrologybee cancer s wish people would little considerate others feelings act speak astrologybee	2010-08-29	0	0	@astrologybee	#Cancer #astrologybee		https://twitter.com/NickiRaye/status/22450939790
22380922284	NickiRaye	 bad ppl dont give fuck others feelings own rt sexstrology cancer emotional httptmimeqbz 	2010-08-28	0	0	@Sexstrology			https://twitter.com/NickiRaye/status/22380922284
22338231532	NickiRaye	 rt truluvhoroscope cancer significant development close relationship strong attraction someone httptmimepjzq	2010-08-28	0	0	@TruLuvHoroscope	#Cancer		https://twitter.com/NickiRaye/status/22338231532
22337885526	NickiRaye	 rt zodiacfacts zodiacfacts cancer astrology sign people remember well wrongs done them dont forgive cant forget	2010-08-28	0	0	@ZodiacFacts	#ZodiacFacts #Cancer		https://twitter.com/NickiRaye/status/22337885526
22333003990	_MsMelz_	 mom got results back cancer check updoctor says shes officially cured cancer ever amen	2010-08-28	0	0				https://twitter.com/_MsMelz_/status/22333003990
22276667536	HtownShan	 im m d anderson cancer center holcombe blvd bertner houston w others http sqcom cuupg	2010-08-27	0	0				https://twitter.com/HtownShan/status/22276667536
22273759785	Treykka	 rt sciencechannel end cancer protein killer early stages study showin promising results popsci httpbitlycq l t	2010-08-27	0	0	@ScienceChannel @popsci			https://twitter.com/Treykka/status/22273759785
22265815015	Sushi_B	 yawn m d anderson cancer center pickens academic tower http sqcombciead	2010-08-27	0	0	@M			https://twitter.com/Sushi_B/status/22265815015
22192255673	Sushi_B	 uggh m d anderson cancer center pickens academic tower http sqcombciead	2010-08-26	0	0	@M			https://twitter.com/Sushi_B/status/22192255673
22190861546	HtownShan	 im md anderson cancer center cpb mays clinic houston http sqcomdxbulx	2010-08-26	0	0				https://twitter.com/HtownShan/status/22190861546
22161730998	NickiRaye	 rt truluvhoroscope cancer snap decisions great idea take several deep breathes reevaluate reach conclusion	2010-08-26	0	0	@TruLuvHoroscope	#Cancer		https://twitter.com/NickiRaye/status/22161730998
22116990589	PeggyBenge	 barbaraduke self checking found cancer also	2010-08-25	0	0	@BarbaraDuke			https://twitter.com/PeggyBenge/status/22116990589
22087170895	Sushi_B	 time make doughnuts m d anderson cancer center pickens academic tower http sqcombciead	2010-08-25	0	0	@M			https://twitter.com/Sushi_B/status/22087170895
21953525750	NickiRaye	 rt sexstrology intense orgasms experiences key water signs pisces cancer scorpio httpmylocmeayhdv	2010-08-23	0	0	@Sexstrology			https://twitter.com/NickiRaye/status/21953525750
21914368488	Sushi_B	 im gonna drop bomb today boss gonna love this m d anderson cancer center pickens academic tower http sqcombciead	2010-08-23	0	0	@M			https://twitter.com/Sushi_B/status/21914368488
21816612978	Rammajammer	 im m d anderson cancer center holcombe blvd bertner houston http sqcom cuupg	2010-08-22	0	0				https://twitter.com/Rammajammer/status/21816612978
21691040990	Cleetis	 houstonchron former yates ai great bailey loses fight cancer httpbitly rvnizrip	2010-08-20	0	0	@HoustonChron			https://twitter.com/Cleetis/status/21691040990
21665060077	Sushi_B	 ugghi love jobreally m d anderson cancer center pickens academic tower http sqcombciead	2010-08-20	0	0	@M			https://twitter.com/Sushi_B/status/21665060077
21663037097	jjbarbin	 starting day chemo one strongest people know m d anderson cancer center http sqcom cuupg	2010-08-20	0	0	@M			https://twitter.com/jjbarbin/status/21663037097
21634330949	_thatstonergirl	 rt emudcoolestnerd rt sexstrology pisces cancer scorpio known deep sexual intensity httpmylocmeaom b	2010-08-19	0	0	@EmuDCoolestNerd @Sexstrology			https://twitter.com/_thatstonergirl/status/21634330949
21556631411	pilyocoe08	 triviasharks apparently animals never get sickas far knownthey immune every known disease including cancer	2010-08-19	0	0				https://twitter.com/pilyocoe08/status/21556631411
21484069676	Sushi_B	 need coffeeeeeee m d anderson cancer center pickens academic tower http sqcombciead	2010-08-18	0	0	@M			https://twitter.com/Sushi_B/status/21484069676
21423736101	Sushi_B	 time go yet m d anderson cancer center pickens academic tower http sqcombciead	2010-08-17	0	0	@M			https://twitter.com/Sushi_B/status/21423736101
21413542236	DadBeard	 people cancer really call the big c so idea say besides wuuuutttt	2010-08-17	0	0				https://twitter.com/DadBeard/status/21413542236
21330280785	HtownShan	 im m d anderson cancer center holcombe houston http sqcom cuupg	2010-08-16	0	0				https://twitter.com/HtownShan/status/21330280785
21214813540	NickiRaye	 rt truluvhoroscope cancer personal energy adding intensity everything life expect deeper emotions passions	2010-08-15	0	0	@TruLuvHoroscope	#Cancer		https://twitter.com/NickiRaye/status/21214813540
21201179408	NickiRaye	 rt sexstrology cancer sometimes appear thickskinned unemotional lovers get see kind sensitive heart underneath	2010-08-14	0	0	@Sexstrology			https://twitter.com/NickiRaye/status/21201179408
21152382205	NickiRaye	 rt sexstrology cancer signs quite sexually creative httpmylocmeaytb 	2010-08-14	0	0	@Sexstrology			https://twitter.com/NickiRaye/status/21152382205
21133237040	NickiRaye	 rt truluvhoroscope cancer try worry much current emotional issues its going end fine	2010-08-14	0	0	@TruLuvHoroscope	#Cancer		https://twitter.com/NickiRaye/status/21133237040
21056783556	Sushi_B	 ousted docsmooth mayor m d anderson cancer center pickens academic tower foursquare http sqcombciead	2010-08-13	0	0	@docsmooth @foursquare			https://twitter.com/Sushi_B/status/21056783556
21056783539	Sushi_B	 workya m d anderson cancer center pickens academic tower http sqcombciead	2010-08-13	0	0	@M			https://twitter.com/Sushi_B/status/21056783539
21043440907	77493	 raise funds pediatric cancer httpbitlyd rhe via httpoutsidein 	2010-08-13	0	0				https://twitter.com/77493/status/21043440907
21043438679	77494	 raise funds pediatric cancer httpbitlydb bz via httpoutsidein 	2010-08-13	0	0				https://twitter.com/77494/status/21043438679
21036489039	NickiRaye	 rt zodiacfacts zodiacfacts cancer like cool oasis hot day httpmylocmeauntp	2010-08-13	0	0	@ZodiacFacts	#ZodiacFacts #Cancer		https://twitter.com/NickiRaye/status/21036489039
20997370882	HtownShan	 im m d anderson cancer center holcombe houston http sqcom cuupg	2010-08-12	0	0				https://twitter.com/HtownShan/status/20997370882
20983911961	LindaKayTucker	 clicked cure breast cancer care httptinyurlcommkgbgm	2010-08-12	0	0	@Care2			https://twitter.com/LindaKayTucker/status/20983911961
20936496880	NickiRaye	 rt sexstrology cancer likes little aggressive play bed httpmylocmear 	2010-08-11	0	0	@Sexstrology			https://twitter.com/NickiRaye/status/20936496880
20884061702	Sushi_B	 hate workcan go home now m d anderson cancer center pickens academic tower http sqcombciead	2010-08-11	0	0	@M			https://twitter.com/Sushi_B/status/20884061702
20818945101	NickiRaye	 sure rt sexstrology spoiling cancer rotten good way keep interest httpmylocmeanhjz	2010-08-10	0	0	@Sexstrology			https://twitter.com/NickiRaye/status/20818945101
20756429245	ShabazPlaytime	 talia_t rt lovescopes cancer sweet make funny determined partners lovescopes yes docancers stand up	2010-08-09	0	0	@talia_t @LoveScopes	#Cancer #LoveScopes		https://twitter.com/ShabazPlaytime/status/20756429245
20752597709	ShabazPlaytime	 donnastaxxx lol bad though rt capt_d_cuming amber rose look like thick ass cancer patient o yesshe bad den mug	2010-08-09	0	0	@DonnaStaxxx @Capt_D_Cuming			https://twitter.com/ShabazPlaytime/status/20752597709
20750751523	NickiRaye	 well neither cancer rt sexstrology gemini tolerate boring sex partner httpmylocmeakq d	2010-08-09	0	0	@Sexstrology			https://twitter.com/NickiRaye/status/20750751523
20683143619	ShabazPlaytime	 benjaminbutta amber rose look like thick ass cancer patientwit que ball head asslolthing still gettin though	2010-08-09	0	0	@BenjaminButta			https://twitter.com/ShabazPlaytime/status/20683143619
20682803318	ShabazPlaytime	 amber rose look like thick ass cancer patient	2010-08-09	0	0				https://twitter.com/ShabazPlaytime/status/20682803318
20681524879	NickiRaye	 nothing say rt sexstrology cancer emotionally sensitive lover dont mean httpmylocmeaikf 	2010-08-09	0	0	@Sexstrology			https://twitter.com/NickiRaye/status/20681524879
20600805387	ThatSuperStar	 pool susan b komen cancer event monarch hotel zaza w others http sqcom nantj	2010-08-07	0	0	@Monarch			https://twitter.com/ThatSuperStar/status/20600805387
20598503582	NickiRaye	 isnt truth rt zodiacfacts zodiacfacts aries cancer come together its case oppo httptmimeqipl	2010-08-07	0	0	@ZodiacFacts	#ZodiacFacts #Aries #Cancer		https://twitter.com/NickiRaye/status/20598503582
20518310175	MrsKandiCut	 announcementbp fails releasing gases leak texas city days dat may cause cancer minutes frm wea stay u say lawsuit	2010-08-06	0	0				https://twitter.com/MrsKandiCut/status/20518310175
20509533386	Kaango	 benefitgarage sale cancer patient httpbeaumontenterprisekaangocomfeviewad vidor thebeaumontenterprise ads	2010-08-06	0	0		#Vidor #TheBeaumontEnterprise #ads		https://twitter.com/Kaango/status/20509533386
20499592227	NickiRaye	 mmmhmm lol rt sexstrology cancer signs quite sexually creative httpmylocmeacost	2010-08-06	0	0	@Sexstrology			https://twitter.com/NickiRaye/status/20499592227
20408417995	taz3cat	 american cancer society tell americans and wall street journal the right vape forum httpbitlyalyhso via addthis 	2010-08-05	0	0	@addthis			https://twitter.com/taz3cat/status/20408417995
20340952507	NickiRaye	 thats right lol rt sexstrology count aries cancer libra capricorn make first contact love sex initiate it	2010-08-04	0	0	@Sexstrology			https://twitter.com/NickiRaye/status/20340952507
20338492266	Cleetis	 sfgate report highfructose corn syrup linked deadliest type cancer httpsfglycfcp g one cont httptlgd u m j	2010-08-04	0	0	@SFGate			https://twitter.com/Cleetis/status/20338492266
20279376154	NickiRaye	 nope im sweetie lol rt zodiacfacts zodiacfacts cancer female always needs you never get aggressive	2010-08-04	0	0	@ZodiacFacts	#ZodiacFacts #Cancer		https://twitter.com/NickiRaye/status/20279376154
20279350710	NickiRaye	 lmao happened rt zodiacfacts zodiacfacts cancer female great cook makes better food httptmimenlku	2010-08-04	0	0	@ZodiacFacts	#ZodiacFacts #Cancer		https://twitter.com/NickiRaye/status/20279350710
20266343456	hijodelasflores	 hxllywxxd skin cancer 	2010-08-03	0	0	@HXLLYWXXD			https://twitter.com/hijodelasflores/status/20266343456
20145941248	rmommaerts	 awesome mdandersonnews md anderson keeps number one cancer ranking us news world report annual survey httpisgddt zc	2010-08-02	0	0	@MDAndersonNews			https://twitter.com/rmommaerts/status/20145941248
20112562111	NickiRaye	 rt zodiacfacts zodiacfacts cancer honor needs want something go get it httpmylocmea q d	2010-08-02	0	0	@ZodiacFacts	#ZodiacFacts #Cancer		https://twitter.com/NickiRaye/status/20112562111
19968868413	cortknee	 apparently snooki mad obama taxing tanning guess shes blame whole generation people developing skin cancer 	2010-07-31	0	0				https://twitter.com/cortknee/status/19968868413
19951446107	NickiRaye	 yep rt zodiacfacts zodiacfacts cancer expects people neatly dressed httpmylocme w p	2010-07-30	0	0	@ZodiacFacts	#ZodiacFacts #Cancer		https://twitter.com/NickiRaye/status/19951446107
19919622071	melissacathcart	 im gonna sexy cancer patient halloween thingsnoonehaseversaid	2010-07-30	0	0		#ThingsNoOneHasEverSaid		https://twitter.com/melissacathcart/status/19919622071
19841382851	Peaches4Pres15	 cancer diet coke	2010-07-29	0	0				https://twitter.com/Peaches4Pres15/status/19841382851
19800188673	DAWGONDUTY	 obamacare rationing finest los angeles ca cancer patient found dead ditch hospital release httptinyurlcom d lt	2010-07-29	0	0				https://twitter.com/DAWGONDUTY/status/19800188673
19732459763	LindaKayTucker	 please click cure breast cancer care httptinyurlcommkgbgm	2010-07-28	0	0	@Care2			https://twitter.com/LindaKayTucker/status/19732459763
19720271338	DToneRythemz	 fuertesdeclaraciones rt nanortm gusta la arroz con leche con popote soy mariposo de corazon cojo poel cu hasta k de cancer anal	2010-07-28	0	0	@NanoRTM	#FuertesDeclaraciones		https://twitter.com/DToneRythemz/status/19720271338
19699466768	NickiRaye	 rt sexstrology cancer likes little aggressive play bed httpmylocme oeqn	2010-07-27	0	0	@Sexstrology			https://twitter.com/NickiRaye/status/19699466768
19590981644	jasonact	 bingopajamas brandice wifes ceo bragged cmpny mtg hed left wife battled cancer work hr weeks wants out	2010-07-26	0	0	@bingopajamas @brandice			https://twitter.com/jasonact/status/19590981644
19540525774	NickiRaye	 true rt astrologybee cancer s pisces cant sleep r sensitive going httptmimegwty	2010-07-25	0	0	@astrologybee	#Cancer #Pisces		https://twitter.com/NickiRaye/status/19540525774
19538039664	NickiRaye	 rt truluvhoroscope tlh cancer people offer emotional warmth love httpmylocme jh i	2010-07-25	0	0	@TruLuvHoroscope	#TLH #Cancer		https://twitter.com/NickiRaye/status/19538039664
19537977038	NickiRaye	 lol sure rt sexstrology cancer soothing love maker httpmylocme jh g	2010-07-25	0	0	@Sexstrology			https://twitter.com/NickiRaye/status/19537977038
19530017909	cmoneyzz	 hour left hell yes ready inhale cancer 	2010-07-25	0	0				https://twitter.com/cmoneyzz/status/19530017909
19431279597	Cleetis	 rt espn espn nfl kaye cowher dies cancer httpespncfasqrrip	2010-07-24	0	0	@espn			https://twitter.com/Cleetis/status/19431279597
19398926179	TheGridironTxn	 thoughts prayers bill cowher family wife passed away cancer 	2010-07-24	0	0				https://twitter.com/TheGridironTxn/status/19398926179
19368144768	allennail	 im md anderson cancer center smith research building knight rd houston http sqcomaglxxx	2010-07-23	0	0				https://twitter.com/allennail/status/19368144768
19354914850	MDAnderson_GAP	 md anderson cancer centers sisters south america regional ratings httpsharesmptod	2010-07-23	0	0		#1 #2		https://twitter.com/MDAnderson_GAP/status/19354914850
19304628026	KDizzle2113	 thought new mcdonalds pink straws promoting breast cancer awareness theyre promote new berry smoothies bad	2010-07-22	0	0				https://twitter.com/KDizzle2113/status/19304628026
19252083360	77502	 haircuts benefit brandon cancer patient httpbitlydtsrc via httpoutsidein 	2010-07-22	0	0				https://twitter.com/77502/status/19252083360
19076127189	edtex8	 hear testcat scan results m d anderson cancer center w others http sqcom cuupg	2010-07-21	0	0	@M			https://twitter.com/edtex8/status/19076127189
18624191157	ChrisCho	 diversity day haha m d anderson cancer center http sqcom cuupg	2010-07-15	0	0	@M			https://twitter.com/ChrisCho/status/18624191157
18555058635	77386	 salsa added richness lives children affected cancer httpbitlyabwgnd via httpoutsidein 	2010-07-14	0	0				https://twitter.com/77386/status/18555058635
18555057654	77373	 salsa added richness lives children affected cancer httpbitlybvxxjo via httpoutsidein 	2010-07-14	0	0				https://twitter.com/77373/status/18555057654
18555057200	77338	 salsa added richness lives children affected cancer httpbitlybdmtpc via httpoutsidein 	2010-07-14	0	0				https://twitter.com/77338/status/18555057200
18459119528	JunieHaddock	 luvmyfam evr el paso taking care mother got thyroid cancer got back days ago	2010-07-13	0	0	@LuvMyFam4EVR2			https://twitter.com/JunieHaddock/status/18459119528
18411642832	BigDaddyMufasa	 ima cancer soooo u know sign looks like layin 	2010-07-13	0	0				https://twitter.com/BigDaddyMufasa/status/18411642832
18365490402	DadBeard	 people work with would surprised many would opt suicide rather live terminal cancer yay grown ups	2010-07-12	0	0				https://twitter.com/DadBeard/status/18365490402
18281599769	biketowardscure	 thinkin james sean brit friends riding cancer too louisiana hospital hit truck get well	2010-07-11	0	0				https://twitter.com/biketowardscure/status/18281599769
18240202860	Mister_Teej	 teamcancer cancer best sign zodiac randomtweet fwm	2010-07-10	0	0		#teamCANCER #randomtweet		https://twitter.com/Mister_Teej/status/18240202860
18211176648	SergeantFalls	 prayers please darryl prince discovered kidney cancer httpmylocme vrt	2010-07-10	0	0				https://twitter.com/SergeantFalls/status/18211176648
18181069160	mennork	 perezhilton wish could thing gf brain cancer least sum take stand love ty	2010-07-10	0	0	@PerezHilton			https://twitter.com/mennork/status/18181069160
18033929594	edtex8	 back again head ct scan c whats really gone on m d anderson cancer center http sqcom cuupg	2010-07-08	0	0	@M			https://twitter.com/edtex8/status/18033929594
17956853274	Kaango	 huge breast cancer rummage sale httpbeaumontenterprisekaangocomfeviewad china thebeaumontenterprise ads yardgaragesales	2010-07-07	0	0		#China #TheBeaumontEnterprise #ads #YardGarageSales		https://twitter.com/Kaango/status/17956853274
17944909489	edtex8	 left ear examed fixin give blood m d anderson cancer center http sqcom cuupg	2010-07-07	0	0	@M			https://twitter.com/edtex8/status/17944909489
17685817274	cullendean	 search phrase play songs testicular cancer result dustin kensrue	2010-07-03	0	0				https://twitter.com/cullendean/status/17685817274
17651195366	peaceloveTAL	 dont tell smoking doesnt cause lung cancer ill tell u full shit watched take father try motherfucker	2010-07-03	0	0				https://twitter.com/peaceloveTAL/status/17651195366
17648680910	peaceloveTAL	 wtf irenew bracelet damn claim cure everything cancer 	2010-07-03	0	0				https://twitter.com/peaceloveTAL/status/17648680910
17519185763	LeeKingVLF	 good cause community coming together cancer patient httpwwwultimatefortbendcom benefitassistcancerpatient	2010-07-01	0	0				https://twitter.com/LeeKingVLF/status/17519185763
17462214796	_MelanieThomas	 zodiacfacts cancer compatible taurus virgo scorpio capricorn pisces 	2010-06-30	0	0		#ZodiacFacts #Cancer #Taurus #Virgo #Scorpio #Capricorn #Pisces		https://twitter.com/_MelanieThomas/status/17462214796
17431148485	Kaango	 huge breast cancer rummage sale httpbeaumontenterprisekaangocomfeviewad china thebeaumontenterprise ads yardgaragesales	2010-06-30	0	0		#China #TheBeaumontEnterprise #ads #YardGarageSales		https://twitter.com/Kaango/status/17431148485
17426503790	Lucky8509	 rt thatdrew cancer picks kids people cant fight back gonna sit watch take people us step yall	2010-06-30	0	0	@thatdrew			https://twitter.com/Lucky8509/status/17426503790
16936660800	DavidOrtez	 fayza heard new iphone cures cancer frustration short temper exhaustion seems side effect	2010-06-24	0	0	@Fayza			https://twitter.com/DavidOrtez/status/16936660800
