id	Username	Text	Date	Retweets	Favorites	Mentions	Hashtags	Geo	Permalink
11185086766514176	HEAUXS_HateTee	 rt sexstrology cancer emotionally sensitive lover dont mean httpmylocmeevefj	2010-12-04	0	0	@Sexstrology	#Cancer		https://twitter.com/HEAUXS_HateTee/status/11185086766514176
11093845445967874	BRealz	 keeping cancer alive cigarette city http sqcombtwcw 	2010-12-04	0	0	@Cigarette			https://twitter.com/BRealz/status/11093845445967874
10951207241650176	HEAUXS_HateTee	 rt sexstrology cancer sweetest lovers httpmylocmeetqik	2010-12-04	0	0	@Sexstrology	#Cancer		https://twitter.com/HEAUXS_HateTee/status/10951207241650176
10869056370380800	HEAUXS_HateTee	 rt sexyasstoni rt sexstrology cancer signs superficial may like body like heart even more	2010-12-03	0	0	@sexyasstoni @Sexstrology	#Cancer		https://twitter.com/HEAUXS_HateTee/status/10869056370380800
10479411748933632	anthonygerhart	 facebook friends putting cartoon profile picture stops child abuse much playing trauma center stops cancer 	2010-12-02	2	0				https://twitter.com/anthonygerhart/status/10479411748933632
10185583896825856	TheMammaryClan	 abby dayatlanta went ahead mastectomy getting results bc scared cancer reasons walk	2010-12-01	0	0	@abby3dayatlanta			https://twitter.com/TheMammaryClan/status/10185583896825856
10056551653965824	mrkilmister	 cancer bitch rowlett cancer center httpgowallac zuk	2010-12-01	0	0				https://twitter.com/mrkilmister/status/10056551653965824
9909850406395904	71115	 lsuhscs researchers identify cancer growth gene httpbitlyg sph via httpoutsidein 	2010-12-01	0	0				https://twitter.com/71115/status/9909850406395904
9818370392203264	joselizacarias	 pagarle pork le aga un examen de cancer 	2010-11-30	0	0				https://twitter.com/joselizacarias/status/9818370392203264
9757454019596289	tomatoepie	 going breast cancer surgery dec st thank prayers janice pistek	2010-11-30	0	0				https://twitter.com/tomatoepie/status/9757454019596289
9464184643256320	outerspacekate	 tweet mr idom mhss beloved physics teacher diagnosed stage lung cancer today	2010-11-29	0	0				https://twitter.com/outerspacekate/status/9464184643256320
9432336567373826	topix_tx	 owner landmark local country music club loses battle cancer httpbitlyfosxbr waco texas	2010-11-29	0	0		#Waco #Texas		https://twitter.com/topix_tx/status/9432336567373826
9395888220798977	75034	 texas breast specialists expands breast cancer treatment services httpbitlyfu nss via httpoutsidein 	2010-11-29	0	0				https://twitter.com/75034/status/9395888220798977
9214657738833921	76712	 wacoarea hospitals fare well handling cancer patients poor prognoses httpbitlyejipks via httpoutsidein 	2010-11-29	0	0				https://twitter.com/76712/status/9214657738833921
9214656623153153	76712	 wacoarea hospitals fare well handling cancer patients poor prognoses httpbitlyfiqibs via httpoutsidein 	2010-11-29	0	0				https://twitter.com/76712/status/9214656623153153
9214650285563904	76657	 wacoarea hospitals fare well handling cancer patients poor prognoses httpbitlyex z o via httpoutsidein 	2010-11-29	0	0				https://twitter.com/76657/status/9214650285563904
9214648146468864	76657	 wacoarea hospitals fare well handling cancer patients poor prognoses httpbitlygdgbgg via httpoutsidein 	2010-11-29	0	0				https://twitter.com/76657/status/9214648146468864
9105785711759361	WetoddNation	 tsa makes cancer victim remove prosthetic breast httpwwwcbsnewscomstories nationalmain shtml	2010-11-28	0	0				https://twitter.com/WetoddNation/status/9105785711759361
9087047331487744	Exxclusive81	 rt _naturalbeauty_ sexstrology aries cancer libra capricorn sense love choose start deny it im libra	2010-11-28	0	0	@_NaturalBeauty_ @Sexstrology			https://twitter.com/Exxclusive81/status/9087047331487744
8596104396414976	BarbellBmbshell	 lipslikepoww omg lol pray god nevr get cancer i definitely wouldnt broadcast twitter lol thank god health	2010-11-27	0	0	@LipsLikePOWW			https://twitter.com/BarbellBmbshell/status/8596104396414976
8594079860391936	BarbellBmbshell	 ii hate cancer sometimes damn emotion arghhh	2010-11-27	0	0				https://twitter.com/BarbellBmbshell/status/8594079860391936
8106250642395136	topix_tx	 young pastor turns struggle cancer year teachable moments httpbitlydq sn flowermound texas	2010-11-26	0	0		#FlowerMound #Texas		https://twitter.com/topix_tx/status/8106250642395136
6206780753317888	topix_tx	 lucinda breeding cancer support bras httpbitlycu wrx whitney texas	2010-11-20	0	0		#Whitney #Texas		https://twitter.com/topix_tx/status/6206780753317888
5560338741207040	76036	 vaccine could stop cancer growth httpbitlybywunk via httpoutsidein 	2010-11-19	0	0				https://twitter.com/76036/status/5560338741207040
5076908639256576	76028	 vaccine could stop cancer growth httpbitly h orv via httpoutsidein 	2010-11-17	0	0				https://twitter.com/76028/status/5076908639256576
4996033281003520	thebetterbrit	 support gaso sponsored american cancer society dad quit anyone can proud him	2010-11-17	0	0		#GASO		https://twitter.com/thebetterbrit/status/4996033281003520
4609951364284416	mrkilmister	 chemo again rowlett regional cancer center http sqcomcp bcq	2010-11-16	0	0	@Rowlett			https://twitter.com/mrkilmister/status/4609951364284416
4295163241304064	BikerForgiven	 elbow room leather clad old school bikers cancer benefit httpexmnralrrxi	2010-11-15	0	0				https://twitter.com/BikerForgiven/status/4295163241304064
4038837101666304	LaKOOLgiirl	 would cure cancer would eat tres leches cake outta crooked mouths vajj	2010-11-15	0	0				https://twitter.com/LaKOOLgiirl/status/4038837101666304
3876794176376832	sasysoutherngal	 come_il_mare went too huge lump removed negative cancer know waiting worst	2010-11-14	0	0	@come_il_mare			https://twitter.com/sasysoutherngal/status/3876794176376832
3703321399398401	75067	 cancer poker run big c ft worth tx httpbitlycpz kn via httpoutsidein 	2010-11-14	0	0				https://twitter.com/75067/status/3703321399398401
3492166143840256	Zens7s	 gwingrimes hey lady moms new anti cancer diet requires processedwhite flour think need take trip artisanbreadco 	2010-11-13	0	0	@gwingrimes @artisanbreadco			https://twitter.com/Zens7s/status/3492166143840256
3173884429860864	75010	 cancer poker run big c ft worth tx httpbitlyax ryk via httpoutsidein 	2010-11-12	0	0				https://twitter.com/75010/status/3173884429860864
3009421407952897	75056	 cancer poker run big c ft worth tx httpbitlycjfhdy via httpoutsidein 	2010-11-12	0	0				https://twitter.com/75056/status/3009421407952897
3008225112756224	75007	 cancer poker run big c ft worth tx httpbitlycvuqbd via httpoutsidein 	2010-11-12	0	0				https://twitter.com/75007/status/3008225112756224
2902862824734720	75225	 park cities going green mom fighting cancer httpbitlyducoaq via httpoutsidein 	2010-11-11	0	0				https://twitter.com/75225/status/2902862824734720
2884264261591040	JeffCarrington	 watching due date cancer andy noncancer christine studio movie grill w others http sqcom vaxlo	2010-11-11	0	0	@Studio			https://twitter.com/JeffCarrington/status/2884264261591040
2661439944790016	75150	 park cities going green mom fighting cancer httpbitlyahot n via httpoutsidein 	2010-11-11	0	0				https://twitter.com/75150/status/2661439944790016
2661380322758657	75043	 park cities going green mom fighting cancer httpbitlyb b zy via httpoutsidein 	2010-11-11	0	0				https://twitter.com/75043/status/2661380322758657
2057429449707520	76008	 cancer poker run big c ft worth tx httpbitlybibg via httpoutsidein 	2010-11-09	0	0				https://twitter.com/76008/status/2057429449707520
2008242779594752	mrkilmister	 seeing oncologist rowlett regional cancer center http sqcomcp bcq	2010-11-09	0	0	@Rowlett			https://twitter.com/mrkilmister/status/2008242779594752
1648347693711360	adventurous_sc	 rt almightygod preacher ridicules breast exams cancer victims youll die gawd tells die httpisgdgpvhq subtitles	2010-11-08	0	0	@almightygod			https://twitter.com/adventurous_sc/status/1648347693711360
1527918601699328	76126	 cancer poker run big c ft worth tx httpbitlyabzsqb via httpoutsidein 	2010-11-08	0	0				https://twitter.com/76126/status/1527918601699328
1271172754841600	76116	 cancer poker run big c ft worth tx httpbitlycaxcph via httpoutsidein 	2010-11-07	0	0				https://twitter.com/76116/status/1271172754841600
985651247841280	kfurguson	 dannywood glad wasnt there lost another victim breast cancer week cousin died thursday morning	2010-11-06	0	0	@dannywood			https://twitter.com/kfurguson/status/985651247841280
426596590682113	76266	 yearold battles cancer treatments httpbitlydatp via httpoutsidein 	2010-11-05	0	0				https://twitter.com/76266/status/426596590682113
29604404436	HimOva__There	 mr_diplomat titans bout pick moss n bills pick merriman n kg calls villanueva cancer patient funny shit	2010-11-03	0	0	@Mr_Diplomat			https://twitter.com/HimOva__There/status/29604404436
29592967983	ebbynezer	 pfasano augieray thought movember men grow mustache support fighting cancer 	2010-11-03	0	0	@pfasano @augieray			https://twitter.com/ebbynezer/status/29592967983
29590625520	Mars23_blackmon	 kg call charlie villaniuava cancer patient smh thats fucked its true really rare skin disease thats stops hair growth	2010-11-03	0	0				https://twitter.com/Mars23_blackmon/status/29590625520
29492290089	plesko	 support fine moustachery fight cancer join movember team httpusmovembercomregister 	2010-11-02	0	0		#Movember		https://twitter.com/plesko/status/29492290089
29463772844	ThaRealJonB	 ogochocinco maybe cancer u play better alongside chris cooley redskins lol	2010-11-02	0	0	@OGOchoCinco			https://twitter.com/ThaRealJonB/status/29463772844
29444748646	76040	 mothers find success breast cancer shirt business httpbitlyb mtjj via httpoutsidein 	2010-11-02	0	0				https://twitter.com/76040/status/29444748646
29397733502	mrkilmister	 became mayor rowlett regional cancer center foursquare http sqcomcp bcq	2010-11-01	0	0	@foursquare			https://twitter.com/mrkilmister/status/29397733502
29397733421	mrkilmister	 time chemo rowlett regional cancer center http sqcomcp bcq	2010-11-01	0	0	@Rowlett			https://twitter.com/mrkilmister/status/29397733421
29311926296	LancesDiamonds	 skoal today mouth cancer wayshit dip u getting best meill end u u end thoughcough syrup da way	2010-10-31	0	0				https://twitter.com/LancesDiamonds/status/29311926296
29244393881	micaelacarol	 really guys prayfordemi live asthma terminal cancer get it	2010-10-30	0	0		#prayfordemi		https://twitter.com/micaelacarol/status/29244393881
29197303697	HolyMeekrob	 gonna get little bit cancer stan httptwitpiccom gdu	2010-10-30	0	0				https://twitter.com/HolyMeekrob/status/29197303697
29183547141	GeoffreyDavid	 colon cancer k	2010-10-30	0	0				https://twitter.com/GeoffreyDavid/status/29183547141
29180930758	cocrews	 every person wishes cancer patient one get better know wont post cont httptlgd nofst	2010-10-30	0	0				https://twitter.com/cocrews/status/29180930758
29149618652	HolyMeekrob	 glue used attach pubes giant cancerous balls known cause cancer ironic	2010-10-29	0	0				https://twitter.com/HolyMeekrob/status/29149618652
29012764583	kalwynah	 prepping chemo rowlett regional cancer center httpinstagrampf e 	2010-10-28	0	0	@Rowlett			https://twitter.com/kalwynah/status/29012764583
28962889721	75240	 golite ads joins susuan g komen breast cancer foundation race cure httpbitlyc bt via httpoutsidein 	2010-10-28	0	0				https://twitter.com/75240/status/28962889721
28869666945	76227	 denton comes together support cancer patient httpbitlyaduaq via httpoutsidein 	2010-10-27	0	0				https://twitter.com/76227/status/28869666945
28866949277	76259	 denton comes together support cancer patient httpbitlyd xrqa via httpoutsidein 	2010-10-27	0	0				https://twitter.com/76259/status/28866949277
28864446202	76207	 denton comes together support cancer patient httpbitlyb de m via httpoutsidein 	2010-10-27	0	0				https://twitter.com/76207/status/28864446202
28849065947	lilshell430	 looking forward ryanstar past depressing weekend ppl die cancer its fair	2010-10-26	0	0	@ryanstar			https://twitter.com/lilshell430/status/28849065947
28848206412	lilshell430	 rascalete thanks prayers cancer battle 	2010-10-26	0	0	@rascalete			https://twitter.com/lilshell430/status/28848206412
28848168378	lilshell430	 tristasutter thanks thoughts prayers unfortunately cancer battle laid rest yesterday	2010-10-26	0	0	@tristasutter			https://twitter.com/lilshell430/status/28848168378
28838366802	76226	 denton comes together support cancer patient httpbitly q bjr via httpoutsidein 	2010-10-26	0	0				https://twitter.com/76226/status/28838366802
28809881058	technopriestess	 donated movember too please support men diagnosed w cancer httpwwwdallasmoustachecom	2010-10-26	0	0		#Movember		https://twitter.com/technopriestess/status/28809881058
28808247368	75230	 golite ads joins susuan g komen breast cancer foundation race cure httpbitlyauzybs via httpoutsidein 	2010-10-26	0	0				https://twitter.com/75230/status/28808247368
28778738199	76201	 denton comes together support cancer patient httpbitlybj y s via httpoutsidein 	2010-10-26	0	0				https://twitter.com/76201/status/28778738199
28672909636	76657	 waco maid service offers free cleanings cancer patients httpbitly oab m via httpoutsidein 	2010-10-25	0	0				https://twitter.com/76657/status/28672909636
28511649596	juheenuna	 volunteering pancreatic cancer research walk reverchon park http sqcomar c	2010-10-23	0	0	@Reverchon			https://twitter.com/juheenuna/status/28511649596
28470856594	pathauldren	 saturday official hockey fights cancer night dallas stars httpexmnrdyddxs nhl dfw predators nashville	2010-10-23	0	0		#Hockey #Cancer #Dallas #Stars #NHL #DFW #predators #nashville		https://twitter.com/pathauldren/status/28470856594
28367120868	Ninja_Like_Nam	 mcdonalds cancer cure burn em down burn em down mean would love couple mcdoubles right now	2010-10-21	0	0				https://twitter.com/Ninja_Like_Nam/status/28367120868
28072344784	britt_nicole	 drinking glass wine yay breast cancer awareness belfior salon spa http sqcom iczhy	2010-10-21	0	0	@Belfior			https://twitter.com/britt_nicole/status/28072344784
28022193730	topix_tx	 fort worth doctor honored four decades work cancer patients httpbitlycspf n fortworth texas	2010-10-21	0	0		#FortWorth #Texas		https://twitter.com/topix_tx/status/28022193730
28009131819	71115	 shreveport woman shares breast cancer story discovery channel program httpbitlydqbyon via httpoutsidein 	2010-10-21	0	0				https://twitter.com/71115/status/28009131819
28009131571	71107	 shreveport woman shares breast cancer story discovery channel program httpbitlyalpzpz via httpoutsidein 	2010-10-21	0	0				https://twitter.com/71107/status/28009131571
27958256513	katielayne	 shyanne oh forgot work lol mild form skin cancer nothing worry about me cancer cancer 	2010-10-20	0	0	@Shyanne41805			https://twitter.com/katielayne/status/27958256513
27899417385	silvercuellar3	 jake gylenhall mlb cancer awareness cant quit it	2010-10-19	0	0				https://twitter.com/silvercuellar3/status/27899417385
27869051913	topix_tx	 pink heal tour helps bring awarness womens fight cancer httpbitlyaxdbeq grapevine texas	2010-10-19	0	0		#Grapevine #Texas		https://twitter.com/topix_tx/status/27869051913
27855223505	katielayne	 dad first procedure done today skin cancer hes got hole size nickel skull temple gross	2010-10-19	0	0				https://twitter.com/katielayne/status/27855223505
27836383286	JewelLadyLori	 october breast cancer awareness month shop breast cancer jewelry wwwcookieleebizlorimccall	2010-10-19	0	0				https://twitter.com/JewelLadyLori/status/27836383286
27706527853	FruityLoops17	 beatcancer lets beat cancer time	2010-10-18	0	0		#BeatCancer		https://twitter.com/FruityLoops17/status/27706527853
27609529062	willsmith28	 brest cancer ribbons pink color testicular cancer ribbons	2010-10-17	0	0				https://twitter.com/willsmith28/status/27609529062
27595786161	yellowbird0	 jesus_m_christ call dick cancer furiously want beat it beatcancer 	2010-10-16	0	0	@Jesus_M_Christ	#BeatCancer		https://twitter.com/yellowbird0/status/27595786161
27512623296	Tattedsweeti	 time go bed walk cancer tomorrow supporting aunt ily night guys	2010-10-16	0	0				https://twitter.com/Tattedsweeti/status/27512623296
27504043865	topix_tx	 shop support breast cancer awareness time httpbitly yvxhi fortworth texas	2010-10-15	0	0		#FortWorth #Texas		https://twitter.com/topix_tx/status/27504043865
27499140842	Ericgaminorox	 know im going fccla group susan g komen race cure people breast cancer soo yea 	2010-10-15	0	0				https://twitter.com/Ericgaminorox/status/27499140842
27485748495	ColtonDearing	 jauchhoegun agreed theyre playing cancer bats december im super pumped	2010-10-15	0	0	@jauchhoegun			https://twitter.com/ColtonDearing/status/27485748495
27465268852	CoachDavisCRHS	 someone tell get tht pink breast cancer ribbon picture	2010-10-15	0	0				https://twitter.com/CoachDavisCRHS/status/27465268852
27414035115	Mars23_blackmon	 smhdang rt madelineilery hate im cancer 	2010-10-15	0	0	@madelineilery			https://twitter.com/Mars23_blackmon/status/27414035115
27373015228	topix_tx	 fight childhood cancer zumba party httpbitlydgvphy lewisville texas	2010-10-14	0	0		#Lewisville #Texas		https://twitter.com/topix_tx/status/27373015228
27353890918	terryapodaca	 large medium small save all retweet breast cancer awareness	2010-10-14	2	0				https://twitter.com/terryapodaca/status/27353890918
27318216723	76040	 local man relates douglas battle cancer httpbitlyaiwrsi via httpoutsidein 	2010-10-14	0	0				https://twitter.com/76040/status/27318216723
27287603515	jayhawker76	 sad find awesome person al complex manager passed hes lost long battle w cancer missed	2010-10-13	0	0				https://twitter.com/jayhawker76/status/27287603515
27249473051	tcubookstore	 nancy brinker founder susan g komen store today pm pm tim halperin performing breast cancer awareness come today	2010-10-13	0	0				https://twitter.com/tcubookstore/status/27249473051
27221500341	76040	 sporting sparkle breast cancer httpbitlycuf fh via httpoutsidein 	2010-10-13	0	0				https://twitter.com/76040/status/27221500341
27221499275	75904	 lufkin realtor donating part commissions month cancer awareness httpbitlyd b ca via httpoutsidein 	2010-10-13	0	0				https://twitter.com/75904/status/27221499275
27221499272	75901	 lufkin realtor donating part commissions month cancer awareness httpbitlyccwbpa via httpoutsidein 	2010-10-13	0	0				https://twitter.com/75901/status/27221499272
27141303336	luresalons	 pink offering pink hair extensions benefitting sharon wetz breast cancer foundation httpbitly fr jj	2010-10-12	0	0				https://twitter.com/luresalons/status/27141303336
27074667071	Womanoftheyear_	 breast cancer awareness imaware 	2010-10-11	0	0		#ImAware		https://twitter.com/Womanoftheyear_/status/27074667071
27047594791	whysotrill	 hell nawh sit hours watch movie white bitch die cancer end mad 	2010-10-11	0	0		#mad		https://twitter.com/whysotrill/status/27047594791
26993912500	katielayne	 found dad minor case skin cancer prayers appreciated	2010-10-10	0	0				https://twitter.com/katielayne/status/26993912500
26978236331	6_MissLuna	 love breast cancer awareness month comes around	2010-10-10	0	0				https://twitter.com/6_MissLuna/status/26978236331
26886791781	bradvenable	 tony gwynn cancer 	2010-10-09	0	0				https://twitter.com/bradvenable/status/26886791781
26882244236	__sausagee	 wow found friend cancer thank god shes getting better youre prayers 	2010-10-09	0	0				https://twitter.com/__sausagee/status/26882244236
26858462092	Slow_Wine504	 thinking going walk next week support cancer	2010-10-09	0	0				https://twitter.com/Slow_Wine504/status/26858462092
26854931001	anthonygerhart	 cancer cure found xmen player coop arcade game coming xbla psn	2010-10-09	0	0				https://twitter.com/anthonygerhart/status/26854931001
26853873986	jdacks	 rt mikerose rt maria_amicone projectpink tweet puma donate breast cancer charity httptmime r 	2010-10-09	0	0	@mikerose57 @maria_amicone	#ProjectPink		https://twitter.com/jdacks/status/26853873986
26834564593	TheSITUATION214	 glamorousmzd quickmixxrick go dj k run breast cancer white rock lake	2010-10-09	0	0	@GlamorousMzD @QUICKMIXXRICK			https://twitter.com/TheSITUATION214/status/26834564593
26670276726	HarborHSN	 hilton harbor pink luncheon fashion show helping raise awareness breast cancer httpowlyi nwa	2010-10-07	0	0				https://twitter.com/HarborHSN/status/26670276726
26670276088	erinkincaid	 hilton harbor pink luncheon fashion show helping raise awareness breast cancer httpowlyi nwa	2010-10-07	0	0				https://twitter.com/erinkincaid/status/26670276088
26669198817	DisMzBCKTAT_GMM	 new twitcon couldnt find pink ribbon made tribute breast cancer month boredom work	2010-10-07	0	0		#twitcon #boredom		https://twitter.com/DisMzBCKTAT_GMM/status/26669198817
26668366808	JaySwisherSweet	 rt j_g die support breast cancer awareness add twibbon avatar now httpbitly itmiw	2010-10-07	0	0	@j_g00die	#twibbon		https://twitter.com/JaySwisherSweet/status/26668366808
26644268683	AmitSharma_DMI	 pakistan indeed cancer in region terrorist country keeping entire world ransom name war terrorismhogwash	2010-10-07	0	0		#Pakistan		https://twitter.com/AmitSharma_DMI/status/26644268683
26626290037	im_RAWse	 looks like im supporting breast cancer awareness	2010-10-07	0	0				https://twitter.com/im_RAWse/status/26626290037
26582417641	arrreema	 breast cancer awareness month everything pink even nfl except kfcs buckets wherearethepinkbuckets remember those	2010-10-06	0	0		#WHEREARETHEPINKBUCKETS		https://twitter.com/arrreema/status/26582417641
26554076697	GeminiAce	 dmlfury want breast cancer httpurbanlegendsaboutcomodmedicalabottledwaterhtm	2010-10-06	0	0	@DMLFury			https://twitter.com/GeminiAce/status/26554076697
26532195284	76040	 fort worth boutique helps brest cancer victims httpbitly rvuhi via httpoutsidein 	2010-10-06	0	0				https://twitter.com/76040/status/26532195284
26526013310	TheAlsace	 rt fiyajazz support breast cancer research add twibbon avatar now httpbitly vvg p	2010-10-06	0	0	@FiyaJazz	#twibbon		https://twitter.com/TheAlsace/status/26526013310
26521206343	Morgan_Michelle	 breast cancer awareness month people wear pink	2010-10-06	0	0				https://twitter.com/Morgan_Michelle/status/26521206343
26475756547	tww356	 know october breast cancer awareness month get checked make donation say prayerremember cancer sucks	2010-10-05	1	0				https://twitter.com/tww356/status/26475756547
26467269854	RandomReborm	 dont know female friends wont let give breast exam im worried health breast cancer awareness month	2010-10-05	0	0				https://twitter.com/RandomReborm/status/26467269854
26420015643	iamAnishaDionne	 oeoie breast cancer awareness month	2010-10-04	0	0	@Oeoie			https://twitter.com/iamAnishaDionne/status/26420015643
26411934545	TheAlsace	 rt fiyajazz rt wmsphotography book breast cancer awareness shoot free shoot httpmylocmecpazc	2010-10-04	0	0	@FiyaJazz @WMSPhotography			https://twitter.com/TheAlsace/status/26411934545
26392595168	TheMexicanAMEX	 kungfuastronaut think ima dye mohawk pink game wkend breast cancer yall think cool make plays	2010-10-04	0	0	@KungFuAstronaut			https://twitter.com/TheMexicanAMEX/status/26392595168
26330966813	marcusramsey	 breast cancer wristbands im pooped httptwitpiccom uiias	2010-10-03	0	0				https://twitter.com/marcusramsey/status/26330966813
26325469529	mschout	 im curing cancer pink clothing nfl surely violates kind man law	2010-10-03	0	0				https://twitter.com/mschout/status/26325469529
26245561656	75150	 bling bra charity auctions launched ebay breast cancer awareness month httpbitly enxv via httpoutsidein 	2010-10-03	0	0				https://twitter.com/75150/status/26245561656
26230284961	LukeAPerkins	 doktecoffee buried man last month probably died undiagnosed cancer tried years get diagnosis told eat better	2010-10-02	0	0	@DokteCoffee			https://twitter.com/LukeAPerkins/status/26230284961
26154121215	75208	 help bust breast cancer urban street bazaar httpbitlydainym via httpoutsidein 	2010-10-02	0	0				https://twitter.com/75208/status/26154121215
26154120798	75201	 help bust breast cancer urban street bazaar httpbitlybbpkdw via httpoutsidein 	2010-10-02	0	0				https://twitter.com/75201/status/26154120798
26122477204	75204	 help bust breast cancer urban street bazaar httpbitlydjpj h via httpoutsidein 	2010-10-01	0	0				https://twitter.com/75204/status/26122477204
26113308328	DedrickWelch	 apparently care deuces remix cancer awareness smh twitter	2010-10-01	0	0		#SMH #Twitter		https://twitter.com/DedrickWelch/status/26113308328
26103896813	Lindsey_Moore	 october breast cancer awareness month today is breast cancer survivor moms birthday happy bday mom	2010-10-01	0	0				https://twitter.com/Lindsey_Moore/status/26103896813
26030996392	SpencerGArnold	 rt robbwolf would remove diet knew cancer primarily runs sugar httpbitlycstesn	2010-09-30	0	0	@robbwolf			https://twitter.com/SpencerGArnold/status/26030996392
25986151112	tww356	 showing support every seconds woman dies breast cancer somewhere world fightbreastcancer	2010-09-30	0	0		#fightbreastcancer		https://twitter.com/tww356/status/25986151112
25917527065	robynfoulks	 dana cancer wtf ahhhhhh thelword	2010-09-29	0	0		#thelword		https://twitter.com/robynfoulks/status/25917527065
25907433598	Travis73	 joni eareckson tada quadriplegic breast cancer httpbitly lu z talks something greater healing	2010-09-29	0	0				https://twitter.com/Travis73/status/25907433598
25887117168	tww356	 hello world happy wednesday two days left sept childhood cancer awareness monthreminding cancer sucks	2010-09-29	0	0				https://twitter.com/tww356/status/25887117168
25878486711	ImNoBetterThanU	 envy lot like cancer mark matlock	2010-09-29	0	0				https://twitter.com/ImNoBetterThanU/status/25878486711
