id	Username	Text	Date	Retweets	Favorites	Mentions	Hashtags	Geo	Permalink
20310002216	78724	 car wash fundraiser done yuma girl lost fight cancer httpbitlyau jpv via httpoutsidein 	2010-08-04	0	0				https://twitter.com/78724/status/20310002216
20266343456	hijodelasflores	 hxllywxxd skin cancer 	2010-08-03	0	0	@HXLLYWXXD			https://twitter.com/hijodelasflores/status/20266343456
20260653788	ATXnicci	 rt gsalternative pot kills cancer government known years httpbitly batiz	2010-08-03	0	0	@gsalternative			https://twitter.com/ATXnicci/status/20260653788
20246646089	rmommaerts	 so tumor still growing rate mm every months thats slow trips eating dang pto cancer sucks	2010-08-03	0	0				https://twitter.com/rmommaerts/status/20246646089
20205054996	Schmidtyy	 im going finish bowl cereal im going cure cancer 	2010-08-03	0	0				https://twitter.com/Schmidtyy/status/20205054996
19959515021	NickiRaye	 luv shjopping trips whos taking one rt zodiacfacts zodiacfacts cancer likes gourmet food shopping trips	2010-07-30	0	0	@ZodiacFacts	#ZodiacFacts #Cancer		https://twitter.com/NickiRaye/status/19959515021
19834087329	roamingthehills	 hey cyclist friends check roll cure httprollforthecurenethomehtml great ride supporting amer cancer soc	2010-07-29	0	0				https://twitter.com/roamingthehills/status/19834087329
19746185022	AbbeyMagic	 turns epsteinbarr virus cause cancer well thats good	2010-07-28	0	0				https://twitter.com/AbbeyMagic/status/19746185022
19708872573	JackS9	 corks cancer and dinner moonshine patio bar grill http sqcom pcnta	2010-07-27	0	0	@Moonshine			https://twitter.com/JackS9/status/19708872573
19698958461	eWOO22	 rt zodiacfacts zodiacfacts cancer cautious letting guards down word	2010-07-27	0	0	@ZodiacFacts	#ZodiacFacts #Cancer #WORD		https://twitter.com/eWOO22/status/19698958461
19431279597	Cleetis	 rt espn espn nfl kaye cowher dies cancer httpespncfasqrrip	2010-07-24	0	0	@espn			https://twitter.com/Cleetis/status/19431279597
18863165464	sprycordage	 doesnt matter cancer youre messing day off	2010-07-18	0	0				https://twitter.com/sprycordage/status/18863165464
18851670998	78613	 duxbury boy takes mound cancer curveball httpbitlydj xvi via httpoutsidein 	2010-07-18	0	0				https://twitter.com/78613/status/18851670998
18851670995	78613	 duxbury boy takes mound cancer curveball httpbitlya xobc via httpoutsidein 	2010-07-18	0	0				https://twitter.com/78613/status/18851670995
18711589970	HatboxAustin	 hat facts skin cancer commonly develops head face neck wide brimmed hats offer protection areas	2010-07-16	0	0				https://twitter.com/HatboxAustin/status/18711589970
18691499742	78745	 anderson ranks first cancer treatment httpbitlydqv r via httpoutsidein 	2010-07-16	0	0				https://twitter.com/78745/status/18691499742
18682975931	78236	 cancer survivors savor special summer camp httpbitlycgxit via httpoutsidein 	2010-07-16	0	0				https://twitter.com/78236/status/18682975931
18682975297	78227	 cancer survivors savor special summer camp httpbitlyc flos via httpoutsidein 	2010-07-16	0	0				https://twitter.com/78227/status/18682975297
18682974882	78207	 cancer survivors savor special summer camp httpbitlyc lnrp via httpoutsidein 	2010-07-16	0	0				https://twitter.com/78207/status/18682974882
18588582906	76519	 friends cure hosting pub crawl uptown fight cancer httpbitlyacwo f via httpoutsidein 	2010-07-15	0	0				https://twitter.com/76519/status/18588582906
18588553515	76579	 friends cure hosting pub crawl uptown fight cancer httpbitlybp csi via httpoutsidein 	2010-07-15	0	0				https://twitter.com/76579/status/18588553515
18588544440	76501	 friends cure hosting pub crawl uptown fight cancer httpbitlybegp z via httpoutsidein 	2010-07-15	0	0				https://twitter.com/76501/status/18588544440
18555069252	78681	 dave cox dies state senator loses battle prostate cancer httpbitly lqqbq via httpoutsidein 	2010-07-14	0	0				https://twitter.com/78681/status/18555069252
18555068639	78664	 dave cox dies state senator loses battle prostate cancer httpbitly tdnv via httpoutsidein 	2010-07-14	0	0				https://twitter.com/78664/status/18555068639
18458601634	78216	 country singer louvin pancreatic cancer httpbitlybb jzr via httpoutsidein 	2010-07-13	0	0				https://twitter.com/78216/status/18458601634
18411642832	BigDaddyMufasa	 ima cancer soooo u know sign looks like layin 	2010-07-13	0	0				https://twitter.com/BigDaddyMufasa/status/18411642832
18404210342	danawebb	 please pray her cancer healed grows relationship w jesus jesus	2010-07-12	1	0		#Jesus		https://twitter.com/danawebb/status/18404210342
18388484145	78236	 south texas offers hope children fighting cancer httpbitlybfpshh via httpoutsidein 	2010-07-12	0	0				https://twitter.com/78236/status/18388484145
18388482954	78227	 south texas offers hope children fighting cancer httpbitly vvha via httpoutsidein 	2010-07-12	0	0				https://twitter.com/78227/status/18388482954
18388481522	78207	 south texas offers hope children fighting cancer httpbitlybo t via httpoutsidein 	2010-07-12	0	0				https://twitter.com/78207/status/18388481522
18315652579	jillcosmos	 wow solar eclipse cancer endings new beginnings	2010-07-11	0	0				https://twitter.com/jillcosmos/status/18315652579
18132617825	78216	 country singer louvin pancreatic cancer httpbitlya u rn via httpoutsidein 	2010-07-09	0	0				https://twitter.com/78216/status/18132617825
18121436399	rmommaerts	 legs cramping night muscle groups twitching like crazy tired little scared whats going on stupid cancer 	2010-07-09	0	0				https://twitter.com/rmommaerts/status/18121436399
18083808346	SobreSound	 yeah srsly im gonna go burn records rt vinyldistrict lebron cures cancer ill finally care ballthruhoop moneysowhat	2010-07-08	0	0	@VinylDistrict	#ballthruhoop #moneysowhat		https://twitter.com/SobreSound/status/18083808346
18027217412	bigbluize	 calculate risk free tool see atrisk may skin cancer httpbitlyt yk nho	2010-07-08	0	0		#nho		https://twitter.com/bigbluize/status/18027217412
18027183052	m_antinarella	 easier said done rt zodiacfacts lesson cancer learn separate emotions thinking	2010-07-08	0	0	@ZodiacFacts	#Cancer		https://twitter.com/m_antinarella/status/18027183052
17970424840	lumpsumcash	 survive noninvasive cancer recover homeless worse lifestyle financial hell check boobs often get quote	2010-07-07	0	0				https://twitter.com/lumpsumcash/status/17970424840
17965980761	lumpsumcash	 what hubby gonna buy critical worth k really give much credit dont count man talk breast cancer	2010-07-07	0	0				https://twitter.com/lumpsumcash/status/17965980761
17965922144	lumpsumcash	 wake smell cash breast cancer strikes healthy day one cant depend medical buy food rent home	2010-07-07	0	0				https://twitter.com/lumpsumcash/status/17965922144
17939644918	CapiCoffee	 coffee reduces head neck cancer risk new study shows httpwpmepyi k	2010-07-07	0	3				https://twitter.com/CapiCoffee/status/17939644918
17736207451	coreeoreeo	 theres one thing hate its losing theres two things hate its losing getting cancer 	2010-07-04	0	0				https://twitter.com/coreeoreeo/status/17736207451
17724872453	78745	 austin fans cancer survivors watch lance armstrong begin tour de france httpbitly cs vn via httpoutsidein 	2010-07-04	0	0				https://twitter.com/78745/status/17724872453
17492394618	russellpage	 atheist writer christopher hitchens diagnosed cancer pray him remember pray salvation httpowly eho	2010-07-01	0	0				https://twitter.com/russellpage/status/17492394618
17288263915	jcabbruzzi	 dam cancer happy hour congrats paddle boarders abels lake w melaniemahaffey http sqcom bjqh	2010-06-28	0	0	@Dam @Abel @melaniemahaffey			https://twitter.com/jcabbruzzi/status/17288263915
17264807254	78745	 dam cancer paddle httpbitlycrcr a via httpoutsidein 	2010-06-28	0	0				https://twitter.com/78745/status/17264807254
17107558173	rachelarciniega	 tonystevens need help megan fox teenagers coping cancer lets retweet tolld live strong	2010-06-26	0	0	@tonystevens4			https://twitter.com/rachelarciniega/status/17107558173
17107044021	rachelarciniega	 teameganfox get word out also follow live strong cancer lance armstrong best take care	2010-06-26	0	1	@teaMeganFox			https://twitter.com/rachelarciniega/status/17107044021
17101841629	lumpsumcash	 confused breast cancer coverage youhaveabroker loyal keeping lifestyle worst occurs httpyouhaveabrokercom	2010-06-26	0	0				https://twitter.com/lumpsumcash/status/17101841629
17015055551	forkyshauna	 taking mom drs appt cancer care centers south texas http sqcomaepbpd	2010-06-25	0	0	@Cancer			https://twitter.com/forkyshauna/status/17015055551
16790469255	KingFlorist	 one bloom time nonprofit ct_ts s event another cancer event coming july st atx austin	2010-06-22	0	0	@CT_TS	#ATX #Austin		https://twitter.com/KingFlorist/status/16790469255
16435273990	g2b2	 friend pam chamberlain died today cancer good lady kind fun cat lover enjoyed sense humor lot	2010-06-17	0	1				https://twitter.com/g2b2/status/16435273990
16422807273	78236	 methodist grant help transport cancer patients httpbitlyahgcls via httpoutsidein 	2010-06-17	0	0				https://twitter.com/78236/status/16422807273
16422807142	78227	 methodist grant help transport cancer patients httpbitly zacdh via httpoutsidein 	2010-06-17	0	0				https://twitter.com/78227/status/16422807142
16422806691	78207	 methodist grant help transport cancer patients httpbitlycx jz via httpoutsidein 	2010-06-17	0	0				https://twitter.com/78207/status/16422806691
16412904078	ericwetzel	 rt joebartoncares would like appologize cancer wrong us try prevent due process gobp	2010-06-17	0	0	@JoeBartonCares	#GOBP		https://twitter.com/ericwetzel/status/16412904078
16276784429	CaliAmbitious	 ayoheartless whatever coming bestie omg bestie cancer 	2010-06-15	0	0	@AYOheartless			https://twitter.com/CaliAmbitious/status/16276784429
16197956465	LARAimages	 theellespell margaret double mastectomy reconstruction today end scary breast cancer journey thanks	2010-06-14	0	0	@TheElleSpell			https://twitter.com/LARAimages/status/16197956465
16179328943	mammaleslie	 cancer stupid	2010-06-14	0	0				https://twitter.com/mammaleslie/status/16179328943
16149817315	Exalted_	 rt drudge_report cancer drug found australian rainforest httpdrudgetwaz bvz	2010-06-14	0	0	@Drudge_Report			https://twitter.com/Exalted_/status/16149817315
16033693522	JimEngland	 its almost if cancer tied usa	2010-06-12	0	0		#usa		https://twitter.com/JimEngland/status/16033693522
15981801727	radzrider	 heard great quote tonight life surviving storm learning dance rain cancer survivor	2010-06-12	0	0				https://twitter.com/radzrider/status/15981801727
15941945056	TeranceJames	 rt imdolce rt terancejames wish handcock flying strong shit cancer heart attacks dont worry shit	2010-06-11	0	0	@ImDolce @TeranceJames			https://twitter.com/TeranceJames/status/15941945056
15813840582	78745	 regional round pairings coaches vs cancer classic announced httpbitlybgnlp via httpoutsidein 	2010-06-09	0	0				https://twitter.com/78745/status/15813840582
15792728979	texasFBfeedr	 regional round pairings coaches vs cancer classic announced httpffdmecbif g longhorns	2010-06-09	1	0		#longhorns		https://twitter.com/texasFBfeedr/status/15792728979
15730119061	mslape	 killing breast cancer peaches plums read latest research httptinyurlcom b c p	2010-06-08	1	0				https://twitter.com/mslape/status/15730119061
15724728477	cristina0123	 found aunt breast cancer pls pray her	2010-06-08	0	0				https://twitter.com/cristina0123/status/15724728477
15656552786	amcclosky	 apple talks product like cure cancer arent cool still pretty awesome	2010-06-07	0	0				https://twitter.com/amcclosky/status/15656552786
15585773688	78745	 thousands celebrate life cancer httpbitlyafstwy via httpoutsidein 	2010-06-06	0	0				https://twitter.com/78745/status/15585773688
15538260228	ScottACarrigan	 got done watching dear john happend deployed got mine email didnt marry guy cancer yet	2010-06-06	0	0				https://twitter.com/ScottACarrigan/status/15538260228
15501701380	allyson_smith	 ad skin cancer taylorsummer httptwitpiccom u lxk	2010-06-05	0	0	@taylorsummer			https://twitter.com/allyson_smith/status/15501701380
15465036028	MasterDimentio	 solowooper hope get cancer d	2010-06-05	0	0	@SoloWooper			https://twitter.com/MasterDimentio/status/15465036028
15463214013	MasterDimentio	 solowooper one gave cancer baruberreh	2010-06-04	0	0	@SoloWooper @BaruBerreh			https://twitter.com/MasterDimentio/status/15463214013
15462640737	MasterDimentio	 solowooper forget foodnow giving someone cancer was	2010-06-04	0	0	@SoloWooper			https://twitter.com/MasterDimentio/status/15462640737
15462163650	MasterDimentio	 solowooper gave someone cancer twitter today	2010-06-04	0	0	@SoloWooper			https://twitter.com/MasterDimentio/status/15462163650
15462080979	MasterDimentio	 lucas th solowooper fear power cancer p	2010-06-04	0	0	@lucas17th @SoloWooper			https://twitter.com/MasterDimentio/status/15462080979
15443307073	MasterDimentio	 gave friend cancer p	2010-06-04	0	0				https://twitter.com/MasterDimentio/status/15443307073
15381198269	radzrider	 rt spotter dear big government wed rather find bin laden cure cancer bomb n korea dont care cont httptlgd lk 	2010-06-03	0	0	@19Spotter			https://twitter.com/radzrider/status/15381198269
15349245404	Survivorship	 natl cancer survivors day june celebrating childhood cancer survivors free brunch music details httpbitly z gp	2010-06-03	0	0				https://twitter.com/Survivorship/status/15349245404
15207655062	scorpio4	 dennis hopper directed starred counterculture classic easy rider dies battle prostate cancer 	2010-06-01	0	0				https://twitter.com/scorpio4/status/15207655062
15196516054	wendywhipple	 vote give idea k ride bikes texas alaska find cure cancer pepsirefresh httppepsi nezcn	2010-06-01	0	0		#pepsirefresh		https://twitter.com/wendywhipple/status/15196516054
15189430101	rsgdata	 heading back san antonio today restaging cancer keep guys posted also treat return	2010-06-01	0	0				https://twitter.com/rsgdata/status/15189430101
15048085016	arroyoracing	 team training raised cancer research capital texas triathlon	2010-05-30	0	0				https://twitter.com/arroyoracing/status/15048085016
14852906319	TheRTFCage	 rt reelwomen tonight lunafest pictureboxstudios pm w door prizes goody bags come support breast cancer httpbitlyd twvx	2010-05-27	0	1	@ReelWomen			https://twitter.com/TheRTFCage/status/14852906319
14776746981	rsgdata	 finally ready get back fray restaged cancer st june	2010-05-26	0	0				https://twitter.com/rsgdata/status/14776746981
14775837934	lepetitowlet	 year ago today beginning fight cancer httpgooglfbjljnr	2010-05-26	0	0		#cancer		https://twitter.com/lepetitowlet/status/14775837934
14775589406	bonrod	 kellytollett great gift dad gave you yes similar experience cancer lots shadows everywhere went	2010-05-26	0	0	@kellytollett			https://twitter.com/bonrod/status/14775589406
14771711632	bonrod	 kellytollett i cancer near death one point began seeing shadows weird things around the	2010-05-26	0	0	@kellytollett			https://twitter.com/bonrod/status/14771711632
14759842772	Exalted_	 rt alcanzarlo sunscreen may give cancer study httpamplifycomu eyo	2010-05-26	0	1	@Alcanzarlo			https://twitter.com/Exalted_/status/14759842772
14749072079	lepetitowlet	 happy year anniversary cancer read journey httpwwwlepetitowletcom	2010-05-26	0	0		#cancer		https://twitter.com/lepetitowlet/status/14749072079
14690457606	viswoman	 facebook people recount bodily pains cancer treatment ortho surgeries sunburn poison ivy feel healthy comparison	2010-05-25	0	0				https://twitter.com/viswoman/status/14690457606
14659160751	ATXLibertarian	 phil mickelson proved amazing golfer hot wife cheat her course shell still get cancer 	2010-05-24	0	0				https://twitter.com/ATXLibertarian/status/14659160751
14646055282	Exalted_	 rt darkpoltweeter new article darkpolitricks study many sunscreens may accelerating cancer httpbitlybgf ka darkpolitrickscom	2010-05-24	0	0	@darkpoltweeter			https://twitter.com/Exalted_/status/14646055282
14641536898	Exalted_	 rt drudge_report study many sunscreens may accelerate cancer httpdrudgetwcjjljx	2010-05-24	0	0	@Drudge_Report			https://twitter.com/Exalted_/status/14641536898
14372180345	Survivorship	 natl cancer survivors day june celebrating childhood cancer survivors free brunch music details httpbitly z gp	2010-05-20	0	0				https://twitter.com/Survivorship/status/14372180345
14357220402	LegiScanTX	 hb complete relating issuance specialty license plates cancer unknown primary origin aware httpbitlycomclxulv	2010-05-20	0	0				https://twitter.com/LegiScanTX/status/14357220402
14284718491	merrillamelia	 hope get aids terminal cancer stupid bitch	2010-05-19	0	0				https://twitter.com/merrillamelia/status/14284718491
14275338134	78249	 retired district judge loses battle cancer dies httpbitlyakhd via httpoutsidein 	2010-05-19	0	0				https://twitter.com/78249/status/14275338134
14255455316	LegiScanTX	 hb complete relating cancer prevention research institute texas httpbitlycom uvbjx	2010-05-18	0	0				https://twitter.com/LegiScanTX/status/14255455316
14253447105	LegiScanTX	 hb complete relating cancer prevention research institute texas httpbitlycom uvbjx	2010-05-18	0	0				https://twitter.com/LegiScanTX/status/14253447105
14177975523	iVanbsac	 diopeople dont lose battle cancer theyve fought fight continue battle them any sayn lost battle	2010-05-17	0	0				https://twitter.com/iVanbsac/status/14177975523
14131667658	Lady_Ace12	 ceezyspacekid hell yeathe worl would better place everybody smokin kush instead cancer	2010-05-16	0	0	@CeezySpaceKid			https://twitter.com/Lady_Ace12/status/14131667658
14024001142	77808	 please prayer strickland family loss daughter cancer b httpbitlyddzuwj via httpoutsidein 	2010-05-15	0	0				https://twitter.com/77808/status/14024001142
14024000940	77807	 please prayer strickland family loss daughter cancer b httpbitlya nqpd via httpoutsidein 	2010-05-15	0	0				https://twitter.com/77807/status/14024000940
13989686880	pambaggett	 told someone abt caringbridge doyouknow some w cancer preemie baby serious injury share wthem httptwurlnlojheox	2010-05-14	0	0	@CaringBridge	#DoYouKnow #cancer		https://twitter.com/pambaggett/status/13989686880
13930972513	GreenCertify	 since overall incidence cancer us escalated epidemic proportions million killing per year	2010-05-13	0	0				https://twitter.com/GreenCertify/status/13930972513
13899733051	77808	 cancer strikes special ops us tour dates postponed news httpbitly goc s via httpoutsidein 	2010-05-13	0	0				https://twitter.com/77808/status/13899733051
13899732854	77807	 cancer strikes special ops us tour dates postponed news httpbitlyal pz via httpoutsidein 	2010-05-13	0	0				https://twitter.com/77807/status/13899732854
13872331520	afogarty2005	 join tour pick bike get friends cheer help livestrong raise k cancer httpbitlydqp m iridefor	2010-05-12	0	0	@LIVESTRONG	#IRideFor		https://twitter.com/afogarty2005/status/13872331520
13859048835	keithlevy	 join tour pick bike get friends cheer help livestrong raise k cancer httpbitlydqp m iridefor	2010-05-12	0	0	@LIVESTRONG	#IRideFor		https://twitter.com/keithlevy/status/13859048835
13560591160	jessica_cruz02	 uncle trooper even though cancer pain still going go back work wow inspiration	2010-05-07	0	0				https://twitter.com/jessica_cruz02/status/13560591160
13495316875	mrEye507	 dia internacional contra el cancer en memoria de quienes perdieron la batalla para los que luchan por ganarla dia dia	2010-05-06	0	0				https://twitter.com/mrEye507/status/13495316875
13485312188	JegerLF	 cancer find today austin gastroenterology http sqcomco n w	2010-05-06	0	0	@Austin			https://twitter.com/JegerLF/status/13485312188
13437235924	townsendcountry	 dear mil second surgery breast cancer today clear margins first oneprayers appreciated	2010-05-05	0	0				https://twitter.com/townsendcountry/status/13437235924
13433701728	CSdoctor	 study stomach cancer young white adults httpbitlyccmacr	2010-05-05	0	0				https://twitter.com/CSdoctor/status/13433701728
13389108387	texstarauto	 still long way go reach goal american cancer society labor hours go	2010-05-04	0	0				https://twitter.com/texstarauto/status/13389108387
13310135678	Amitinator	 shallow gimmick rt celivingston kfc prevent breast cancer clucking serious httpbitlybjv t fb	2010-05-03	0	0	@celivingston	#fb		https://twitter.com/Amitinator/status/13310135678
13248938893	anadarlinn	 bieber cancer might make it im scarred lifee rt dabieberville	2010-05-02	0	0		#dabieberville		https://twitter.com/anadarlinn/status/13248938893
13228793621	78218	 thousands turn support cancer research httpbitlyc qvns via httpoutsidein 	2010-05-02	0	0				https://twitter.com/78218/status/13228793621
13228793558	78218	 thousands turn cancer research httpbitlyc qvns via httpoutsidein 	2010-05-02	0	0				https://twitter.com/78218/status/13228793558
13228793534	78203	 thousands turn cancer research httpbitlybxiv z via httpoutsidein 	2010-05-02	0	0				https://twitter.com/78203/status/13228793534
13228793387	78203	 thousands turn support cancer research httpbitlybxiv z via httpoutsidein 	2010-05-02	0	0				https://twitter.com/78203/status/13228793387
13190188791	TheMonkiesUncle	 kind end line walking breast cancer thenow miles btw httptwitpiccom jyvns	2010-05-01	0	0				https://twitter.com/TheMonkiesUncle/status/13190188791
13182931360	jnm	 breast cancer walk boobs	2010-05-01	0	0				https://twitter.com/jnm/status/13182931360
13083545565	CSdoctor	 fda approves prostate cancer vaccine httpbitlyam gmq	2010-04-29	0	0				https://twitter.com/CSdoctor/status/13083545565
13045460722	chriscreel	 possible fire coach midplayoff series mike woodson cancer hawks	2010-04-28	0	0		#hawks		https://twitter.com/chriscreel/status/13045460722
13041329117	Mysteryyygirl	 shannonleetweed rt juliebenz plz retweet help raise th bday rally kids cancer la httpbitly w rqf	2010-04-28	0	0	@shannonleetweed @juliebenz			https://twitter.com/Mysteryyygirl/status/13041329117
13041188272	Mysteryyygirl	 elizadushku rt juliebenz plz retweet help raise th bday rally kids cancer la httpbitly w rqf	2010-04-28	0	0	@elizadushku @juliebenz			https://twitter.com/Mysteryyygirl/status/13041188272
13041151460	Mysteryyygirl	 jennyfrommtv rt juliebenz plz retweet help raise th bday rally kids cancer la httpbitly w rqf	2010-04-28	0	0	@JennyfromMTV @juliebenz			https://twitter.com/Mysteryyygirl/status/13041151460
13041097536	Mysteryyygirl	 chelseahandler rt juliebenz plz retweet help raise th bday rally kids cancer la httpbitly w rqf	2010-04-28	0	0	@chelseahandler @juliebenz			https://twitter.com/Mysteryyygirl/status/13041097536
13040992525	Mysteryyygirl	 channingtatum rt juliebenz plz retweet help raise th bday rally kids cancer la httpbitly w rqf	2010-04-28	0	0	@channingtatum @juliebenz			https://twitter.com/Mysteryyygirl/status/13040992525
13040939866	Mysteryyygirl	 theellenshow rt juliebenz plz retweet help raise th bday rally kids cancer la httpbitly w rqf	2010-04-28	0	0	@TheEllenShow @juliebenz			https://twitter.com/Mysteryyygirl/status/13040939866
13040846222	Mysteryyygirl	 kirstiealley rt juliebenz plz retweet help raise th bday rally kids cancer la httpbitly w rqf	2010-04-28	0	0	@kirstiealley @juliebenz			https://twitter.com/Mysteryyygirl/status/13040846222
12795617195	LaurenCroft	 ashleystewart could apparently however going giving jim hug worth it recently found brain cancer	2010-04-24	0	0	@AshleyStewart88			https://twitter.com/LaurenCroft/status/12795617195
12791992052	chumster	 check seaholm power plant endless beauty launch party eblaunch austin tix supports breast cancer research good times	2010-04-24	0	0		#EBlaunch #Austin		https://twitter.com/chumster/status/12791992052
12636623921	Blest_Servant	 currently rd place john kanzius cancer research two highest receicve kvote today	2010-04-22	0	0				https://twitter.com/Blest_Servant/status/12636623921
12616595873	_Duhneece	 rt bestofsigns bestofsigns retweet youre proud virgo pisces scorpio cancer bestofsigns im cancer 	2010-04-21	0	0	@BestOfSigns	#BestOfSigns #BestOfSigns		https://twitter.com/_Duhneece/status/12616595873
12548539958	KATHRYN_BROWN_	 happy blessed cancer free yeah	2010-04-20	0	0				https://twitter.com/KATHRYN_BROWN_/status/12548539958
12534704760	dosadi	 beastie boys adam yauch requests cancer smashing vibes httpbitlybmaiet comin ya homie	2010-04-20	0	0				https://twitter.com/dosadi/status/12534704760
12478925554	josecarlos_e	 reach lucky instead sweet die cancer least creative advertising	2010-04-19	0	0				https://twitter.com/josecarlos_e/status/12478925554
12468654104	EdgarAriel__	 lol mine right cancer rt freakyfact freaky one you httptwitpiccom gtadt	2010-04-19	0	0	@FreakyFact	#Freaky411		https://twitter.com/EdgarAriel__/status/12468654104
12323444979	bluenude3	 step peta gonna sweep it americawants american cancer society get free fullpage ad usa today please rt americancancer 	2010-04-17	0	0	@AmericanCancer	#AmericaWants		https://twitter.com/bluenude3/status/12323444979
12267878564	bluenude3	 peta cancer research u decide americawants american cancer society get free fullpage ad usa todayplease rt americancancer	2010-04-16	0	0	@AmericanCancer	#AmericaWants		https://twitter.com/bluenude3/status/12267878564
12233173877	WKCIV	 im cancer care centers south texas medical dr san antonio http sqcomaepbpd	2010-04-15	0	0				https://twitter.com/WKCIV/status/12233173877
11972827726	topix_insight	 fashion group fights cancer flight cure httpbitlyblqpc sanmarcos california	2010-04-10	0	0		#SanMarcos #California		https://twitter.com/topix_insight/status/11972827726
11914283863	chachere1	 katy relay life fun shona brooke raising money cancer research	2010-04-09	0	0				https://twitter.com/chachere1/status/11914283863
