id	Username	Text	Date	Retweets	Favorites	Mentions	Hashtags	Geo	Permalink
11099396232	topix_ut	 concerts raise funds cancer research httpbitlycbnuqz brianhead utah	2010-03-26	0	0		#BrianHead #Utah		https://twitter.com/topix_ut/status/11099396232
20556336429273088	HuntsmanHeroes	 tonight tomorrow pm ebay forward benefits huntsman cancer foundation eve httpwwweveslccom	2010-12-30	0	0				https://twitter.com/HuntsmanHeroes/status/20556336429273088
19630047014944768	pandaluxe	 rt sarahksilverman smokers get take min breaks awkward social gatherings awkward cancer spreadings	2010-12-28	0	0	@SarahKSilverman			https://twitter.com/pandaluxe/status/19630047014944768
19504956050513920	utahmedlaw	 medical malpractice cancer misdiagnosis httpbitlydi jz 	2010-12-27	0	0				https://twitter.com/utahmedlaw/status/19504956050513920
17307031132176384	utahmedlaw	 failure diagnose breast cervical cancer malpractice cases may increase due lack screening younger women httpbitlyhzz b	2010-12-21	0	0				https://twitter.com/utahmedlaw/status/17307031132176384
17043648717783040	klebinn	 aanaluisacs ce eh de cancer tb nem lembrava	2010-12-20	0	0	@aanaluisacs			https://twitter.com/klebinn/status/17043648717783040
16728333416931328	Sisal13	 youtah both cancer real crappy idea carl survivors	2010-12-20	0	0	@youtah			https://twitter.com/Sisal13/status/16728333416931328
16273925826678784	KEZI9Rosie	 deepest condolences go sone mikki family losing nephew cancer hes better place 	2010-12-18	0	0				https://twitter.com/KEZI9Rosie/status/16273925826678784
15433347979280384	ElaseMedicalSpa	 help elase provide christmas local children fighting cancer hope kids httprcastgxcrxl	2010-12-16	0	0				https://twitter.com/ElaseMedicalSpa/status/15433347979280384
14758881162960897	utahmedlaw	 failure diagnose breast cervical cancer malpractice cases may increase due lack screening younger women httpbitlyhzz b	2010-12-14	0	0				https://twitter.com/utahmedlaw/status/14758881162960897
14402818022576128	laserjolter	 zupas animated movies cancer extinction lunch	2010-12-13	0	0		#lunch		https://twitter.com/laserjolter/status/14402818022576128
10832200895307776	jraywelch	 thanks everyone works here phenomenal people really care patients huntsman cancer institute	2010-12-03	0	0	@Huntsman			https://twitter.com/jraywelch/status/10832200895307776
9775214292377601	drewsp75	 neviegirl read tmblrtwitter posts indomitable spirit amazing keep up beat cancer 	2010-11-30	0	0	@NevieGirl83			https://twitter.com/drewsp75/status/9775214292377601
9573177931866112	topix_ut	 utah vocal teacher beats cancer claim national spotlight httpbitlygdpckg saratogasprings utah	2010-11-30	0	0		#SaratogaSprings #Utah		https://twitter.com/topix_ut/status/9573177931866112
5521363347439616	topix_ut	 researchers byu find quicker way detect cancer httpbitly gqlfk eaglemountain utah	2010-11-19	0	0		#EagleMountain #Utah		https://twitter.com/topix_ut/status/5521363347439616
5334331379687425	utahmedlaw	 latestage cancer care varies widely hospital region httptinyccn t 	2010-11-18	0	0				https://twitter.com/utahmedlaw/status/5334331379687425
4942905705758720	Deesing	 havent heard im new cancer never looked better cant stand it	2010-11-17	0	0				https://twitter.com/Deesing/status/4942905705758720
4652984826863616	Deesing	 tsablogteam say regarding allegations machines emit radiation thus cause cancer cost freedom	2010-11-16	0	0	@TSABlogTeam			https://twitter.com/Deesing/status/4652984826863616
3339447768715264	j_h0	 im american cancer society south east salt lake city http sqcomciwncm	2010-11-13	0	0				https://twitter.com/j_h0/status/3339447768715264
29696591315	myhccu	 cool cause otd movember teams dedicated growing mustaches curing prostate cancer support djwaldow teamslc httpargydjmo	2010-11-04	0	0	@djwaldow	#Movember #teamslc		https://twitter.com/myhccu/status/29696591315
29486125194	kiiinley	 toothpaste cancer causing chemicals it shut up	2010-11-02	0	0		#shut		https://twitter.com/kiiinley/status/29486125194
28968326806	84088	 south jordan boy gets wish beating cancer httpbitlychxfnb via httpoutsidein 	2010-10-28	0	0				https://twitter.com/84088/status/28968326806
28924210009	tylerweaves	 tylergreene breast cancer examinations youre wrong	2010-10-27	0	0	@tylergreene86			https://twitter.com/tylerweaves/status/28924210009
28561458003	Sisal13	 ladyozma child lung cancer prayers you	2010-10-23	0	0	@ladyozma			https://twitter.com/Sisal13/status/28561458003
27877957719	thespineline	 cancer manmade disease controversial study claims so httpbitlydhtc 	2010-10-19	1	0				https://twitter.com/thespineline/status/27877957719
27776455997	AxlMnz	 im huntsman cancer institute salt lake city ut httpgowallac henw 	2010-10-18	0	0				https://twitter.com/AxlMnz/status/27776455997
27702470501	AlexandraE	 remember october breast cancer awareness month httpwwwhikeforbreastcancercom	2010-10-17	0	0				https://twitter.com/AlexandraE/status/27702470501
27439712243	clementi1832	 ancient world dealt cancer httpgoogl m r	2010-10-15	0	0				https://twitter.com/clementi1832/status/27439712243
27350342459	goingbacktokali	 hibaissa cue bunch tea partiers screaming damn cancer patients suck heal	2010-10-14	0	0	@HibaIssa			https://twitter.com/goingbacktokali/status/27350342459
27337404066	84118	 high school football kearns win game copper hills cancer fundraiser success httpbitly gtwn via httpoutsidein 	2010-10-14	0	0				https://twitter.com/84118/status/27337404066
27285972242	ChessZeppelin	 foods fight cancer chicagotribunecom httpbitlycq mc 	2010-10-13	0	0				https://twitter.com/ChessZeppelin/status/27285972242
26918653149	84102	 thousands participate fox s breast cancer walk httpbitlyb id n via httpoutsidein 	2010-10-10	0	0				https://twitter.com/84102/status/26918653149
26918653110	84105	 thousands participate fox s breast cancer walk httpbitly x wlg via httpoutsidein 	2010-10-10	0	0				https://twitter.com/84105/status/26918653110
26850147202	MandaVision	 strides breast cancer liberty park w others http sqcom uzinb	2010-10-09	0	0	@Liberty			https://twitter.com/MandaVision/status/26850147202
26686272870	pdangcil	 love boobies support breast cancer awareness month saying thing loud	2010-10-07	0	0				https://twitter.com/pdangcil/status/26686272870
26686100897	pdangcil	 cant women say i love boobs breast cancer awareness i like leave purse on counter doesnt tell jack	2010-10-07	0	0				https://twitter.com/pdangcil/status/26686100897
26685981825	pdangcil	 viral campaign women keep purses annoying its supposed breast cancer awareness really	2010-10-07	0	0				https://twitter.com/pdangcil/status/26685981825
26674814176	jakeswensen	 former snow usu philadelphia eagles receiver kevin curtis battling testicular cancer httpbitlyaqaby 	2010-10-07	0	0		#USU		https://twitter.com/jakeswensen/status/26674814176
26654071929	_kanonball	 wear pink support breast cancer ben family	2010-10-07	0	0				https://twitter.com/_kanonball/status/26654071929
26624048072	84101	 breast cancer awareness month httpbitlydtyolb via httpoutsidein 	2010-10-07	0	0				https://twitter.com/84101/status/26624048072
26622604660	CDoggity	 lycandid youre going qualify children whose parents die cancer drunk drivers called something different	2010-10-07	0	0	@LycanDid			https://twitter.com/CDoggity/status/26622604660
26000629785	TimHaslam	 mls games month using httptwitpiccom tcrvk breast cancer stuff made too woot woot	2010-09-30	0	0				https://twitter.com/TimHaslam/status/26000629785
25273639450	ryanrossokay	 except kind intense song girl cancer still works though	2010-09-22	0	0				https://twitter.com/ryanrossokay/status/25273639450
25055305369	jortron	 participating making strides breast cancer wrong reasons	2010-09-20	0	0				https://twitter.com/jortron/status/25055305369
24810512495	jakemallory	 hera foundation presents adventurefilmcom climb life huntsman cancer institute http sqcom kx gx	2010-09-17	0	0	@Huntsman	#climb4life		https://twitter.com/jakemallory/status/24810512495
24774753377	GraniteSchools	 rt kutv news school shows support cancer stricken teacher olympus junior high school looked like sea pink httpbitlydc dh 	2010-09-17	0	0	@KUTV2News			https://twitter.com/GraniteSchools/status/24774753377
24713736660	topix_ut	 man flies cities days fight cancer memory mom httpbitlyb dmls saltlakecity utah	2010-09-16	0	0		#SaltLakeCity #Utah		https://twitter.com/topix_ut/status/24713736660
24499979495	topix_ut	 skin cancer awareness k walk sept httpbitly qi po westbountiful utah	2010-09-14	0	0		#WestBountiful #Utah		https://twitter.com/topix_ut/status/24499979495
24170235507	DsAngelBaby	 su c joke money going cure treatment family members die due cancer ive given hope	2010-09-11	0	0	@SU2C			https://twitter.com/DsAngelBaby/status/24170235507
24148274172	EGGBOY8X	 rt ericstonestreet hey cancer me pm etpt pm ct nbc cbs abc fox su c httpplixicomp 	2010-09-10	0	0	@ericstonestreet @SU2C			https://twitter.com/EGGBOY8X/status/24148274172
22872023162	84098	 get pizza fight cancer httpbitly pgdmw via httpoutsidein 	2010-09-03	0	0				https://twitter.com/84098/status/22872023162
22864196850	AshGarrett85	 insanely hard night curse cancer 	2010-09-03	0	0				https://twitter.com/AshGarrett85/status/22864196850
22691590758	84060	 get pizza fight cancer httpbitly sgcuq via httpoutsidein 	2010-09-01	0	0				https://twitter.com/84060/status/22691590758
22691590502	84049	 get pizza fight cancer httpbitly axdnv via httpoutsidein 	2010-09-01	0	0				https://twitter.com/84049/status/22691590502
22418577623	84106	 hundreds race salt lake city woman fighting cancer httpbitlybw kaq via httpoutsidein 	2010-08-29	0	0				https://twitter.com/84106/status/22418577623
21893517116	84604	 free skin cancer screening provo httpbitlyb ltkg via httpoutsidein 	2010-08-23	0	0				https://twitter.com/84604/status/21893517116
21893517046	84606	 free skin cancer screening provo httpbitlyc aguf via httpoutsidein 	2010-08-23	0	0				https://twitter.com/84606/status/21893517046
21811690002	topix_ut	 free skin cancer screening provo httpbitlybl j provo utah	2010-08-22	0	0		#Provo #Utah		https://twitter.com/topix_ut/status/21811690002
21789910238	84106	 sugar house woman provides unique look cancer treatment httpbitlyax nwa via httpoutsidein 	2010-08-21	0	0				https://twitter.com/84106/status/21789910238
21771200158	84043	 local organizations paint saratoga race course pink fight breast cancer httpbitly f oez via httpoutsidein 	2010-08-21	0	0				https://twitter.com/84043/status/21771200158
21730899407	84109	 sugar house woman provides unique look cancer treatment httpbitlya wc j via httpoutsidein 	2010-08-21	0	0				https://twitter.com/84109/status/21730899407
21730895120	84108	 sugar house woman provides unique look cancer treatment httpbitly ww xp via httpoutsidein 	2010-08-21	0	0				https://twitter.com/84108/status/21730895120
21711652445	topix_ut	 run drive style fight cancer httpbitly qkaoi parkcity utah	2010-08-20	0	0		#ParkCity #Utah		https://twitter.com/topix_ut/status/21711652445
21574546610	84043	 fabulous fillies day saratoga race course raise funds breast cancer research httpbitlyc y sd via httpoutsidein 	2010-08-19	0	0				https://twitter.com/84043/status/21574546610
21550980488	84606	 free skin cancer clinic held provo httpbitlyd msjj via httpoutsidein 	2010-08-19	0	0				https://twitter.com/84606/status/21550980488
21550980216	84604	 free skin cancer clinic held provo httpbitly rcrks via httpoutsidein 	2010-08-19	0	0				https://twitter.com/84604/status/21550980216
21536541537	topix_ut	 free skin cancer clinic provo httpbitly h jgh provo utah	2010-08-18	0	0		#Provo #Utah		https://twitter.com/topix_ut/status/21536541537
21125107901	dellblair	 dinner cancer patient and good friend wife final stages sort shifts ontological reference frame	2010-08-14	0	0				https://twitter.com/dellblair/status/21125107901
20484624839	CDoggity	 ugh still constantly feel like im going vomit cant go homei need money xx wouldnt surprised cancer 	2010-08-06	0	0				https://twitter.com/CDoggity/status/20484624839
20247647981	psmith553	 cancer screening done well enough dont go back year	2010-08-03	0	1				https://twitter.com/psmith553/status/20247647981
20242878359	psmith553	 time month cancer check up huntsman cancer institute http sqcom kx gx	2010-08-03	0	0	@Huntsman			https://twitter.com/psmith553/status/20242878359
20136866220	84062	 survivor siblings set race cancer httpbitlycvnv o via httpoutsidein 	2010-08-02	0	0				https://twitter.com/84062/status/20136866220
20079888461	cancrx	 lunch back lab cure cancer red robin gourmet burgers http sqcom krmcx	2010-08-01	0	0	@Red			https://twitter.com/cancrx/status/20079888461
20016075708	smfoote	 help support nevada cancer institute ill ride miles viva bike vegas donate money httpbitly xcvz 	2010-07-31	0	0				https://twitter.com/smfoote/status/20016075708
19753988365	topix_ut	 cancer victims family asks volunteers test bone marrow matches httpbitlyd jbqn draper utah	2010-07-28	0	0		#Draper #Utah		https://twitter.com/topix_ut/status/19753988365
19726786702	84065	 cancer victims family asks volunteers test bone marrow matches httpbitlydpcthg via httpoutsidein 	2010-07-28	0	0				https://twitter.com/84065/status/19726786702
19726786333	84043	 cancer victims family asks volunteers test bone marrow matches httpbitlyc gflp via httpoutsidein 	2010-07-28	0	0				https://twitter.com/84043/status/19726786333
19726785836	84020	 cancer victims family asks volunteers test bone marrow matches httpbitlyct lis via httpoutsidein 	2010-07-28	0	0				https://twitter.com/84020/status/19726785836
19726785376	84004	 cancer victims family asks volunteers test bone marrow matches httpbitly a ql via httpoutsidein 	2010-07-28	0	0				https://twitter.com/84004/status/19726785376
19393444544	RevRieder	 cancer leo birthday celebration full swing even early great turn area slc 	2010-07-23	0	0	@area51slc			https://twitter.com/RevRieder/status/19393444544
19108100052	pandaluxe	 fancychristofer fuck cancer im really sorry hear aunt	2010-07-21	0	0	@fancychristofer			https://twitter.com/pandaluxe/status/19108100052
18533803035	84604	 melanoma prevention free skin cancer screenings httpbitlyd zcoh via httpoutsidein 	2010-07-14	0	0				https://twitter.com/84604/status/18533803035
18533802900	84606	 melanoma prevention free skin cancer screenings httpbitly rxpxd via httpoutsidein 	2010-07-14	0	0				https://twitter.com/84606/status/18533802900
17956647092	utahmedlaw	 va malpractice lawsuit filed problems cancer treatment httpbitlybyaotl	2010-07-07	0	0				https://twitter.com/utahmedlaw/status/17956647092
17455333612	frankmeffert	 cure cancer profit years patent write song cancer profit years die	2010-06-30	0	0				https://twitter.com/frankmeffert/status/17455333612
17264115760	dannysainsbury	 phunnel cancer 	2010-06-28	0	0	@phunnel			https://twitter.com/dannysainsbury/status/17264115760
17047242383	LaurenMcGee_	 im huntsman cancer institute http sqcom kx gx	2010-06-25	0	0				https://twitter.com/LaurenMcGee_/status/17047242383
16808203524	tslack	 chance cancer comes back appetite back its downhill here thanks thoughts prayers	2010-06-22	0	0				https://twitter.com/tslack/status/16808203524
16749466862	meremayjohn	 final blog familys experience cancer loss mom httpmeremayjohnblogspotcom momssidefinalvoicehtml	2010-06-22	0	0				https://twitter.com/meremayjohn/status/16749466862
16394289524	meremayjohn	 new blog part cancer journey httpmeremayjohnblogspotcom mckinziesstoryhtml	2010-06-17	0	0				https://twitter.com/meremayjohn/status/16394289524
16333110186	meremayjohn	 familys experience cancer parts httpmeremayjohnblogspotcom	2010-06-16	0	0				https://twitter.com/meremayjohn/status/16333110186
16283311628	CDoggity	 fuck d cant end episode plane crash main character revealing cancer 	2010-06-16	0	0				https://twitter.com/CDoggity/status/16283311628
16199629915	DsAngelBaby	 smith coming back town always chosen sex babies thats apparently got cancer samantha jones satc 	2010-06-15	0	0		#SATC		https://twitter.com/DsAngelBaby/status/16199629915
15990314423	84112	 colon cancer alliance seminar httpbitlyct mb via httpoutsidein 	2010-06-12	0	0				https://twitter.com/84112/status/15990314423
15656849848	Tagon42	 going shave head childrens cancer research details come day two	2010-06-07	0	0				https://twitter.com/Tagon42/status/15656849848
14927759797	Plaid_Guitar	 tsunderesaurus one friends died cancer its horrible	2010-05-28	0	0	@tsunderesaurus			https://twitter.com/Plaid_Guitar/status/14927759797
14866786798	cpetteys7	 rt usspeedskating help eochowicz s cousin david bone marrow cancer please rt httpowly qtfw	2010-05-27	0	0	@USSpeedskating @Eochowicz			https://twitter.com/cpetteys7/status/14866786798
14812544059	carty64	 cancer talk tonight fam hate its real glad were hiding fuckcancer	2010-05-27	0	0		#fuckcancer		https://twitter.com/carty64/status/14812544059
14512949954	debi9kids	 rt corradettitwins finished picking strawberries benifit pediatric cancer memory sweet tuesday how awesome d	2010-05-22	0	0	@corradettitwins			https://twitter.com/debi9kids/status/14512949954
14399706789	jesdarbonne	 shaunda american cancer society relay life httptwitpiccom pjj 	2010-05-20	0	0				https://twitter.com/jesdarbonne/status/14399706789
14340254421	rchatterton	 also check this cancer cured httpwwwtedcomtalkswilliam_lihtml	2010-05-20	0	0				https://twitter.com/rchatterton/status/14340254421
14020699151	Kaango	 yard sale proceeds donated american cancer society httputahkaangocomfeviewad saltlakecity mediaoneofutah ads	2010-05-15	0	0		#SaltLakeCity #MediaOneofUtah #ads		https://twitter.com/Kaango/status/14020699151
13938481831	donboling	 drug companies suck cheap cancer drug finally tested humans httpbitlydcvp livestrong cancersucks	2010-05-13	0	0		#livestrong #cancersucks		https://twitter.com/donboling/status/13938481831
13797952397	sobbinginthebar	 litaford true mom surgery breast cancer last night gets icu normal room see rock	2010-05-11	0	0	@litaford			https://twitter.com/sobbinginthebar/status/13797952397
13772106584	carty64	 dancin the s cancer spread lungs liver	2010-05-11	0	0	@Dancin2the80s			https://twitter.com/carty64/status/13772106584
13618480477	DaSeinSteve	 killed k beat cancer race course philosoraptors	2010-05-08	0	0		#philosoraptors		https://twitter.com/DaSeinSteve/status/13618480477
13473657486	84101	 complete transcript utah cancer specialists chat httpbitly t mbe via httpoutsidein 	2010-05-06	0	0				https://twitter.com/84101/status/13473657486
13473342148	84106	 complete transcript utah cancer specialists chat httpbitlyauezbu via httpoutsidein 	2010-05-06	0	0				https://twitter.com/84106/status/13473342148
13470053618	84107	 complete transcript utah cancer specialists chat httpbitly uoiua via httpoutsidein 	2010-05-06	0	0				https://twitter.com/84107/status/13470053618
13374572705	TysonQuick	 help cure cancer ibms cloud computing project add computer team jounce cloud httprtnumlvcn khz	2010-05-04	0	0				https://twitter.com/TysonQuick/status/13374572705
13113023542	Kaango	 girls clubhouse cancer boutique httpprovokaangocomfeviewad americanfork dailyheraldutahvalley ads boutiques	2010-04-30	0	0		#AmericanFork #DailyHeraldUtahValley #ads #Boutiques		https://twitter.com/Kaango/status/13113023542
13031503317	MySoCalledChaos	 rfhkerry face cancer kidding again 	2010-04-28	0	0	@RFHKerry			https://twitter.com/MySoCalledChaos/status/13031503317
12711214222	utahbikelaw	 report wellpoint targets breast cancer patients cancellation httpbitlybvjzcf	2010-04-23	0	0				https://twitter.com/utahbikelaw/status/12711214222
12668413396	consultweet	 attended great b b expo today layton davis convention center great event met dave thompson davis hospital cancer treatment	2010-04-22	0	0				https://twitter.com/consultweet/status/12668413396
12586844033	84112	 mollydrive flogging cancer httpbitlycoz xd via httpoutsidein html	2010-04-21	0	0				https://twitter.com/84112/status/12586844033
12586843450	84108	 mollydrive flogging cancer httpbitlybns j via httpoutsidein html	2010-04-21	0	0				https://twitter.com/84108/status/12586843450
12502133177	Tagon42	 last tweet characters number makes everyone think thingthe astrological sign cancer good night everyone	2010-04-20	0	0				https://twitter.com/Tagon42/status/12502133177
12183077330	yocline	 rt draupp one would think curing cancer lets settle down internet someone grab beer holy hell ditto	2010-04-14	0	0	@draupp			https://twitter.com/yocline/status/12183077330
11811417929	Kaango	 garage sale raise funds cancer research httputahkaangocomfeviewad clearfield mediaoneofutah ads yardgaragesales	2010-04-08	0	0		#Clearfield #MediaOneofUtah #ads #YardGarageSales		https://twitter.com/Kaango/status/11811417929
11781136222	lifeinthekey	 heavy heart one best human beings ive ever met passed away hate cancer	2010-04-07	0	0				https://twitter.com/lifeinthekey/status/11781136222
11730634943	DsAngelBaby	 wtfsexfacts cell phones wont dont cause cancer wont ever believe it	2010-04-06	0	0	@WTFSexFacts			https://twitter.com/DsAngelBaby/status/11730634943
11707304984	DsAngelBaby	 fucking stupid rt fox now breast cancer breast cancer linked cell phones httpbitlyc qtts wtfsexfacts wtfsexfacts	2010-04-06	0	0	@fox13now @WTFSexFacts	#WTFSexFacts		https://twitter.com/DsAngelBaby/status/11707304984
11294013254	84112	 myriad u lose ruling breast cancer gene patents business news httpbitlycq fik via httpoutsidein 	2010-03-30	0	0				https://twitter.com/84112/status/11294013254
11294013218	84108	 myriad u lose ruling breast cancer gene patents business news httpbitlycfjkbw via httpoutsidein 	2010-03-30	0	0				https://twitter.com/84108/status/11294013218
11240144973	84112	 seminar held provide grief support cancer patients kstu news httpbitlyatk og via httpoutsidein 	2010-03-29	0	0				https://twitter.com/84112/status/11240144973
11240144924	84108	 seminar held provide grief support cancer patients kstu news httpbitlycnwao via httpoutsidein 	2010-03-29	0	0				https://twitter.com/84108/status/11240144924
10886993567	AshleysGotAGun	 paying tanning going suck im bummed tan gym beds burning rays skin cancer oh well	2010-03-22	0	0				https://twitter.com/AshleysGotAGun/status/10886993567
25195402925	84325	 exkiss drummer raising money cancer research httpbitlydwjih via httpoutsidein 	2010-09-22	0	0				https://twitter.com/84325/status/25195402925
24920855305	84335	 exkiss drummer raising money cancer research httpbitly jufk via httpoutsidein 	2010-09-19	0	0				https://twitter.com/84335/status/24920855305
16936788699	USU_UICC	 american cancer society relay life cache county httpbitlycypxej via addthis	2010-06-24	0	0	@addthis			https://twitter.com/USU_UICC/status/16936788699
16865055437	USU_UICC	 relayforlife bakesale going today am pm tscfountain come help stop cancer donations today	2010-06-23	0	0		#RelayForLife #BakeSale #TSCFountain		https://twitter.com/USU_UICC/status/16865055437
13866371182	USU_UICC	 american cancer society relay life cache county httpbitlycsvq w via addthis	2010-05-12	0	0	@addthis			https://twitter.com/USU_UICC/status/13866371182
14991605791	iamslack	 park w fam petitioning sun cancer fb	2010-05-29	0	0		#fb		https://twitter.com/iamslack/status/14991605791
13959487652	k_munnyyy	 cervical cancer ads depress heck me ive literally seen like last hour hulu	2010-05-14	0	0				https://twitter.com/k_munnyyy/status/13959487652
12786203800	Craig_SomeGuy	 im glad kfc decided fight breast cancer power obesity	2010-04-24	0	0				https://twitter.com/Craig_SomeGuy/status/12786203800
24920855305	84335	 exkiss drummer raising money cancer research httpbitly jufk via httpoutsidein 	2010-09-19	0	0				https://twitter.com/84335/status/24920855305
5592014204698624	topix_ut	 benefit organized veteran battling cancer httpbitlycxf r tremonton utah	2010-11-19	0	0		#Tremonton #Utah		https://twitter.com/topix_ut/status/5592014204698624
5264578065731585	danallen46	 heydan great news glad hear cancer free	2010-11-18	0	0	@heydan			https://twitter.com/danallen46/status/5264578065731585
23156819761	jasonwattVO	 part past present family friends battling cancer httpsu cstandup cancerorg	2010-09-06	0	0				https://twitter.com/jasonwattVO/status/23156819761
18183650611	IanJames_H	 fuzzylumkins haha think prostate cancer	2010-07-10	0	0	@FuzzyLumkins			https://twitter.com/IanJames_H/status/18183650611
