id	Username	Text	Date	Retweets	Favorites	Mentions	Hashtags	Geo	Permalink
508449677143195648	elenaaabeee	 msuconfess im diabetic boyfriend ruins dinner plans ill refuse eat crash wintershymnal 	2014-09-06	0	0	@MSUconfess @WintersHymnal			https://twitter.com/elenaaabeee/status/508449677143195648
502204665501851650	crunchatimesme	 wish could eat cannoli like normal person without slipping diabetic coma literally diabeticprobssplenda lyfe	2014-08-20	0	0		#diabeticprobs #splenda4lyfe		https://twitter.com/crunchatimesme/status/502204665501851650
480776635390517248	vmdecosmo	 hi id like large iced diabetic coma dunkinprobs	2014-06-22	0	4		#DunkinProbs		https://twitter.com/vmdecosmo/status/480776635390517248
479854820007088128	KKoz03	 mareupiper_ it anemia treatments caused become diabetic again dont want insulin	2014-06-20	0	0	@mareupiper_17			https://twitter.com/KKoz03/status/479854820007088128
458967434679304194	thisunainttaken	 hes fucking professor im sweating like diabetic cheesecake factory daymade newphrasegained	2014-04-23	0	0		#DayMade #NewPhraseGained		https://twitter.com/thisunainttaken/status/458967434679304194
442808131312431104	mandiiannz	 swear mom stays going hospital diabetic sister 	2014-03-09	0	0				https://twitter.com/mandiiannz/status/442808131312431104
440678294389030912	crunchatimesme	 cfoxxyy adorablewords okay pick diabetic	2014-03-03	0	0	@cfoxxyy @AdorableWords			https://twitter.com/crunchatimesme/status/440678294389030912
439452719502602240	__gyvl	 bitch told im borderline diabetic bish whet	2014-02-28	0	0				https://twitter.com/__gyvl/status/439452719502602240
439110479450214400	knockXdown	 guy work diabetic eats mcdonalds everyday tells vegetarian unhealthy ok guy	2014-02-27	0	9				https://twitter.com/knockXdown/status/439110479450214400
426578086315192320	crunchatimesme	 know diabetic crave juice water every minute day	2014-01-23	0	2				https://twitter.com/crunchatimesme/status/426578086315192320
424982742267592704	Buff_Bunnie	 timdrummondcom eatinghealthy plus im type diabetic gotta watch levels carb intake	2014-01-19	0	0	@TimDrummondCom	#eatinghealthy		https://twitter.com/Buff_Bunnie/status/424982742267592704
421100365590048768	huntersalem18	 diabeticben diabetic wrestler earth nicepin clutch	2014-01-08	0	2	@diabeticBEN	#nicepin #clutch		https://twitter.com/huntersalem18/status/421100365590048768
546330872497311745	alexambrosino	 look guy he diabetic im sorry what	2014-12-20	1	10				https://twitter.com/alexambrosino/status/546330872497311745
545641728917909504	SaccManJones	 stephenasmith type one diabetic years much respect bringing educated manner regarding jay cutler	2014-12-18	0	0	@stephenasmith			https://twitter.com/SaccManJones/status/545641728917909504
537640753351385088	MactheHusky	 lwhekk eats spoonfuls sugar washes soda dont tell do goes diabetic shock	2014-11-26	0	0	@lwhekk			https://twitter.com/MactheHusky/status/537640753351385088
536702217882173440	afsharindani	 baking never much sugar afra unless youre diabetic 	2014-11-23	1	5				https://twitter.com/afsharindani/status/536702217882173440
510847610643841024	ashleyyscarlett	 little known fact teddy diabetic	2014-09-13	2	6				https://twitter.com/ashleyyscarlett/status/510847610643841024
499649906341330945	P_Brooks3	 c_benny danielledimezzz hope become diabetic 	2014-08-13	0	2	@C_Benny21 @danielledimezzz			https://twitter.com/P_Brooks3/status/499649906341330945
496066294677241856	paigebaxterrr	 sometimes forget im diabetic mightwannaworkonthat	2014-08-03	0	2		#MightWannaWorkOnThat		https://twitter.com/paigebaxterrr/status/496066294677241856
490959962299191296	Ashauntix3	 tatianaamari dads go diabetic coma driving back maine stay	2014-07-20	0	0	@TatianaAmari5			https://twitter.com/Ashauntix3/status/490959962299191296
469909153595805696	lilxplum	 surprised im diabetic 	2014-05-23	0	1				https://twitter.com/lilxplum/status/469909153595805696
457975267647324160	michael_dougert	 candy lying around obrien household man swear trying make diabetic	2014-04-20	2	6				https://twitter.com/michael_dougert/status/457975267647324160
451515401412042753	mtremblay28	 nothing funnier waiter asked danbutla wanted water responded no thank im diabetic 	2014-04-02	1	7	@DanButla			https://twitter.com/mtremblay28/status/451515401412042753
445727911640059904	paigebaxterrr	 alli_micozzi youre diabetic 	2014-03-17	0	2	@Alli_Micozzi			https://twitter.com/paigebaxterrr/status/445727911640059904
440173933846085634	kate_arthur__	 doingityourseif easy delicious kit kat mnm cake httpstwittercomdoingityourseifstatus photo pictwittercomb oijqfqft diabetic coma	2014-03-02	0	1	@DoingItYourseIf			https://twitter.com/kate_arthur__/status/440173933846085634
436724504895971328	OdellLiv7434	 knowing ketone strip negative slightly trace probs annoying thing ever joy diabetic	2014-02-20	0	0				https://twitter.com/OdellLiv7434/status/436724504895971328
431274131532054528	brittnayamber97	 turned diabetic knowing nickjonas better dealing it favorite jonas brothers	2014-02-05	0	0	@nickjonas			https://twitter.com/brittnayamber97/status/431274131532054528
429261258114600961	w_pat_tc	 wo a system method quantitatively assessing diabetic cardiac autonomic g n g n http wpattcwo a 	2014-01-31	0	0		#G01N #G01N33		https://twitter.com/w_pat_tc/status/429261258114600961
423177251073433600	crunchatimesme	 love friends go bowling put name sugar since im diabetic	2014-01-14	0	4				https://twitter.com/crunchatimesme/status/423177251073433600
547937010774990848	_Fear_The_Beard	 ya know im really surprised elves arent diabetic eat candy candy canes candy corn syrup	2014-12-24	0	3				https://twitter.com/_Fear_The_Beard/status/547937010774990848
541014094669950976	almostgirll	 from_datombs aint obese dont focus type diabetic ridden walruses walk mcdonalds day instead fucker	2014-12-05	0	0	@From_DaTombs			https://twitter.com/almostgirll/status/541014094669950976
536728627623522304	JackWitty	 franginter im sweeter diabetic honey bee sugarland ummdint come right im domino sugah sweetah	2014-11-23	0	0	@franginter			https://twitter.com/JackWitty/status/536728627623522304
534349494838894592	Big_White_K	 says diabetic me damn almond joys melting pocket friend wtf really throw dont want die turd	2014-11-17	0	0				https://twitter.com/Big_White_K/status/534349494838894592
532587553581699073	RadAstronaut	 artiequitter watched special finally best yet cant wait podcast diabetic jerkoff	2014-11-12	0	0	@artiequitter			https://twitter.com/RadAstronaut/status/532587553581699073
532486164750823424	JMichaelsNews	 more mendezs family says young diabetic mothers sneakers found dumpster behind cvs eastern ave lynn ma necn live	2014-11-12	1	1	@NECN			https://twitter.com/JMichaelsNews/status/532486164750823424
532243787935125504	randomwolf70	 textfrommittens diabetic cat treatment difficult additional years worth every penny he lived 	2014-11-11	0	1	@TextFromMittens			https://twitter.com/randomwolf70/status/532243787935125504
532015289337401344	OldensPharmacy	 thxs soshore hospital diabetic wound care great educational fair saturday dedicated people improving quality life south shore	2014-11-10	0	0				https://twitter.com/OldensPharmacy/status/532015289337401344
530736381942050816	medic486	 keithwilson adding little diabetic training pictwittercomtjoqkped r	2014-11-07	0	0	@KeithWilson3			https://twitter.com/medic486/status/530736381942050816
530500348725985280	ashleyf_11	 love dad thinks tell hes following diabetic diet like im nurse teach living u aint foolin	2014-11-06	0	0				https://twitter.com/ashleyf_11/status/530500348725985280
528362950646829056	lalalalauren11	 amanda_please girl im going diabetic notmad might puke lmao	2014-10-31	0	0	@amanda_please11	#notmad		https://twitter.com/lalalalauren11/status/528362950646829056
516626445230436352	sugyrrah	 damn you diabetic nerve pain	2014-09-29	0	0				https://twitter.com/sugyrrah/status/516626445230436352
515578692748476416	OlympiaXylaige	 waruikoohii shoot stars miss youll land diabetic coma	2014-09-26	0	3	@waruikoohii			https://twitter.com/OlympiaXylaige/status/515578692748476416
515214924449316864	ABPardue	 details important misplaced decimal point kill diabetic 	2014-09-25	0	1				https://twitter.com/ABPardue/status/515214924449316864
513432691816280065	Ms_Keri	 diabetesabordo diabeticconnect diabetic supplies never denied	2014-09-20	1	3	@diabetesabordo @DiabeticConnect			https://twitter.com/Ms_Keri/status/513432691816280065
512035312579911680	WhoCaresEffU	 also pre diabetic lowest spectrum diabetes bcuz keep losing weight doc thinks reverse metformin	2014-09-16	1	0		#metformin		https://twitter.com/WhoCaresEffU/status/512035312579911680
511667114055598080	BradHound	 mu tang diabetic years 	2014-09-15	0	0	@Mu5tang64			https://twitter.com/BradHound/status/511667114055598080
509095199361216513	ClimberofRock	 apparently i need needles insulin pens translates i need syringes insulin pcp fucking diabetic bullshit	2014-09-08	0	0				https://twitter.com/ClimberofRock/status/509095199361216513
507360790287228929	SandraaKemp	 amount icelandic candy dad brought going make diabetic 	2014-09-03	0	0				https://twitter.com/SandraaKemp/status/507360790287228929
505973474792591361	annettelocked	 well thats thing now must smell like amputated diabetic toe https twittercomwsjstatus 	2014-08-31	0	0				https://twitter.com/annettelocked/status/505973474792591361
504015858369585152	sugyrrah	 diabetic one powers ability attract ants urine til	2014-08-25	0	0		#TIL		https://twitter.com/sugyrrah/status/504015858369585152
501742418015055872	crystalhaynes	 def genesio cassimiro stopping pee bushes diabetic way pharmacy meds fox 	2014-08-19	0	0		#fox25		https://twitter.com/crystalhaynes/status/501742418015055872
501313264634953729	Boston_CP	 diabetic teen kicked drivein theater diabetic teenager kicked drivein movie theater http dlvrit f kyy	2014-08-18	0	1				https://twitter.com/Boston_CP/status/501313264634953729
501147306373050369	LadyKaela_	 woman behind us date discussing diabetic cat shegoneputouttonight	2014-08-17	1	1		#shegoneputouttonight		https://twitter.com/LadyKaela_/status/501147306373050369
499520953286918144	ursonate	 owensdamien endashes im diabetic unionsqdonuts	2014-08-13	0	0	@OwensDamien @endashes @UnionSqDonuts			https://twitter.com/ursonate/status/499520953286918144
498518849059573760	lendinger	 bostoncomiccon diabetic gets dizzy front staff help directions concessions would nice notimpressed	2014-08-10	0	1	@BostonComicCon	#notimpressed		https://twitter.com/lendinger/status/498518849059573760
497871047778377728	m1cha3l65	 wrong want chocolate dinner say no remember im diabetic kinda wrong sigh	2014-08-08	0	0				https://twitter.com/m1cha3l65/status/497871047778377728
494363878521065472	kkmento123	 currently am dad took tumble cuz sugar low life diabetic	2014-07-30	0	0				https://twitter.com/kkmento123/status/494363878521065472
494199858375708672	kay_nizzzle	 abbeyottinger try diabetic hahaha	2014-07-29	0	1	@abbeyottinger			https://twitter.com/kay_nizzzle/status/494199858375708672
493083300970643457	olivejuice__	 olivia smith saving someone diabetic coma one day time	2014-07-26	0	0				https://twitter.com/olivejuice__/status/493083300970643457
491069211158917120	Escarleeta_	 im diabetic already fuck lmao	2014-07-20	0	0				https://twitter.com/Escarleeta_/status/491069211158917120
490946107909107713	m1cha3l65	 its national ice cream day wants take diabetic ice cream sundae maybe daddysdairy lizzysicecream	2014-07-20	1	1	@DaddysDairy @LizzysIceCream			https://twitter.com/m1cha3l65/status/490946107909107713
487661632537886721	brookeloch97	 chipotle run diabetic sister low blood sugar icantdeal pictwittercomkaa omgy	2014-07-11	0	19		#ICantDeal		https://twitter.com/brookeloch97/status/487661632537886721
487455704278892544	bby_phfat	 u cute boy stealing diabetic	2014-07-11	0	0				https://twitter.com/bby_phfat/status/487455704278892544
487327251382276096	Escarleeta_	 always get your fat dont know diabetic 	2014-07-10	0	0				https://twitter.com/Escarleeta_/status/487327251382276096
487054605147054081	MZiets	 good thing im watching hannibal alone victims died type diabetic coma fantastic cant wait nightmares start	2014-07-09	0	1				https://twitter.com/MZiets/status/487054605147054081
486510418958237696	SarahFoley18	 mattimrie sounds horriblein deliciously diabetic way	2014-07-08	0	0	@mattimrie			https://twitter.com/SarahFoley18/status/486510418958237696
485432955003600897	TheMaltz	 nothing like diabetic pie death saturday morning wilwproject wilw feliciaday pictwittercomdjljgfjvly	2014-07-05	0	0	@wilw @feliciaday	#wilwproject		https://twitter.com/TheMaltz/status/485432955003600897
480910278683799552	m1cha3l65	 moody diabetic reaction whatevs hate word its even word	2014-06-22	0	0		#Whatevs		https://twitter.com/m1cha3l65/status/480910278683799552
479178817018548224	izzy_hb	 idontfitz nothin like getting woken diabetic meals 	2014-06-18	0	1	@idontfitz			https://twitter.com/izzy_hb/status/479178817018548224
479035178804076544	Bookdwarf	 onpointradio its close home im healthy diabetic diagnosed major issues its harder people think	2014-06-17	0	0	@OnPointRadio			https://twitter.com/Bookdwarf/status/479035178804076544
478757579179687936	_KarlaMarina	 loves left diabetic cant sweet you	2014-06-17	0	0				https://twitter.com/_KarlaMarina/status/478757579179687936
478724713695285249	LindaFaria2	 brunomars next year junior type one diabetic would like come prom	2014-06-16	0	2	@BrunoMars			https://twitter.com/LindaFaria2/status/478724713695285249
478303722452156417	MonNi_QT	 sometimes really wanna impress guy look jokes online harry potter hookup lines diabetic pick lines jenmwall 	2014-06-15	0	0	@Jenmwall92			https://twitter.com/MonNi_QT/status/478303722452156417
475239422171303937	Indovascular	 superb contribution jmills tucson arizona understanding diabetic foot via wifi classification vascularhealth svsvam	2014-06-07	2	2	@jmills1955 @VascularHealth	#SVSVAM		https://twitter.com/Indovascular/status/475239422171303937
474280833516576768	courtney_rose_	 go one fucking seminar god dam diabetic retinopathy im going front everyone	2014-06-04	0	1				https://twitter.com/courtney_rose_/status/474280833516576768
468951984599728128	Leticiaaaa_x	 mesmer_eyes_ real get customer wants shot french vanilla extra cream sweetlow like bitch still gon diabetic	2014-05-20	0	0	@Mesmer_EYES_			https://twitter.com/Leticiaaaa_x/status/468951984599728128
468933504135598082	twittarelli	 im diabetic im person diabetes im going let define	2014-05-20	0	1				https://twitter.com/twittarelli/status/468933504135598082
468184738516041728	alyssa_therrien	 chelssaay same swear im diabetic	2014-05-18	0	0	@chelssaay10			https://twitter.com/alyssa_therrien/status/468184738516041728
466198431401512960	angiefrissore	 know muffin man muffin man know muffin man died going diabetic shock ruinanurseryrhyme	2014-05-13	15	37		#RuinANurseryRhyme		https://twitter.com/angiefrissore/status/466198431401512960
464848683788693505	BradHound	 waiting doctors app diabetic discussion harvard vanguard medical associates kenmore http sqcom jiuex 	2014-05-09	0	0	@Harvard			https://twitter.com/BradHound/status/464848683788693505
463639754962370560	samaintyagirl	 stinnaawhite im english please im diabetic	2014-05-06	1	1	@stinnaawhite			https://twitter.com/samaintyagirl/status/463639754962370560
460872015675940864	DemiAntoine	 type one diabetic autistic ptsd young woman fake ass piece shit someone always helped everyone	2014-04-28	0	0				https://twitter.com/DemiAntoine/status/460872015675940864
458445170720378880	MikaylaHodgdon	 wise words anna sessa im drinking lot water think im becoming diabetic lol what annasessa 	2014-04-21	1	2	@AnnaSessa96			https://twitter.com/MikaylaHodgdon/status/458445170720378880
457897781123108864	mcmurphy14	 akellerman needs diabetic get high everyday high blood sugar feeling beyond accurate	2014-04-20	0	1	@akellerman03			https://twitter.com/mcmurphy14/status/457897781123108864
456931589281562624	couto_stephanie	 vanessavalliere cant make im going alexs parents house dad diabetic too sweet	2014-04-17	0	0	@vanessavalliere			https://twitter.com/couto_stephanie/status/456931589281562624
456822099001499648	twittarelli	 beccabamford hahahaha youre better diabetic am	2014-04-17	0	1	@BeccaBamford			https://twitter.com/twittarelli/status/456822099001499648
455934385477652481	VoicelikeNOther	 sherrieshepherd loving book im hard headed diabetic years book beside god wake call tu	2014-04-15	0	0	@SherriEShepherd			https://twitter.com/VoicelikeNOther/status/455934385477652481
455340386983358464	kaw3589	 thank for diabetic coma easter bunny dunks pinkandgreen peeps back bay mbta station http instagramcompmu swbqvln	2014-04-13	0	0	@Back	#dunks #pinkandgreen #peeps		https://twitter.com/kaw3589/status/455340386983358464
454238097782607872	swimdragontaiji	 taichiexaminer explain health record best tai chi masters yang cheng fu tung hu ling diabetic	2014-04-10	0	0	@Taichiexaminer	#health		https://twitter.com/swimdragontaiji/status/454238097782607872
454092073181130752	susannxo	 mackkburke get shower without falling real question diabetic never falls really diabetic 	2014-04-09	0	1	@MackkBurke			https://twitter.com/susannxo/status/454092073181130752
452656291941740544	RegularMarco	 ive eaten like lb diabetic weekend	2014-04-05	0	1				https://twitter.com/RegularMarco/status/452656291941740544
451834005005299713	maaaryfox	 mom really say dog likes diabetic balls	2014-04-03	0	0				https://twitter.com/maaaryfox/status/451834005005299713
451740807478145024	violacity	 cute diabetic boy waiting room complaining getting blood taken lifts gym tonight diabeticflirting	2014-04-03	0	0		#diabeticflirting		https://twitter.com/violacity/status/451740807478145024
451222438744166400	twittarelli	 ive bad diabetic lately	2014-04-02	0	0				https://twitter.com/twittarelli/status/451222438744166400
448562928254742528	DJFratNip	 jackieeesoucy youre diabetic	2014-03-25	0	4	@JackieeeSoucy			https://twitter.com/DJFratNip/status/448562928254742528
448455700839403520	violacity	 saw someone testing blood sugar got excited realized diabetes clinic waiting room everyone diabetic	2014-03-25	0	0				https://twitter.com/violacity/status/448455700839403520
446088187702951936	mmbagelz	 a check sugar carb counts diabetic foodchat	2014-03-18	0	0		#FoodChat		https://twitter.com/mmbagelz/status/446088187702951936
442036397978185728	gschallmo8	 sithlord_ozai eyes sparkle like diabetic frog named giuseppe gschallmo awh	2014-03-07	0	1	@SITHLORD_OZAI @gschallmo8			https://twitter.com/gschallmo8/status/442036397978185728
441053086845775872	MakkBurke	 leticeex x mackkburke love u ur fav diabetic super duper healthy tha diabetic soul pictwittercomx eatgndco	2014-03-04	0	1	@leticeex0x @MackkBurke			https://twitter.com/MakkBurke/status/441053086845775872
440694782940426240	MakkBurke	 tbh huge diabetic gap	2014-03-03	0	8				https://twitter.com/MakkBurke/status/440694782940426240
438809071228289024	caffeinehusky	 looking food diabetic cat unleashed petco http sqcommvadyx	2014-02-26	0	0	@Unleashed			https://twitter.com/caffeinehusky/status/438809071228289024
438543400535859200	mollyadaaa	 yourfoodporn b_adamopoulos youre diabetic plate could kill u chill	2014-02-26	1	0	@YourFoodPorn @B_Adamopoulos	#chill		https://twitter.com/mollyadaaa/status/438543400535859200
435089139940462592	caffeinehusky	 prescription card goldie diabetic cat catrescue banfield pet hospital http sqcom gprrif	2014-02-16	0	0	@Banfield	#catrescue		https://twitter.com/caffeinehusky/status/435089139940462592
435087086929338368	caffeinehusky	 cat food diabetic cat at petsmart http sqcom b tshc	2014-02-16	0	0	@PetSmart			https://twitter.com/caffeinehusky/status/435087086929338368
434828516971278336	caffeinehusky	 prescription pet food diabetic cat unleashed petco http sqcom b m o 	2014-02-15	0	0	@Unleashed			https://twitter.com/caffeinehusky/status/434828516971278336
434160476403273728	dazedjack	 think mom tried kill diabetic needle thing even though dont diabetes asianmoms scary diabetes	2014-02-13	0	0		#asianmoms #scary #diabetes		https://twitter.com/dazedjack/status/434160476403273728
434001331200618496	DoverQuick	 wish diabetic would make suicide much easier	2014-02-13	0	1				https://twitter.com/DoverQuick/status/434001331200618496
433270498517323777	Jes2626	 josilin diabetic center	2014-02-11	0	0	@Josilin			https://twitter.com/Jes2626/status/433270498517323777
431387809409417216	sunflwer1975	 negirlprobz thats brothers except shes type diabetic doesnt take care drugs	2014-02-06	0	0	@NEGirlprobz			https://twitter.com/sunflwer1975/status/431387809409417216
431094771009200128	HartelRyan	 im surprised im fat diabetic way eat really blows mind	2014-02-05	0	0				https://twitter.com/HartelRyan/status/431094771009200128
431021374669197312	IvoryStandard	 nursing jobs diabetic case manager rn home health works supervision doocm and http ivorystandardcomjobadaspxpos tingid 	2014-02-05	0	0		#nursing #jobs		https://twitter.com/IvoryStandard/status/431021374669197312
429154595881754624	w_pat_tc	 wo a predicting treating diabetic complications a k a k http wpattcwo a pictwittercomy jb n nsh	2014-01-31	0	0		#A61K #A61K48		https://twitter.com/w_pat_tc/status/429154595881754624
428975450480996352	m1cha3l65	 want chocolate bad bad diabetic 	2014-01-30	0	0				https://twitter.com/m1cha3l65/status/428975450480996352
428025585886326785	MakkBurke	 im young female diabetic adolescent loves long walks beach picking used needles find along shore	2014-01-27	0	7				https://twitter.com/MakkBurke/status/428025585886326785
426694962936578048	SickStory_	 joetosone itsbriibitch yummyfooodporn going diabetic shock right speak homie bigboys	2014-01-24	0	1	@joetosone @ItsBriiBitch @YummyFooodPorn	#bigboys		https://twitter.com/SickStory_/status/426694962936578048
421653535433170944	sunflwer1975	 stucknewengland politibunny colleencpa future diabetic	2014-01-10	0	0	@StuckNewEngland @PolitiBunny @colleencpa			https://twitter.com/sunflwer1975/status/421653535433170944
514521588449177600	Darkparadise51	 diabetic comma	2014-09-23	0	0				https://twitter.com/Darkparadise51/status/514521588449177600
500476768529432576	katie_6943	 kassy_lovatic obsessed fat diabetic candy store love know	2014-08-15	0	0	@kassy_lovatic			https://twitter.com/katie_6943/status/500476768529432576
494501550346104832	kay_nizzzle	 see one person complain shots timeline the diabetic	2014-07-30	0	0				https://twitter.com/kay_nizzzle/status/494501550346104832
492128254594007040	robbiez	 theprophetlen theryancon poopledrank realize diabetic right	2014-07-23	0	0	@TheProphetLen @TheRyanCon @poopledrank			https://twitter.com/robbiez/status/492128254594007040
487453700554637312	dkhalil13	 bartolo colon diabetic	2014-07-11	0	0				https://twitter.com/dkhalil13/status/487453700554637312
484538048659464193	johnhazellnut	 ap ap diabetic passionate wiffleballplayer thank you	2014-07-02	0	0	@28ap28ap	#wiffleballplayer		https://twitter.com/johnhazellnut/status/484538048659464193
483113644071202816	Respect__Bacon	 whats worse diabetic lefty diabetic lefty thats color blind boomtherealtruck willgordonagain glantonspat	2014-06-29	0	0	@TheRealTruck @WillGordonAgain @glantonspat			https://twitter.com/Respect__Bacon/status/483113644071202816
473616686827204608	treetrunnk	 shout favorite diabetic ever face planet youre gonna kill	2014-06-02	2	1				https://twitter.com/treetrunnk/status/473616686827204608
460476115497517056	RickyJackson4L	 wait turks diabetic	2014-04-27	0	0				https://twitter.com/RickyJackson4L/status/460476115497517056
549313360387637249	colleenw	 thank ninetynine letting sad diabetic take pit stop	2014-12-28	0	1		#ninetynine		https://twitter.com/colleenw/status/549313360387637249
470170042093424640	ktymomo	 diabetic patients think cbg low even tho tell its wnl theres ur problem diabetus nurse_problems	2014-05-24	0	1	@Nurse_Problems	#diabetus		https://twitter.com/ktymomo/status/470170042093424640
514935026908409856	TheCatcher29	 im type one diabetic refer type one diabadass	2014-09-24	0	0				https://twitter.com/TheCatcher29/status/514935026908409856
468603664769105922	erikvieira93	 mirandalexander pa caralho im trying diabetic age lol ill swing sometime bro	2014-05-20	0	0	@Mirandalexander			https://twitter.com/erikvieira93/status/468603664769105922
530736381942050816	medic486	 keithwilson adding little diabetic training pictwittercomtjoqkped r	2014-11-07	0	0	@KeithWilson3			https://twitter.com/medic486/status/530736381942050816
496661922427969536	matt_larosa	 dunkies employee advertising new french vanilla swirl would like try it youre diabetic you	2014-08-05	0	2				https://twitter.com/matt_larosa/status/496661922427969536
483113644071202816	Respect__Bacon	 whats worse diabetic lefty diabetic lefty thats color blind boomtherealtruck willgordonagain glantonspat	2014-06-29	0	0	@TheRealTruck @WillGordonAgain @glantonspat			https://twitter.com/Respect__Bacon/status/483113644071202816
426694962936578048	SickStory_	 joetosone itsbriibitch yummyfooodporn going diabetic shock right speak homie bigboys	2014-01-24	0	1	@joetosone @ItsBriiBitch @YummyFooodPorn	#bigboys		https://twitter.com/SickStory_/status/426694962936578048
423595692356304896	Ali_Crawf0rd	 grampy asking bring peaceful meadows frappe hospital youre diabetic grampy maybe carrots	2014-01-15	0	2				https://twitter.com/Ali_Crawf0rd/status/423595692356304896
421812501454807040	AndrewM4399	 badnewsbenson mbiz kid going diabetic shock clowns thought hilarious	2014-01-10	0	0	@BADnewsbenson1 @mbiz10			https://twitter.com/AndrewM4399/status/421812501454807040
526447988865249280	agroh23	 guy behind continues insist cutler diabetic	2014-10-26	0	1				https://twitter.com/agroh23/status/526447988865249280
