id	Username	Text	Date	Retweets	Favorites	Mentions	Hashtags	Geo	Permalink
523677261137199105	ally_laska	 desijedeikin diabetic gluten intolerant vegan sober would fucking skinny	2014-10-18	0	1	@DesiJedeikin			https://twitter.com/ally_laska/status/523677261137199105
515523745986117633	Lizerator56	 goldbearex misschloethepug phibotticelli jack presidente dogrina martha_cavalier willowmena fine labs mite b diabetic	2014-09-26	0	0	@goldbearex @MissChloethePug @3phibotticelli @Jack4Presidente @dogrina2 @Martha_Cavalier @willowmena1			https://twitter.com/Lizerator56/status/515523745986117633
512737735568670720	Joey_Olsen99	 kildufftommy pathetic diabetic	2014-09-18	0	1	@KilduffTommy			https://twitter.com/Joey_Olsen99/status/512737735568670720
496053755868372992	ShanarchyM	 impscorner making stories diabetic dog get needles whatev	2014-08-03	0	0	@ImpsCorner			https://twitter.com/ShanarchyM/status/496053755868372992
490486833302626304	yahhurdmay13	 sierra_anne hello im diabetic pump career made difficult accepted great job btw pump r u	2014-07-19	0	1	@sierra_anne93			https://twitter.com/yahhurdmay13/status/490486833302626304
489492359970037761	burkefest	 candy outlet sisters im diabetic help candyworld n mor http instagramcompqhhn wiefr	2014-07-16	0	1	@Candyworld			https://twitter.com/burkefest/status/489492359970037761
474280833516576768	courtney_rose_	 go one fucking seminar god dam diabetic retinopathy im going front everyone	2014-06-04	0	1				https://twitter.com/courtney_rose_/status/474280833516576768
442036397978185728	gschallmo8	 sithlord_ozai eyes sparkle like diabetic frog named giuseppe gschallmo awh	2014-03-07	0	1	@SITHLORD_OZAI @gschallmo8			https://twitter.com/gschallmo8/status/442036397978185728
428975450480996352	m1cha3l65	 want chocolate bad bad diabetic 	2014-01-30	0	0				https://twitter.com/m1cha3l65/status/428975450480996352
425484856030932993	iratebostonian	 kids today snorting smarties sugar high please eat ittastes better get high pass out im also diabetic 	2014-01-20	1	4				https://twitter.com/iratebostonian/status/425484856030932993
528223407532703744	THEOGLOUGHMAN	 ive diabetic whole decade today time flies	2014-10-31	0	1				https://twitter.com/THEOGLOUGHMAN/status/528223407532703744
511309846713737216	ThaHalfMamba	 jay cutler diabetic warrior	2014-09-14	0	0				https://twitter.com/ThaHalfMamba/status/511309846713737216
456543577581973504	ashleyD1205	 diabetic type hangry	2014-04-16	0	0				https://twitter.com/ashleyD1205/status/456543577581973504
511677303659954176	_adoylee	 moment accidentally ask diabetic friend doesnt eat sugar keeney oops mybad	2014-09-15	0	1	@keeney713	#oops #mybad		https://twitter.com/_adoylee/status/511677303659954176
