id	Username	Text	Date	Retweets	Favorites	Mentions	Hashtags	Geo	Permalink
4943729500622848	kramerbpm	 wtf ronnybennington im diabetic great drinker bullshit friends	2010-11-17	0	0	@Ronnybennington @202friends			https://twitter.com/kramerbpm/status/4943729500622848
27741683378	LuiThe6th	 hate coffee diuretic feel like diabetic much im going bathroom	2010-10-18	0	0				https://twitter.com/LuiThe6th/status/27741683378
11992770768	Kaango	 free diabetic supplies free glucose meter free watch httpknkaangocomfeviewad washington kaangonews ads	2010-04-11	0	0		#Washington #KaangoNews #ads		https://twitter.com/Kaango/status/11992770768
20160336766173184	sallycade	 stevenmanuel never catch hypodermic needles lancets insulin variety potentially dangerous diabetic things	2010-12-29	0	0	@stevenmanuel			https://twitter.com/sallycade/status/20160336766173184
11992770768	Kaango	 free diabetic supplies free glucose meter free watch httpknkaangocomfeviewad washington kaangonews ads	2010-04-11	0	0		#Washington #KaangoNews #ads		https://twitter.com/Kaango/status/11992770768
20160336766173184	sallycade	 stevenmanuel never catch hypodermic needles lancets insulin variety potentially dangerous diabetic things	2010-12-29	0	0	@stevenmanuel			https://twitter.com/sallycade/status/20160336766173184
