id	Username	Text	Date	Retweets	Favorites	Mentions	Hashtags	Geo	Permalink
26214988621	concretewaffer	 ive obviously overly excited local used bookstores sales diabetic love diabetic cookbooks	2010-10-02	0	0				https://twitter.com/concretewaffer/status/26214988621
12134663181	84112	 ways stay involved diabetic teen ways stay involved diabetic teen httpbitlyd sszj via html	2010-04-13	0	0				https://twitter.com/84112/status/12134663181
12134663131	84108	 ways stay involved diabetic teen ways stay involved diabetic teen httpbitlyacfouy via html	2010-04-13	0	0				https://twitter.com/84108/status/12134663131
11900859281	84108	 diabetic teens listen diabetic teens listen httpbitlya wbgn via html	2010-04-09	0	0				https://twitter.com/84108/status/11900859281
11881363544	84112	 diabetic teens listen diabetic teens listen httpbitlybpt bg via html	2010-04-09	0	0				https://twitter.com/84112/status/11881363544
