id	Username	Text	Date	Retweets	Favorites	Mentions	Hashtags	Geo	Permalink
2333495259041792	Karen_Yazzie	 read article dogs detect low blood sugar levels owners diabetic sisters dog wilber diabetes	2010-11-10	0	0		#diabetes		https://twitter.com/Karen_Yazzie/status/2333495259041792
29100943624	weeklyalibi	 weeks arts lit hidef hitchcock kids theater sans diabetic coma french kiss death httpalibicomtinyurl 	2010-10-29	0	0		#Arts		https://twitter.com/weeklyalibi/status/29100943624
23861924986	MoshPitMike	 rt guz fnoutrage this food birthday diabetic here	2010-09-07	0	0	@Guz500 @FnOutrage			https://twitter.com/MoshPitMike/status/23861924986
10959891888	byeazell	 woot mom got latest blood tests back shes norm diabetic still needs keep meds diet norm	2010-03-23	0	0				https://twitter.com/byeazell/status/10959891888
12979101656	srodrigueziii	 sure new motto baskinrobbins inducing diabetic comas since baskin robbins http sqcombuonlu	2010-04-27	0	0	@Baskin			https://twitter.com/srodrigueziii/status/12979101656
