id	Username	Text	Date	Retweets	Favorites	Mentions	Hashtags	Geo	Permalink
20203720205668352	topix_in	 diabetes group discuss weight loss httpbitlyhznubc elkhart indiana	2010-12-29	0	0		#Elkhart #Indiana		https://twitter.com/topix_in/status/20203720205668352
15107903312625664	matttebbe	 bobhyatt kinnon geoffholsclaw fitchest toddhiestand ill go watch fitch hyatt kinnonfitch might uncure diabetes	2010-12-15	0	0	@bobhyatt @kinnon @geoffholsclaw @fitchest @toddhiestand			https://twitter.com/matttebbe/status/15107903312625664
2283137136594944	46514	 healthy diet topic diabetes talk httpbitlydlxirk via httpoutsidein 	2010-11-10	0	0				https://twitter.com/46514/status/2283137136594944
29499979594	SteveeRTinder	 nickjonas found diabetes listened ur song am thankyou inspiration many young ppl urock	2010-11-02	0	0	@nickjonas	#thankyou #URocK		https://twitter.com/SteveeRTinder/status/29499979594
24145800772	Omejikat	 angeliic_hheart botiser oku twp giving diabetes 	2010-09-10	0	0	@aNgeliiC_Hheart @Botiser			https://twitter.com/Omejikat/status/24145800772
19771055234	FattyMcTubkins	 herpes cops go together like donuts diabetes 	2010-07-28	0	0				https://twitter.com/FattyMcTubkins/status/19771055234
15293800246	AustinHostetter	 liberty medical fanatic wilford brimley spotted nappanee dq mmmmm diabetes 	2010-06-02	0	0				https://twitter.com/AustinHostetter/status/15293800246
14606752761	TwiztedVoicez	 bretmichaels congrats win also lost dad diabetes years back think its fantastic ur working help kids	2010-05-24	0	0	@bretmichaels			https://twitter.com/TwiztedVoicez/status/14606752761
11418827759	46517	 health digest diabetes group meet thursday etruthcom life httpbitlycfr kf via httpoutsidein 	2010-04-01	0	0				https://twitter.com/46517/status/11418827759
10519575298	PastorScott	 friend jd told me i got second hand diabetes candy cigarettes lol classic	2010-03-15	0	0				https://twitter.com/PastorScott/status/10519575298
19548562169798656	BustaBusta	 xxemochanxx yeahi get dizzy work busy diabetes anxiety meds	2010-12-27	0	0	@xxemochanxx			https://twitter.com/BustaBusta/status/19548562169798656
19515651727036417	BustaBusta	 really hate diabetes 	2010-12-27	0	0				https://twitter.com/BustaBusta/status/19515651727036417
17694503179657216	iamnot2ndclass	 never ever buying diabetes supplies american diabetes wholesale again charged bank account twice order call bs	2010-12-22	0	0				https://twitter.com/iamnot2ndclass/status/17694503179657216
15472754987892736	BillSanders1	 im diabetes endocrinology consultants clearvista place indianapolis http sqcomextfzi	2010-12-16	0	0				https://twitter.com/BillSanders1/status/15472754987892736
13651911269949440	iamnot2ndclass	 take care you get tested diabetes stds sleep apnea regularly friends family love st	2010-12-11	0	0				https://twitter.com/iamnot2ndclass/status/13651911269949440
13307897664503808	dsimpso1	 babysitting indiana clinic diabetes endocrinology http sqcomd knoa	2010-12-10	0	0	@Indiana			https://twitter.com/dsimpso1/status/13307897664503808
12977074046238720	kimkwoods	 hey guys got referral noblesville diabetes endocrinology http sqcomfl q q	2010-12-09	0	0	@Noblesville			https://twitter.com/kimkwoods/status/12977074046238720
12878099720966145	iamnot2ndclass	 dr office diabetes check up	2010-12-09	0	0				https://twitter.com/iamnot2ndclass/status/12878099720966145
11797400679096321	Meghan_Clare	 us spends gdp healthcare next france yet highest life explowest infant mortor lowest diabetes rate	2010-12-06	0	0				https://twitter.com/Meghan_Clare/status/11797400679096321
7827086718799872	bramrod	 diabetes thankful thanksgiving fb	2010-11-25	0	0		#fb		https://twitter.com/bramrod/status/7827086718799872
1763306180182016	earlqhan	 give diabetes posthalloween discounted candy	2010-11-08	0	0				https://twitter.com/earlqhan/status/1763306180182016
671938028503040	topix_in	 diabetes jpg httpbitlyadl r greensburg indiana	2010-11-05	0	0		#Greensburg #Indiana		https://twitter.com/topix_in/status/671938028503040
27890840840	Fabulously_40	 tomorrow appointment diabetes team	2010-10-19	0	0				https://twitter.com/Fabulously_40/status/27890840840
26842900185	AdamEvans	 walk cure diabetes iupui campus center http sqcom gnqfu	2010-10-09	0	0	@IUPUI			https://twitter.com/AdamEvans/status/26842900185
26458702699	mymanjoe	 dropped photos step indy american diabetes association http sqcomdsk df	2010-10-05	0	0	@American			https://twitter.com/mymanjoe/status/26458702699
26272789960	mymanjoe	 step walk fight diabetes iupui httpyfrogcomb bwxj indy	2010-10-03	0	0	@IUPUI	#Indy		https://twitter.com/mymanjoe/status/26272789960
24829365268	47362	 dining diabetes series planned httpbitlya c u via httpoutsidein 	2010-09-18	0	0				https://twitter.com/47362/status/24829365268
24397363455	jeff_chaney	 im st francis diabetes center	2010-09-13	0	0				https://twitter.com/jeff_chaney/status/24397363455
23026279199	lorieali23	 entertainment weekly reviewed going distance a light tasty morsel romantic comedy news diabetes 	2010-09-04	0	0				https://twitter.com/lorieali23/status/23026279199
18501495669	47408	 bloomington hospitals diabetes center also offers classes prediabetes httpbitlycctfab via httpoutsidein 	2010-07-14	0	0				https://twitter.com/47408/status/18501495669
18501495634	47401	 bloomington hospitals diabetes center also offers classes prediabetes httpbitlybhb gq via httpoutsidein 	2010-07-14	0	0				https://twitter.com/47401/status/18501495634
18501495529	47404	 bloomington hospitals diabetes center also offers classes prediabetes httpbitlyb ulxc via httpoutsidein 	2010-07-14	0	0				https://twitter.com/47404/status/18501495529
17833377728	artsyErin	 type diabetes past yrs limits fruit drink choice sugarfree lemonade ive found new favorite fuze healthy infuzions	2010-07-05	0	0				https://twitter.com/artsyErin/status/17833377728
17438672428	carterseaton	 wonder ill give people diabetes blood like aids doesnt spread like that joooeeeey httpmylocme e lp	2010-06-30	0	0	@joooeeeey			https://twitter.com/carterseaton/status/17438672428
15890176143	Chloe2681	 rachelpartdeux sounds like gestational diabetes test	2010-06-10	0	0	@rachelpartdeux			https://twitter.com/Chloe2681/status/15890176143
15629851734	cassiejay007	 appt time indiana clinic diabetes endocrinology http sqcomd knoa	2010-06-07	0	0	@Indiana			https://twitter.com/cassiejay007/status/15629851734
15008755608	RMickelsen	 cgm diabetes hard time getting yr old type son wear cgm sensors matter explain benefits help	2010-05-29	0	0		#diabetes		https://twitter.com/RMickelsen/status/15008755608
4213824131432448	SaraatValpo	 talking much sugar breakfast friend told diabetes awareness monthgreat timing	2010-11-15	0	0				https://twitter.com/SaraatValpo/status/4213824131432448
29066692819	46135	 hospital announces diabetes class dates httpbitlybsau s via httpoutsidein 	2010-10-29	0	0				https://twitter.com/46135/status/29066692819
18501495529	47404	 bloomington hospitals diabetes center also offers classes prediabetes httpbitlyb ulxc via httpoutsidein 	2010-07-14	0	0				https://twitter.com/47404/status/18501495529
18501495444	47403	 bloomington hospitals diabetes center also offers classes prediabetes httpbitlyb a d via httpoutsidein 	2010-07-14	0	0				https://twitter.com/47403/status/18501495444
12808840436	47885	 walk diabetes terre haute httpbitlyadukvj via httpoutsidein 	2010-04-25	0	0				https://twitter.com/47885/status/12808840436
12808839712	47805	 walk diabetes terre haute httpbitly io ou via httpoutsidein 	2010-04-25	0	0				https://twitter.com/47805/status/12808839712
12808839660	47803	 walk diabetes terre haute httpbitlya toob via httpoutsidein 	2010-04-25	0	0				https://twitter.com/47803/status/12808839660
12808839608	47802	 walk diabetes terre haute httpbitlyamahyo via httpoutsidein 	2010-04-25	0	0				https://twitter.com/47802/status/12808839608
24915508787	46703	 cameron walmart team diabetes class httpbitlyan nvh via httpoutsidein 	2010-09-19	0	0				https://twitter.com/46703/status/24915508787
19597181420	Xenokilla	 mmmmmmm breakfast take diabetes httpyfrogcom fmrbaj	2010-07-26	0	0		#breakfast		https://twitter.com/Xenokilla/status/19597181420
27821721572	topix_in	 dining diabetes cooking school held november httpbitlybccsci boonville indiana	2010-10-19	0	0		#Boonville #Indiana		https://twitter.com/topix_in/status/27821721572
11371707211	BrendaSueHughes	 exciting news family new inhaled insulin shows promise diabetes news weht evansville henderson owensboro httpgoogloebp	2010-03-31	0	0				https://twitter.com/BrendaSueHughes/status/11371707211
27821721572	topix_in	 dining diabetes cooking school held november httpbitlybccsci boonville indiana	2010-10-19	0	0		#Boonville #Indiana		https://twitter.com/topix_in/status/27821721572
18501495634	47401	 bloomington hospitals diabetes center also offers classes prediabetes httpbitlybhb gq via httpoutsidein 	2010-07-14	0	0				https://twitter.com/47401/status/18501495634
18501495444	47403	 bloomington hospitals diabetes center also offers classes prediabetes httpbitlyb a d via httpoutsidein 	2010-07-14	0	0				https://twitter.com/47403/status/18501495444
10519575298	PastorScott	 friend jd told me i got second hand diabetes candy cigarettes lol classic	2010-03-15	0	0				https://twitter.com/PastorScott/status/10519575298
24694445877	Aseroff	 juvenile diabetes awareness near dear heartand nonfunctioning pancreas	2010-09-16	0	0				https://twitter.com/Aseroff/status/24694445877
12808839712	47805	 walk diabetes terre haute httpbitly io ou via httpoutsidein 	2010-04-25	0	0				https://twitter.com/47805/status/12808839712
12808840436	47885	 walk diabetes terre haute httpbitlyadukvj via httpoutsidein 	2010-04-25	0	0				https://twitter.com/47885/status/12808840436
19548562169798656	BustaBusta	 xxemochanxx yeahi get dizzy work busy diabetes anxiety meds	2010-12-27	0	0	@xxemochanxx			https://twitter.com/BustaBusta/status/19548562169798656
19515651727036417	BustaBusta	 really hate diabetes 	2010-12-27	0	0				https://twitter.com/BustaBusta/status/19515651727036417
