id	Username	Text	Date	Retweets	Favorites	Mentions	Hashtags	Geo	Permalink
415639537700720640	schmuckbuddha	 great example setting little girl whose hospital diabetes busy eating big mac fatty	2013-12-24	0	0				https://twitter.com/schmuckbuddha/status/415639537700720640
413532331870552064	tommyrusso	 still leaving rice behind sushi norice diabetes carbs genki sushi http instagramcompifylc o vl	2013-12-18	0	0	@Genki	#sushi #norice #diabetes #carbs		https://twitter.com/tommyrusso/status/413532331870552064
391823890718400512	Jmhanson88	 hula pie per hotel clerk diabetes lol dukes beach house http instagramcompfrinexnfq 	2013-10-20	0	0	@Duke			https://twitter.com/Jmhanson88/status/391823890718400512
390665730569809921	jodyyoshida	 a c month ago cheehoo thanks victoza type diabetes maui medical group http instagramcompfjt jhrepn	2013-10-16	0	0	@Maui	#a1c #victoza #type2 #diabetes		https://twitter.com/jodyyoshida/status/390665730569809921
384557278092742656	hilife97	 fuck diabetes fuck kidney problems fuck cough fuck doctor fuck nurses fuck shots fuck all	2013-09-30	0	0				https://twitter.com/hilife97/status/384557278092742656
379794738163249152	jodyyoshida	 errr inject day diabetes type victoza w cjisk maui medical group http instagramcompewep xetq	2013-09-16	0	0	@cjisk @Maui	#diabetes #type2 #victoza		https://twitter.com/jodyyoshida/status/379794738163249152
368259827106996224	CarasBigMac	 diabetes pictwittercom lrsckiqdx	2013-08-16	0	0				https://twitter.com/CarasBigMac/status/368259827106996224
367573979197739008	jeccamoore	 dustin_laurel nickmendoza get diabetes	2013-08-14	0	0	@Dustin_Laurel @Nickmendoza70			https://twitter.com/jeccamoore/status/367573979197739008
361727056297467906	DannyJWillis	 its basically melted slurpee thats mostly rum cirrhosis diabetes vacation	2013-07-29	0	0		#vacation		https://twitter.com/DannyJWillis/status/361727056297467906
360941155355078656	jodyyoshida	 happens pool low glucose levels im usually s diabetes http instagramcompcqgrokrepm	2013-07-26	0	0		#glucose #diabetes		https://twitter.com/jodyyoshida/status/360941155355078656
335655625289777153	Joe_Buettner	 probably closer diabetes ever oreo consumption week soaddicting	2013-05-18	0	1		#soaddicting		https://twitter.com/Joe_Buettner/status/335655625289777153
291838762684657664	dizziedaze	 hula pie aka diabetes plate kimos maui pic http sqcom fyuxa	2013-01-17	0	0	@Kimo			https://twitter.com/dizziedaze/status/291838762684657664
417439026879004672	HawaiiShira	 organiclivefood contributed somightily diabetes epidemic ravaging nation	2013-12-29	0	0	@OrganicLiveFood			https://twitter.com/HawaiiShira/status/417439026879004672
386409540687626240	HelgiOlafson	 stepoutphilly thanks following me support walk father held hostage diabetes type five years passed	2013-10-05	0	0	@StepOutPhilly			https://twitter.com/HelgiOlafson/status/386409540687626240
371781487323922432	TKgoinAPEshit	 trying cake eat get cha diabetes 	2013-08-25	0	0				https://twitter.com/TKgoinAPEshit/status/371781487323922432
291423179686170624	keolaharris	 meow lost feet diabetes meow fatcat miyos http instagrampuijclyldxl	2013-01-16	0	0	@Miyos	#fatcat		https://twitter.com/keolaharris/status/291423179686170624
414194796438114304	DWKM	 waltandperry sandozablue diabetes started	2013-12-20	0	0	@waltandperry @sandozablue			https://twitter.com/DWKM/status/414194796438114304
371779677817696256	RealtorRon	 happy rotarians service st annual anahola diabetes wellness fair anahola neighborhood http instagramcompddhwxfbj b	2013-08-25	0	0	@anahola			https://twitter.com/RealtorRon/status/371779677817696256
417115952640049152	CraigmunnSpeaks	 thinking dr turk scrubs lately messed gave black guy diabetes autistic child fuckers	2013-12-28	0	1		#fuckers		https://twitter.com/CraigmunnSpeaks/status/417115952640049152
417056299486953473	immichaelmorgan	 gasping air rt rupaulsdragrace we got big girls hope dont diabetes willambelli	2013-12-28	0	0	@RuPaulsDragRace @WillamBelli			https://twitter.com/immichaelmorgan/status/417056299486953473
415920643792596993	marcmurd	 cinnabon flavored vodka pinnacle canary coal mine end westerncivilization sweet embrace diabetes 	2013-12-25	0	0		#Cinnabon #vodka #Pinnacle #westerncivilization #diabetes		https://twitter.com/marcmurd/status/415920643792596993
414288744967987200	EPradel	 hes talking burger king getting diabetes night getting weirder weirder	2013-12-21	0	0				https://twitter.com/EPradel/status/414288744967987200
413941001724493824	_MyyyCaaak	 taylor_bra diabetes	2013-12-20	0	0	@taylor_bra			https://twitter.com/_MyyyCaaak/status/413941001724493824
412473513379782656	InoG_	 momma got diabetes i told u stay away nasty ass ass girls noo momma got sugars ahhh baby	2013-12-16	0	0				https://twitter.com/InoG_/status/412473513379782656
410470721958064128	eeeengela	 im gonna get literal diabetes today	2013-12-10	0	0				https://twitter.com/eeeengela/status/410470721958064128
406890101835198464	PALOALTO_AKAs	 womens health conference dec th gain helpful insights coveredca diabetes much more join us reg http aachacorg	2013-11-30	1	0	@http	#CoveredCA #Diabetes		https://twitter.com/PALOALTO_AKAs/status/406890101835198464
406296696872640512	janicajos	 thankful icecream almost giving diabetes	2013-11-29	0	1				https://twitter.com/janicajos/status/406296696872640512
401881782296920065	SpyHI	 hawaii people live poverty three times likely diabetes matthew nagato tedxhnl	2013-11-16	1	3		#TEDxHNL		https://twitter.com/SpyHI/status/401881782296920065
400272514888134657	Aloha_Hoesss	 havent grits yrs rt naezus grits give diabetes quick rt me yall really think oatmeal gonna make yall live longer	2013-11-12	0	0	@Naezus @me			https://twitter.com/Aloha_Hoesss/status/400272514888134657
398960898578321408	spencertoyama	 eat docrock foodporn nom gluttony diabetes heartattack taste http instagramcompgeqiimbp h	2013-11-08	0	0	@docrock @Taste	#foodporn #nom #gluttony #diabetes #heartattack		https://twitter.com/spencertoyama/status/398960898578321408
398193580813991938	KHonbo	 riabaldevia hiconnector connector supports waimanalo health centers diabetes health fair today pictwittercomgkluiiebai	2013-11-06	1	0	@riabaldevia @HIConnector			https://twitter.com/KHonbo/status/398193580813991938
396742818107904000	allysha_mae13	 finished walk cure diabetes 	2013-11-02	0	0				https://twitter.com/allysha_mae13/status/396742818107904000
396529713419542529	PUNAMAZING	 alohadayne punamazing diabetes sunday x yes	2013-11-02	0	0	@alohadayne @PUNAMAZING			https://twitter.com/PUNAMAZING/status/396529713419542529
395459165386055680	james_cavin	 mt naurunews least nauruans age suffer diabetes http bitlybwuuav nauru makes think hpu	2013-10-30	0	0	@NauruNews @HPU	#diabetes #Nauru		https://twitter.com/james_cavin/status/395459165386055680
394013420699521024	ehhitsjustamy	 diabetes cup likinittho birthdaycakeremix coldstone waikikichillin cold stone http instagramcompf ge ck xe	2013-10-26	0	0	@Cold	#likinittho #birthdaycakeremix #coldstone #waikikichillin		https://twitter.com/ehhitsjustamy/status/394013420699521024
392794974778957824	camojeggings	 wow ate bowl pasta two scoops ice cream cookie butter haha hashtag diabetes	2013-10-22	0	5				https://twitter.com/camojeggings/status/392794974778957824
391024445248122880	MarlanaBaez	 think im gonna get diabetes soon	2013-10-17	0	0				https://twitter.com/MarlanaBaez/status/391024445248122880
390205588292239360	sinasison	 delicious diabetes life foundation http instagramcompfgcvbhm rd	2013-10-15	0	0	@Life			https://twitter.com/sinasison/status/390205588292239360
389286283744251904	Jesse_Frandsen	 jenaboldt sneezed touched butt ukulelei guess were even diabetes now	2013-10-13	0	0	@JenaBoldt			https://twitter.com/Jesse_Frandsen/status/389286283744251904
388972018718105600	chrisgeezy_	 ucelaphresh lmao diabetes ha yeah dont want that gon real problem	2013-10-12	0	0	@UceLaPhresh			https://twitter.com/chrisgeezy_/status/388972018718105600
388812131866406912	marcmurd	 julieklausner could put blender ice cream first kid family diagnosed diabetes wins	2013-10-11	0	0	@julieklausner			https://twitter.com/marcmurd/status/388812131866406912
385233397372575744	laumom2	 wow affordable time forget pills exercise may effective meds treating heart disease diabetes http time fh bdx 	2013-10-01	0	0	@TIME			https://twitter.com/laumom2/status/385233397372575744
383386898426646528	lightlycynical	 tyleroakley tipsforyoudaily diabetes pictwittercom otncszl 	2013-09-26	0	0	@tyleroakley @TipsForYouDaily			https://twitter.com/lightlycynical/status/383386898426646528
381560079910060033	tiredashIey	 diabetes plate lol pictwittercomgridlfqafo	2013-09-21	0	1				https://twitter.com/tiredashIey/status/381560079910060033
378669715914104832	SiMaNuManu	 brazilmorris u facebook shares many moments writing community page calls sia figiel diabetes 	2013-09-13	0	0	@BrazilMorris			https://twitter.com/SiMaNuManu/status/378669715914104832
375148462418821120	SiMaNuManu	 dlife sia figiel person living type diabetes also mother aunt sister friend http fbmeenkxdio 	2013-09-04	0	1	@dLife			https://twitter.com/SiMaNuManu/status/375148462418821120
373910343816212480	neecoal_	 diabetes jar addicted pictwittercom dliozlotr	2013-08-31	0	0		#addicted		https://twitter.com/neecoal_/status/373910343816212480
368573709532938240	jayloha4220	 swear job get diabetes honolulu international airport hnl http instagramcompdgvwtugawm	2013-08-16	0	0	@Honolulu			https://twitter.com/jayloha4220/status/368573709532938240
367021120295157762	CarasBigMac	 diabetes xo pictwittercomslsw qgaxw	2013-08-12	0	2				https://twitter.com/CarasBigMac/status/367021120295157762
366108488784560130	YoEmanYo	 diabetes cup pictwittercomeobvrwa if	2013-08-10	0	2				https://twitter.com/YoEmanYo/status/366108488784560130
358721341572120576	hooligansgarage	 willyferrell juan chocolate bars eats juan now diabetes juan diabetes caboman haha	2013-07-20	0	0	@WillyFerrell @caboman70			https://twitter.com/hooligansgarage/status/358721341572120576
354340860797784064	HVC_Hawaii	 get cracked handle monday mornings _ candy sugarrush diabetes sixlets http instagramcompbhmiamoiuk	2013-07-08	0	0		#candy #sugarrush #diabetes #sixlets		https://twitter.com/HVC_Hawaii/status/354340860797784064
353394162877476866	ninacoconut	 skin cancer diabetes already hit list	2013-07-06	0	0				https://twitter.com/ninacoconut/status/353394162877476866
350036859222638592	HVC_Hawaii	 salted caramel vanilla crunch cake vanilla ice cream icecream diabetes dessert cake fatty http instagramcompbcnpznoius	2013-06-26	0	0		#icecream #diabetes #dessert #cake #fatty		https://twitter.com/HVC_Hawaii/status/350036859222638592
347799888823726081	HVC_Hawaii	 donuts breakfast yes please thanks bossman bestbossever regalbakery diabetes sugarrush http instagramcompayuo joivi	2013-06-20	0	0		#bestbossever #regalbakery #diabetes #sugarrush		https://twitter.com/HVC_Hawaii/status/347799888823726081
336728279413305344	ohpoooyo	 dis polynesians high blood pressure diabetes ohwell lessonlearnlater http instagramcompzkeanhsg w	2013-05-21	0	0		#ohwell #lessonlearnlater		https://twitter.com/ohpoooyo/status/336728279413305344
333863181556527104	shemez_ana	 sweet tooth sweet husband diabetes d haagendaz peanutbutterpie pie icecream purle http instagramcompzps f lo t	2013-05-13	0	0		#haagendaz #peanutbutterpie #pie #icecream #purle		https://twitter.com/shemez_ana/status/333863181556527104
332543757507514368	sheyrcstl	 sister anxiety attack atm shes presentation today topic diabetes ___	2013-05-09	0	0				https://twitter.com/sheyrcstl/status/332543757507514368
328276790739079168	LinaGirlLangi	 cuz diabeticals love da sweetsthis dessert no offense people diabetes its our http instagramcompyoapognhgz	2013-04-27	1	0				https://twitter.com/LinaGirlLangi/status/328276790739079168
326933944866070528	SgtMardiswife	 diabetes joke	2013-04-24	0	0				https://twitter.com/SgtMardiswife/status/326933944866070528
326084370941239297	ThatBoy3	 dice run getting started supporting jdrf juvenile diabetes research foundation sundayfunday http instagramcompyybloltpfb	2013-04-21	0	0		#jdrf #sundayfunday		https://twitter.com/ThatBoy3/status/326084370941239297
325474730364792833	sarahraahhh	 nikkytea ohh is thought gonna get diabetes something hahah thanks	2013-04-20	0	1	@nikkytea			https://twitter.com/sarahraahhh/status/325474730364792833
324756564516941825	marcmurd	 new cocacola slogan havent always wished child diabetes 	2013-04-18	0	0		#cocacola #diabetes		https://twitter.com/marcmurd/status/324756564516941825
318202549343768577	LegiScanHI	 hcr update board education department education diabetes training http bitlycomy kdyp	2013-03-30	0	0				https://twitter.com/LegiScanHI/status/318202549343768577
317029432248373248	Haileyrwilliams	 put much sugar tea it tastes like im drinking diabetes falinew bestdiscribtionever	2013-03-27	0	1	@FalineW	#bestdiscribtionever		https://twitter.com/Haileyrwilliams/status/317029432248373248
315824404951089153	LegiScanHI	 hcr update board education department education diabetes training http bitlycomy kdyp	2013-03-24	0	0				https://twitter.com/LegiScanHI/status/315824404951089153
314296878055436288	LegiScanHI	 sr update board education department education diabetes training http bitlycomy ygfj	2013-03-20	0	0				https://twitter.com/LegiScanHI/status/314296878055436288
314153442924961793	LegiScanHI	 scr update board education department education diabetes training http bitlycomzbin z	2013-03-19	0	0				https://twitter.com/LegiScanHI/status/314153442924961793
312701366156013569	LegiScanHI	 hcr update board education department education diabetes training http bitlycomy kdyp	2013-03-15	0	0				https://twitter.com/LegiScanHI/status/312701366156013569
312448790776930304	ErikaRawrchelle	 macdaddy meaning life iaminlove honeytoast icecream diabetes noregrets http instagrampw je crlz 	2013-03-15	0	0		#iaminlove #honeytoast #icecream #diabetes #noregrets		https://twitter.com/ErikaRawrchelle/status/312448790776930304
312258486132166656	LegiScanHI	 hcr update board education department education diabetes training http bitlycomy kdyp	2013-03-14	0	0				https://twitter.com/LegiScanHI/status/312258486132166656
311778572308213760	breezybambs	 diabetes	2013-03-13	0	0				https://twitter.com/breezybambs/status/311778572308213760
311543753942921216	LegiScanHI	 hcr new board education department education diabetes training http bitlycomy kdyp	2013-03-12	0	0				https://twitter.com/LegiScanHI/status/311543753942921216
311277199523201024	lvdyams	 phuuucbabyy _anjimarie kevvind fried banana drizzled diabetes zippys http instagrampwvotftgdt 	2013-03-11	0	0	@phuuucbabyy @Zippy			https://twitter.com/lvdyams/status/311277199523201024
310728307677216768	LegiScanHI	 scr new board education department education diabetes training http bitlycomzbin z	2013-03-10	0	0				https://twitter.com/LegiScanHI/status/310728307677216768
310698463144849409	LegiScanHI	 sr new board education department education diabetes training http bitlycomy ygfj	2013-03-10	0	0				https://twitter.com/LegiScanHI/status/310698463144849409
309113852493168642	GetSalEnginJobs	 diabetes sales specialist honolulu hi http tinyurlcomd v ruk get sales engineer jobs salesengineer jobs job getalljobs	2013-03-05	0	0		#Honolulu #SalesEngineer #jobs #job #GetAllJobs		https://twitter.com/GetSalEnginJobs/status/309113852493168642
308363697858957312	kellinaka	 bowled diabetes association fundraiser tournament semiprostatus ornot supportagoodcause http instagrampwahiyrf v_	2013-03-03	0	0		#172 #semiprostatus #ornot #supportagoodcause		https://twitter.com/kellinaka/status/308363697858957312
308162330900967424	abbunnycake	 vanilla shave ice topped condensed milk mochi caramel bacon bits pound cake diabetes yolo http instagrampwzcicjzh_a	2013-03-03	0	0		#diabetes #yolo		https://twitter.com/abbunnycake/status/308162330900967424
302166959078903808	LegiScanHI	 hb update doh diabetes reporting http bitlycomy i an	2013-02-14	0	0				https://twitter.com/LegiScanHI/status/302166959078903808
302066304301535233	LegiScanHI	 hb update students diabetes diabetes medical management plan schools http bitlycomwccv e	2013-02-14	0	0				https://twitter.com/LegiScanHI/status/302066304301535233
301698885141803009	LegiScanHI	 hb update students diabetes diabetes medical management plan schools http bitlycomwccv e	2013-02-13	0	0				https://twitter.com/LegiScanHI/status/301698885141803009
301676256745910272	LegiScanHI	 hb update doh diabetes reporting http bitlycomy i an	2013-02-13	0	0				https://twitter.com/LegiScanHI/status/301676256745910272
299250046413705216	AnnabelleStone	 digital literacy help clients access health information fr legitimate websites heart health diabetes diet exercise	2013-02-06	0	0				https://twitter.com/AnnabelleStone/status/299250046413705216
299058872285528064	LegiScanHI	 hb update students diabetes diabetes medical management plan schools http bitlycomwccv e	2013-02-06	0	0				https://twitter.com/LegiScanHI/status/299058872285528064
298804697563815939	LegiScanHI	 sb update department education diabetes students appropriation http bitlycomyddcwy	2013-02-05	0	0				https://twitter.com/LegiScanHI/status/298804697563815939
298666286072868864	LegiScanHI	 hb update doh diabetes reporting http bitlycomy i an	2013-02-05	0	0				https://twitter.com/LegiScanHI/status/298666286072868864
297216734618853377	LegiScanHI	 hb update department education diabetes students appropriation http bitlycomw enej	2013-02-01	0	0				https://twitter.com/LegiScanHI/status/297216734618853377
296187444636819456	LegiScanHI	 hb update students diabetes diabetes medical management plan schools http bitlycomwccv e	2013-01-29	0	0				https://twitter.com/LegiScanHI/status/296187444636819456
296056589255856129	LegiScanHI	 sb update department education diabetes students appropriation http bitlycomyddcwy	2013-01-28	0	0				https://twitter.com/LegiScanHI/status/296056589255856129
295820019584077826	LegiScanHI	 hb update department education diabetes students appropriation http bitlycomw enej	2013-01-28	0	0				https://twitter.com/LegiScanHI/status/295820019584077826
294888890437885952	LegiScanHI	 hb new doh diabetes reporting http bitlycomy i an	2013-01-25	0	0				https://twitter.com/LegiScanHI/status/294888890437885952
294691269177917440	mmadison	 diabetes pictwittercomipfwa du	2013-01-25	0	1				https://twitter.com/mmadison/status/294691269177917440
294659882731311104	LegiScanHI	 hb new department education diabetes students appropriation http bitlycomw enej	2013-01-24	0	0				https://twitter.com/LegiScanHI/status/294659882731311104
292114596985196544	BianchaYalung	 landonjumpoff wanna live type diabetes life	2013-01-17	0	0	@landonjumpoff			https://twitter.com/BianchaYalung/status/292114596985196544
290692397191536641	BianchaYalung	 medical field call diabetes death sentence ollywoodhi bianchayalung haha ewww want shit ever	2013-01-14	0	0	@ollywoodhi @BianchaYalung			https://twitter.com/BianchaYalung/status/290692397191536641
290690860474048513	BianchaYalung	 ollywoodhi asking freal kine cuz tell first signs symptoms diabetes mellitus ii	2013-01-14	0	0	@ollywoodhi			https://twitter.com/BianchaYalung/status/290690860474048513
290645808192299010	beyoncasian	 someone brought box almond rocas work couldnt contain myself ate five diabetes fat almondroca	2013-01-13	0	3		#fat #almondroca		https://twitter.com/beyoncasian/status/290645808192299010
