id	Username	Text	Date	Retweets	Favorites	Mentions	Hashtags	Geo	Permalink
417506722765238272	UgeneGon	 thoughts cant breathe im thinkin asthmatic	2013-12-29	0	0				https://twitter.com/UgeneGon/status/417506722765238272
417082459961192448	Grondizzle	 evil asthmatic whats cape going opera dont think so	2013-12-28	0	0				https://twitter.com/Grondizzle/status/417082459961192448
411016889268072448	NETHERRAKK	 used severely asthmatic would hooked machine every night little hated much	2013-12-12	1	1				https://twitter.com/NETHERRAKK/status/411016889268072448
393595577466122240	flipflopcaravan	 prenup fest featuring sir coyler asthmatic band hipsterwedding slims last chance chili shack http sqcomhf m s	2013-10-25	0	0	@Slim	#hipsterwedding		https://twitter.com/flipflopcaravan/status/393595577466122240
376100279269076993	melferburque	 im fat asthmatic actually doubting_tom melferburque kausikdatta vitabrevi teh pouts case tuff guy well	2013-09-06	0	0	@Doubting_Tom @melferburque @kausikdatta22 @VitaBrevi			https://twitter.com/melferburque/status/376100279269076993
372928427999109120	radooga_map	 deep breathing exercises folks like is radiator or sorry guys cold asthmatic	2013-08-28	0	1		#asthmatic		https://twitter.com/radooga_map/status/372928427999109120
367719346803453952	RNBcello	 asthmatic gotsta say nanayno humidity	2013-08-14	0	0				https://twitter.com/RNBcello/status/367719346803453952
374830462524346368	afrolivia	 aint weezy asthmatic	2013-09-03	0	0				https://twitter.com/afrolivia/status/374830462524346368
