id	Username	Text	Date	Retweets	Favorites	Mentions	Hashtags	Geo	Permalink
417574770956185600	Kam_Bontrager	 yes im gay no dont like rainbows dont sound like squeaky toy like sports tbell voice like darth vader wo asthma 	2013-12-30	1	16				https://twitter.com/Kam_Bontrager/status/417574770956185600
415682264115077121	_REYPapi_	 asthma acting badly	2013-12-24	0	0				https://twitter.com/_REYPapi_/status/415682264115077121
415340473742393344	celestehillary	 asthma pits	2013-12-23	0	2				https://twitter.com/celestehillary/status/415340473742393344
411911098724392960	Bookey_J	 chavez_ravine ive taken hiatus running cant run its cold asthma	2013-12-14	0	0	@Chavez_Ravine			https://twitter.com/Bookey_J/status/411911098724392960
408808863928832000	Birdy_Gobble97	 asthma makes wheezy sometimes sound like ive smoking billion years asthmaprobs	2013-12-05	0	0		#asthmaprobs		https://twitter.com/Birdy_Gobble97/status/408808863928832000
403646027292352512	chantelhugscows	 sheyna__ nope i wish didnt smoke asthma need stop	2013-11-21	0	1	@Sheyna__			https://twitter.com/chantelhugscows/status/403646027292352512
402420605384810497	cgibs1128	 didnt sleep well anxiety time high asthma	2013-11-18	0	0				https://twitter.com/cgibs1128/status/402420605384810497
402258860288667649	kaley_tweets	 aa asthma attackin wakin up wonderin happened 	2013-11-17	0	0				https://twitter.com/kaley_tweets/status/402258860288667649
401162996149260288	ethan_kirk7	 also beat asthma exercising overlymanlyman	2013-11-14	0	2		#OverlyManlyMan		https://twitter.com/ethan_kirk7/status/401162996149260288
400277086578814976	mason_neuman18	 asthma killer today	2013-11-12	0	1				https://twitter.com/mason_neuman18/status/400277086578814976
399873716881858561	iTs_TJacK	 watch em breath like got asthma topshotta_ 	2013-11-11	1	1	@TopShotta_119			https://twitter.com/iTs_TJacK/status/399873716881858561
395924118228701184	Cj_Kiss	 fact asthma attack middle class coughing embarrassing	2013-10-31	0	0				https://twitter.com/Cj_Kiss/status/395924118228701184
395507960907960320	Jaymes003	 jessica_z chris_z children corn literally gave asthma attack 	2013-10-30	1	1	@Jessica_Z925 @Chris_Z925			https://twitter.com/Jaymes003/status/395507960907960320
393362655651459072	mikemartynowicz	 honestly love weather crisp fall air allergies asthma hate time year love it	2013-10-24	0	1				https://twitter.com/mikemartynowicz/status/393362655651459072
389706623075106818	shardedominique	 feel like asthma going start acting today coughing night 	2013-10-14	0	0				https://twitter.com/shardedominique/status/389706623075106818
389380573065916416	chino_saleh	 getting asthma again cause stopped breathing nowhere like times weeks	2013-10-13	0	0				https://twitter.com/chino_saleh/status/389380573065916416
387756256578256896	saturatedcth	 asthma needs stop acting ong	2013-10-08	1	0				https://twitter.com/saturatedcth/status/387756256578256896
385995338445631488	PaulMarandet	 forget heat players asthma now arent full grown healthy active men	2013-10-04	1	0				https://twitter.com/PaulMarandet/status/385995338445631488
384800274033819648	menerjerffffff	 sexylads realized harry niall asthma long ago	2013-09-30	0	0	@5sexylads			https://twitter.com/menerjerffffff/status/384800274033819648
383401426115764225	madisonsturgell	 gramps blow nose billion times to allergies asthma cant breathe nose ill die k	2013-09-26	0	0				https://twitter.com/madisonsturgell/status/383401426115764225
382569374625714176	MojoFlexx	 nicknamed dick asthma leaves bitches breathless swag	2013-09-24	0	0		#swag		https://twitter.com/MojoFlexx/status/382569374625714176
381902501567426560	C_Raww_	 its asthma kush got coughin	2013-09-22	0	0				https://twitter.com/C_Raww_/status/381902501567426560
381616117187235840	saturatedcth	 asthma u c k	2013-09-21	0	0				https://twitter.com/saturatedcth/status/381616117187235840
380844479676047360	JackMilesIII	 asthma down wish cure	2013-09-19	0	0				https://twitter.com/JackMilesIII/status/380844479676047360
380000713423585281	imcute321	 fact lot sex unblock stuffed nose sex also natural antihistamine help combat asthma hay fever jrhodes 	2013-09-17	0	1	@Fact @JRhodes93			https://twitter.com/imcute321/status/380000713423585281
377985631822954496	tiffanyreamer23	 allergies killing lungs sware im going end asthma	2013-09-11	0	0				https://twitter.com/tiffanyreamer23/status/377985631822954496
377972204421779456	courtney_maeve	 n_warren shes hospital im pretty sure sever asthma attack	2013-09-11	0	0	@N_Warren69			https://twitter.com/courtney_maeve/status/377972204421779456
371386463683760128	vickiewaddsup	 mowed grass asthma attack took meds killer headache fml	2013-08-24	0	0				https://twitter.com/vickiewaddsup/status/371386463683760128
366386066602721281	Charleito	 asthma	2013-08-10	0	0				https://twitter.com/Charleito/status/366386066602721281
365724532050366465	saturatedcth	 asthma sucks bad	2013-08-09	0	0				https://twitter.com/saturatedcth/status/365724532050366465
365453208954478592	jdejrodriguez	 jaron_brown_ maybe asthma httpstwittercomjaron_brown_status photo pictwittercom whinnnpow 	2013-08-08	0	0	@jaron_brown_			https://twitter.com/jdejrodriguez/status/365453208954478592
363166852748296192	kel_see	 man asthma attack 	2013-08-02	0	0				https://twitter.com/kel_see/status/363166852748296192
363165631555702784	kel_see	 asthma fucking sucks 	2013-08-02	0	0				https://twitter.com/kel_see/status/363165631555702784
357675750700220416	bennybobenny	 its_court_omg asthma horrrrrible today complaint	2013-07-17	0	0	@Its_Court_OMG			https://twitter.com/bennybobenny/status/357675750700220416
357673165750677504	bennybobenny	 its_court_omg u run asthma 	2013-07-17	0	0	@Its_Court_OMG			https://twitter.com/bennybobenny/status/357673165750677504
355532610912526336	3lise_augustin3	 asthma suck	2013-07-11	2	0				https://twitter.com/3lise_augustin3/status/355532610912526336
352486064117657600	_REYPapi_	 commoncock calling penis asthma leaves bitches breathless	2013-07-03	0	0	@CommonCock			https://twitter.com/_REYPapi_/status/352486064117657600
345653306569404416	MishaelTheis	 big problem one headphones blows hear breathing like im asthma attack	2013-06-14	0	0				https://twitter.com/MishaelTheis/status/345653306569404416
345173805532082176	IUKokomo	 kids learning asthma triggers eezethewheeze iuknursing myiuk mycampus summercamp http instagramcompagefpfeb o	2013-06-13	1	0	@	#eezethewheeze #iuknursing #myiuk #mycampus #summercamp		https://twitter.com/IUKokomo/status/345173805532082176
344611752870301697	Indian__Thugg	 call asthma cause ileave niqqas breathless 	2013-06-11	0	0				https://twitter.com/Indian__Thugg/status/344611752870301697
344563737547665409	_justdoitPruitt	 sick asthma kinda really sucks	2013-06-11	0	0				https://twitter.com/_justdoitPruitt/status/344563737547665409
343216308705447938	6_NatashaB	 courtneykipker running makes feel like saliva chipmunk cheeks asthma somethings taking body lol	2013-06-08	0	1	@courtneykipker			https://twitter.com/6_NatashaB/status/343216308705447938
333788197840642048	Big_Mac_Jay23	 numbero_juan last summer lol went beach asthma attack	2013-05-12	0	1	@Numbero_JUAN			https://twitter.com/Big_Mac_Jay23/status/333788197840642048
333752621930262529	JANIESGotta_Gun	 wheezing hate asthma 	2013-05-12	1	1				https://twitter.com/JANIESGotta_Gun/status/333752621930262529
333029771384598528	Quasiveli	 nigga ive fight beforea fight asthma	2013-05-10	0	3				https://twitter.com/Quasiveli/status/333029771384598528
331723319164407809	kimnonna	 ugh allergies asthma kept night guess shouldnt sit outside soak sunshine	2013-05-07	0	0				https://twitter.com/kimnonna/status/331723319164407809
331433491193532417	Quasiveli	 omg hahahahahahah nigga gotta stop ima asthma attack lmfao	2013-05-06	0	0				https://twitter.com/Quasiveli/status/331433491193532417
328205815775387648	mace_dolen	 molaineross kinda sucks asthma really bad quit team last year come run hour us since easy lol	2013-04-27	0	0	@molaineross			https://twitter.com/mace_dolen/status/328205815775387648
326004200733552640	Yelah_Muabsun	 wanna stick vacuum hose lungs extract bullshit hate tickle feeling hate asthma 	2013-04-21	0	1				https://twitter.com/Yelah_Muabsun/status/326004200733552640
324608653430755329	mack_gratigny	 think selfinduced asthma	2013-04-17	0	1				https://twitter.com/mack_gratigny/status/324608653430755329
323614905842417664	lilboyazul	 wooooooooooooooooooooooooooooooooooooooooooooooooooooooooooo lawd help need inhaler dont even gots asthma love u jennifer	2013-04-14	2	1				https://twitter.com/lilboyazul/status/323614905842417664
322149091037560832	__kaylamarieox	 mom trying make quit sports asthma shit wtf	2013-04-10	0	0				https://twitter.com/__kaylamarieox/status/322149091037560832
321684938745344001	haleymarie104	 mini asthma attack class ughhhh	2013-04-09	0	0				https://twitter.com/haleymarie104/status/321684938745344001
319980826794278912	KjBrad16	 bubbers sick asthma 	2013-04-04	0	0				https://twitter.com/KjBrad16/status/319980826794278912
317450174278545409	MonaReefa_	 losing breath asthma attack	2013-03-28	0	0				https://twitter.com/MonaReefa_/status/317450174278545409
317404079989084160	kdice_2	 miriahu asthma meuh yea miriahcuz wanna see assss ma ughhh lmao miriahis tight lmfao	2013-03-28	0	0				https://twitter.com/kdice_2/status/317404079989084160
314093375378825216	_OBEY_Renee_	 lmao rtlimooniemusic dont chase hoes got asthma plus smoke	2013-03-19	0	0	@LiMoonieMusic			https://twitter.com/_OBEY_Renee_/status/314093375378825216
313502183087816704	Mr_Coach_Kline_	 used think good bed ex told asthma 	2013-03-18	1	1				https://twitter.com/Mr_Coach_Kline_/status/313502183087816704
311676358566756352	_LilSallyWalker	 tweetyourfear drowning suffocating asthma attack dying able breathe	2013-03-12	0	0		#tweetyourfear		https://twitter.com/_LilSallyWalker/status/311676358566756352
310475368308019200	GrimesAshleigh	 thesawickipedia asthma kills run every time	2013-03-09	0	0	@TheSawickipedia			https://twitter.com/GrimesAshleigh/status/310475368308019200
305866711712813056	alexbcarlin	 doubt untrained women warthritis boys w asthma take walkers the prison let alone people iwantyou thewalkingdead	2013-02-24	0	0	@the	#iwantyou #thewalkingdead		https://twitter.com/alexbcarlin/status/305866711712813056
300687664573714432	julismom	 asthma rears ugly head oh painful blood blister gum area sucks juli beautiful http instagrampvjjsmuvb	2013-02-10	0	0				https://twitter.com/julismom/status/300687664573714432
298998803028119553	_LilSallyWalker	 need inhaler swear asthma	2013-02-05	0	0		#Asthma		https://twitter.com/_LilSallyWalker/status/298998803028119553
297362540298653696	madihorn	 kaylahdeanne know walked someone almost asthma attack cuz smelled bad	2013-02-01	0	1	@kaylahdeanne			https://twitter.com/madihorn/status/297362540298653696
295809989447151616	speak_in_vowels	 allergy asthma center follow me neither certainly dont require entire center defects let alone tweets	2013-01-28	0	0				https://twitter.com/speak_in_vowels/status/295809989447151616
294578843203809280	Kim_Esquivel	 pretty sure asthma cant stop wheezing use inhaler st time	2013-01-24	0	0				https://twitter.com/Kim_Esquivel/status/294578843203809280
291716977922306049	lutherungirl	 ever felt like youre running elephant chest cold asthma oneofthosedays	2013-01-16	0	0		#cold #asthma #oneofthosedays		https://twitter.com/lutherungirl/status/291716977922306049
287137743409147904	spencerslabaugh	 found asthma medicine made steroids wonder ripped	2013-01-04	0	0				https://twitter.com/spencerslabaugh/status/287137743409147904
414604672372965376	_LipstickJunkie	 got asthma seanxeric refuse chase anyone	2013-12-21	0	0	@SEANxERIC			https://twitter.com/_LipstickJunkie/status/414604672372965376
414586010417102849	gemcitysai	 taylorwf_ got asthma cant chase hoes	2013-12-21	1	0	@taylorwf_			https://twitter.com/gemcitysai/status/414586010417102849
414469816729075712	ErinNicole09	 pretty sure grandma sprayed half air wick asthma attacks arent even asthmatic	2013-12-21	0	0				https://twitter.com/ErinNicole09/status/414469816729075712
412105280223064064	BodhiNAuble	 anthrax wax gives ya asthma attacks	2013-12-15	0	0				https://twitter.com/BodhiNAuble/status/412105280223064064
412062702245117952	AaronAtay14	 shutupstanley lady jags gave high blood pressure high blood pressure holy ghost seizures asthma apocalypse whatever im dead	2013-12-14	2	2	@ShutupStanley			https://twitter.com/AaronAtay14/status/412062702245117952
411866098166812672	_Badass_2x	 asthma 	2013-12-14	5	0				https://twitter.com/_Badass_2x/status/411866098166812672
410044088097193984	rvyfyb	 going home early my chest hurt think asthma bothering me typa shit	2013-12-09	0	1				https://twitter.com/rvyfyb/status/410044088097193984
409760709921488897	DanielYoungBSU	 think watching phidet horrible asthma would be there	2013-12-08	0	0				https://twitter.com/DanielYoungBSU/status/409760709921488897
409744805913042944	KetchmarkWCPO	 marciawalker started cough mine always leads asthma oh prednisone zpack lungs really bad shape	2013-12-08	0	0	@MarciaWalker50			https://twitter.com/KetchmarkWCPO/status/409744805913042944
409166707039543297	mollyjennaaa	 fucking hate asthma 	2013-12-06	0	0				https://twitter.com/mollyjennaaa/status/409166707039543297
408731902510514176	cumtakeapuff	 aaliyah singing chainz extra gone say got asthma instead got extra	2013-12-05	0	0				https://twitter.com/cumtakeapuff/status/408731902510514176
408270250720120832	Living4_Damon	 ughh asthma dat shit 	2013-12-04	0	0				https://twitter.com/Living4_Damon/status/408270250720120832
407689031892221953	AliiiGotBandz	 im seriously good swimming cant anymore cause asthma 	2013-12-02	0	0				https://twitter.com/AliiiGotBandz/status/407689031892221953
407579399857659904	Jessicammartin1	 power outage asthma attack burkhardt burning rubber smell	2013-12-02	0	0				https://twitter.com/Jessicammartin1/status/407579399857659904
406750253409243137	Living4_Damon	 ii hate asthma 	2013-11-30	0	0				https://twitter.com/Living4_Damon/status/406750253409243137
406076914210570240	britmc	 miles min considering bitter cold asthma race year shabby	2013-11-28	0	1				https://twitter.com/britmc/status/406076914210570240
406057877493665792	_LipstickJunkie	 im chasing niggas got asthma	2013-11-28	0	0				https://twitter.com/_LipstickJunkie/status/406057877493665792
404849777147260928	FITGUY4	 woman overcomes asthma allergies raw food diet httpwww undergroundhealthcomwomanovercome sasthmaandallergieswithrawfooddiet 	2013-11-25	0	0				https://twitter.com/FITGUY4/status/404849777147260928
404839302200180736	DanielYoungBSU	 asthma cant imagine playing one cold let alone quarters ot nebulizer treatments everyone	2013-11-25	0	0				https://twitter.com/DanielYoungBSU/status/404839302200180736
403504416873275392	GaryCKern	 gonna get retested believe well see goes allergy asthma clinical immunology associates http sqcom fy m w	2013-11-21	0	0	@Allergy			https://twitter.com/GaryCKern/status/403504416873275392
402626007783321600	dadcrew_zach	 hate asthma much die	2013-11-18	0	0				https://twitter.com/dadcrew_zach/status/402626007783321600
400709609188769792	_Badass_2x	 really thinking ina bad asthma attack basketball one day smh	2013-11-13	0	0				https://twitter.com/_Badass_2x/status/400709609188769792
400294686591430657	DodgerGreywing	 ill start giving shit problems stop aggravating asthma horrible stench	2013-11-12	0	0				https://twitter.com/DodgerGreywing/status/400294686591430657
398998170887155712	thecolincrouse	 anthrax wax give ya asthma attacksss	2013-11-08	0	0				https://twitter.com/thecolincrouse/status/398998170887155712
398963378284400640	SHAWTYBRITT	 feel like asthma	2013-11-08	0	0				https://twitter.com/SHAWTYBRITT/status/398963378284400640
398553182999044097	MarcusNicholsNM	 asthma attack personal fitness today emts came give ekg cool	2013-11-07	0	0				https://twitter.com/MarcusNicholsNM/status/398553182999044097
396658422839398402	pritymomma	 hot breaking news idris elba suffers asthma attack south africa http owly be wa im praying everything ok	2013-11-02	0	0	@Hot963			https://twitter.com/pritymomma/status/396658422839398402
396301250758574081	britmc	 got asked asthma dr appt smoke suppose asthmatics stupid enough smoke would attacks 	2013-11-01	0	0				https://twitter.com/britmc/status/396301250758574081
396006263168831488	Jessicammartin1	 teamasswater get little buzz asthma attack lol chose first	2013-10-31	0	0	@TeamAssWater1			https://twitter.com/Jessicammartin1/status/396006263168831488
395930150740586497	Idyt	 im asking keep kids heaving alexaaad right diagnosed asthma 	2013-10-31	1	2	@alexaaad			https://twitter.com/Idyt/status/395930150740586497
393732652542349312	ISRC2	 rc week iu health methodist hosp respiratory care dept hosting bake sale asthma camp day r u doing pictwittercomv zh jzrub	2013-10-25	0	0				https://twitter.com/ISRC2/status/393732652542349312
392726654654906368	ValleyoftheMoms	 sometimes kid asthma needs lawyer doctor emrotayl child asthma related poverty chadpriestmesh says yes tedxind 	2013-10-22	0	0	@emrotayl @ChadPriestMESH	#TEDxIND		https://twitter.com/ValleyoftheMoms/status/392726654654906368
392665963927068672	britmc	 seriously hate asthma doctor left two vms schedule appt got hung on inhaler puffs left assholes	2013-10-22	0	0				https://twitter.com/britmc/status/392665963927068672
391727533604872192	AaronAtay14	 know something hilarious actually use inhaler calm f downand dont even asthma	2013-10-19	0	0				https://twitter.com/AaronAtay14/status/391727533604872192
390815531927740416	musical_wiz	 damn near asthma attack morning smfh	2013-10-17	0	0				https://twitter.com/musical_wiz/status/390815531927740416
390698325017907200	rbowensmusicco	 killa_kam might psycho faking asthma attack wouldve weak bro	2013-10-17	0	0	@Killa_Kam09			https://twitter.com/rbowensmusicco/status/390698325017907200
387894285380890624	that_girl_lola	 cold air asthma proved poor combo today church iron http sqcom ievzk	2013-10-09	0	0	@Church			https://twitter.com/that_girl_lola/status/387894285380890624
387786358213066752	juneXV_15	 walking hall library midnight feel asthma attack coming taatas clearly arent keeping warm	2013-10-08	0	0				https://twitter.com/juneXV_15/status/387786358213066752
387618500912488448	chantastic11	 itweetfacts people asthma hear better without it nottrue	2013-10-08	0	0	@iTweetFacts	#nottrue		https://twitter.com/chantastic11/status/387618500912488448
386523166140424192	KittyHasFleaz	 augh hate fall perfect asthma weather 	2013-10-05	0	0				https://twitter.com/KittyHasFleaz/status/386523166140424192
385729198230630400	GaryCKern	 quest breathe free continues allergy asthma clinical immunology associates http sqcom qvn	2013-10-03	0	0	@Allergy			https://twitter.com/GaryCKern/status/385729198230630400
385517902872313858	IndianapolisCP	 cpap study shows hope asthma patients researchers hope found groundbreaking treatment asthma http dlvrit j lf	2013-10-02	0	0				https://twitter.com/IndianapolisCP/status/385517902872313858
384424697414168577	torit1127	 baby got asthma newtome	2013-09-29	0	0		#NewToMe		https://twitter.com/torit1127/status/384424697414168577
384381963672367104	ambie_bambi_13	 i wish cute laugh one laughs make people laugh sound like hyperventilating walrus asthma 	2013-09-29	0	0				https://twitter.com/ambie_bambi_13/status/384381963672367104
383066531971608576	Living4_Damon	 mahh asthma messing wit mhee 	2013-09-25	0	0				https://twitter.com/Living4_Damon/status/383066531971608576
382867637308358656	DodgerGreywing	 albuterol nothing except make jittery im asthma attack im shaking uncontrollably	2013-09-25	0	0				https://twitter.com/DodgerGreywing/status/382867637308358656
382718446502707200	MarcusNicholsNM	 write physiology paper asthma nephrotic syndrome	2013-09-25	0	0				https://twitter.com/MarcusNicholsNM/status/382718446502707200
382678410863980544	Bwillis84	 slimkaaaatie shirt tight nipples asthma attacks jacobslick	2013-09-24	0	1	@slimkaaaatie @JacobSlick			https://twitter.com/Bwillis84/status/382678410863980544
382579042274140160	kaaylisle	 bitch asthma dont spray shit youll kill	2013-09-24	0	0				https://twitter.com/kaaylisle/status/382579042274140160
382003291111956480	Erikaalynnnnn_	 asthma attack shit joke thank god getting	2013-09-23	0	0				https://twitter.com/Erikaalynnnnn_/status/382003291111956480
381781476104474624	jessktweets	 awesome morning run til asthma attack roughmorning	2013-09-22	0	0		#RoughMorning		https://twitter.com/jessktweets/status/381781476104474624
380116310203449345	Mikey0263	 good work today still tightness chest asthma feeling disappointed defeated	2013-09-17	0	0				https://twitter.com/Mikey0263/status/380116310203449345
379605934525665280	Jamole_Callahan	 kids asthma acting dr yancys office http sqcom d kt	2013-09-16	0	0	@Dr			https://twitter.com/Jamole_Callahan/status/379605934525665280
379418983226548224	hederleth	 able sit church reconciliation incense triggers asthma catholicskwlgrl classic	2013-09-15	0	1	@CATHOLICskwlGRL	#classic		https://twitter.com/hederleth/status/379418983226548224
375513330065997824	JessieFreakinB	 fuuuuuuuuuck asthma hard years shit fun	2013-09-05	0	0				https://twitter.com/JessieFreakinB/status/375513330065997824
375479025382084608	Beloved31075	 semipsychedelic lol nyquil babyyyyyy mine came fine well besides epilepsy asthma blame dad 	2013-09-05	0	0	@Semipsychedelic			https://twitter.com/Beloved31075/status/375479025382084608
374264322165202944	NickehYo	 know youre fun asthma attack	2013-09-01	1	0				https://twitter.com/NickehYo/status/374264322165202944
374050512200425473	NickehYo	 first asthma attack tonight hahahahavavaca	2013-09-01	0	0				https://twitter.com/NickehYo/status/374050512200425473
373232931554082816	LizG1788	 pharmacy called today let know allergy asthma season approaching forget get prescriptions nerdstatus	2013-08-29	0	0		#NerdStatus		https://twitter.com/LizG1788/status/373232931554082816
373186066448003072	AaronAtay14	 ila halfway chair taylor crying rolling slouched seats sydney bout almost asthma attack	2013-08-29	0	0				https://twitter.com/AaronAtay14/status/373186066448003072
372433101986598912	IndianapolisCP	 woman officer ignored asthma attack woman says lawsuit went asthma attack was http dlvrit sgwrc	2013-08-27	0	0				https://twitter.com/IndianapolisCP/status/372433101986598912
372433098354327552	IndianapolisCP	 woman says indiana state trooper ignored asthma attack woman says lawsuit went asthma http dlvrit sgwpd	2013-08-27	0	0				https://twitter.com/IndianapolisCP/status/372433098354327552
372212580523077632	MasonSlinker	 magic_mat haha give asthma either	2013-08-27	0	0	@Magic_Mat171			https://twitter.com/MasonSlinker/status/372212580523077632
370531140404535296	GaryCKern	 yup morning continues allergy asthma clinical immunology associates http sqcom gylkb	2013-08-22	0	0	@Allergy			https://twitter.com/GaryCKern/status/370531140404535296
369805813482651648	rosesareredd19	 laugh sounds like hyperventilating walrus asthma laughing hard marissasimmons thatisus	2013-08-20	0	1	@MarissaSimmons1	#thatisus		https://twitter.com/rosesareredd19/status/369805813482651648
368530740947853312	Straight_Menace	 asthma right 	2013-08-16	0	0				https://twitter.com/Straight_Menace/status/368530740947853312
368146661085696002	DemiGodSean	 fact lot sex unblock stuffed nose sex also natural antihistamine help combat asthma hay fever	2013-08-15	1	0	@Fact			https://twitter.com/DemiGodSean/status/368146661085696002
367528891235053569	vinvin3hoes	 u asthma cuz u got dat ass lolz died	2013-08-14	0	0		#died		https://twitter.com/vinvin3hoes/status/367528891235053569
367399396826034177	ash_leiiighann	 thank god bros asthma doc finally got puts cig body could incubated cuz asthmas bad	2013-08-13	0	0				https://twitter.com/ash_leiiighann/status/367399396826034177
366607204188553216	IndianapolisCP	 asthma action plan new school year summer ends change temperature allergens environment http dlvrit nsnhc	2013-08-11	0	0				https://twitter.com/IndianapolisCP/status/366607204188553216
366591536252715010	IndianapolisCP	 asthma action plan new school year summer ends change temperature allergens environment http dlvrit nrwt 	2013-08-11	0	0				https://twitter.com/IndianapolisCP/status/366591536252715010
364110428676161536	destanidawnn	 cause shawty cant run heat got bad asthma	2013-08-04	0	0				https://twitter.com/destanidawnn/status/364110428676161536
361831787778936832	lizzie_meyer97	 kristindeshea__ todays conditioning going rough ass day asthmaprobs noinhaler itll rough dont even asthma	2013-07-29	0	1	@kristindeshea__	#asthmaprobs #noinhaler		https://twitter.com/lizzie_meyer97/status/361831787778936832
360505029163098112	rossgood54	 feel like im asthma attack dont even asthma	2013-07-25	0	1				https://twitter.com/rossgood54/status/360505029163098112
360472579133284352	daddysadidas	 ziallidek harry asthma hell miss twins	2013-07-25	0	0	@ziallidek			https://twitter.com/daddysadidas/status/360472579133284352
359885043302281218	chbaran413	 need stop touching me asthma attack live_love_loren she doesnt asthma 	2013-07-23	0	0	@Live_Love_LOREN			https://twitter.com/chbaran413/status/359885043302281218
358813453605027840	TrinidadTaedo	 _immewhoryou day seen u dennys wit yo fam months ago left hospital asthma attack lbvs	2013-07-21	0	0	@_ImMeWhoRYou			https://twitter.com/TrinidadTaedo/status/358813453605027840
358812648210567169	TrinidadTaedo	 shouldnt smoke kuz got really bad asthma still anyway lbvs	2013-07-21	0	0				https://twitter.com/TrinidadTaedo/status/358812648210567169
355876420406362114	mickenzievought	 people still get asthma thought beat that thingsmyfiancesays voughtp	2013-07-12	0	1	@voughtp	#thingsmyfiancesays		https://twitter.com/mickenzievought/status/355876420406362114
