id	Username	Text	Date	Retweets	Favorites	Mentions	Hashtags	Geo	Permalink
397862864012054528	name_blueberry	 love insurance covers transgender surgery services doesnt cover asthma allergy testing nice ilovebeingaman aachoo	2013-11-05	0	0		#nice #ilovebeingaman #aachoo		https://twitter.com/name_blueberry/status/397862864012054528
394097178743828480	samplencner	 cold makes asthma way worse really	2013-10-26	1	1				https://twitter.com/samplencner/status/394097178743828480
382569374625714176	MojoFlexx	 nicknamed dick asthma leaves bitches breathless swag	2013-09-24	0	0		#swag		https://twitter.com/MojoFlexx/status/382569374625714176
372136149952634880	samplencner	 asthma joke seriously sucks	2013-08-26	1	6				https://twitter.com/samplencner/status/372136149952634880
349895678572498944	TweetyDizzle	 cant wait get asthma control	2013-06-26	0	0				https://twitter.com/TweetyDizzle/status/349895678572498944
349007574605119488	TweetyDizzle	 asthma really getting nervesbreathing machine inhaler working	2013-06-23	0	0				https://twitter.com/TweetyDizzle/status/349007574605119488
341668434301579264	samplencner	 hate asthma	2013-06-03	3	3				https://twitter.com/samplencner/status/341668434301579264
335145817491001344	samplencner	 asthma ruins everything go runs	2013-05-16	0	0				https://twitter.com/samplencner/status/335145817491001344
316326640940625921	PutasLoveChica	 x_salutered dont chase hoes got asthma shrugs	2013-03-25	0	0	@x_SaluteRed			https://twitter.com/PutasLoveChica/status/316326640940625921
315194025869185024	PutasLoveChica	 really wanted go tonight fuck asthma rs	2013-03-22	0	0				https://twitter.com/PutasLoveChica/status/315194025869185024
400397904130494465	chutch09	 get sniped bad practice one teammates asthma attack laughing hard	2013-11-12	0	9				https://twitter.com/chutch09/status/400397904130494465
350028715100618752	baaileyjones	 brody sent video kitty named juan asthma attack um say devil worshiper	2013-06-26	0	0				https://twitter.com/baaileyjones/status/350028715100618752
399339786613555201	CoolCatsAndFire	 asthma roll window	2013-11-09	0	0				https://twitter.com/CoolCatsAndFire/status/399339786613555201
392439502993911809	kaitlinmcgheee	 muh_lory hes severe asthma attack	2013-10-21	0	0	@muh_lory			https://twitter.com/kaitlinmcgheee/status/392439502993911809
381554366966018048	I_Speak_Music_	 doctor single triggers asthma theyre cigarettes cold weather fast physical movements daily	2013-09-21	0	0				https://twitter.com/I_Speak_Music_/status/381554366966018048
360099601556045824	staceywheelerxo	 guys_codes nicknamed dick asthma leaves bitches breathless	2013-07-24	0	0	@Guys_Codes			https://twitter.com/staceywheelerxo/status/360099601556045824
350016382588567552	stephondupreepr	 aint chasing bitch got asthma 	2013-06-26	15	13				https://twitter.com/stephondupreepr/status/350016382588567552
316515491348877312	topix_in	 camp notagonnawheeze teaches kids cope asthma fun http bitly vi tb evansville indiana	2013-03-26	0	0		#Evansville #Indiana		https://twitter.com/topix_in/status/316515491348877312
299369123228557312	SydnieeNicole	 say prayer niece avery asthma attack were riley hospital popped blood vessels around eyes news yet	2013-02-06	0	0				https://twitter.com/SydnieeNicole/status/299369123228557312
401910044737818624	AnDyWaN1138	 oh yea lets totally asthma attack without inhaler interesting	2013-11-16	0	0				https://twitter.com/AnDyWaN1138/status/401910044737818624
340669781441126401	dirtykanoda03	 i nicknamed dick asthma leaves bitches breathless idc thats funny	2013-05-31	0	3				https://twitter.com/dirtykanoda03/status/340669781441126401
384800274033819648	menerjerffffff	 sexylads realized harry niall asthma long ago	2013-09-30	0	0	@5sexylads			https://twitter.com/menerjerffffff/status/384800274033819648
377431599178342400	paddyhaggs	 cheannyboy ill give asthma	2013-09-10	0	1	@CheannyBoy			https://twitter.com/paddyhaggs/status/377431599178342400
371796282966163456	nikikiki_	 asthma attack commercial creepin	2013-08-25	0	0				https://twitter.com/nikikiki_/status/371796282966163456
365275282686476289	hipsterspice	 daylong asthma attack body hates me	2013-08-07	0	0				https://twitter.com/hipsterspice/status/365275282686476289
352242213280948224	Lord_Will_	 got two pumps one asthma	2013-07-02	0	0				https://twitter.com/Lord_Will_/status/352242213280948224
344611752870301697	Indian__Thugg	 call asthma cause ileave niqqas breathless 	2013-06-11	0	0				https://twitter.com/Indian__Thugg/status/344611752870301697
339312946603769858	GetLPNJobs	 allergy asthma rnlpncma southbend http tinyurlcompymulhc get lpn jobs lpn jobs job getalljobs	2013-05-28	0	0		#SouthBend #LPN #jobs #job #GetAllJobs		https://twitter.com/GetLPNJobs/status/339312946603769858
339176988143124480	GetLPNJobs	 allergy asthma rnlpncma southbend http tinyurlcomorx l get lpn jobs lpn jobs job getalljobs	2013-05-27	0	0		#SouthBend #LPN #jobs #job #GetAllJobs		https://twitter.com/GetLPNJobs/status/339176988143124480
333788197840642048	Big_Mac_Jay23	 numbero_juan last summer lol went beach asthma attack	2013-05-12	0	1	@Numbero_JUAN			https://twitter.com/Big_Mac_Jay23/status/333788197840642048
297903327939796993	Chic_Sweetie	 teresze gon kill us lol know scared night walkin lmaotalking bout got asthma	2013-02-02	1	0				https://twitter.com/Chic_Sweetie/status/297903327939796993
295953134239498240	OddestOfTheOdd1	 asthma honestly gonna death me soon cant breathe fish water	2013-01-28	0	0				https://twitter.com/OddestOfTheOdd1/status/295953134239498240
294240039599235072	AmourPerdu_	 candii_socute canti asthma really dont know want do school want go to	2013-01-23	0	0	@Candii_socute			https://twitter.com/AmourPerdu_/status/294240039599235072
289559136214077440	Tbibbs1	 pneumonia flu asthma attack upper respiratory infection me laying waiting scandal	2013-01-10	0	0				https://twitter.com/Tbibbs1/status/289559136214077440
289126445488418817	Nicole_OnOne	 asthma attack today 	2013-01-09	0	0				https://twitter.com/Nicole_OnOne/status/289126445488418817
320819048579489792	S1MPLY_m333	 thank ones helped asthma attack love appreciation guys wasnt yall prolly would died	2013-04-07	0	1				https://twitter.com/S1MPLY_m333/status/320819048579489792
316649604689055744	CoRiLaShAe	 sweetiz_dataste hey gurl asthma 	2013-03-26	0	0	@SweetIz_DaTaste			https://twitter.com/CoRiLaShAe/status/316649604689055744
406057877493665792	_LipstickJunkie	 im chasing niggas got asthma	2013-11-28	0	0				https://twitter.com/_LipstickJunkie/status/406057877493665792
400294686591430657	DodgerGreywing	 ill start giving shit problems stop aggravating asthma horrible stench	2013-11-12	0	0				https://twitter.com/DodgerGreywing/status/400294686591430657
398998170887155712	thecolincrouse	 anthrax wax give ya asthma attacksss	2013-11-08	0	0				https://twitter.com/thecolincrouse/status/398998170887155712
398553182999044097	MarcusNicholsNM	 asthma attack personal fitness today emts came give ekg cool	2013-11-07	0	0				https://twitter.com/MarcusNicholsNM/status/398553182999044097
390698325017907200	rbowensmusicco	 killa_kam might psycho faking asthma attack wouldve weak bro	2013-10-17	0	0	@Killa_Kam09			https://twitter.com/rbowensmusicco/status/390698325017907200
382867637308358656	DodgerGreywing	 albuterol nothing except make jittery im asthma attack im shaking uncontrollably	2013-09-25	0	0				https://twitter.com/DodgerGreywing/status/382867637308358656
382718446502707200	MarcusNicholsNM	 write physiology paper asthma nephrotic syndrome	2013-09-25	0	0				https://twitter.com/MarcusNicholsNM/status/382718446502707200
307684430208696320	HoffmanKelley	 julifisher asthma really bad cannot get better plus food getting stuck says eating	2013-03-01	0	0	@julifisher13			https://twitter.com/HoffmanKelley/status/307684430208696320
296685607374159872	a_la_mode04	 humidityrunning outside asthma not good combination ouch cant breathee nopain nogain	2013-01-30	0	0		#ouch #nopain #nogain		https://twitter.com/a_la_mode04/status/296685607374159872
413364393070448640	sevensatans	 also asthma 	2013-12-18	0	0				https://twitter.com/sevensatans/status/413364393070448640
410637844005552128	_ashleyhughes	 bronchitis sucks asthma top sucks even	2013-12-11	0	0				https://twitter.com/_ashleyhughes/status/410637844005552128
410557253968998400	_ashleyhughes	 found bronchitis asthma least know ive felt shitty	2013-12-10	0	1				https://twitter.com/_ashleyhughes/status/410557253968998400
399557510681853952	lakotanakisa	 shouldnt get drunk anymore laugh hard asthma attack	2013-11-10	0	0				https://twitter.com/lakotanakisa/status/399557510681853952
393699977320730624	Tamerlane_suman	 ghettoblackmom last night twerking club asthma attack 	2013-10-25	0	0	@Ghettoblackmom			https://twitter.com/Tamerlane_suman/status/393699977320730624
378353181647847425	LPod21	 roommate talking guy likes her we cant date nothing common smoke weed asthma lmfao	2013-09-12	1	1				https://twitter.com/LPod21/status/378353181647847425
349897005373464577	kcbani01	 asthma fucking sucks	2013-06-26	0	0				https://twitter.com/kcbani01/status/349897005373464577
340729294894542848	sharneceas	 remember biggie said run police picture that nigga im fat id fuck around catch asthma attack	2013-06-01	0	0				https://twitter.com/sharneceas/status/340729294894542848
336929278207856640	jbaurley	 im family allergy asthma new albany in http sqcom unvtt	2013-05-21	0	0				https://twitter.com/jbaurley/status/336929278207856640
301096726125744128	BlakeStewart24	 hate allegeries asthma thestruggle	2013-02-11	1	0		#TheStruggle		https://twitter.com/BlakeStewart24/status/301096726125744128
335636921382498304	SaraMcLaughlin1	 cat house something wheezing like this suddenly develop asthma 	2013-05-18	0	0				https://twitter.com/SaraMcLaughlin1/status/335636921382498304
372212580523077632	MasonSlinker	 magic_mat haha give asthma either	2013-08-27	0	0	@Magic_Mat171			https://twitter.com/MasonSlinker/status/372212580523077632
