id	Username	Text	Date	Retweets	Favorites	Mentions	Hashtags	Geo	Permalink
336606099581063169	Dev__Black	 usually asthma attacks dont phase one major panicd	2013-05-20	0	0				https://twitter.com/Dev__Black/status/336606099581063169
322145772034457600	highestgrade_	 call holdin on im cuz evidently aint going nowhere headache top asthma isnt at	2013-04-10	0	0				https://twitter.com/highestgrade_/status/322145772034457600
322066254313697282	highestgrade_	 _iputgod st pollen triggers allergies triggers asthma always im home now	2013-04-10	0	0	@_iputGOD1st			https://twitter.com/highestgrade_/status/322066254313697282
321263445745999872	emilynesbit	 started week health center breathing treatment diagnosis bronchitis asthma happymonday	2013-04-08	0	0		#asthma #happymonday		https://twitter.com/emilynesbit/status/321263445745999872
320568048077651968	Dev__Black	 im real deal mad die today asthma attack hunt followers til u die	2013-04-06	0	0				https://twitter.com/Dev__Black/status/320568048077651968
320567293174247427	Dev__Black	 wish sum bad upon tha people follow me asked yall thousand times fa dollars fa asthma pump	2013-04-06	0	0				https://twitter.com/Dev__Black/status/320567293174247427
320561154214727680	Dev__Black	 dude sum body fuckin buy asthma pump damn ill pay tha bak yall sum bitches	2013-04-06	0	0				https://twitter.com/Dev__Black/status/320561154214727680
320414744475488256	Dev__Black	 sumbody please give dollars asthma pump yall understand severity situation	2013-04-06	0	0				https://twitter.com/Dev__Black/status/320414744475488256
320186959714734082	Dev__Black	 sumbody asthma pump die next pay check	2013-04-05	0	0				https://twitter.com/Dev__Black/status/320186959714734082
319860738854371328	Dev__Black	 got asthma tho	2013-04-04	0	0				https://twitter.com/Dev__Black/status/319860738854371328
319543606320975872	Dev__Black	 sumbody willing pay fa asthma pump	2013-04-03	0	0				https://twitter.com/Dev__Black/status/319543606320975872
316204496831270913	emilynesbit	 h asthma cantbreathe	2013-03-25	0	0		#cantbreathe		https://twitter.com/emilynesbit/status/316204496831270913
309695927579447296	Dev__Black	 wheres asthma pump	2013-03-07	0	0				https://twitter.com/Dev__Black/status/309695927579447296
403728478756827136	SwaRe2U	 asthma scandal	2013-11-21	0	0		#Scandal		https://twitter.com/SwaRe2U/status/403728478756827136
399959162123456512	1Lashedrick	 chase you got asthma cant	2013-11-11	0	0				https://twitter.com/1Lashedrick/status/399959162123456512
394974157425106944	Robbo_55	 one guy class keeps saying whatever topic presented far topics asthma diabetes alcohol abuse	2013-10-28	0	0				https://twitter.com/Robbo_55/status/394974157425106944
393531054155235328	1Lashedrick	 got asthma girl cant chase	2013-10-24	0	0				https://twitter.com/1Lashedrick/status/393531054155235328
393505598475882496	aphroditee___	 changing weather asthma going wild	2013-10-24	0	0				https://twitter.com/aphroditee___/status/393505598475882496
393213924889595904	aphroditee___	 asthma plus allergies 	2013-10-23	0	0				https://twitter.com/aphroditee___/status/393213924889595904
393213789799448576	aphroditee___	 feel horrible havent real asthma attack like	2013-10-23	0	0				https://twitter.com/aphroditee___/status/393213789799448576
392664672979406848	aphroditee___	 need get checked out chest hurting bad feel like im verge asthma attack	2013-10-22	0	0				https://twitter.com/aphroditee___/status/392664672979406848
377980278293008384	TeeLow_theGyzzl	 take asthma meds nod since phone died	2013-09-11	0	0				https://twitter.com/TeeLow_theGyzzl/status/377980278293008384
331605866564419584	KemmiaG	 hope son outgrows asthma	2013-05-06	0	0				https://twitter.com/KemmiaG/status/331605866564419584
331605812436951042	KemmiaG	 asthma aint joke	2013-05-06	0	0				https://twitter.com/KemmiaG/status/331605812436951042
365636421123440642	ashleyraeyoung4	 asthma attack bed ridiculous	2013-08-08	0	0		#ridiculous		https://twitter.com/ashleyraeyoung4/status/365636421123440642
363814840466284544	lindsey_creswel	 love asthma	2013-08-03	3	1				https://twitter.com/lindsey_creswel/status/363814840466284544
400118635118608384	662LilDee	 dont chase hoes got asthma lol	2013-11-11	0	0				https://twitter.com/662LilDee/status/400118635118608384
354344749391556608	CUTIEPIEEWING	 hate asthma	2013-07-08	0	0				https://twitter.com/CUTIEPIEEWING/status/354344749391556608
305520711315886081	angeleyes2cute	 long hold breath asthma attack 	2013-02-23	0	0				https://twitter.com/angeleyes2cute/status/305520711315886081
329701474152103936	BeautifulMe_Sha	 asthma bad 	2013-05-01	0	0				https://twitter.com/BeautifulMe_Sha/status/329701474152103936
313424996007563264	SheDrippy_Juicy	 wont let leave sight since thet asthma attack	2013-03-17	0	0				https://twitter.com/SheDrippy_Juicy/status/313424996007563264
305520711315886081	angeleyes2cute	 long hold breath asthma attack 	2013-02-23	0	0				https://twitter.com/angeleyes2cute/status/305520711315886081
300380199277719552	_little_italy	 dog asthma attack get home shes excited see truelove	2013-02-09	0	0		#TrueLove		https://twitter.com/_little_italy/status/300380199277719552
299720981671469056	E4Envey_	 um stomach hurts asthma kicking 	2013-02-07	0	0				https://twitter.com/E4Envey_/status/299720981671469056
394331407096762368	x_brina2TIMESx	 gotta take deep breaths like got asthma something	2013-10-27	0	0				https://twitter.com/x_brina2TIMESx/status/394331407096762368
374226690626428928	Got_MO_ass	 really gotta go get checked asthma weak hell here barely breathing shit seriously	2013-09-01	0	1				https://twitter.com/Got_MO_ass/status/374226690626428928
301318502114021376	born2differ_	 people asthma know 	2013-02-12	0	0				https://twitter.com/born2differ_/status/301318502114021376
383440375249395712	iiMFLYii	 wooda_shudacuda gahhleee dont asthma	2013-09-26	0	0	@WOODa_ShudaCuda			https://twitter.com/iiMFLYii/status/383440375249395712
379470503494582272	shelbyfaith102	 sarah_branch morganeguia asthma 	2013-09-16	0	0	@sarah_branch7 @morganeguia			https://twitter.com/shelbyfaith102/status/379470503494582272
369475487233372160	Damn_itsVEZ	 think im either gonna anxiety attack panic attack asthma attack	2013-08-19	0	0				https://twitter.com/Damn_itsVEZ/status/369475487233372160
353243938812985347	laeryVSlarry	 lil nephew finna asthma attack fun	2013-07-05	0	0				https://twitter.com/laeryVSlarry/status/353243938812985347
344101865312620545	HelloAllieCat42	 thecommoncock calling penis asthma leaves bitches breathless truuu	2013-06-10	0	0	@TheCommonCock			https://twitter.com/HelloAllieCat42/status/344101865312620545
311761584940789761	WTVAalan	 currently f outside clear skies er year old niece shes another asthma attack prayers please	2013-03-13	0	0				https://twitter.com/WTVAalan/status/311761584940789761
412241140008497152	He_Ate_MyTweet	 cant chase bitches got asthma	2013-12-15	0	0				https://twitter.com/He_Ate_MyTweet/status/412241140008497152
311761584940789761	WTVAalan	 currently f outside clear skies er year old niece shes another asthma attack prayers please	2013-03-13	0	0				https://twitter.com/WTVAalan/status/311761584940789761
413097730529951745	annieblairr	 thats terrible moment im runner cant run far cause developed sports induced asthma 	2013-12-17	0	1				https://twitter.com/annieblairr/status/413097730529951745
409372001615093760	NWDuval904	 lol rt mydickiscalled dick called asthma leaves bitches breathless	2013-12-07	0	0	@MyDickIsCalled			https://twitter.com/NWDuval904/status/409372001615093760
388072457971576832	Nemot_	 youngpvndv asthma acting	2013-10-09	0	0	@youngpVndV			https://twitter.com/Nemot_/status/388072457971576832
382172991452639232	BiigFine_Horse	 wrestling bay hittn pump im dam old asthma attacks	2013-09-23	0	0				https://twitter.com/BiigFine_Horse/status/382172991452639232
363751118653751297	khowieXOXO	 random asthma attacks arent cool brah	2013-08-03	0	0				https://twitter.com/khowieXOXO/status/363751118653751297
363750982309527552	khowieXOXO	 hate asthma cause every time pass smoker somewhere someone recently smoked hack lung	2013-08-03	0	0				https://twitter.com/khowieXOXO/status/363750982309527552
333422805129515008	pologuru	 ekyagle_hunter need asthma pumpno bitch need money stop stealing	2013-05-11	0	0	@EkyAGLE_hunter			https://twitter.com/pologuru/status/333422805129515008
331574846247038976	xStunningMo	 lil scrappy cant thugg nigga got asthma	2013-05-06	1	0				https://twitter.com/xStunningMo/status/331574846247038976
313822484434653185	V0sterr	 paulinenguyenn lol used inhaler younger its cause asthma 	2013-03-18	0	0	@paulinenguyenn			https://twitter.com/V0sterr/status/313822484434653185
384088375122485248	missIdBmad2	 really would like blow one sons sister asthma dont wanna smoke around her	2013-09-28	0	0				https://twitter.com/missIdBmad2/status/384088375122485248
363751118653751297	khowieXOXO	 random asthma attacks arent cool brah	2013-08-03	0	0				https://twitter.com/khowieXOXO/status/363751118653751297
363750982309527552	khowieXOXO	 hate asthma cause every time pass smoker somewhere someone recently smoked hack lung	2013-08-03	0	0				https://twitter.com/khowieXOXO/status/363750982309527552
302854905209712640	B_miley13	 n nunu asthma lol	2013-02-16	0	0				https://twitter.com/B_miley13/status/302854905209712640
330929096613830656	2Kute_Jaz	 bitch said asthma attack	2013-05-05	0	0				https://twitter.com/2Kute_Jaz/status/330929096613830656
394992398012387328	_MasterMind94	 __gorgeousflaws asthma attack haunted trail friday damn stupid man	2013-10-28	0	0	@__GorgeousFlaws			https://twitter.com/_MasterMind94/status/394992398012387328
303759002402172928	JBooDaYungan	 excusemipimpin hunnad_tatts yo dresser back ass biscuit face ass asthma pump built ass	2013-02-19	0	0	@excusemipimpin @hunnad_tatts			https://twitter.com/JBooDaYungan/status/303759002402172928
365636421123440642	ashleyraeyoung4	 asthma attack bed ridiculous	2013-08-08	0	0		#ridiculous		https://twitter.com/ashleyraeyoung4/status/365636421123440642
365608921748090881	ashleyraeyoung4	 working would much easier wo asthma unnecessary	2013-08-08	0	0		#unnecessary		https://twitter.com/ashleyraeyoung4/status/365608921748090881
364971245776805888	1ofDa7wonderZ	 ladiesbelovinme damn outchea giving asthma attacks	2013-08-07	0	0	@LadiesBeLovinMe			https://twitter.com/1ofDa7wonderZ/status/364971245776805888
363814840466284544	lindsey_creswel	 love asthma	2013-08-03	3	1				https://twitter.com/lindsey_creswel/status/363814840466284544
347200447683108864	LA_JEFE1	 think im finna asthma attack	2013-06-18	0	0				https://twitter.com/LA_JEFE1/status/347200447683108864
347607512318619648	REPPIN_HOD	 bay gone mess around asthma attack	2013-06-20	0	0				https://twitter.com/REPPIN_HOD/status/347607512318619648
