id	Username	Text	Date	Retweets	Favorites	Mentions	Hashtags	Geo	Permalink
462592639607795713	___Kees	 br wnsugarr asthma attack	2014-05-03	0	0	@Br0wnsugarr			https://twitter.com/___Kees/status/462592639607795713
460249198609596416	nonchalantNeesh	 asthma sooooo annoying	2014-04-26	2	0				https://twitter.com/nonchalantNeesh/status/460249198609596416
456524327685324801	DiorMarieee	 lowkeyy hell nah nigga almost asthma attack	2014-04-16	0	0	@LowKeyy97			https://twitter.com/DiorMarieee/status/456524327685324801
452876700767256576	LilDaeDae_	 asthma	2014-04-06	0	0				https://twitter.com/LilDaeDae_/status/452876700767256576
451866065963081728	kakarrott	 im suffering bad asthma attack nd bissellclean machine lowes left bad odor	2014-04-03	0	0	@BISSELLclean @lowes	#1136		https://twitter.com/kakarrott/status/451866065963081728
450405995110727680	nonchalantNeesh	 asthma loves get nerves cant breath normally	2014-03-30	0	0				https://twitter.com/nonchalantNeesh/status/450405995110727680
438199295569707009	Bransolino	 __lifeofjames gotta take treatment asthma	2014-02-25	0	0	@__LifeOfJames			https://twitter.com/Bransolino/status/438199295569707009
438171115534315520	Bransolino	 yung__hippy yea asthma glook	2014-02-24	0	0	@Yung__hippy			https://twitter.com/Bransolino/status/438171115534315520
436356708739608577	Bransolino	 nobody understands bad hate asthma around time weather changes	2014-02-19	0	0				https://twitter.com/Bransolino/status/436356708739608577
436354502363713536	Bransolino	 livelongmook yea im good asthma started fucking	2014-02-19	0	0	@LiveLongMook			https://twitter.com/Bransolino/status/436354502363713536
423948353517662208	nonchalantNeesh	 trillgotti dont chase hoes asthma	2014-01-16	0	0	@TrillGotti			https://twitter.com/nonchalantNeesh/status/423948353517662208
423086802279600128	nonchalantNeesh	 asthma acting up dont time	2014-01-14	1	0				https://twitter.com/nonchalantNeesh/status/423086802279600128
506194655701393410	AyeYO_lexiii	 asthma bitch	2014-08-31	0	1				https://twitter.com/AyeYO_lexiii/status/506194655701393410
453028656810819584	donnnaxcx	 asthma anxiety good combination let tell	2014-04-07	0	1				https://twitter.com/donnnaxcx/status/453028656810819584
432470448652443648	Poohdusss	 let bitches pump like asthma attack	2014-02-09	0	0				https://twitter.com/Poohdusss/status/432470448652443648
516751268594073600	KG_2	 woodsey sad_o_sky coulda ran pulled asthma attack	2014-09-29	0	0	@Woodsey4 @Sad_O_Sky			https://twitter.com/KG_2/status/516751268594073600
487067915859267584	blaineswanzy	 danistyles commonblackgiri asthma problem life	2014-07-09	0	1	@DaniStyles101 @CommonBlackGirI			https://twitter.com/blaineswanzy/status/487067915859267584
481505827254435841	Odd_Zxggy	 run police picture nigga im fat ill fuck around catch asthma attack	2014-06-24	0	0				https://twitter.com/Odd_Zxggy/status/481505827254435841
432470448652443648	Poohdusss	 let bitches pump like asthma attack	2014-02-09	0	0				https://twitter.com/Poohdusss/status/432470448652443648
512758553216425984	EmCashh	 omg eff asthma little bitch	2014-09-18	0	0				https://twitter.com/EmCashh/status/512758553216425984
543179911528448000	aesposito1	 got two jobs im still broke got bad asthma still smoke	2014-12-11	0	4				https://twitter.com/aesposito1/status/543179911528448000
530091660202770435	iLikeKarenDaily	 hey cures asthma 	2014-11-05	0	1				https://twitter.com/iLikeKarenDaily/status/530091660202770435
530091509266518016	iLikeKarenDaily	 learned pharmacology asthma sleep next chihuahua dog get asthma die shortly	2014-11-05	0	1				https://twitter.com/iLikeKarenDaily/status/530091509266518016
513658639559983104	maggie_snyder	 lol since thx asthma	2014-09-21	0	0				https://twitter.com/maggie_snyder/status/513658639559983104
491697358514556928	_keshawnj	 kevonstage im dying preacher asthma attack akeelah bee references nice touch	2014-07-22	0	0	@KevOnStage			https://twitter.com/_keshawnj/status/491697358514556928
467121493277949954	kailee5250	 walking street new york gives sense cultural history walking street la gives asthma ilovenyc	2014-05-15	0	0		#ilovenyc		https://twitter.com/kailee5250/status/467121493277949954
456807060995600384	gypsylizzy	 nothing like asthma attack almost passing trying find inhaler thefinalcountdown howyadoin	2014-04-17	0	0		#thefinalcountdown #howyadoin		https://twitter.com/gypsylizzy/status/456807060995600384
449410656652259328	THRoWtHAtCaSH_K	 hate asthma attacks	2014-03-28	0	1				https://twitter.com/THRoWtHAtCaSH_K/status/449410656652259328
437429106075242496	KristinColvin	 asthma whitney allergic	2014-02-22	0	0				https://twitter.com/KristinColvin/status/437429106075242496
435214831306960896	CarnationSophia	 commoncock calling penis asthma leaves bitches breathless jenn_ford 	2014-02-16	1	0	@CommonCock @jenn_ford94			https://twitter.com/CarnationSophia/status/435214831306960896
433606331153797120	AshleyJeter3	 asthma attack help	2014-02-12	0	0		#help		https://twitter.com/AshleyJeter3/status/433606331153797120
432709949857480705	gypsylizzy	 vaguely remembering asthma attack last night awk	2014-02-09	0	0		#awk		https://twitter.com/gypsylizzy/status/432709949857480705
430158038172180480	Jas_keepsit100	 rocking lil guy sleephis asthma done kicked today	2014-02-02	0	0				https://twitter.com/Jas_keepsit100/status/430158038172180480
428885929458401280	ClaireMaria13	 walking class cold asthma 	2014-01-30	1	1				https://twitter.com/ClaireMaria13/status/428885929458401280
425990624010309632	LOVELY1_3	 jarricabanks son weather asthma mix smh coughed allllllllll night long sadmommytweet naj	2014-01-22	0	0	@JarricaBanks	#sadmommytweet		https://twitter.com/LOVELY1_3/status/425990624010309632
423895150268801025	Lettesara	 got er asthma attack moring	2014-01-16	0	0				https://twitter.com/Lettesara/status/423895150268801025
423278045030793217	TboyJude	 dont chase hoes got asthma lol	2014-01-14	0	0				https://twitter.com/TboyJude/status/423278045030793217
505506220485386240	ClaireMaria13	 allergies asthma attack anxiety roof ill go bed	2014-08-29	0	0				https://twitter.com/ClaireMaria13/status/505506220485386240
479040314682773504	ClaireMaria13	 everytime get around people smoke get headache asthma flares	2014-06-17	1	0				https://twitter.com/ClaireMaria13/status/479040314682773504
475421942699544576	ClaireMaria13	 asthma anxiety dont work well together	2014-06-07	0	0				https://twitter.com/ClaireMaria13/status/475421942699544576
438502487079665665	ClaireMaria13	 bronchitis top asthma killer	2014-02-25	0	0				https://twitter.com/ClaireMaria13/status/438502487079665665
436331871568265218	ClaireMaria13	 third asthma attack dayno big deal	2014-02-19	0	0				https://twitter.com/ClaireMaria13/status/436331871568265218
428885929458401280	ClaireMaria13	 walking class cold asthma 	2014-01-30	1	1				https://twitter.com/ClaireMaria13/status/428885929458401280
547517359729442816	ughnancy	 hate asthma cus go dumb ass check every fucking months	2014-12-23	0	0				https://twitter.com/ughnancy/status/547517359729442816
540226464843857920	jasmined_brown	 police always run stoplights stopped guyman pissed max asthma attack could weasing	2014-12-03	1	0				https://twitter.com/jasmined_brown/status/540226464843857920
538912801096749057	twinkietooturnt	 grandmother keep saying asthma tf its know asthma attack feels like	2014-11-29	0	0				https://twitter.com/twinkietooturnt/status/538912801096749057
532008458531647488	ughnancy	 asthma anxiety worst thing ever	2014-11-10	0	0				https://twitter.com/ughnancy/status/532008458531647488
518256910181883904	kimpenny_	 infennity_ asthma attack agr lol	2014-10-04	0	0	@inFENNity_			https://twitter.com/kimpenny_/status/518256910181883904
511228964179034114	BLXCKMAGIC	 think im going asthma attack	2014-09-14	0	0				https://twitter.com/BLXCKMAGIC/status/511228964179034114
510533822472269824	1kingsammy	 pump mouth like nigga asthma	2014-09-12	0	0				https://twitter.com/1kingsammy/status/510533822472269824
495052338932224001	ceaselio	 kuroniji cant join didnt pay dues didnt pass physical got asthma its religion	2014-07-31	0	1	@kuroniji			https://twitter.com/ceaselio/status/495052338932224001
494819338197553152	whoisamanda_b	 allergies asthma 	2014-07-31	0	0				https://twitter.com/whoisamanda_b/status/494819338197553152
492382518730301440	kellyblynn	 death car culture sad like climate change obesity asthma car crashes	2014-07-24	1	0				https://twitter.com/kellyblynn/status/492382518730301440
492021516830539776	girldiorr	 chest hurt dont asthma pump	2014-07-23	0	0				https://twitter.com/girldiorr/status/492021516830539776
488373259780362240	twinkietooturnt	 grimmietravv ohhhhh naw couldnt fade niggas got asthma like shit lls nd im searchin like shit	2014-07-13	1	1	@GrimmieTravv			https://twitter.com/twinkietooturnt/status/488373259780362240
487440321262141440	Sean3don0juan1	 kiarasinterlude ever love somebody much barely breathe youre them thats asthma love	2014-07-10	0	1	@kiarasinterlude			https://twitter.com/Sean3don0juan1/status/487440321262141440
476902352776355841	ebelievee__	 asthma killing	2014-06-11	0	0				https://twitter.com/ebelievee__/status/476902352776355841
458423166860144640	Chef_BoyarLee	 last night asthma attack really really need quit smoking glad already started process time get super serious	2014-04-21	0	0				https://twitter.com/Chef_BoyarLee/status/458423166860144640
455563969785528320	IrickYourWorld	 asthma isaacs farts	2014-04-14	1	0				https://twitter.com/IrickYourWorld/status/455563969785528320
447588249087647746	BIGMIKE4loko	 uberfacts sex unblock stuffy nose also antihistamine help combat asthma hay fevereven hand version	2014-03-23	0	0	@UberFacts			https://twitter.com/BIGMIKE4loko/status/447588249087647746
435079729084116992	Hamsturdam	 chill im wheezing asthma hasnt acted sooo long	2014-02-16	0	0				https://twitter.com/Hamsturdam/status/435079729084116992
434530618270298113	BLXCKMAGIC	 illnesses like insomnia lack appetite asthma knwn successfully cured medicinal marijuana helen_garciaa bett	2014-02-14	1	0	@Helen_Garciaa			https://twitter.com/BLXCKMAGIC/status/434530618270298113
430913923601403904	FrankenFert	 asderff clit fat asthma attack lmao pictwittercomotrsnje vy	2014-02-04	3	1	@Asderff			https://twitter.com/FrankenFert/status/430913923601403904
430491502201282560	ahaval	 rebeccaschinsky maybe asthma contagious	2014-02-03	0	0	@RebeccaSchinsky			https://twitter.com/ahaval/status/430491502201282560
430038606213042176	fillyfil_	 hanging asthma team pictwittercompgovnvzwmo	2014-02-02	0	1				https://twitter.com/fillyfil_/status/430038606213042176
429108609923153920	_iamroman	 ughh body hurt head hurt asthma reflects coughing bitch im set fuck right	2014-01-30	0	0				https://twitter.com/_iamroman/status/429108609923153920
422902180296011776	_iamroman	 asthma shit birds icant	2014-01-13	0	0		#icant		https://twitter.com/_iamroman/status/422902180296011776
421461542480392193	NiggasBePurpin	 smokin dope sound lik im havin asthma attack	2014-01-09	0	0				https://twitter.com/NiggasBePurpin/status/421461542480392193
420192182449225729	JaWaun917	 asthma fucking worst	2014-01-06	1	1				https://twitter.com/JaWaun917/status/420192182449225729
507161084391088128	mdgdarapper	 fucking asthma attack smh	2014-09-03	0	0				https://twitter.com/mdgdarapper/status/507161084391088128
494819338197553152	whoisamanda_b	 allergies asthma 	2014-07-31	0	0				https://twitter.com/whoisamanda_b/status/494819338197553152
477478136288780290	markstory_	 turns problems asthma knew wish hadnt waited month g http sqcom sbu sk	2014-06-13	0	0				https://twitter.com/markstory_/status/477478136288780290
467258341878935552	ShowTimee____	 damn asthma killing me	2014-05-16	0	0				https://twitter.com/ShowTimee____/status/467258341878935552
422832839596728320	dontgetMAD_son	 freemanbrigitte time minor asthma attack class though	2014-01-13	0	2	@freemanbrigitte			https://twitter.com/dontgetMAD_son/status/422832839596728320
507161084391088128	mdgdarapper	 fucking asthma attack smh	2014-09-03	0	0				https://twitter.com/mdgdarapper/status/507161084391088128
490616770366291969	RenardFantastiq	 time thought asthma socal think little thought it postride today want eat inhaler	2014-07-19	0	0				https://twitter.com/RenardFantastiq/status/490616770366291969
424975805509537792	Supermads17	 please tell fuck sister would spray strong perfume room knows im asthma trouble wtf	2014-01-19	0	0				https://twitter.com/Supermads17/status/424975805509537792
513143319556542464	FyaMuva	 pump mouth like nigga asthma	2014-09-19	0	0				https://twitter.com/FyaMuva/status/513143319556542464
509879502680649728	sudi_	 uppityafrican think im asthma probz x__x steam helps	2014-09-10	0	0	@UppityAfrican			https://twitter.com/sudi_/status/509879502680649728
507320320089673728	FyaMuva	 pump mouth lihh nigga asthma	2014-09-03	0	0				https://twitter.com/FyaMuva/status/507320320089673728
499212470452781058	sudi_	 smilesobright_ people called lame cuz ion smokebut fuck yall bkuz got asthma too still chief vigourously	2014-08-12	1	0	@SmileSoBright_			https://twitter.com/sudi_/status/499212470452781058
494521363927818242	whoisamanda_b	 asthma always issue	2014-07-30	0	0				https://twitter.com/whoisamanda_b/status/494521363927818242
485133029484945408	_tkeionnnn	 didnt bring asthma medicine	2014-07-04	0	1				https://twitter.com/_tkeionnnn/status/485133029484945408
482983980623749120	NoChillSleepy	 families run movies always kid asthma 	2014-06-28	0	0				https://twitter.com/NoChillSleepy/status/482983980623749120
473015165911183360	sudi_	 asthma sucks especially am top cant sleep cuz got trees	2014-06-01	0	0				https://twitter.com/sudi_/status/473015165911183360
463474064427081728	Breejayy_	 juju_bee nigga got asthma lol level scrap	2014-05-05	2	1	@JuJu_Bee53			https://twitter.com/Breejayy_/status/463474064427081728
540356689669939200	1RawThought	 peter king r ny idiot people choice asthma heart condition	2014-12-03	0	0				https://twitter.com/1RawThought/status/540356689669939200
529735060770258944	LovelyMarissaa	 hate asthma	2014-11-04	0	0				https://twitter.com/LovelyMarissaa/status/529735060770258944
511322547548590080	deee_Nastyy	 dont wanna asthma	2014-09-14	0	0				https://twitter.com/deee_Nastyy/status/511322547548590080
505166158786748416	Septemberlovee_	 crystian came asthma pump late lol	2014-08-28	0	0				https://twitter.com/Septemberlovee_/status/505166158786748416
504111092139048960	Septemberlovee_	 welll need get asthma pump bff house	2014-08-25	0	0				https://twitter.com/Septemberlovee_/status/504111092139048960
450416269947580416	vibejust_died	 asthma acting dumb cant breath shit	2014-03-30	0	0				https://twitter.com/vibejust_died/status/450416269947580416
446379228695908352	FreeBandChico	 moe dis girl said i cant chase nigga its cuz got asthma funny	2014-03-19	0	0				https://twitter.com/FreeBandChico/status/446379228695908352
423168426438557696	_only_kayy	 asthma attack im today	2014-01-14	0	0				https://twitter.com/_only_kayy/status/423168426438557696
526376584392220674	GRTUD	 asthma meds add banner smoke canadian terror photos mtp	2014-10-26	0	0		#MTP		https://twitter.com/GRTUD/status/526376584392220674
510891360334123008	MuchDope	 baby got asthma	2014-09-13	0	0				https://twitter.com/MuchDope/status/510891360334123008
497932679405658112	Leggs410	 wanna smoke j fuck asthma	2014-08-08	0	0				https://twitter.com/Leggs410/status/497932679405658112
497495114852597761	Leggs410	 asthma attack work inhaler why again	2014-08-07	0	0		#why #again		https://twitter.com/Leggs410/status/497495114852597761
430203927683149824	SincerelyKimmie	 tyshenad wanna leave guest step i cant chase youi got asthma 	2014-02-02	1	0	@TyshenaD			https://twitter.com/SincerelyKimmie/status/430203927683149824
431289241369591808	be_posiLIV	 child bad asthma spray febreeze around them deserve get reported child abuse	2014-02-05	0	0				https://twitter.com/be_posiLIV/status/431289241369591808
495975468135612416	maggie_snyder	 fourth grade asthma attack walking starting line main street mile	2014-08-03	0	3				https://twitter.com/maggie_snyder/status/495975468135612416
