id	Username	Text	Date	Retweets	Favorites	Mentions	Hashtags	Geo	Permalink
453997825173753857	Paul_L_King_Jr	 diagnosed nocturnal asthma	2014-04-09	0	1				https://twitter.com/Paul_L_King_Jr/status/453997825173753857
453997053585399809	bbygirlt__	 hate asthma 	2014-04-09	0	0				https://twitter.com/bbygirlt__/status/453997053585399809
453682227818541058	Paul_L_King_Jr	 going asthma docta tomorrow gotta fix lungs	2014-04-08	0	2				https://twitter.com/Paul_L_King_Jr/status/453682227818541058
453356877741826048	hillaryhopee	 asthma sucks	2014-04-07	0	0				https://twitter.com/hillaryhopee/status/453356877741826048
453350551104008192	bbygirlt__	 yothatsnae since asthma started stupid	2014-04-07	1	0	@yothatsnae			https://twitter.com/bbygirlt__/status/453350551104008192
452274724601868288	_qweenjiggy	 dont got asthma still aint chasing nigga	2014-04-04	8	1				https://twitter.com/_qweenjiggy/status/452274724601868288
450654392086450176	crackwhore1000	 wouldnt wish asthma worst enemy	2014-03-31	0	1				https://twitter.com/crackwhore1000/status/450654392086450176
449973735907655680	TinyRaindr0p_	 kate made laugh hard started asthma attack	2014-03-29	0	1				https://twitter.com/TinyRaindr0p_/status/449973735907655680
449540088905875458	pinkfuzza	 allergyshots sucks family healthcare allergy asthma specialists http sqcom ihphhu	2014-03-28	0	1	@Family	#allergyshots		https://twitter.com/pinkfuzza/status/449540088905875458
449538470134824962	Overly_d	 want you yea gonna chase no got asthma	2014-03-28	2	0				https://twitter.com/Overly_d/status/449538470134824962
449253260474716160	npssandy	 shots today im vacation yay family allergy asthma care http sqcom jsit f	2014-03-27	0	0	@Family			https://twitter.com/npssandy/status/449253260474716160
448441194021154816	__MercyDior	 chase you bby got asthma	2014-03-25	1	0				https://twitter.com/__MercyDior/status/448441194021154816
448352512522072065	Shaiblack_	 took min bop mins feel like im rey asthma attack iont even shit	2014-03-25	0	0				https://twitter.com/Shaiblack_/status/448352512522072065
446843667161309184	Ericanderr	 evan got scared asthma attack	2014-03-20	0	4				https://twitter.com/Ericanderr/status/446843667161309184
444538263542321152	kariann13113	 little girls asthma acting upn feel bad her	2014-03-14	0	0				https://twitter.com/kariann13113/status/444538263542321152
441905235423150080	Paul_L_King_Jr	 wake night asthma	2014-03-07	0	0				https://twitter.com/Paul_L_King_Jr/status/441905235423150080
441315159928487936	Jerzgirll	 suck family allergy asthma care http sqcom mw ina	2014-03-05	0	0	@Family			https://twitter.com/Jerzgirll/status/441315159928487936
441058600208060417	__madeinTYWON	 ah shit need asthma machine cant breathe	2014-03-04	0	0				https://twitter.com/__madeinTYWON/status/441058600208060417
440392273088749568	FamousAmosBITCH	 theysickofme shawty back seat ok noticed asthma attack say panic attack	2014-03-03	0	0	@TheySickOfME			https://twitter.com/FamousAmosBITCH/status/440392273088749568
438176611431899136	Dae_Hating	 dont chase niggas asthma 	2014-02-25	0	0				https://twitter.com/Dae_Hating/status/438176611431899136
436503683585822720	prettybrinlon	 st morning internship im late bec asthma baby shestillsmiling mygirl http instagramcompkpakilipo 	2014-02-20	0	0		#shestillsmiling #mygirl		https://twitter.com/prettybrinlon/status/436503683585822720
436292022421704705	_DimeSeason3	 chase niggah got asthma	2014-02-19	0	0				https://twitter.com/_DimeSeason3/status/436292022421704705
434341611091558400	npssandy	 shots today family allergy asthma care http sqcom ouxiu 	2014-02-14	0	0	@Family			https://twitter.com/npssandy/status/434341611091558400
434151421408468993	BridgetDoyle16	 laugh sounds like asthma attack	2014-02-13	0	2				https://twitter.com/BridgetDoyle16/status/434151421408468993
433947167573938176	ChuchiiLo	 really bad asthma attack trying shovel stupid ass snow	2014-02-13	0	0				https://twitter.com/ChuchiiLo/status/433947167573938176
431938743600414720	briannajld	 thank lovely assholes decided give friend asthma attack spraying pepper spray inside building fuckyou	2014-02-07	0	0		#FuckYou		https://twitter.com/briannajld/status/431938743600414720
431791517897072640	pinkfuzza	 allergyshots pollenallergy boo family healthcare allergy asthma specialists http sqcom fdom x	2014-02-07	0	0	@Family	#allergyshots #pollenallergy #boo		https://twitter.com/pinkfuzza/status/431791517897072640
431289241369591808	be_posiLIV	 child bad asthma spray febreeze around them deserve get reported child abuse	2014-02-05	0	0				https://twitter.com/be_posiLIV/status/431289241369591808
430491502201282560	ahaval	 rebeccaschinsky maybe asthma contagious	2014-02-03	0	0	@RebeccaSchinsky			https://twitter.com/ahaval/status/430491502201282560
429861326224392192	AlyNichelle	 h asthma 	2014-02-02	0	0				https://twitter.com/AlyNichelle/status/429861326224392192
428975108498403328	npssandy	 shots breathing tests woo hoo p family allergy asthma care http sqcom bcnmae	2014-01-30	0	0	@Family			https://twitter.com/npssandy/status/428975108498403328
428903090830712833	Em_Singletonx	 asthma cold weather mix well	2014-01-30	0	0				https://twitter.com/Em_Singletonx/status/428903090830712833
428752765406703617	__preski	 fvckhumans__ got asthma too know body cant take therefore ima shaking tatas	2014-01-29	0	0	@fvckhumans__			https://twitter.com/__preski/status/428752765406703617
427935907485073408	__410Keith	 dont chasing nobody sorry got asthma	2014-01-27	7	1				https://twitter.com/__410Keith/status/427935907485073408
427921234530422784	ndoto	 redorama aw man asthma troubles something else 	2014-01-27	0	0	@redorama			https://twitter.com/ndoto/status/427921234530422784
427652272710238208	Ebonyhappynow	 n hospital asthma got daughter pictwittercomufdf cyzry	2014-01-26	0	0				https://twitter.com/Ebonyhappynow/status/427652272710238208
427230071976632320	mandiiiwilsonn	 wish cute laugh one laughs make people laugh sound like hyperventilating walrus asthma	2014-01-25	3	2				https://twitter.com/mandiiiwilsonn/status/427230071976632320
427143578792771584	nickblesso	 alejandracovill asthma im colorblind	2014-01-25	0	0	@AlejandraCovill			https://twitter.com/nickblesso/status/427143578792771584
424368158674538496	lannaette	 probably hit asthma attackthe fuck smelling like smoke	2014-01-17	0	0				https://twitter.com/lannaette/status/424368158674538496
424283254750208000	halesterxoxo	 either getting sick asthma kicking	2014-01-17	0	1				https://twitter.com/halesterxoxo/status/424283254750208000
423899319683776512	npssandy	 shots today family allergy asthma care http sqcom dajtcc	2014-01-16	0	0	@Family			https://twitter.com/npssandy/status/423899319683776512
422770076832772096	crackwhore1000	 asthma bitch fuck	2014-01-13	0	0				https://twitter.com/crackwhore1000/status/422770076832772096
422633266509012992	Paul_L_King_Jr	 asthma killing	2014-01-13	0	1				https://twitter.com/Paul_L_King_Jr/status/422633266509012992
422590357625659392	djzone10233	 swear bout asthma attack	2014-01-12	0	0				https://twitter.com/djzone10233/status/422590357625659392
422589958336315392	djzone10233	 ok dont like my chest feels like somebody punching weights feel asthma acting smh	2014-01-12	0	0				https://twitter.com/djzone10233/status/422589958336315392
422119722004774913	RianKinnard	 barely breathe think asthma said mean girl boysbeforefriends	2014-01-11	0	1		#boysbeforefriends		https://twitter.com/RianKinnard/status/422119722004774913
421502627747479552	Durkmoney__	 lilreese aint chasin hoes got asthma lol 	2014-01-09	0	0	@LilReese300	#300		https://twitter.com/Durkmoney__/status/421502627747479552
420525472523776000	Makayla__kernan	 got bus asthma attack fcpsmaryland made go school weather	2014-01-07	1	0	@FCPSMaryland			https://twitter.com/Makayla__kernan/status/420525472523776000
419988907544301568	deariuswilliam	 got asthma cant chasing dese hoes	2014-01-05	0	0				https://twitter.com/deariuswilliam/status/419988907544301568
512764461694726144	OrEoKiSsEsXoXo	 worried kirah bug respiratory stuff thats spreading across states gets shes done for asthma sucks	2014-09-18	0	0				https://twitter.com/OrEoKiSsEsXoXo/status/512764461694726144
501546009106063360	LegendaryLing_6	 anonymous_guapo kingling__ pump mouth like asthma snapped	2014-08-18	1	0	@Anonymous_guapo @KINGLING__			https://twitter.com/LegendaryLing_6/status/501546009106063360
501545934908829697	Anonymous_guapo	 kingling__ pump mouth like asthma	2014-08-18	0	1	@KINGLING__			https://twitter.com/Anonymous_guapo/status/501545934908829697
499752729825509376	LegendaryLing_6	 pump mouth like nigga asthma	2014-08-13	1	0				https://twitter.com/LegendaryLing_6/status/499752729825509376
471377738998480896	sassyjaneex	 dgkayla_ asthma waiting room since still havent seen	2014-05-27	0	0	@DGKayla_			https://twitter.com/sassyjaneex/status/471377738998480896
471344743264174080	sassyjaneex	 live hospital seem ones get asthma control	2014-05-27	0	0				https://twitter.com/sassyjaneex/status/471344743264174080
471339569380880386	sassyjaneex	 statics show deaths year asthma could prevented attacks day around world	2014-05-27	0	0				https://twitter.com/sassyjaneex/status/471339569380880386
471339388656693249	sassyjaneex	 asthma worst thing world	2014-05-27	0	0				https://twitter.com/sassyjaneex/status/471339388656693249
465332362164056064	Kinghardy7	 niggas give asthma talkin	2014-05-10	0	1				https://twitter.com/Kinghardy7/status/465332362164056064
439069358988742656	SammyLouise18	 wanna take ava pulmonary dr get tested asthma gotta call pulmonary dr dr ahh fun stuff	2014-02-27	0	0				https://twitter.com/SammyLouise18/status/439069358988742656
431250394636111872	shortnsweet1004	 shes talkin husbands asthma would ever think care	2014-02-05	0	0				https://twitter.com/shortnsweet1004/status/431250394636111872
428010757545263104	Snrenner	 scale kick wonder mad mom would smoked cigg window room would die asthma attack	2014-01-27	0	1				https://twitter.com/Snrenner/status/428010757545263104
420732818306916352	NFASavDaddy	 dont chase hoes asthma	2014-01-07	0	0				https://twitter.com/NFASavDaddy/status/420732818306916352
467859047237296128	GlocksB4Cocks	 hate asthma 	2014-05-17	0	0				https://twitter.com/GlocksB4Cocks/status/467859047237296128
461922452600541184	alliekg_	 asthma bad fucking awful	2014-05-01	0	1				https://twitter.com/alliekg_/status/461922452600541184
435227758252527616	mallowcup44	 asthma needs stop like right	2014-02-16	0	0				https://twitter.com/mallowcup44/status/435227758252527616
446103896189317121	TheItalianPanda	 school sinusproblems asthma sinusinfection	2014-03-18	0	1		#sinusproblems #asthma #sinusinfection		https://twitter.com/TheItalianPanda/status/446103896189317121
420039496147947520	ThatGirl_Shelbi	 now im catching cold something asthma attacking up	2014-01-05	0	0				https://twitter.com/ThatGirl_Shelbi/status/420039496147947520
471339569380880386	sassyjaneex	 statics show deaths year asthma could prevented attacks day around world	2014-05-27	0	0				https://twitter.com/sassyjaneex/status/471339569380880386
471339388656693249	sassyjaneex	 asthma worst thing world	2014-05-27	0	0				https://twitter.com/sassyjaneex/status/471339388656693249
483736577961885696	MDmasin	 mom always trying show friends next time asthma attack ima turn tv act like cant hear	2014-06-30	0	0				https://twitter.com/MDmasin/status/483736577961885696
463472721759059968	Ajahbaybe	 way used asthma pump	2014-05-05	0	0				https://twitter.com/Ajahbaybe/status/463472721759059968
546879152805384192	JBookerxFilms	 sister asthma attack im sitting smoking g pen	2014-12-21	0	0				https://twitter.com/JBookerxFilms/status/546879152805384192
544469586234843136	thiskidLT	 wonder sick job would called cuz asthma	2014-12-15	0	0				https://twitter.com/thiskidLT/status/544469586234843136
543107508609777664	SaCaitsMetalMom	 way home mid evil times awesome dd suffering asthma attack get well soon caitlin	2014-12-11	0	0				https://twitter.com/SaCaitsMetalMom/status/543107508609777664
539912827725545472	Hanbacksami	 im done chasing got asthma cant chase anymore want youll understand	2014-12-02	0	1				https://twitter.com/Hanbacksami/status/539912827725545472
535759826991992832	Septemberlovee_	 im forever leaving asthma pumps home	2014-11-21	0	0				https://twitter.com/Septemberlovee_/status/535759826991992832
529735060770258944	LovelyMarissaa	 hate asthma	2014-11-04	0	0				https://twitter.com/LovelyMarissaa/status/529735060770258944
529089632148152323	Legendarydevill	 so asthma too	2014-11-02	0	0				https://twitter.com/Legendarydevill/status/529089632148152323
526376584392220674	GRTUD	 asthma meds add banner smoke canadian terror photos mtp	2014-10-26	0	0		#MTP		https://twitter.com/GRTUD/status/526376584392220674
520039764771495936	stephanieramz	 oh remember girl asthma attack haunted train walk rest way rain smh	2014-10-08	0	0				https://twitter.com/stephanieramz/status/520039764771495936
519920150787944449	tharealtariq	 ____michaelaaaa know tried make asthma attack	2014-10-08	0	0	@____Michaelaaaa			https://twitter.com/tharealtariq/status/519920150787944449
513143319556542464	FyaMuva	 pump mouth like nigga asthma	2014-09-19	0	0				https://twitter.com/FyaMuva/status/513143319556542464
511749820164636672	yungscoliosis	 thats asthma kush got coughiiiiin	2014-09-16	0	0				https://twitter.com/yungscoliosis/status/511749820164636672
510891360334123008	MuchDope	 baby got asthma	2014-09-13	0	0				https://twitter.com/MuchDope/status/510891360334123008
510862538436014080	halesterxoxo	 blows thing smoke asthma attack cigs blacks	2014-09-13	0	2				https://twitter.com/halesterxoxo/status/510862538436014080
510533822472269824	1kingsammy	 pump mouth like nigga asthma	2014-09-12	0	0				https://twitter.com/1kingsammy/status/510533822472269824
508943680108261376	LovelyKouture_	 hate asthma its highly annoying	2014-09-08	0	1				https://twitter.com/LovelyKouture_/status/508943680108261376
507320320089673728	FyaMuva	 pump mouth lihh nigga asthma	2014-09-03	0	0				https://twitter.com/FyaMuva/status/507320320089673728
505166158786748416	Septemberlovee_	 crystian came asthma pump late lol	2014-08-28	0	0				https://twitter.com/Septemberlovee_/status/505166158786748416
504479908622770176	Ju3Lzzz	 pokemonpowell run police picture that nigga im fat ill fuck around asthma attack thats bust back	2014-08-27	0	0	@PokemonPowell			https://twitter.com/Ju3Lzzz/status/504479908622770176
504479844844208128	pokemonpowell	 run police picture that nigga im fat ill fuck around asthma attack thats bust back	2014-08-27	0	0				https://twitter.com/pokemonpowell/status/504479844844208128
504111092139048960	Septemberlovee_	 welll need get asthma pump bff house	2014-08-25	0	0				https://twitter.com/Septemberlovee_/status/504111092139048960
502654748567560192	HennyVilll	 got asthma wont chase bitch leaving	2014-08-21	2	0				https://twitter.com/HennyVilll/status/502654748567560192
502311814735343617	AbZolute0Kelvin	 cedez_supahbadd noass_gotgas like fuckin girls asthma bust nut minutes tired wow	2014-08-21	2	0	@cedez_supahbadd @NoAss_GotGas			https://twitter.com/AbZolute0Kelvin/status/502311814735343617
500874611291353089	zaireeeeeee	 nigga aint gonna chase got asthma	2014-08-17	0	0				https://twitter.com/zaireeeeeee/status/500874611291353089
497932679405658112	Leggs410	 wanna smoke j fuck asthma	2014-08-08	0	0				https://twitter.com/Leggs410/status/497932679405658112
497776841768570880	theMADdude	 heck would u pierce nose even asthma dont	2014-08-08	0	1				https://twitter.com/theMADdude/status/497776841768570880
497495114852597761	Leggs410	 asthma attack work inhaler why again	2014-08-07	0	0		#why #again		https://twitter.com/Leggs410/status/497495114852597761
491763738517598208	RissKiss_13	 take asthma pretty seriously whether its mild not def something joke about rhony	2014-07-22	0	0		#RHONY		https://twitter.com/RissKiss_13/status/491763738517598208
491763306365845504	RissKiss_13	 someone asthma dont find funny aviva joke that rhony	2014-07-22	0	2		#RHONY		https://twitter.com/RissKiss_13/status/491763306365845504
491083676567216131	MochaLuciano	 asthma acting up idk wether im gonna live diesmh	2014-07-21	0	0				https://twitter.com/MochaLuciano/status/491083676567216131
487440321262141440	Sean3don0juan1	 kiarasinterlude ever love somebody much barely breathe youre them thats asthma love	2014-07-10	0	1	@kiarasinterlude			https://twitter.com/Sean3don0juan1/status/487440321262141440
487350169600815104	HUNGRYMIKEE	 cam_overall running heat smart asthma dont let excuse got	2014-07-10	1	0	@Cam_OverAll			https://twitter.com/HUNGRYMIKEE/status/487350169600815104
485304229154680832	TRILLEST_MEECH	 together since hospital wen born wen hadda asthma attack wen tht cough	2014-07-05	0	0				https://twitter.com/TRILLEST_MEECH/status/485304229154680832
485133029484945408	_tkeionnnn	 didnt bring asthma medicine	2014-07-04	0	1				https://twitter.com/_tkeionnnn/status/485133029484945408
479678778767990784	RissKiss_13	 aviva needs stop whole asthma thing asthma stop making huge deal rhonygoeswest	2014-06-19	0	0		#RHONYGoesWest		https://twitter.com/RissKiss_13/status/479678778767990784
476665486550507520	LovelyyFreckles	 late cause asthma	2014-06-11	0	0				https://twitter.com/LovelyyFreckles/status/476665486550507520
474713671030292481	TRILLEST_MEECH	 im gettin dreads could turn lightskin darkskin cuz asthma nd according doctor wen im darkskin body need oxygen	2014-06-05	0	0				https://twitter.com/TRILLEST_MEECH/status/474713671030292481
472384286075924480	KAYLALENEE__	 asthma blowing	2014-05-30	0	0				https://twitter.com/KAYLALENEE__/status/472384286075924480
468219835634417664	ThatsMatt301	 mactutmose french inhale u dont smoke look like got rd degree asthma lmfaooo pictwittercomxrwejwshox	2014-05-18	0	0	@MacTutmose			https://twitter.com/ThatsMatt301/status/468219835634417664
463067294391107584	immesimone3	 mayne need asthma pump	2014-05-04	0	0				https://twitter.com/immesimone3/status/463067294391107584
461138399274217472	iamlexisugar	 second death asthma im hearing year lord please spare people ripamakaigwe	2014-04-29	0	0		#RIPAmakaIgwe		https://twitter.com/iamlexisugar/status/461138399274217472
460876252136894464	MIkhailgrayyyyy	 smh cold mixed asthma hate crap pictwittercombrv iljvzq	2014-04-28	0	0				https://twitter.com/MIkhailgrayyyyy/status/460876252136894464
459382049829576704	__GoGettaa	 aint going chase ya da way asthma set ya kno	2014-04-24	1	0				https://twitter.com/__GoGettaa/status/459382049829576704
451576402924433409	800Bandz	 chase bitch got asthma	2014-04-03	3	1				https://twitter.com/800Bandz/status/451576402924433409
449613216096997376	birgiterika	 nothing fun asthma attack middle conference yeah	2014-03-28	0	0		#yeah		https://twitter.com/birgiterika/status/449613216096997376
445361245395632129	marycaterinaaa	 lukeq hate asthma 	2014-03-16	0	0	@LukeQ24			https://twitter.com/marycaterinaaa/status/445361245395632129
443551668744224769	Tony_Stark92	 asthma bothering meshould stop smoking	2014-03-11	0	0				https://twitter.com/Tony_Stark92/status/443551668744224769
442315409271050241	iamlexisugar	 its sad hear asthma actually claimed life friend really sad please mercy god	2014-03-08	0	0				https://twitter.com/iamlexisugar/status/442315409271050241
440749598446211072	Uptown____Hoyas	 fuck asthma	2014-03-04	0	1				https://twitter.com/Uptown____Hoyas/status/440749598446211072
438532467864403969	LovelyyFreckles	 asthma medicine makes heart rate go up nerves making shake like crazy 	2014-02-25	0	1				https://twitter.com/LovelyyFreckles/status/438532467864403969
437868150286454784	Armane_Xchange	 bowie state im fucking burning room please find ac im dying im ready sue got asthma thank bsu resident	2014-02-24	1	1				https://twitter.com/Armane_Xchange/status/437868150286454784
437787484291080192	LovelyyFreckles	 asthma bitch	2014-02-23	0	0				https://twitter.com/LovelyyFreckles/status/437787484291080192
437361638409502720	KAYLALENEE__	 didnt think asthma anymore since ive smokin much think its gonna come back	2014-02-22	0	0				https://twitter.com/KAYLALENEE__/status/437361638409502720
435689412257914880	bonespanek	 well asthma guess thats kind thing	2014-02-18	1	10				https://twitter.com/bonespanek/status/435689412257914880
433101009800658944	stephanieramz	 need stop terio pics im sending priyamarie ready give girl asthma attack lol	2014-02-10	0	0	@priyamarie92			https://twitter.com/stephanieramz/status/433101009800658944
432586113241600000	HailieMckenzie	 cheerchick yo said exercise asthma 	2014-02-09	0	0	@cheerchick0920			https://twitter.com/HailieMckenzie/status/432586113241600000
430203927683149824	SincerelyKimmie	 tyshenad wanna leave guest step i cant chase youi got asthma 	2014-02-02	1	0	@TyshenaD			https://twitter.com/SincerelyKimmie/status/430203927683149824
424283254750208000	halesterxoxo	 either getting sick asthma kicking	2014-01-17	0	1				https://twitter.com/halesterxoxo/status/424283254750208000
421461542480392193	NiggasBePurpin	 smokin dope sound lik im havin asthma attack	2014-01-09	0	0				https://twitter.com/NiggasBePurpin/status/421461542480392193
421304836639166464	xoxoDrex	 freaking asthma attack last night ugh	2014-01-09	0	0				https://twitter.com/xoxoDrex/status/421304836639166464
420461946324799488	muffdaddyyyy	 sleep me baby keep waking crying asthma messing more lord plz help mee	2014-01-07	0	0				https://twitter.com/muffdaddyyyy/status/420461946324799488
420382928099872768	___AmazingK	 morning ohhhh lawddd asthma attack	2014-01-06	0	0				https://twitter.com/___AmazingK/status/420382928099872768
420192182449225729	JaWaun917	 asthma fucking worst	2014-01-06	1	1				https://twitter.com/JaWaun917/status/420192182449225729
547717572066836482	WalkerPenz	 feel like got asthma	2014-12-24	0	0				https://twitter.com/WalkerPenz/status/547717572066836482
487811739975557120	emily_ayyy	 asthma real bitch	2014-07-12	2	1				https://twitter.com/emily_ayyy/status/487811739975557120
483468710372724736	_itsjunior	 waiting nightly asthma attack like	2014-06-30	0	0				https://twitter.com/_itsjunior/status/483468710372724736
424396334364643328	Youre_Adopted	 asthma attack dont even asthma	2014-01-17	0	0				https://twitter.com/Youre_Adopted/status/424396334364643328
542521094670782467	HoeAssAnt	 dont got time chasing anybody got asthma	2014-12-09	0	0				https://twitter.com/HoeAssAnt/status/542521094670782467
539864377563033600	minniemiles	 forgot start new inhaler morning pulmonary appt fri kinda anxious asthma bronchitis something else	2014-12-02	0	0				https://twitter.com/minniemiles/status/539864377563033600
519261571638632448	gcsaxton	 lizzs_lockeroom im bout dat asthma boss	2014-10-06	0	0	@Lizzs_Lockeroom			https://twitter.com/gcsaxton/status/519261571638632448
519001559938920448	minniemiles	 wheezing again try seen today dont want placed maintenance asthma meds again may choice	2014-10-06	0	0				https://twitter.com/minniemiles/status/519001559938920448
511692791530160128	_____lifeofJANE	 xjaeeeee _____msfts better gtfoh im going tf home min asthma something idec ohhh ok	2014-09-15	0	0	@xJaeeeee @_____MSFTS			https://twitter.com/_____lifeofJANE/status/511692791530160128
510547765710311424	softballgirl___	 sometimes laugh lot asthma acting	2014-09-12	0	0				https://twitter.com/softballgirl___/status/510547765710311424
509838073711312897	DjNxptune	 asthma sucks ass bruh stamp hate wheezing	2014-09-10	0	1				https://twitter.com/DjNxptune/status/509838073711312897
504837392793350144	WasGoodSlim	 pull pump nigga call asthma attack	2014-08-27	0	0				https://twitter.com/WasGoodSlim/status/504837392793350144
504837285398204416	WasGoodSlim	 foreigns back back haters asthma attacks	2014-08-27	0	0				https://twitter.com/WasGoodSlim/status/504837285398204416
503741518981914624	Dreeeezyyy	 omydeezus crying asthma attack tweeting	2014-08-24	0	0	@omyDeezus			https://twitter.com/Dreeeezyyy/status/503741518981914624
501905910005264384	softballgirl___	 asthma bothering inhaler	2014-08-19	0	0				https://twitter.com/softballgirl___/status/501905910005264384
499338736824762368	beybe__	 dont asthma pump	2014-08-12	0	0				https://twitter.com/beybe__/status/499338736824762368
496103491015024642	JnaeNichelle	 feel like asthma acting	2014-08-03	0	0				https://twitter.com/JnaeNichelle/status/496103491015024642
492500232870297600	iztheU_N_A	 highlights today going doctors appt getting new allergy asthma meds watching sky change reddish color	2014-07-24	0	0				https://twitter.com/iztheU_N_A/status/492500232870297600
491062243912859649	Lonzos_World	 asthma worst moe heat	2014-07-20	0	0				https://twitter.com/Lonzos_World/status/491062243912859649
490917258823073794	tizzzzzzzy	 hate asthma man	2014-07-20	10	3				https://twitter.com/tizzzzzzzy/status/490917258823073794
488508475778289664	softballgirl___	 hate asthma	2014-07-13	0	0				https://twitter.com/softballgirl___/status/488508475778289664
484460125357633537	nonchalantNeesh	 nothing like asthma attack able locate inhaler	2014-07-02	0	0				https://twitter.com/nonchalantNeesh/status/484460125357633537
478601634269118464	nonchalantNeesh	 blazing outside asthma like no go house	2014-06-16	0	1				https://twitter.com/nonchalantNeesh/status/478601634269118464
474083904677507072	Dreeeezyyy	 hope get asthma clearance air force	2014-06-04	0	0				https://twitter.com/Dreeeezyyy/status/474083904677507072
469537581378863104	nonchalantNeesh	 cant hot weather asthma acts badly	2014-05-22	0	1				https://twitter.com/nonchalantNeesh/status/469537581378863104
464663248059785216	301_Obi	 fashionaddictd ever close encounter death one asthma attack mann	2014-05-09	0	0	@FashionAddictD			https://twitter.com/301_Obi/status/464663248059785216
464474161906483201	nonchalantNeesh	 ayeepee__ asthma wont	2014-05-08	0	0	@AyeePee__			https://twitter.com/nonchalantNeesh/status/464474161906483201
