id	Username	Text	Date	Retweets	Favorites	Mentions	Hashtags	Geo	Permalink
549783247425925120	dedflwrs	 asthma sucks literally	2014-12-29	0	0				https://twitter.com/dedflwrs/status/549783247425925120
538883362078093312	MeaganStClair	 asthma attack sucked balls	2014-11-29	0	0				https://twitter.com/MeaganStClair/status/538883362078093312
512435498410078208	alberinadreshaj	 get noise complaints every time hit blunt kid talkin loud coughs cuz asthma	2014-09-17	0	1				https://twitter.com/alberinadreshaj/status/512435498410078208
493930250510675969	BreannaDemers9	 could change anything self would asthma fact cant see anything without contacts glasses	2014-07-28	0	0				https://twitter.com/BreannaDemers9/status/493930250510675969
490509154448977920	BreannaDemers9	 still trouble breathing oh hate asthma	2014-07-19	0	0				https://twitter.com/BreannaDemers9/status/490509154448977920
490385855450578944	BreannaDemers9	 cant breath whenever cry thanks asthma	2014-07-19	0	0				https://twitter.com/BreannaDemers9/status/490385855450578944
475623096486203393	Raven_Simone143	 rickypdillon hey ricky hey ricky asthma nickiminaj hell follow me hell follow not hell follow me hell follow not oh	2014-06-08	0	0	@RickyPDillon @NICKIMINAJ			https://twitter.com/Raven_Simone143/status/475623096486203393
470708019718660096	fit_with_hips	 gymoholic actually helps asthma helps w muscle tension running stoned favorite	2014-05-25	0	1	@gymoholic5150			https://twitter.com/fit_with_hips/status/470708019718660096
467777347756630016	ryleebailey5	 thastonernation asthma pictwittercompksw zmt 	2014-05-17	0	1	@ThaStonerNation			https://twitter.com/ryleebailey5/status/467777347756630016
462189622706335744	kendralemoine	 accepting still asthma made life lot easier idea breathing could easy puffs day	2014-05-02	0	1				https://twitter.com/kendralemoine/status/462189622706335744
431668342144131073	jessmarkarian	 leah stayed back nd grade asthma	2014-02-07	1	4				https://twitter.com/jessmarkarian/status/431668342144131073
420652549289820160	KaitlynBenoit	 would nice would stop asthma attacks considering ive used past weeks entire life	2014-01-07	0	0				https://twitter.com/KaitlynBenoit/status/420652549289820160
537831480765190144	Mashisha78	 shit jameson great asthma acting up	2014-11-26	0	0				https://twitter.com/Mashisha78/status/537831480765190144
487782461448130560	AndreaThea1	 cat diagnosed asthma 	2014-07-11	0	1				https://twitter.com/AndreaThea1/status/487782461448130560
462461969594077184	blsansouci13	 asthma would make sudden ridiculously dramatic appearance years imdying whatisair	2014-05-03	0	0		#imdying #whatisair		https://twitter.com/blsansouci13/status/462461969594077184
472165541273436160	marg_in__charge	 alisondowd im asthma attack soccer scene lawd	2014-05-29	0	1	@alisondowd1			https://twitter.com/marg_in__charge/status/472165541273436160
540528407445254145	JoshyyP	 maddiegracce c_alpo_h asthma heavy body keep caused heart attack	2014-12-04	0	1	@maddiegracce @c_alpo_h			https://twitter.com/JoshyyP/status/540528407445254145
540090552646381568	SavanaRose_	 perk really bad asthma its really bothering dont get sleep mom lets stay home	2014-12-03	0	0				https://twitter.com/SavanaRose_/status/540090552646381568
539927257368629250	SavanaRose_	 ugh hate asthma lung donors there	2014-12-02	0	0				https://twitter.com/SavanaRose_/status/539927257368629250
508992257807360000	WhatchyaWareing	 chilling nurse cause asthma sucks lol	2014-09-08	0	0				https://twitter.com/WhatchyaWareing/status/508992257807360000
500350953401638912	yaymakayla	 cant look clothes without asthma attack hahahahaha	2014-08-15	0	0				https://twitter.com/yaymakayla/status/500350953401638912
487030935942995968	SavanaRose_	 hate asthma 	2014-07-09	0	0				https://twitter.com/SavanaRose_/status/487030935942995968
457752461437325312	GenevaLevesque	 jeannanicolexx youre guinea pig soumds like asthma 	2014-04-20	1	0	@jeannanicolexx			https://twitter.com/GenevaLevesque/status/457752461437325312
445587840488198144	DabbinKitten	 tellin torch power rip bowls niggah its gotta lit cant power rip anything cause fucking asthma idiot	2014-03-17	0	0				https://twitter.com/DabbinKitten/status/445587840488198144
419687064163319808	lookatthiscutie	 donnnie asthma anything like	2014-01-04	0	0	@donnnie14			https://twitter.com/lookatthiscutie/status/419687064163319808
544853798473453568	RyanKruschwitz	 asthma unreal today	2014-12-16	0	0				https://twitter.com/RyanKruschwitz/status/544853798473453568
541041934505357312	maegsmurph	 tonight collapsed asthma attack floor routinehows night going	2014-12-05	0	1				https://twitter.com/maegsmurph/status/541041934505357312
463417593794408449	Kelsey_Knips	 kid serious asthma playing tag jayd sounds like dying dog	2014-05-05	0	2				https://twitter.com/Kelsey_Knips/status/463417593794408449
451156159974891520	c_m0ney123	 april fools day gives asthma attack	2014-04-01	0	2				https://twitter.com/c_m0ney123/status/451156159974891520
431627576378155008	zpooley22	 would smoke hot day asthma lyle	2014-02-06	0	3				https://twitter.com/zpooley22/status/431627576378155008
513447830556782594	___pel	 dont think get cold moves lungs asthma kills sos	2014-09-20	0	1		#sos		https://twitter.com/___pel/status/513447830556782594
493930250510675969	BreannaDemers9	 could change anything self would asthma fact cant see anything without contacts glasses	2014-07-28	0	0				https://twitter.com/BreannaDemers9/status/493930250510675969
490509154448977920	BreannaDemers9	 still trouble breathing oh hate asthma	2014-07-19	0	0				https://twitter.com/BreannaDemers9/status/490509154448977920
490385855450578944	BreannaDemers9	 cant breath whenever cry thanks asthma	2014-07-19	0	0				https://twitter.com/BreannaDemers9/status/490385855450578944
436321297875079168	becca_harth	 asthma attack shoveling driveway	2014-02-19	0	1				https://twitter.com/becca_harth/status/436321297875079168
475623096486203393	Raven_Simone143	 rickypdillon hey ricky hey ricky asthma nickiminaj hell follow me hell follow not hell follow me hell follow not oh	2014-06-08	0	0	@RickyPDillon @NICKIMINAJ			https://twitter.com/Raven_Simone143/status/475623096486203393
467777347756630016	ryleebailey5	 thastonernation asthma pictwittercompksw zmt 	2014-05-17	0	1	@ThaStonerNation			https://twitter.com/ryleebailey5/status/467777347756630016
451417153066266624	AlmyarFrostpnt	 asthma sucks	2014-04-02	0	0				https://twitter.com/AlmyarFrostpnt/status/451417153066266624
446770458281906177	annamellly	 asthma really shape worst combo ever	2014-03-20	1	1				https://twitter.com/annamellly/status/446770458281906177
431068712536657920	AlmyarFrostpnt	 coughing fit subsequently asthma attack im great today	2014-02-05	0	0				https://twitter.com/AlmyarFrostpnt/status/431068712536657920
422130635843850241	annamellly	 lol totally forgot asthma attack today	2014-01-11	0	3				https://twitter.com/annamellly/status/422130635843850241
538883362078093312	MeaganStClair	 asthma attack sucked balls	2014-11-29	0	0				https://twitter.com/MeaganStClair/status/538883362078093312
501050666396028928	KeaneCmxdesigns	 lawn ninja day lawnninja lawnbandit mow gothyhippy tiedye bandana black breath asthma http instagramcomprzpu mqnno	2014-08-17	0	0		#lawnninja #lawnbandit #mow #gothyhippy #tiedye #bandana #black #breath #asthma		https://twitter.com/KeaneCmxdesigns/status/501050666396028928
444900237065596928	bbbadwolfff	 asthma yo pictwittercomq zmrwp ly	2014-03-15	0	0				https://twitter.com/bbbadwolfff/status/444900237065596928
429077667124895746	Treeeko	 love getting asthma attacks middle gymbreathing overrated anyways athsmaattacks cantbreathe help	2014-01-30	0	0		#AthsmaAttacks #cantbreathe #help		https://twitter.com/Treeeko/status/429077667124895746
