id	Username	Text	Date	Retweets	Favorites	Mentions	Hashtags	Geo	Permalink
271798515980713984	Sarahhhboo1222	 shnafan watch eat today shlittle diabetic loveyou missyou bestbigbro tweezynation	2012-11-22	0	0	@TweezyNation	#loveyou #missyou #bestbigbro		https://twitter.com/Sarahhhboo1222/status/271798515980713984
154813170270208000	ScottMMichaels	 waltmossberg wait till see else cooking diabetic space im working hardly believe it	2012-01-05	0	0	@waltmossberg			https://twitter.com/ScottMMichaels/status/154813170270208000
165228693243957248	Pueo50	 insulin diabetic cat longs drug http sqcomajbpxo	2012-02-02	0	0	@Longs			https://twitter.com/Pueo50/status/165228693243957248
284472217490837505	AdamJKo	 breath smells like diabetic sumo wrestlers laps cream cheese pool	2012-12-27	0	0				https://twitter.com/AdamJKo/status/284472217490837505
275157039582441472	chaster808	 keer d_gray_wolf hahamauubos ko na nga itong l na pepsi kakaabang kay bebe halla diabetic labas ko nito waaahhh	2012-12-02	0	0	@keer234 @d_gray_wolf			https://twitter.com/chaster808/status/275157039582441472
266265306543030272	BianchaYalung	 im located land diabetic feet aka pearl city q	2012-11-07	0	0				https://twitter.com/BianchaYalung/status/266265306543030272
263745171320090625	galangster	 moms snickerdoodles gonna make diabetic pictwittercomjzza iog	2012-10-31	0	0				https://twitter.com/galangster/status/263745171320090625
258791528426778624	jlnoblezada	 continuing education diabetic retinopathy atsuhime lifeofadoctor hugo higa md http instagrampq slgypiei	2012-10-18	0	0	@atsuhime55 @Hugo	#lifeofadoctor		https://twitter.com/jlnoblezada/status/258791528426778624
251025583239200768	jlnoblezada	 seeing patients diabetic clinic lifeofadoctor kaiser permanente http instagrampqdhd hpiha	2012-09-26	0	0	@Kaiser	#lifeofadoctor		https://twitter.com/jlnoblezada/status/251025583239200768
245969994867957760	jlnoblezada	 diabetic eye clinic life eyedoctor kaiser permanente http instagramppfmdbspip 	2012-09-12	0	0	@Kaiser	#eyedoctor		https://twitter.com/jlnoblezada/status/245969994867957760
230723709755879424	jlnoblezada	 seeing diabetic patients today at kaiser permanente http pathcomp gqwj	2012-08-01	0	0				https://twitter.com/jlnoblezada/status/230723709755879424
222749718000840705	jlnoblezada	 diabetic eye clinic at kaiser permanente http pathcompjxhke	2012-07-10	0	0				https://twitter.com/jlnoblezada/status/222749718000840705
214519392929722369	JE_AlterEgo	 never want leave hawaii beautiful women skirts shorts time eye candy think im diabetic imjustsaying	2012-06-17	0	0		#imjustsaying		https://twitter.com/JE_AlterEgo/status/214519392929722369
210066649452257281	jlnoblezada	 diabetic eye clinic at kaiser permanente http pathcomprtyqx	2012-06-05	0	0				https://twitter.com/jlnoblezada/status/210066649452257281
204992906929504257	jlnoblezada	 diabetic eye clinic at kaiser permanente http pathcomp natj	2012-05-22	0	0				https://twitter.com/jlnoblezada/status/204992906929504257
200280774178643968	jlnoblezada	 diabetic eye clinic at kaiser permanente http pathcomp riie 	2012-05-09	0	0				https://twitter.com/jlnoblezada/status/200280774178643968
190135169192181761	jlnoblezada	 diabetic eye clinic kaiser permanente http sqcomhl jks	2012-04-11	0	0	@Kaiser			https://twitter.com/jlnoblezada/status/190135169192181761
184677270240235521	KayleeTee808	 bloodsugar morning miserable diabetic sucks	2012-03-27	0	0		#bloodsugar #diabetic		https://twitter.com/KayleeTee808/status/184677270240235521
179988697989660672	jlnoblezada	 diabetic eye clinic kaiser permanente http sqcomycie o	2012-03-14	0	0	@Kaiser			https://twitter.com/jlnoblezada/status/179988697989660672
156797340596977664	jlnoblezada	 diabetic eye clinic kaiser permanente http sqcomwfzshr	2012-01-10	0	0	@Kaiser			https://twitter.com/jlnoblezada/status/156797340596977664
