id	Username	Text	Date	Retweets	Favorites	Mentions	Hashtags	Geo	Permalink
283062141383237632	t_fischey5	 juan chocolate bars eats juan now diabetes juan diabetes 	2012-12-23	0	0				https://twitter.com/t_fischey5/status/283062141383237632
282871495770914816	shreagan	 amazingphil diabetes 	2012-12-23	0	0	@AmazingPhil			https://twitter.com/shreagan/status/282871495770914816
282363718665375744	Jenniferruiz32	 kristinamariee makes sense mom diabetes 	2012-12-22	0	0	@KristinaMariee3			https://twitter.com/Jenniferruiz32/status/282363718665375744
282113599550402560	Striplin20	 watched grandma administer diabetes shot asked dont see that said i wanna live ilovemygrandma	2012-12-21	0	1		#ILoveMyGrandma		https://twitter.com/Striplin20/status/282113599550402560
280839025475059712	WilsonJorden	 talking moms diabetes suffering health im glad shes heaven years miss everday flyhigh 	2012-12-17	0	0		#FlyHigh		https://twitter.com/WilsonJorden/status/280839025475059712
280518699042086912	seannothstine15	 t diabetesprobs diabetes big problem	2012-12-16	0	0	@T1diabetesprobs			https://twitter.com/seannothstine15/status/280518699042086912
279344158823550977	clairebelle13	 ok slept not long whats wrong me decided banana pancakes is obesity side diabetes nursingdiagnosis	2012-12-13	0	0		#nursingdiagnosis		https://twitter.com/clairebelle13/status/279344158823550977
279312621885329409	AndrewJDriver93	 candy store diabetes sarcasm	2012-12-13	0	0		#sarcasm		https://twitter.com/AndrewJDriver93/status/279312621885329409
278773415844904960	LiveFastDYEHard	 think ive enough sugar tonight induce diabetes plus side maybe get econ final desperatetimes	2012-12-12	0	1		#desperatetimes		https://twitter.com/LiveFastDYEHard/status/278773415844904960
276749663678394369	seannothstine15	 doctors think diabetes 	2012-12-06	0	2				https://twitter.com/seannothstine15/status/276749663678394369
275740095905136640	FredElmer_	 commercial giving diabetes	2012-12-03	0	1				https://twitter.com/FredElmer_/status/275740095905136640
274031887939428353	GavinBaker81	 wowfactsoflife lack sleep increases risk heart disease diabetes obesity teamnosleep	2012-11-29	1	0	@WOWFactsOfLife	#teamnosleep		https://twitter.com/GavinBaker81/status/274031887939428353
273654072618401793	CurlyC513	 thingsifindattractive high blood pressure diabetes clogged arteries mcdonalds coupons fat chicks	2012-11-28	0	0		#5thingsifindattractive		https://twitter.com/CurlyC513/status/273654072618401793
273210129330077697	jxsonkills	 aka diabetes mouthful the cup http instagrampsgvcfbiob 	2012-11-26	0	0	@The			https://twitter.com/jxsonkills/status/273210129330077697
271321587314204672	shawnfausett	 wish assignments like this diabetes walk nutrition home sweet home http instagrampstuc mkb k	2012-11-21	0	0	@home	#nutrition		https://twitter.com/shawnfausett/status/271321587314204672
269458285948698624	JeffBajayo	 heycheri totally gonna go stock diabetes sticks hah	2012-11-16	0	0	@heycheri			https://twitter.com/JeffBajayo/status/269458285948698624
266291311190110209	chelsea7866	 john cookies eats them john have diabetes john diabetes _annemarie	2012-11-07	0	1	@17_annemarie			https://twitter.com/chelsea7866/status/266291311190110209
263839644007948289	FredElmer_	 rude_guys ted chocolate bars eats have diabetes ted diabetes diabetisboom	2012-10-31	1	0	@Rude_Guys @diabetisboom			https://twitter.com/FredElmer_/status/263839644007948289
262636728567865344	breauxfosho	 oh goodness candy corn worth diabetes	2012-10-28	1	2				https://twitter.com/breauxfosho/status/262636728567865344
262033464700846081	itskatSTAXdaddy	 like fat kid loves diabetes commonphrasefail	2012-10-26	0	0		#commonphrasefail		https://twitter.com/itskatSTAXdaddy/status/262033464700846081
261305883739447296	dgoodin24	 eikenator diabetes	2012-10-24	0	2	@eikenator	#diabetes		https://twitter.com/dgoodin24/status/261305883739447296
259097800724320256	LaurenNothstine	 imofloflo lol choose to dont think body likes it diabetes its necessarily ideal do	2012-10-18	0	0	@imofloflo			https://twitter.com/LaurenNothstine/status/259097800724320256
256070728703692802	marie_pistachio	 urgent care smells like cigarettes diabetes 	2012-10-10	0	3				https://twitter.com/marie_pistachio/status/256070728703692802
253461630111870976	Red_Banker	 cubs vs astros nite barely edges honey boo boo vs type diabetes mondays pointless televised competition g_rant g_rant httpstwittercomred_bankerstatus courtneyjoann think may diabetes seen coming damnsunkist damnsunkist httpstwittercomcourtneyjoann status jakegriff emily was may diabetes now emily httpstwittercomjakegriff status megancollene andy warhol could take picture make million dollarsif cant quench thirst might diabetes dreamteam	2012-09-29	0	0		#dreamteam		https://twitter.com/megancollene/status/251927449749827584
244880545354489856	Valdeezus	 hope onedirection gets fat dies diabetes notsorrt	2012-09-09	0	0		#onedirection #notsorrt		https://twitter.com/Valdeezus/status/244880545354489856
236923904990515200	milohousewife	 kathleenewers im wheelchair myself bone disease lupus file full dosnt work dont know diabetes 	2012-08-18	0	0	@KathleenEwers			https://twitter.com/milohousewife/status/236923904990515200
235136659845439490	LS_Med	 dont miss lees summits free diabetes education program months classes start tomorrow http rcastp bq e	2012-08-13	0	0				https://twitter.com/LS_Med/status/235136659845439490
228968209561309186	GreatestDyeLawn	 dont diabetes yet im buying shit chubby cowboy picture screen	2012-07-27	0	0				https://twitter.com/GreatestDyeLawn/status/228968209561309186
227123044806705153	Liv_24_97	 night diabetes slow pitch softball tourney goodcause fun	2012-07-22	0	0		#GoodCause #Fun		https://twitter.com/Liv_24_97/status/227123044806705153
226203204063473664	Hilary1701	 feeling like pee every five minutes knowing really dont diabetes	2012-07-20	0	0		#diabetes		https://twitter.com/Hilary1701/status/226203204063473664
225938363948081152	Chrisjournet	 bob cookies eats themwhat bob have diabetes bob diabetes 	2012-07-19	0	0				https://twitter.com/Chrisjournet/status/225938363948081152
222709636313268226	BigTimeShields4	 karateboykyle laughed diabetes i laughed died beatings dirtydirtgrub	2012-07-10	0	0	@KarateBoyKyle @DirtyDirtGrub			https://twitter.com/BigTimeShields4/status/222709636313268226
216219851298045952	GetHeaEducaJobs	 diabetes educator colum columbia mo http tinyurlcom avc get health educator jobs healtheducator jobs job getalljobs	2012-06-22	0	0		#Columbia #HealthEducator #jobs #job #GetAllJobs		https://twitter.com/GetHeaEducaJobs/status/216219851298045952
215449888715051008	GetHeaEducaJobs	 diabetes educator sp springfield mo http tinyurlcomc gqecq get health educator jobs healtheducator jobs job getalljobs	2012-06-20	0	0		#Springfield #HealthEducator #jobs #job #GetAllJobs		https://twitter.com/GetHeaEducaJobs/status/215449888715051008
214753118192271361	MedicalBrief	 wild almond tree oil may combat obesity diabetes future weapon battle obesity a via sciencedaily http bitlyla d 	2012-06-18	0	0	@sciencedaily			https://twitter.com/MedicalBrief/status/214753118192271361
214714285769764865	topix_mo	 tree oil may combat obesity diabetes http bitlynk hpl rolla missouri	2012-06-18	0	0		#Rolla #Missouri		https://twitter.com/topix_mo/status/214714285769764865
212475640631406592	GetHeaEducaJobs	 diabetes educator sp springfield mo http tinyurlcom r fvm get health educator jobs healtheducator jobs job getalljobs	2012-06-12	0	0		#Springfield #HealthEducator #jobs #job #GetAllJobs		https://twitter.com/GetHeaEducaJobs/status/212475640631406592
209355142691164160	mmcodd	 got diabetes steak n shake http instagramplbbcfemd_m	2012-06-03	0	0	@Steak			https://twitter.com/mmcodd/status/209355142691164160
209281410970820608	GetHeaEducaJobs	 diabetes educator colum columbia mo http tinyurlcom yqpl l get health educator jobs healtheducator jobs job getalljobs	2012-06-03	0	0		#Columbia #HealthEducator #jobs #job #GetAllJobs		https://twitter.com/GetHeaEducaJobs/status/209281410970820608
208017468227190784	walkthelongroad	 months final observation diabetes live loved one careful say do counts	2012-05-30	0	0				https://twitter.com/walkthelongroad/status/208017468227190784
202494234752856064	Just_TomTom	 bout go get insulin certified anyone got diabetes 	2012-05-15	0	0				https://twitter.com/Just_TomTom/status/202494234752856064
202265098352467968	WoodBecker7	 daddyrodabaugh going give diabetes sugars wilfordbremley kiddingbutnot	2012-05-15	0	0	@daddyrodabaugh	#wilfordbremley #kiddingbutnot		https://twitter.com/WoodBecker7/status/202265098352467968
193170991785062403	Pottz_of_Gold	 crombeen proof diabetes kick ass playoffs	2012-04-19	0	0				https://twitter.com/Pottz_of_Gold/status/193170991785062403
186812326337462272	LS_Med	 lees summit medical center offers new diabetes education classes http rcasth nv 	2012-04-02	0	0				https://twitter.com/LS_Med/status/186812326337462272
182122059051188224	MzVivacious_11	 aka week come learn health diabetes asthma info suc	2012-03-20	0	0				https://twitter.com/MzVivacious_11/status/182122059051188224
178112756690591746	RoyaltyFo	 hope dlotty get diagnosed diabetes sleep	2012-03-09	0	0				https://twitter.com/RoyaltyFo/status/178112756690591746
174322212898217984	TammieTucker	 sugarcube loved seeing tv helping people understanding diabetes 	2012-02-27	0	0	@SugarCube			https://twitter.com/TammieTucker/status/174322212898217984
172914768603136000	georgeschmitz	 true life gave diabetes birthday	2012-02-24	0	1				https://twitter.com/georgeschmitz/status/172914768603136000
168073764553232384	charli1point5	 illegalriegel youre gonna get crap diabetes youve ever wanted hahaha	2012-02-10	0	0	@IllegalRiegel	#diabetes		https://twitter.com/charli1point5/status/168073764553232384
165208665383632897	GetSalEnginJobs	 springfield mo diabetes springfield mo http tinyurlcom pjk m get sales engineer jobs salesengineer jobs job getalljobs	2012-02-02	0	0		#Springfield #SalesEngineer #jobs #job #GetAllJobs		https://twitter.com/GetSalEnginJobs/status/165208665383632897
161890233259008000	BigTimeShields4	 funnyordie paula deens new line desserts injected diabetes medication circumwhat twitterlessdirtgrub	2012-01-24	0	0	@funnyordie @circumwhat @twitterlessdirtgrub			https://twitter.com/BigTimeShields4/status/161890233259008000
159513138214076417	meggywap1738	 paula deen diabetes 	2012-01-18	0	0				https://twitter.com/meggywap1738/status/159513138214076417
159346992722612224	dustindixon87	 paula deen diabetes hard belive thoughtfully includes butter mayo cream cheese every meal	2012-01-17	0	0				https://twitter.com/dustindixon87/status/159346992722612224
159339084949635072	_DanyGirl	 paula deen type diabetes imaginethat	2012-01-17	1	1		#imaginethat		https://twitter.com/_DanyGirl/status/159339084949635072
159302418440536064	chrisbeggs	 paula deen diabetes popestillcatholic 	2012-01-17	0	0		#popestillcatholic		https://twitter.com/chrisbeggs/status/159302418440536064
283911954941222912	KristenAguirre	 hannibal ymcas passport fitness something everyone triathlon training diabetes cooking standard machines khqa	2012-12-26	1	0	@KHQA			https://twitter.com/KristenAguirre/status/283911954941222912
258627037835689984	smroling4	 rude_guys ted chocolate bars eats have diabetes ted diabetes nopantsmandy	2012-10-17	0	0	@Rude_Guys @NoPantsMandy			https://twitter.com/smroling4/status/258627037835689984
240578455413071872	nawaf_hamooh	 q retw ahbkgr rt girls rtweet q diabetes meal planning pictwittercom dcpd ey	2012-08-28	1	0	@Q8reTW @ahbkgr @RT4girls @rtweet2011q8			https://twitter.com/nawaf_hamooh/status/240578455413071872
240577547073642496	nawaf_hamooh	 ahbkgr rtweet q q retw diabetes carbohydrate counting pictwittercomylhs him	2012-08-28	2	0	@ahbkgr @rtweet2011q8 @Q8reTW			https://twitter.com/nawaf_hamooh/status/240577547073642496
159868902057320448	betsyhavens	 tater_rage_page anybody really surprised find paula deen diabetes didnt think so	2012-01-19	0	0	@tater_rage_page			https://twitter.com/betsyhavens/status/159868902057320448
280138482305884160	Jaydub588	 teejo_ good get diabetes once	2012-12-15	0	0	@teejo_			https://twitter.com/Jaydub588/status/280138482305884160
256405143631847424	_Marny_	 doc told needed lose weight eat right asap would meds high blood pressure diabetes mo	2012-10-11	0	0				https://twitter.com/_Marny_/status/256405143631847424
246417064447860736	maddieb98	 ddwyer k_warzycha jacob__peterson soonysaad diabetes bracelet litte brother gave you	2012-09-13	0	0	@Ddwyer14 @k_warzycha @jacob__peterson @soonysaad			https://twitter.com/maddieb98/status/246417064447860736
246416551929077760	maddieb98	 keikamara ddwyer soonysaad diabetes bracelet brother gave soonysaad 	2012-09-13	0	0	@keikamara @ddwyer14 @soonysaad @SoonySaad			https://twitter.com/maddieb98/status/246416551929077760
231023513622953985	Pedrinsky21	 charliezc caritowtf ah ok entonces saldr con ellos pasear tomar mucha coca aunque ellos les de diabetes por que aguantan nada	2012-08-02	0	0	@Charliezc @caritowtf			https://twitter.com/Pedrinsky21/status/231023513622953985
222408888824238080	Live4Him_48	 nigga rick ross need put shirt back videos thats diabetes body	2012-07-09	2	0				https://twitter.com/Live4Him_48/status/222408888824238080
204359404974379008	ApesOfIron	 lets get therock death valley biking miles cure diabetes october th whose me jdrf 	2012-05-20	0	0	@TheRock @JDRF			https://twitter.com/ApesOfIron/status/204359404974379008
172833604714500097	tlhawk	 ruled anorexia rt istone isnt getting blury vision youre hungry sign diabetes think	2012-02-23	0	0	@istone23			https://twitter.com/tlhawk/status/172833604714500097
208017468227190784	walkthelongroad	 months final observation diabetes live loved one careful say do counts	2012-05-30	0	0				https://twitter.com/walkthelongroad/status/208017468227190784
274031887939428353	GavinBaker81	 wowfactsoflife lack sleep increases risk heart disease diabetes obesity teamnosleep	2012-11-29	1	0	@WOWFactsOfLife	#teamnosleep		https://twitter.com/GavinBaker81/status/274031887939428353
271711035239579648	carls9396	 family comparing hga c scores glasses wine diabetes	2012-11-22	0	0		#diabetes		https://twitter.com/carls9396/status/271711035239579648
254013769204781056	Kid_Lizette	 littledinoroar laugh back youre bathing suit theyve got type diabetes 	2012-10-04	1	0	@littleDinoROAR			https://twitter.com/Kid_Lizette/status/254013769204781056
240687662082707456	kbrant08	 hipstermermaid years receiving consuming many candy grams glenn coco developed diabetes ethangr chelsbpierce kayleewh	2012-08-29	0	1	@hipstermermaid @ethangr @chelsbpierce @KayleeWH			https://twitter.com/kbrant08/status/240687662082707456
239952341904797696	JVR621	 pain makes stronger facing fear makes braver crohns ibd invisableillness diabetes chronicillness ostomy cancer illness	2012-08-27	0	0		#Crohns #ibd #invisableillness #diabetes #chronicillness #ostomy #Cancer #illness		https://twitter.com/JVR621/status/239952341904797696
230223901811175424	JVR621	 know name story youve heard ive done ive through crohns uc ibd crohnicillness diabetes cancer	2012-07-31	0	0		#Crohns #UC #IBD #crohnicillness #diabetes #Cancer		https://twitter.com/JVR621/status/230223901811175424
200852396115628032	meghanbohnert13	 kburg cant stop chugging water maybe diabetes insipidus gonna start drinking toilets point help	2012-05-11	0	0	@kburg10	#help		https://twitter.com/meghanbohnert13/status/200852396115628032
200779119192051712	Concr3te_Ros3	 ambitious___mel sis im praying fam diabetes liveable jut watch weight diet stay prayed	2012-05-10	0	0	@Ambitious___Mel			https://twitter.com/Concr3te_Ros3/status/200779119192051712
189552800328466433	kmhunt14	 i check diabetes whats going running notthrilled 	2012-04-09	0	0		#what #notthrilled #		https://twitter.com/kmhunt14/status/189552800328466433
185865941345767424	DaniHogard	 could get diabetes looking cake steph catholicproblems fishfry	2012-03-30	0	0		#CatholicProblems #fishfry		https://twitter.com/DaniHogard/status/185865941345767424
171055126767874048	amydevaughn	 study diabetes ice cream study insulin resistance first hand pictwittercomsnghxznz	2012-02-18	0	0				https://twitter.com/amydevaughn/status/171055126767874048
164340984661020672	TCStant	 late unprepared excusecoffee maker broke diabetes isnt excuse fuck	2012-01-31	0	0				https://twitter.com/TCStant/status/164340984661020672
164022301455695872	TCStant	 hes mad diabetes	2012-01-30	0	0				https://twitter.com/TCStant/status/164022301455695872
162272132213112833	Kid_Lizette	 nerdbliss always tempted mix up parkinsons mom stage diabetes dad randomly caught fire times	2012-01-25	0	0	@NerdBliss			https://twitter.com/Kid_Lizette/status/162272132213112833
284849488076627969	Jamesha_Harris	 god cursed diabetes feel like im insaneyou aint hood dont deserve mane 	2012-12-28	1	0				https://twitter.com/Jamesha_Harris/status/284849488076627969
271862955639975937	Brad_Mf_C	 living diabetes struggle stay alivee	2012-11-23	0	0				https://twitter.com/Brad_Mf_C/status/271862955639975937
268111858534346752	paulfodde81	 got oreos ritz packs mtn dew big ass pack hot pockets pack red bull ill diagnosed w diabetes 	2012-11-12	0	0				https://twitter.com/paulfodde81/status/268111858534346752
261313028455297025	99chewstuff	 reesej_dadiva blood jesus covers diabetes betta lay twinkies plan stayin outa barnes ijs cthu	2012-10-24	0	0	@ReeseJ_DaDiva	#IJS		https://twitter.com/99chewstuff/status/261313028455297025
250004663854854145	Wucking_Freck	 mugs said got sugar rush bitch hope get diabetes	2012-09-23	0	0				https://twitter.com/Wucking_Freck/status/250004663854854145
242554017539035137	_Trappin_OnMyy	 diabetes noo joke	2012-09-03	0	0				https://twitter.com/_Trappin_OnMyy/status/242554017539035137
225998854691098625	Sherrell_Denise	 _ammond naaaa ont want everybody saying gone get diabetes add sugar	2012-07-19	0	0	@_Ammond			https://twitter.com/Sherrell_Denise/status/225998854691098625
221853568548872192	Megroo_	 hope health issues dont get bad cancer heart problems diabetes everything runs sides family 	2012-07-08	1	0				https://twitter.com/Megroo_/status/221853568548872192
221500556357812224	STLgreatest	 boy im looking condoms im working tonteee boy thing working diabetes fat fuck projectx cthu 	2012-07-07	1	0		#ProjectX		https://twitter.com/STLgreatest/status/221500556357812224
215237652113399809	69spotter	 quarts qt midwest bladdercontrol diabetes pictwittercomzjtfl p	2012-06-19	1	0		#midwest #bladdercontrol #diabetes		https://twitter.com/69spotter/status/215237652113399809
202787914973851648	Poisso3	 dameathookyoung type diabetes	2012-05-16	0	0	@DaMeathookYoung			https://twitter.com/Poisso3/status/202787914973851648
199980228544708608	JrayHaliday	 chicks dudes diabetes 	2012-05-08	0	0				https://twitter.com/JrayHaliday/status/199980228544708608
187159697659412480	Mama_Reds	 awesome time bringiton cast stl cast benefit juvenile diabetes amazing seeyallincharlotte	2012-04-03	0	0	@bringiton	#seeyallincharlotte		https://twitter.com/Mama_Reds/status/187159697659412480
180324974492516354	James_EJ_Turner	 lnsanefacts sex least per week lower mans risk heart disease stroke diabetes 	2012-03-15	0	0				https://twitter.com/James_EJ_Turner/status/180324974492516354
178941682031665152	DeeSattDaDon	 bornn_freshh next thing kno finna diabetes commercial lol	2012-03-11	0	0	@Bornn_freshh			https://twitter.com/DeeSattDaDon/status/178941682031665152
175317249652039683	63121	 protein may play role obesity diabetes aging http bitlyyr fgd via http outsidein 	2012-03-01	0	0				https://twitter.com/63121/status/175317249652039683
175253179968126976	63132	 protein may play role obesity diabetes aging http bitlyzslnno via http outsidein 	2012-03-01	0	0				https://twitter.com/63132/status/175253179968126976
175253179494187009	63130	 protein may play role obesity diabetes aging http bitlyzdqbih via http outsidein 	2012-03-01	0	0				https://twitter.com/63130/status/175253179494187009
175253171411746816	63114	 protein may play role obesity diabetes aging http bitlywx qxb via http outsidein 	2012-03-01	0	0				https://twitter.com/63114/status/175253171411746816
173981535123419137	Kevin_Hebert	 jonah hills diabetes rt davidtcline remembrances hope dont forget mention career adam sandler oscars	2012-02-26	2	0	@davidtcline	#Oscars		https://twitter.com/Kevin_Hebert/status/173981535123419137
173335466035253248	63303	 ssm st joseph health center offers diabetes self management training http bitlyyzozxx via http outsidein 	2012-02-25	0	0				https://twitter.com/63303/status/173335466035253248
173301658854490113	63301	 ssm st joseph health center offers diabetes self management training http bitlyzqdtgh via http outsidein 	2012-02-25	0	0				https://twitter.com/63301/status/173301658854490113
172911768740438016	topix_mo	 burroughs senior spokesman proponent juvenile diabetes http bitlywcu q ladue missouri	2012-02-24	0	0		#Ladue #Missouri		https://twitter.com/topix_mo/status/172911768740438016
164110223332741122	63121	 software creates dashboard diabetes docs http bitlywckp via http outsidein 	2012-01-30	0	0				https://twitter.com/63121/status/164110223332741122
158948806396870658	Sonnyjr78	 bout act fool this walmart pharmacythey act like im tryn get refil cocainei want diabetes meds go bk wrk	2012-01-16	0	0	@this			https://twitter.com/Sonnyjr78/status/158948806396870658
155345082176913409	SLIKK_DARKO	 diabetes _cathy hate spam	2012-01-06	0	0	@Diabetes			https://twitter.com/SLIKK_DARKO/status/155345082176913409
155183317682094080	SLIKK_DARKO	 mcdonalds delivered would rapworld wide diabetes	2012-01-06	4	0				https://twitter.com/SLIKK_DARKO/status/155183317682094080
280518699042086912	seannothstine15	 t diabetesprobs diabetes big problem	2012-12-16	0	0	@T1diabetesprobs			https://twitter.com/seannothstine15/status/280518699042086912
276749663678394369	seannothstine15	 doctors think diabetes 	2012-12-06	0	2				https://twitter.com/seannothstine15/status/276749663678394369
254067734697103361	K_laMaxine	 rough night drunk deaf diabetes	2012-10-04	0	0		#drunk #deaf #diabetes		https://twitter.com/K_laMaxine/status/254067734697103361
284195257384595456	BeccaOrick	 chrissiebert bring food get early onset diabetes die im looking you goodfriend	2012-12-27	0	0	@chrissiebert22	#goodfriend		https://twitter.com/BeccaOrick/status/284195257384595456
279313817903706113	layynuhh73	 comedyposts juan chocolate bars eats juan now diabetes juan diabetes madelinee 	2012-12-13	0	0	@ComedyPosts @Madelinee48			https://twitter.com/layynuhh73/status/279313817903706113
259842769755971584	Jasontheorphan	 willleroy african kids came ate fat kids would cut diabetes obesity rates us like half bro	2012-10-20	0	0	@WillLeRoy			https://twitter.com/Jasontheorphan/status/259842769755971584
240896837748400129	OhYeahItsBata	 lawlzmyballs john cookies eats them john have diabetes john diabetes browniebite 	2012-08-29	1	0	@LawlzMyBalls @browniebite90			https://twitter.com/OhYeahItsBata/status/240896837748400129
238080468812185600	m_laub	 fillwerrell juan chocolate bars eats juan now diabetes juan diabetes michelle_axid cayla_bowen	2012-08-21	0	0	@FillWerrell @Michelle_AXID @Cayla_Bowen			https://twitter.com/m_laub/status/238080468812185600
223401610947203073	63129	 arnold walgreens sells jdrf sneakers cure diabetes http bitlynrp xj via http outsidein 	2012-07-12	0	0				https://twitter.com/63129/status/223401610947203073
223379482495549440	63052	 arnold walgreens sells jdrf sneakers cure diabetes http bitlypoyedd via http outsidein 	2012-07-12	0	0				https://twitter.com/63052/status/223379482495549440
223379471896559616	63026	 arnold walgreens sells jdrf sneakers cure diabetes http bitlypoydyv via http outsidein 	2012-07-12	0	0				https://twitter.com/63026/status/223379471896559616
223379465781264385	63010	 arnold walgreens sells jdrf sneakers cure diabetes http bitlypoyd via http outsidein 	2012-07-12	0	0				https://twitter.com/63010/status/223379465781264385
217673759262388224	bobbyjaycox	 funnybrooks implying eaten or mcdoubles day didnt know could diabetes professionally	2012-06-26	0	0	@FunnyBrooks			https://twitter.com/bobbyjaycox/status/217673759262388224
212042899683155968	T13Jarvis	 im john diabetes z_hirth samtaff goodtimes grantducker 	2012-06-11	0	1	@Z_Hirth54 @SamTaff74 @GrantDucker90	#goodTimes		https://twitter.com/T13Jarvis/status/212042899683155968
202294433901838337	HEATSUTxO	 jabrucy time gonna cure diabetes	2012-05-15	1	0	@Jabrucy			https://twitter.com/HEATSUTxO/status/202294433901838337
195395074073427968	ThaRealGary	 making mac n cheese tommy doublin butter were gonna die diabetes firstworldproblems	2012-04-26	0	0		#FirstWorldProblems		https://twitter.com/ThaRealGary/status/195395074073427968
193330990557569025	63131	 qa kirkwood teen works end diabetes http bitlyhxpf v via http outsidein 	2012-04-20	0	0				https://twitter.com/63131/status/193330990557569025
185011014281068544	NicholynMiller	 jose chocolate bars eats jose now diabetes jose diabetes 	2012-03-28	1	0				https://twitter.com/NicholynMiller/status/185011014281068544
173022495811706880	63122	 burroughs senior spokesman proponent juvenile diabetes http bitlywptr p via http outsidein 	2012-02-24	0	0				https://twitter.com/63122/status/173022495811706880
172939104147881985	63131	 burroughs senior spokesman proponent juvenile diabetes http bitlyyeka e via http outsidein 	2012-02-24	0	0				https://twitter.com/63131/status/172939104147881985
168910668764950528	rosstenczar	 act surprised upset adele dies diabetes years	2012-02-12	0	0				https://twitter.com/rosstenczar/status/168910668764950528
162026245998125057	63127	 missouri senator visits juvenile diabetes research foundation http bitlyanrjx via http outsidein 	2012-01-24	0	0				https://twitter.com/63127/status/162026245998125057
