id	Username	Text	Date	Retweets	Favorites	Mentions	Hashtags	Geo	Permalink
162026239861854209	63126	 missouri senator visits juvenile diabetes research foundation http bitlyw vfai via http outsidein 	2012-01-24	0	0				https://twitter.com/63126/status/162026239861854209
161996119734362112	63128	 missouri senator visits juvenile diabetes research foundation http bitlyxnrtjf via http outsidein 	2012-01-24	0	0				https://twitter.com/63128/status/161996119734362112
161996118459285504	63122	 missouri senator visits juvenile diabetes research foundation http bitlyy v gc via http outsidein 	2012-01-24	0	0				https://twitter.com/63122/status/161996118459285504
161996116303421440	63123	 missouri senator visits juvenile diabetes research foundation http bitlyaes w via http outsidein 	2012-01-24	0	0				https://twitter.com/63123/status/161996116303421440
161996104358043650	63026	 missouri senator visits juvenile diabetes research foundation http bitlyymg av via http outsidein 	2012-01-24	0	0				https://twitter.com/63026/status/161996104358043650
285269903009775617	nickbenigno	 diabetes come pictwittercomehjgqod 	2012-12-30	0	0				https://twitter.com/nickbenigno/status/285269903009775617
270490905516060672	DrArnone	 kobe_lgh possibly bloodsugar problem diagnosed diabetes 	2012-11-19	0	0	@Kobe_LGH			https://twitter.com/DrArnone/status/270490905516060672
266690795468382209	mummy2366	 sarahssweetz fun john chocolate bars eats john now diabetes john diabetes lol	2012-11-08	0	0	@SarahsSweetz @Fun			https://twitter.com/mummy2366/status/266690795468382209
203501933166727168	yatown_news_am	 doctors speak menopause diabetes stltodaycom http yatowncomnewscentaurc hesterfieldmodoctorstospeakonmenopausediabetespbstltodaycomlocentaur cchesterfield cmosnonwednesday cmay cdrcarenschaecherwilldiscussmanagingmenopauseviytidoctorstospeakonmenopause cdiabetesxuhttp a f fwwwstltodaycom fsuburbanjournals fmetro flife fdoctorstospeakonmenopausediabetes farticle_ af febb f a ed e f c c htmlsrctw centaur chesterfield mo	2012-05-18	0	0		#Centaur #Chesterfield #MO		https://twitter.com/yatown_news_am/status/203501933166727168
193391847803068416	63376	 qa kirkwood teen works end diabetes http bitlyjbhiun via http outsidein 	2012-04-20	0	0				https://twitter.com/63376/status/193391847803068416
185733038993448960	deanoshome	 uberfacts lack sleep increases risk heart disease diabetes obesity notpikrk	2012-03-30	0	0	@UberFacts @notpikrk			https://twitter.com/deanoshome/status/185733038993448960
173981535123419137	Kevin_Hebert	 jonah hills diabetes rt davidtcline remembrances hope dont forget mention career adam sandler oscars	2012-02-26	2	0	@davidtcline	#Oscars		https://twitter.com/Kevin_Hebert/status/173981535123419137
173335470355386368	63376	 ssm st joseph health center offers diabetes self management training http bitlyz dwv via http outsidein 	2012-02-25	0	0				https://twitter.com/63376/status/173335470355386368
173335466035253248	63303	 ssm st joseph health center offers diabetes self management training http bitlyyzozxx via http outsidein 	2012-02-25	0	0				https://twitter.com/63303/status/173335466035253248
173301661555625984	63304	 ssm st joseph health center offers diabetes self management training http bitlyywmpwj via http outsidein 	2012-02-25	0	0				https://twitter.com/63304/status/173301661555625984
168111886729084928	boriquajo	 big congratulations weight loss situation diabetes hard wanna grow old w son thank you	2012-02-10	0	0				https://twitter.com/boriquajo/status/168111886729084928
165941505322786816	MRHibbard	 uberscholar didnt know diabetes 	2012-02-04	0	0	@uberscholar			https://twitter.com/MRHibbard/status/165941505322786816
159492395438845953	Stegallicous	 didnt know could consume stick butter everyday w diabetes stillpauladeanfan	2012-01-17	0	0		#stillpauladeanfan		https://twitter.com/Stegallicous/status/159492395438845953
270490905516060672	DrArnone	 kobe_lgh possibly bloodsugar problem diagnosed diabetes 	2012-11-19	0	0	@Kobe_LGH			https://twitter.com/DrArnone/status/270490905516060672
185733038993448960	deanoshome	 uberfacts lack sleep increases risk heart disease diabetes obesity notpikrk	2012-03-30	0	0	@UberFacts @notpikrk			https://twitter.com/deanoshome/status/185733038993448960
285407582552748032	jrmoorecomedy	 hard us uncle dies due diabetes slap face served cake funeral	2012-12-30	0	0				https://twitter.com/jrmoorecomedy/status/285407582552748032
284849488076627969	Jamesha_Harris	 god cursed diabetes feel like im insaneyou aint hood dont deserve mane 	2012-12-28	1	0				https://twitter.com/Jamesha_Harris/status/284849488076627969
281271565688135680	absolut4	 angelljaunnae oh yeah dont diabetes dword insteaddrugs	2012-12-19	0	0	@AngellJaunnae			https://twitter.com/absolut4/status/281271565688135680
277163799826546689	MigorSTL	 seen car work parking lot copy christmas album carpenters greatest hits must diabetes patient	2012-12-07	0	2				https://twitter.com/MigorSTL/status/277163799826546689
274516144369590272	Nazzo28	 wow woman starbucks really pregnant really huge latte wants bet kid diabetes severe add	2012-11-30	0	0				https://twitter.com/Nazzo28/status/274516144369590272
261649513536712704	adamsiebs	 fully safe rt uberfacts one alcoholic drink day reduce risk type diabetes percent	2012-10-25	0	0	@UberFacts			https://twitter.com/adamsiebs/status/261649513536712704
258578197015318530	MalloryRDN	 know everything know diabetes ready dominate test hey ho	2012-10-17	0	0				https://twitter.com/MalloryRDN/status/258578197015318530
254257784907001856	GetHeaEducaJobs	 diabetes educator amh saintlouis mo http tinyurlcom nokuo get health educator jobs healtheducator jobs job getalljobs	2012-10-05	0	0		#SaintLouis #HealthEducator #jobs #job #GetAllJobs		https://twitter.com/GetHeaEducaJobs/status/254257784907001856
254069850039795714	mariahmimms	 sugar makes feel bettter diabetes	2012-10-05	0	0		#Diabetes		https://twitter.com/mariahmimms/status/254069850039795714
242554017539035137	_Trappin_OnMyy	 diabetes noo joke	2012-09-03	0	0				https://twitter.com/_Trappin_OnMyy/status/242554017539035137
233973737840599043	SeanCollinsSTL	 diabetes episode hypoglycemia pretty fucking scary get candy glucagon takemeaway fb	2012-08-10	0	0		#glucagon #takemeaway #fb		https://twitter.com/SeanCollinsSTL/status/233973737840599043
232405834552971265	GetSalManagJobs	 diabetes district sales manager saintlouis mo http tinyurlcomcd vabf get sales manager jobs salesmanager jobs job getalljobs	2012-08-06	0	0		#SaintLouis #SalesManager #jobs #job #GetAllJobs		https://twitter.com/GetSalManagJobs/status/232405834552971265
225998854691098625	Sherrell_Denise	 _ammond naaaa ont want everybody saying gone get diabetes add sugar	2012-07-19	0	0	@_Ammond			https://twitter.com/Sherrell_Denise/status/225998854691098625
219898861928456193	LMK4891	 diabetes appointment center advanced medicine w others http sqcomlsx yb	2012-07-02	0	0	@Center			https://twitter.com/LMK4891/status/219898861928456193
215802067032350720	LDEEZY_BABY	 smh cousin type diabetes huuuhhhh starting great day	2012-06-21	0	0				https://twitter.com/LDEEZY_BABY/status/215802067032350720
215404335415300096	GetHeaEducaJobs	 diabetes educator sai saintlouis mo http tinyurlcomcsdtpgj get health educator jobs healtheducator jobs job getalljobs	2012-06-20	0	0		#SaintLouis #HealthEducator #jobs #job #GetAllJobs		https://twitter.com/GetHeaEducaJobs/status/215404335415300096
212439796423987200	wilk306	 diabetes jones saved retail value pocket expense glad least donated soul	2012-06-12	0	0				https://twitter.com/wilk306/status/212439796423987200
212128442530009088	GetHeaEducaJobs	 diabetes educator sai saintlouis mo http tinyurlcomd vc get health educator jobs healtheducator jobs job getalljobs	2012-06-11	0	0		#SaintLouis #HealthEducator #jobs #job #GetAllJobs		https://twitter.com/GetHeaEducaJobs/status/212128442530009088
209331063477121024	GetHeaEducaJobs	 diabetes educator sai saintlouis mo http tinyurlcom rwlo q get health educator jobs healtheducator jobs job getalljobs	2012-06-03	0	0		#SaintLouis #HealthEducator #jobs #job #GetAllJobs		https://twitter.com/GetHeaEducaJobs/status/209331063477121024
188548013046763521	63103	 cast bring on raises diabetes research http bitlyhuw iq via http outsidein 	2012-04-07	0	0				https://twitter.com/63103/status/188548013046763521
183245344061136896	benbrogan	 diabetes tastes good sweettea	2012-03-23	0	0		#SweetTea		https://twitter.com/benbrogan/status/183245344061136896
175317249652039683	63121	 protein may play role obesity diabetes aging http bitlyyr fgd via http outsidein 	2012-03-01	0	0				https://twitter.com/63121/status/175317249652039683
175253189501788161	63124	 protein may play role obesity diabetes aging http bitlyw vlvp via http outsidein 	2012-03-01	0	0				https://twitter.com/63124/status/175253189501788161
175253179494187009	63130	 protein may play role obesity diabetes aging http bitlyzdqbih via http outsidein 	2012-03-01	0	0				https://twitter.com/63130/status/175253179494187009
172972881381310465	63117	 burroughs senior spokesman proponent juvenile diabetes http bitlyxd eam via http outsidein 	2012-02-24	0	0				https://twitter.com/63117/status/172972881381310465
172939103560675330	63124	 burroughs senior spokesman proponent juvenile diabetes http bitlyaimhx via http outsidein 	2012-02-24	0	0				https://twitter.com/63124/status/172939103560675330
172911768740438016	topix_mo	 burroughs senior spokesman proponent juvenile diabetes http bitlywcu q ladue missouri	2012-02-24	0	0		#Ladue #Missouri		https://twitter.com/topix_mo/status/172911768740438016
164110223332741122	63121	 software creates dashboard diabetes docs http bitlywckp via http outsidein 	2012-01-30	0	0				https://twitter.com/63121/status/164110223332741122
199325194043654146	storeron	 dessert smells like diabetes lol codympitts	2012-05-06	0	0	@CodyMPitts			https://twitter.com/storeron/status/199325194043654146
159346992722612224	dustindixon87	 paula deen diabetes hard belive thoughtfully includes butter mayo cream cheese every meal	2012-01-17	0	0				https://twitter.com/dustindixon87/status/159346992722612224
275346982296489984	clairebelle13	 nursing school test week least know interventions diabetes were raising risks disease	2012-12-02	0	0				https://twitter.com/clairebelle13/status/275346982296489984
274517820908384256	sadpixels	 hello free day hello donut hello diabetes regrets hallmark cards inc http instagrampsqb nlqwnr	2012-11-30	0	0	@Hallmark			https://twitter.com/sadpixels/status/274517820908384256
273174221667065856	Nayere	 forgot gotta watch sugar intake type diabetes get clapped go kool aid got speed dial	2012-11-26	0	0				https://twitter.com/Nayere/status/273174221667065856
272926136684658688	jenmayekawa	 dannyboi holy sweet jesuspolyhydramnios gestational diabetes im trying consider possibilities would produce this	2012-11-25	0	0	@dannyboi965			https://twitter.com/jenmayekawa/status/272926136684658688
272161661060780032	Nayere	 wonder gonna work sickle cell diabetes ppl wanna say im playing sick im tired god beyond much handle	2012-11-23	0	0				https://twitter.com/Nayere/status/272161661060780032
270926796139159552	braybo2	 guy i used go stuff face full twinkies cant anymore because diabetes 	2012-11-20	0	0				https://twitter.com/braybo2/status/270926796139159552
268711457443688449	mollstothewall9	 wearing blue head toe raise awareness diabetes especially kelseymart worlddiabetesday pictwittercomeeu tx	2012-11-14	0	1	@kelseymart	#WorldDiabetesDay		https://twitter.com/mollstothewall9/status/268711457443688449
265877903743528960	SkylerParke	 john chocolate bars eats john now diabetes john diabetes 	2012-11-06	0	1				https://twitter.com/SkylerParke/status/265877903743528960
262249929685213184	DCoolestBoy	 diabetes number one cause blindness adults thats crazy eat healthy	2012-10-27	0	0				https://twitter.com/DCoolestBoy/status/262249929685213184
256027591172030464	gypsyfilmmaker	 work class today diabetes test work speed dating tomorrow busybee	2012-10-10	0	0		#busybee		https://twitter.com/gypsyfilmmaker/status/256027591172030464
234972494833012736	theletterj1	 factboook person diabetes urine tastes sweet extra sugar bloodstream	2012-08-13	0	0	@FactBoook			https://twitter.com/theletterj1/status/234972494833012736
234845909974933504	SaviiJ924	 benefits swallowing seamanhelp sore throats prevent diabetes no wonder fat ass dont diabetes chrissy x	2012-08-12	0	0	@chrissy34x			https://twitter.com/SaviiJ924/status/234845909974933504
230087546657464320	tanboyyy	 youngest bro said black people diabetes cause koolaid lolol	2012-07-30	0	0				https://twitter.com/tanboyyy/status/230087546657464320
203196217751109634	TDGPhotography	 kristaonpurpose biotech company kc make instruments used dx diabetes sounds boring know 	2012-05-17	0	0	@kristaonpurpose			https://twitter.com/TDGPhotography/status/203196217751109634
195294231550631936	DyllanConstInc	 american diabetes lets get jazzed event american jazz museum pic http sqcomjov gx	2012-04-25	0	0	@American			https://twitter.com/DyllanConstInc/status/195294231550631936
172199553515266048	ThrowerTheD_	 srizzy lol yeah nukka hahahahaha liquid diabetes 	2012-02-22	0	0	@SRizzy13			https://twitter.com/ThrowerTheD_/status/172199553515266048
170937885091045376	charli1point5	 ask ron paul bsl test diabetes doc	2012-02-18	0	0		#diabetes #DOC		https://twitter.com/charli1point5/status/170937885091045376
169933155954999296	YesIm_Serious	 want koolaid liquid diabetes tfyouthinking	2012-02-15	1	0		#Tfyouthinking		https://twitter.com/YesIm_Serious/status/169933155954999296
165868718231011328	charli1point5	 myglu gonna valentine diabetes 	2012-02-04	0	0		#MyGlu #Valentine #diabetes		https://twitter.com/charli1point5/status/165868718231011328
165851934794846210	charli1point5	 words cure diabetes bittersweet anyone else	2012-02-04	2	0		#diabetes		https://twitter.com/charli1point5/status/165851934794846210
162703666086813696	CardioTabs	 instance diabetes american indians three generations ago due diet according drjamesokeefe	2012-01-26	0	0	@DrJamesOKeefe			https://twitter.com/CardioTabs/status/162703666086813696
160772578103930881	KCDorianGray	 hillcrestblonde call sleepover sweet think gave type diabetes 	2012-01-21	0	1	@HillcrestBlonde			https://twitter.com/KCDorianGray/status/160772578103930881
159772973107118081	KCDorianGray	 crowejam paula deen hide diabetes looked everywhere butter butt	2012-01-18	0	0	@CroweJam			https://twitter.com/KCDorianGray/status/159772973107118081
159253728262754305	STLKaren	 im sorry anyone really surprised paula deen diabetes 	2012-01-17	0	0				https://twitter.com/STLKaren/status/159253728262754305
279344158823550977	clairebelle13	 ok slept not long whats wrong me decided banana pancakes is obesity side diabetes nursingdiagnosis	2012-12-13	0	0		#nursingdiagnosis		https://twitter.com/clairebelle13/status/279344158823550977
273654072618401793	CurlyC513	 thingsifindattractive high blood pressure diabetes clogged arteries mcdonalds coupons fat chicks	2012-11-28	0	0		#5thingsifindattractive		https://twitter.com/CurlyC513/status/273654072618401793
267895221617033217	topix_mo	 help light night sky lees summit blue world diabetes day nov pm http bitlyw nxgg leessummit missouri	2012-11-12	0	0		#LeesSummit #Missouri		https://twitter.com/topix_mo/status/267895221617033217
253461630111870976	Red_Banker	 cubs vs astros nite barely edges honey boo boo vs type diabetes mondays pointless televised competition g_rant g_rant httpstwittercomred_bankerstatus ls_med dont miss lees summits free diabetes education program months classes start tomorrow http rcastp bq e httpstwittercomls_medstatus mmcodd got diabetes steak n shake http instagramplbbcfemd_m steak httpstwittercommmcoddstatus ls_med lees summit medical center offers new diabetes education classes http rcasth nv httpstwittercomls_medstatus courtneylube diabetes cup pictwittercomnrbxp hp httpstwittercomcourtneylubestatus jazz trumpet smallywood cmbox sam_picc talk diabetes making hungry smallywood cmbox sam_picc httpstwittercomjazz trumpetstatus tbcoydiabetes diabetes education diabetes suppliesstop tobacco programs meals prepared sent http hometakebettercareofyourselfkccom httpstwittercomtbcoydiabetesstatus wezilukundo friend chocolate bars ate now me diabetes course	2012-03-11	0	0				https://twitter.com/WeziLukundo/status/179006074584702976
272865287387361281	rock_lauren	 testing structural integrity pantskansas city always worth extra pounds possible diabetes kc	2012-11-25	0	0		#KC		https://twitter.com/rock_lauren/status/272865287387361281
203891837684027392	daricsnyder	 state bird diabetes kansas city international airport cnbc http sqcomm xgjk	2012-05-19	0	0	@Kansas			https://twitter.com/daricsnyder/status/203891837684027392
172914768603136000	georgeschmitz	 true life gave diabetes birthday	2012-02-24	0	1				https://twitter.com/georgeschmitz/status/172914768603136000
168073764553232384	charli1point5	 illegalriegel youre gonna get crap diabetes youve ever wanted hahaha	2012-02-10	0	0	@IllegalRiegel	#diabetes		https://twitter.com/charli1point5/status/168073764553232384
263731926978932736	TristanAsh9	 lanefreeborn gonna die painful diabetes related death rip	2012-10-31	0	0	@LaneFreeborn	#RIP		https://twitter.com/TristanAsh9/status/263731926978932736
210589158400466944	CortneyInspires	 khatastrophe jcgriggs diabetes khup now khups must come north pole its ice khold khristmas gift only	2012-06-07	0	0	@KHatastrophe06 @JCGriggs1			https://twitter.com/CortneyInspires/status/210589158400466944
182880035718434817	Kill_SallieMae	 tested diabetes type yesterday	2012-03-22	0	0				https://twitter.com/Kill_SallieMae/status/182880035718434817
171713133856038912	mmollllyy	 think im going get diabetes candy omfg	2012-02-20	1	0				https://twitter.com/mmollllyy/status/171713133856038912
278596136489590784	Twelve__Gage	 uberfacts one alcoholic drink day reduce risk type diabetes percent think im negative percentage	2012-12-11	0	2	@UberFacts			https://twitter.com/Twelve__Gage/status/278596136489590784
