id	Username	Text	Date	Retweets	Favorites	Mentions	Hashtags	Geo	Permalink
527067635465584640	alexcomer_	 thezakary tcus mascot looks like retarded frog cancerous growths tcuhateweek 	2014-10-28	0	2	@thezakary	#TCUHateWeek		https://twitter.com/alexcomer_/status/527067635465584640
488849199169945600	nicearmpit	 im actually waiting test results come back see thing eye cancerous wasnt funny impersonate	2014-07-14	0	0				https://twitter.com/nicearmpit/status/488849199169945600
428278908962607104	chilonicole	 electricf el nipple tumors get removed idk cancerous yet cant find removed	2014-01-28	0	0	@electricf3el			https://twitter.com/chilonicole/status/428278908962607104
534763645792952320	benny_work	 olli maatta cancerous tumor removed two weeks ago playing tonight stud	2014-11-18	0	0		#stud		https://twitter.com/benny_work/status/534763645792952320
513946554206785536	D_w_o_o_d	 finished typing pretty cancerous essay thats due am relieved understatement	2014-09-22	0	3				https://twitter.com/D_w_o_o_d/status/513946554206785536
458756696358539264	IAmAstra_	 scomo dog developed tumor around age cancerous didnt money treatment lived still	2014-04-22	0	1	@Scomo843			https://twitter.com/IAmAstra_/status/458756696358539264
