id	Username	Text	Date	Retweets	Favorites	Mentions	Hashtags	Geo	Permalink
438043246426853377	DanRayWalls	 pwmania wwe jake the snake roberts issues statement ahead surgery remove cancerous tumor http bitly dqbdhp praying	2014-02-24	0	0	@PWMania	#WWE		https://twitter.com/DanRayWalls/status/438043246426853377
517761821600919552	Snesley21	 deleting facebook tonight feels like im removing cancerous mole i assume never one removed before	2014-10-02	0	1				https://twitter.com/Snesley21/status/517761821600919552
465201923768209409	MasterGThuggin	 assumptions cancerous successful relationships	2014-05-10	2	1				https://twitter.com/MasterGThuggin/status/465201923768209409
462042539135336450	J_Cuub	 cuposyrup nigga got cure cancer httpstwittercomcuposyrupstatus photo pictwittercomcp yzdgefz or maybe cancerous tumor lmao	2014-05-01	0	0	@cuposyrup			https://twitter.com/J_Cuub/status/462042539135336450
452125534538199042	a_robinson33	 nannys good papas cyst results came back today its cancerous thanksforprayers	2014-04-04	0	2		#thanksforprayers		https://twitter.com/a_robinson33/status/452125534538199042
514164553811492864	dj_mcnair3	 girl aint perfect straight cancerous ass folks tryna hate	2014-09-22	1	0				https://twitter.com/dj_mcnair3/status/514164553811492864
467409945759973377	ElisabethAnne17	 caspershafer its ridiculous drawn someone be know theyre cancerous you	2014-05-16	0	2	@CasperShafer			https://twitter.com/ElisabethAnne17/status/467409945759973377
517761821600919552	Snesley21	 deleting facebook tonight feels like im removing cancerous mole i assume never one removed before	2014-10-02	0	1				https://twitter.com/Snesley21/status/517761821600919552
467409945759973377	ElisabethAnne17	 caspershafer its ridiculous drawn someone be know theyre cancerous you	2014-05-16	0	2	@CasperShafer			https://twitter.com/ElisabethAnne17/status/467409945759973377
