id	Username	Text	Date	Retweets	Favorites	Mentions	Hashtags	Geo	Permalink
445212688231444481	MeBiitchhh	 cancer _ht cancer dont trust easily people trusted past gave reason to	2014-03-16	0	0	@Cancer	#Cancer		https://twitter.com/MeBiitchhh/status/445212688231444481
445212556287049728	MeBiitchhh	 cancer _ht whine complain consider nuisance cancer me way	2014-03-16	0	0	@Cancer	#Cancer		https://twitter.com/MeBiitchhh/status/445212556287049728
445212034431733762	MeBiitchhh	 rt cancer _ht lying cancer makes doubt everything say everything thing point on	2014-03-16	0	1	@Cancer	#Cancer		https://twitter.com/MeBiitchhh/status/445212034431733762
445211544537030656	MeBiitchhh	 cancer _ht cancer respect say truth instead excuses	2014-03-16	0	0	@Cancer	#Cancer		https://twitter.com/MeBiitchhh/status/445211544537030656
444595086169747457	EricZiwak	 adamschefter prayers out former bills qb jim kelly undergoing surgery recurrence cancer sad news hoping best	2014-03-14	0	0	@AdamSchefter			https://twitter.com/EricZiwak/status/444595086169747457
444196684185485313	tiptap991	 katieshow americancancer feliceschnoll nyphospital neice joy years old stage colon cancer she given weeks	2014-03-13	0	0	@KatieShow @AmericanCancer @FeliceSchnoll @nyphospital			https://twitter.com/tiptap991/status/444196684185485313
443790813248909312	DamienDarling	 friday edison nj hall famer cancer survivor action indypowerrankin pwinsidercom pictwittercomghnb macng	2014-03-12	2	1	@IndyPowerRankin @pwinsidercom			https://twitter.com/DamienDarling/status/443790813248909312
443719157516075008	williamryuputra	 tweetramalan cancer setia romantis dan selalu tahu bahasa rahasia tubuh pasangannya aaddeeellll	2014-03-12	0	0	@TweetRAMALAN @aaddeeellll	#Cancer		https://twitter.com/williamryuputra/status/443719157516075008
443599832121241600	mandddE	 fuck u cancer	2014-03-12	8	5				https://twitter.com/mandddE/status/443599832121241600
443544131357663232	AirB0und	 ceyxxxx freaks aquarius scorpio pisces taurus gemini cancer libra virgo leo capricorn gemini	2014-03-11	0	1	@ceyxxxx	#Gemini		https://twitter.com/AirB0und/status/443544131357663232
443538234489188352	MR_Aggravation	 cancerareus_ cancer loyal people deserves	2014-03-11	0	0	@CancerAreUs_	#Cancer		https://twitter.com/MR_Aggravation/status/443538234489188352
443503937644404737	Lydiaaa85	 cancer token person cant see happen	2014-03-11	0	0				https://twitter.com/Lydiaaa85/status/443503937644404737
443394510433693697	Tiana_Lucy	 retweets save dying child cure cancer retweets dont mean hate mom worship satan get life	2014-03-11	2	3				https://twitter.com/Tiana_Lucy/status/443394510433693697
443346103287943169	MR_Aggravation	 cancerareus_ cancer strong even hurt still keep smile face	2014-03-11	0	0	@CancerAreUs_	#Cancer		https://twitter.com/MR_Aggravation/status/443346103287943169
443071592575561728	latashamcclain1	 cancer ugly makes u sooooooo glad u fight good fightget ur checkups	2014-03-10	0	1		#get		https://twitter.com/latashamcclain1/status/443071592575561728
442110066619985920	CVanCottMD	 colon cancer symptoms http owlyullun stuartmarcusmd stvincentsmc	2014-03-07	1	0	@StuartMarcusMD @StVincentsMC	#cancer		https://twitter.com/CVanCottMD/status/442110066619985920
441803829257187328	felicity_madore	 xstrology cancer s loving sign zodiacyay	2014-03-07	0	0	@XSTROLOGY	#Cancer		https://twitter.com/felicity_madore/status/441803829257187328
441803559462785024	felicity_madore	 xstrology cancer shy sweet sweet never see bad people takes see bad	2014-03-07	0	0	@XSTROLOGY	#Cancer		https://twitter.com/felicity_madore/status/441803559462785024
441803365857886208	felicity_madore	 xstrology determined cannot shake cancer s mind theyll see end singing	2014-03-07	0	0	@XSTROLOGY	#Cancer		https://twitter.com/felicity_madore/status/441803365857886208
441802911505719296	felicity_madore	 xstrology cancer s capability change moods faster keep track true lol	2014-03-07	0	0	@XSTROLOGY	#Cancer		https://twitter.com/felicity_madore/status/441802911505719296
441764702205804544	CVanCottMD	 neoadjuvant therapy resectable pancreatic cancer asco connection http connectionascoorgmagazineartic leid neoadjuvanttherapyforresectablepancreaticcanceraspxstuartmarcusmd stvincentsmc	2014-03-06	0	0	@ASCO @StuartMarcusMD @StVincentsMC			https://twitter.com/CVanCottMD/status/441764702205804544
441722062806450176	t_smith59	 cant believe ears stay strong mom beat cancer ill praying tonight	2014-03-06	1	9				https://twitter.com/t_smith59/status/441722062806450176
441664703778287616	Tiana_Lucy	 xstrology hurt cancer s words cut worse double edged sword truth	2014-03-06	0	1	@XSTROLOGY	#Cancer		https://twitter.com/Tiana_Lucy/status/441664703778287616
441663346266628096	cassii17xo	 think im gunna get cancer fumes lady like holy shit	2014-03-06	0	0				https://twitter.com/cassii17xo/status/441663346266628096
441617983832883200	Jeri203	 fact people consume pizza may actually decreasing risk cancer pizza rules allyhersk	2014-03-06	1	1	@Fact @AllyHersk			https://twitter.com/Jeri203/status/441617983832883200
441446707705159680	MR_Aggravation	 cancerareus_ cancer s ones chase beg anyones attention	2014-03-06	20	4	@CancerAreUs_	#Cancer		https://twitter.com/MR_Aggravation/status/441446707705159680
441401740538421248	tisi_12	 one wish one would experience effects cancer brings person affected family fuckcancer	2014-03-05	11	5		#fuckcancer		https://twitter.com/tisi_12/status/441401740538421248
441384166958309377	Amazing_tashhh	 cancerterms cancer classic comeback kid cant keep long	2014-03-05	0	0	@CancerTerms	#Cancer		https://twitter.com/Amazing_tashhh/status/441384166958309377
441251434588553216	MattyJ079	 good night holyshit cancer imadomythang hahahah	2014-03-05	0	1		#holyshit #Cancer #imadomythang #hahahah		https://twitter.com/MattyJ079/status/441251434588553216
440895378507186176	MRIbeatstrials	 u morning death crying sad ya happy ass posting statuses u fucking attention whorei hope u catch cancer 	2014-03-04	1	0				https://twitter.com/MRIbeatstrials/status/440895378507186176
440715282194386944	Tiana_Lucy	 xstrology hurt cancer s words cut worse double edged sword truth	2014-03-04	0	1	@XSTROLOGY	#Cancer		https://twitter.com/Tiana_Lucy/status/440715282194386944
440705179457822721	CVanCottMD	 men there symptoms testicular cancer http owlyub jy tcsm end cancer stuartmarcusmd stvincentsmc	2014-03-03	1	0	@StuartMarcusMD @StVincentsMC	#tcsm #end		https://twitter.com/CVanCottMD/status/440705179457822721
440678273685913600	MR_Aggravation	 hate cigarette commercials like nigga gonna still smoke seeing holes bitch neck let dont cancer stick	2014-03-03	0	0				https://twitter.com/MR_Aggravation/status/440678273685913600
440221711670464512	aackler	 seat belts increase cancer rates tecnicallytrue	2014-03-02	0	0		#tecnicallytrue		https://twitter.com/aackler/status/440221711670464512
439982707096190976	slbxo	 fucking word cancer makes cringe	2014-03-01	0	1				https://twitter.com/slbxo/status/439982707096190976
439981610277285888	slbxo	 tweetherout_ developed aggressive cancer put	2014-03-01	0	0	@TweetHerOut_			https://twitter.com/slbxo/status/439981610277285888
439958828801474561	msfreakinbeast	 dont mess cancer	2014-03-01	0	0		#cancer		https://twitter.com/msfreakinbeast/status/439958828801474561
439857778388385792	UglyBoyJonesy	 nah rt urfavritasshole cancer take weekend relax alone u need get away everyone everything chill hoe	2014-03-01	0	1	@UrFavritAsshole			https://twitter.com/UglyBoyJonesy/status/439857778388385792
439606491927298049	ceg072186	 vinnysstarlight fucking ass cancer	2014-02-28	0	0	@VinnysStarlight			https://twitter.com/ceg072186/status/439606491927298049
439147058025730049	pisces031	 thatdumbbl nde weedandmatch zodiacareus pictwittercomzv ljwdyhh cancer pisces lol	2014-02-27	0	0	@thatdumbbl0nde @WeedAndMatch	#ZodiacAreUs		https://twitter.com/pisces031/status/439147058025730049
438852598385221633	sarahchowyen	 mikedopee forealdoe_ray shit shes dying cancer 	2014-02-26	0	0	@Mikedopee @ForealDoe_Ray			https://twitter.com/sarahchowyen/status/438852598385221633
438850060907204608	nickleone123	 happy little cousin logan bravest kid know finally cancer free pictwittercompibdri xbs	2014-02-26	43	115				https://twitter.com/nickleone123/status/438850060907204608
438792948332118016	tisi_12	 jrod smoke youre probably ignorant fact cause cancer its addicting along many thingstheir fault	2014-02-26	0	0	@jrod1311			https://twitter.com/tisi_12/status/438792948332118016
438778639061381121	Queen_Nefertina	 like give child chance cancer nigga	2014-02-26	0	0				https://twitter.com/Queen_Nefertina/status/438778639061381121
438373293981462529	Lydiaaa85	 gotta stay strong cancer suks	2014-02-25	0	0		#cancer #suks		https://twitter.com/Lydiaaa85/status/438373293981462529
438373093204324352	PettyBrii_	 cancerareus cancer s often temper problems anger management issues	2014-02-25	0	0	@CancerAreUs	#Cancer		https://twitter.com/PettyBrii_/status/438373093204324352
437804378666594305	caitndunc	 acceb yeah lung cancer	2014-02-23	0	0	@acceb			https://twitter.com/caitndunc/status/437804378666594305
437783881874685952	MR_Aggravation	 zodiacareus many clothes cancer yet enough clothes	2014-02-23	0	0	@ZodiacAreUs	#Cancer		https://twitter.com/MR_Aggravation/status/437783881874685952
437768176328523776	tisi_12	 personally think greatest thing world hear someone know deserves best beats cancer tiffanystrong	2014-02-23	3	7		#tiffanystrong		https://twitter.com/tisi_12/status/437768176328523776
437448325047271424	callmevinchenzo	 breast cancer awareness	2014-02-22	1	2				https://twitter.com/callmevinchenzo/status/437448325047271424
436955372512116737	yen1987	 kohls cute goes towards breast cancer wear proudly xoxox pictwittercomrtnwaxwxi 	2014-02-21	0	0	@Kohls			https://twitter.com/yen1987/status/436955372512116737
436207582102163458	amandapapaa	 bestofcancer cancer s may seem shy firstgive shots watch happens pretty much	2014-02-19	0	1	@BestofCancer	#Cancer		https://twitter.com/amandapapaa/status/436207582102163458
436072018703032320	Rebeccaliscio	 unusuaifactpage immune system destroys least one cell every day would become cancer lived	2014-02-19	0	0	@UnusuaIFactPage			https://twitter.com/Rebeccaliscio/status/436072018703032320
435660487834234880	AngtheMessenger	 wish cancer didnt exist fuckcancer	2014-02-18	0	1		#FuckCancer		https://twitter.com/AngtheMessenger/status/435660487834234880
435577392543715329	sarahchowyen	 tooo much ask attractive female obsess me fuckdamn return ill create cute cancer 	2014-02-17	0	1				https://twitter.com/sarahchowyen/status/435577392543715329
435054674161713153	ckonto	 cool way tap unused processing power phone help cure cancer http qzcom pictwittercomtdqt cgj m	2014-02-16	0	0				https://twitter.com/ckonto/status/435054674161713153
434455902331351040	CurlyyyFreakkk	 bestofcancer cancer help people dont deserve it	2014-02-14	0	0	@BestofCancer	#Cancer		https://twitter.com/CurlyyyFreakkk/status/434455902331351040
433722505682231296	sarahchowyen	 feel like cancer new trend	2014-02-12	0	0				https://twitter.com/sarahchowyen/status/433722505682231296
433722450292256768	sarahchowyen	 lol cancer people	2014-02-12	0	0	@cancer			https://twitter.com/sarahchowyen/status/433722450292256768
433475041674924033	xRplz	 much cancer going lol	2014-02-12	0	0				https://twitter.com/xRplz/status/433475041674924033
433465122355703808	JeffreyThunders	 idontbekaren kidney stones brutal bad cancer though	2014-02-11	0	0	@idontbekaren			https://twitter.com/JeffreyThunders/status/433465122355703808
432660938572201984	therealsokaine	 philly vday weekend release undefeatable new songvideo project fundraiser american cancer society	2014-02-09	0	0				https://twitter.com/therealsokaine/status/432660938572201984
432150025771438080	sophiegracesmom	 brdwaydancer woot djetergirl bestest thanks help cancer fighter newbeginnings closertofree anytime 	2014-02-08	0	0	@brdwaydancer @djetergirl2	#cancer #fighter #NewBeginnings #CloserToFree		https://twitter.com/sophiegracesmom/status/432150025771438080
432141821054312448	Krusczinski	 hours sleep new climb stairs raise money lung cancer 	2014-02-08	0	6				https://twitter.com/Krusczinski/status/432141821054312448
431984251748487168	CVanCottMD	 congratulations jackandraka much learn pancreatic cancer youre amazing pancreaticcancer stvincentsmc stuartmarcusmd	2014-02-07	1	0	@jackandraka @StVincentsMC @StuartMarcusMD	#pancreaticcancer		https://twitter.com/CVanCottMD/status/431984251748487168
431973222255718400	JohnRalston7	 god damn nicole could get college degree time could stop world hunger could find cure cancer pictwittercomvln zo znh	2014-02-07	1	3				https://twitter.com/JohnRalston7/status/431973222255718400
431613829882339328	Nigey__	 dad slowly dying brain cancer mom alzheimers forgets hes dying saddest thing ever heard	2014-02-06	0	1				https://twitter.com/Nigey__/status/431613829882339328
431583982774677504	alpacabowl4u	 mom uk bob marley died cancer thought overdosed me smoked pot mom yeah thought thats overdosed	2014-02-06	0	13				https://twitter.com/alpacabowl4u/status/431583982774677504
431308586036494336	MR_Aggravation	 cancerareus_ cancer s vicious tongues pissed off	2014-02-06	9	4	@CancerAreUs_	#Cancer		https://twitter.com/MR_Aggravation/status/431308586036494336
431300308741156864	TGAWDD	 cancer _ht cancer never chase love affection attention know given freely another person isnt worth cancer cancer httpstwittercomtgawddstatus tgawdd cancer _ht cancer cant let go people attached them	2014-02-06	0	1	@Cancer	#Cancer		https://twitter.com/TGAWDD/status/431299211196637185
431299055340486657	TGAWDD	 cancer _ht cancer used getting way persuading others believe believe in	2014-02-06	0	0	@Cancer	#Cancer		https://twitter.com/TGAWDD/status/431299055340486657
431299019785371648	TGAWDD	 cancer _ht cancer attached unique unusual personalities	2014-02-06	3	0	@Cancer	#Cancer		https://twitter.com/TGAWDD/status/431299019785371648
431265693171191809	MR_Aggravation	 see sign xander aries taurus gemini leo virgo libra scorpio sagittarius capricorn aquarius pisces cancer 	2014-02-05	4	0				https://twitter.com/MR_Aggravation/status/431265693171191809
431232982104674304	MR_Aggravation	 cancer pictwittercommjwhqmtfwl 	2014-02-05	2	2		#Cancer		https://twitter.com/MR_Aggravation/status/431232982104674304
431232662343127040	pisces031	 idgaf_kelly zodiacareus the bad asses zodiac pisces cancer gemini aries yaaa teamaries teampisces	2014-02-05	0	0	@IDGAF_Kelly @ZodiacAreUs	#Pisces #Cancer #Gemini #Aries #TeamAries		https://twitter.com/pisces031/status/431232662343127040
431209660386127872	paulzalonski	 st agatha patron saint living breast cancer many succumbed cancer join prayer http communiostblogsorgindexphp saintagathapatronforbreastcancerpatients 	2014-02-05	0	0				https://twitter.com/paulzalonski/status/431209660386127872
431158028696444928	mariacorichi	 officialalexjay real talk tho young kids cancer deserve live dream rttt	2014-02-05	0	0	@OFFICIALALEXJAY			https://twitter.com/mariacorichi/status/431158028696444928
431128140111699968	remember267	 genosworld wcvb sad dear child lost battle cancer arms jesus now	2014-02-05	0	1	@Genosworld @wcvb			https://twitter.com/remember267/status/431128140111699968
431064349571309569	therealsokaine	 sure watch world premiere undefeatable efforts raise funds cancer research pictwittercomctpzmqm xy	2014-02-05	0	0				https://twitter.com/therealsokaine/status/431064349571309569
430899029388840960	PagingDrDylan	 last sentence chilling need better nprnews global cancer cases rising alarming rate worldwide http npr csqj s 	2014-02-04	0	0	@nprnews			https://twitter.com/PagingDrDylan/status/430899029388840960
430760435856715776	yarbonic	 jenarnoldmd praise god heard cancer n remission happy family stay blessed	2014-02-04	0	0	@JenArnoldMD			https://twitter.com/yarbonic/status/430760435856715776
430520440596205568	_expl0sive	 rt cancerareus_ cancer get jealous easily love partner mine mine 	2014-02-03	0	0	@CancerAreUs_	#Cancer		https://twitter.com/_expl0sive/status/430520440596205568
430185417925984256	MR_Aggravation	 zodiacareus cancer live die tomorrow love live forever	2014-02-02	8	3	@ZodiacAreUs	#Cancer		https://twitter.com/MR_Aggravation/status/430185417925984256
430167704545554432	ALW128	 bestofcancer cancer s often temper problems anger management issues	2014-02-02	0	0	@BestofCancer	#Cancer		https://twitter.com/ALW128/status/430167704545554432
430147728749109248	Alay_Patel	 chevy cancer mm hyundai genesis cocacola seinfeld far best ads superbowl yet way behind ones past	2014-02-02	0	1				https://twitter.com/Alay_Patel/status/430147728749109248
429415650725855232	Tiana_Lucy	 zodiacfacts cancer looking people show love	2014-01-31	0	0	@ZodiacFacts	#Cancer		https://twitter.com/Tiana_Lucy/status/429415650725855232
429374952564097024	AirB0und	 xo_candiceeee cancer sticks burnt goya rice	2014-01-31	0	0	@Xo_candiceeee			https://twitter.com/AirB0und/status/429374952564097024
429366241367977984	corchardscott	 breast cancer week pictwittercomzgtbqxh ad	2014-01-31	2	3				https://twitter.com/corchardscott/status/429366241367977984
429241126944784384	Tiana_Lucy	 cancer _ht apology accepted cancer trust denied	2014-01-31	0	0	@Cancer	#Cancer		https://twitter.com/Tiana_Lucy/status/429241126944784384
429103534676520960	Tiana_Lucy	 isexstrology cancer s love late night convos anything shows care stay them 	2014-01-30	1	0	@iSexstrology	#Cancer		https://twitter.com/Tiana_Lucy/status/429103534676520960
428642128638771202	MsSuSie_Q	 im smilow cancer hospital ynhh new haven ct http sqcom ffllwb	2014-01-29	0	0	@ynhh			https://twitter.com/MsSuSie_Q/status/428642128638771202
428613273420693505	Mike_Ciams	 tarynbartolucci cancer	2014-01-29	0	1	@tarynbartolucci			https://twitter.com/Mike_Ciams/status/428613273420693505
428607418214649857	GenomeRob	 might impossible depressed get cancer thats pretty fucking great	2014-01-29	0	0				https://twitter.com/GenomeRob/status/428607418214649857
428384459810144256	MR_Aggravation	 cancerareus cancer dont like talk personal things unless feel really comfortable cancerareus cancer httpstwittercommr_aggravationstatus mr_aggravation rt cancerareus cancer strongest zodiac honest genuine personality cannot compared zodiacs cancerareus cancer httpstwittercommr_aggravationstatus mr_aggravation cancerareus_ cancer gives good advice doesnt mean use us therapist cancerareus_ cancer httpstwittercommr_aggravationstatus mr_aggravation cancers youre boring dont talk cancer drop ass cancers cancer httpstwittercommr_aggravationstatus mr_aggravation dang got retweets cancer status like retweet something else httpstwittercommr_aggravationstatus mr_aggravation cancer cancerareus pictwittercom mp c ddac cancerareus cancer httpstwittercommr_aggravationstatus mr_aggravation cancerareus cancer never lie someone trusts never trust someone lie them true shit cancers loyal cancerareus cancer httpstwittercommr_aggravationstatus jvck_sun whenever see someone cancer bawl struggle real httpstwittercomjvck_sunstatus mikhaliaaa melllanie_ann xstrology cancer take best care you always need find cancer then uhm fuck not melllanie_ann xstrology cancer httpstwittercommikhaliaaastatus tiffanyybxo ox like cancer even exist httpstwittercomtiffanyybxo oxstatus mr_aggravation zodiacareus piscesbaby pictwittercomijd lvjgbj cancer cancer 	2014-01-20	0	0	@ZodiacAreUs	#PiscesBaby #Cancer		https://twitter.com/MR_Aggravation/status/425440511051456513
424626373085646848	Tiana_Lucy	 agirlnamekierra yas best baybaeee rt dope_love_babie cancer word	2014-01-18	2	0	@agirlnamekierra @Dope_Love_Babie			https://twitter.com/Tiana_Lucy/status/424626373085646848
424413485444128768	Tiana_Lucy	 cancer _ht cancer s give away dinner last dime pocket help friend out always	2014-01-18	0	0	@Cancer	#Cancer		https://twitter.com/Tiana_Lucy/status/424413485444128768
424322507249029121	rebeccasylvers	 cancer ideal every way jenqlu	2014-01-17	0	1	@JenQLu			https://twitter.com/rebeccasylvers/status/424322507249029121
424242050150965248	a13xandraaaa	 sophiacantore liiiiike dad gave mom meds make seem like cancer help escaped cops	2014-01-17	0	0	@SophiaCantore5			https://twitter.com/a13xandraaaa/status/424242050150965248
424043132456415232	Tiana_Lucy	 cancerterms cancer s great listeners advisers even people get tired listening whine retweet	2014-01-16	0	0	@CancerTerms	#Cancer		https://twitter.com/Tiana_Lucy/status/424043132456415232
423819096342687744	3scobar	 devastating news rip tonya u missed im sorry matt family ur loss cancer took another angel hate dis	2014-01-16	0	1				https://twitter.com/3scobar/status/423819096342687744
423597874216439808	Tiana_Lucy	 cancer _ht cancer irritated misunderstood theyre sensitive like wanted	2014-01-15	0	0	@Cancer	#Cancer		https://twitter.com/Tiana_Lucy/status/423597874216439808
423558991625863169	msalvarez_	 moms dumb bitch gets lung cancer aint visiting hospital	2014-01-15	0	0				https://twitter.com/msalvarez_/status/423558991625863169
423478336367886336	Tiana_Lucy	 cancerterms cancer allow sex relationship its stable wont allow sex relationship general rt	2014-01-15	0	0	@CancerTerms	#Cancer		https://twitter.com/Tiana_Lucy/status/423478336367886336
422472673328103424	Lydiaaa85	 hate cancer swear could take shit grandpa would hearbeat 	2014-01-12	0	0				https://twitter.com/Lydiaaa85/status/422472673328103424
422109881370693632	MR_Aggravation	 cancer strong even hurt still keep smile face	2014-01-11	0	0		#Cancer		https://twitter.com/MR_Aggravation/status/422109881370693632
422109740299476993	MR_Aggravation	 cancer strong even hurt still keep smile face	2014-01-11	0	0		#Cancer		https://twitter.com/MR_Aggravation/status/422109740299476993
422080564582440961	MR_Aggravation	 im cancer pictwittercomj db mkfzd 	2014-01-11	0	0				https://twitter.com/MR_Aggravation/status/422080564582440961
422056472386998272	Smilystace	 heading roadsbrewing support todds ctpourtour every draft goes pediatric cancer research pictwittercomyc kuw sbn	2014-01-11	0	2	@2RoadsBrewing @CTPourTour			https://twitter.com/Smilystace/status/422056472386998272
422018072233660416	CTHSFB	 westhillstamford senior captain evan skoparantzos given ucan inspire award overcame cancer youngster became star wr cthsfb	2014-01-11	15	18		#cthsfb		https://twitter.com/CTHSFB/status/422018072233660416
421823272658161664	Tiana_Lucy	 cancerterms difficult know cancer getting serious since seem serious everything timeyep	2014-01-10	0	0	@CancerTerms	#Cancer		https://twitter.com/Tiana_Lucy/status/421823272658161664
421753619416113153	pisces031	 zodiacfacts gemini cancer cusp ability understand difficulties loved ones must work through nice baby	2014-01-10	0	0	@ZodiacFacts			https://twitter.com/pisces031/status/421753619416113153
421709771478433792	Tiana_Lucy	 cancer _hc behind every beautiful cancer woman dumb ass guy wrong made strong	2014-01-10	0	0	@Cancer	#Cancer		https://twitter.com/Tiana_Lucy/status/421709771478433792
421519071847649280	foxg642	 everyone worst year ever mom diagnosed stage glioblastoma cancer didnt think so shut fuck up	2014-01-10	0	1				https://twitter.com/foxg642/status/421519071847649280
421500693481287680	Tiana_Lucy	 fuck cancer 	2014-01-09	4	2				https://twitter.com/Tiana_Lucy/status/421500693481287680
421476714892763136	Tiana_Lucy	 cancer _hc cancer dont play hard get hard get yup	2014-01-09	0	0	@Cancer	#Cancer		https://twitter.com/Tiana_Lucy/status/421476714892763136
421320773924843520	PatBrough	 overheard chemo treatment room you happy cancer patients replied life short u reevaluate things	2014-01-09	0	1				https://twitter.com/PatBrough/status/421320773924843520
421169341871452160	MR_Aggravation	 cancerareus cancer show love next minute cold	2014-01-09	11	3	@CancerAreUs	#Cancer		https://twitter.com/MR_Aggravation/status/421169341871452160
421055571526430722	Sir_eye_uhh	 xstrology cancer s adore idea love romanticised breachandler	2014-01-08	0	1	@XSTROLOGY @breachandler	#Cancer		https://twitter.com/Sir_eye_uhh/status/421055571526430722
420952427920392192	Tiana_Lucy	 cancer _ht cancer let in value doesnt happen often true	2014-01-08	0	0	@Cancer	#Cancer		https://twitter.com/Tiana_Lucy/status/420952427920392192
420906340136267778	StayGold3n	 im new cancer never looked better cant stand it	2014-01-08	0	0				https://twitter.com/StayGold3n/status/420906340136267778
420516641815142400	EvelynVarqas	 immillie_bitch aries samuraismacked saira_munoz aries ariesweare httpstwittercomhan_overtheloudstatus photo pictwittercomk tkerlygq cancer rt aries squad	2014-01-07	1	0	@ImMillie_Bitch @SamuraiSmacked @Saira_Munoz @AriesWeAre	#aries		https://twitter.com/EvelynVarqas/status/420516641815142400
419963796875399168	amberrbarbieri	 diagnosed selfie game strong fighting cancer winner httpstwittercomdiagnosedstatus photo pictwittercomvep cdxzyi	2014-01-05	0	0	@diagnosed	#winner		https://twitter.com/amberrbarbieri/status/419963796875399168
419591245624012800	save_tillie	 think skin cancer	2014-01-04	0	0				https://twitter.com/save_tillie/status/419591245624012800
419227124969771008	Tiana_Lucy	 selfieoiympics selfie game strong fighting cancer winner httpstwittercomselfieoiympicsstatus photo pictwittercomd tulajyn 	2014-01-03	3	2	@SelfieOIympics	#winner		https://twitter.com/Tiana_Lucy/status/419227124969771008
419122780790358016	shanix0_	 selfyolympics selfie game strong fighting cancer winner pictwittercomdpapxzi fv 	2014-01-03	1	0	@SelfyOlympics	#winner		https://twitter.com/shanix0_/status/419122780790358016
418976261407780864	mich_candii	 fuck cancer	2014-01-03	1	1				https://twitter.com/mich_candii/status/418976261407780864
418612595252551680	Tiana_Lucy	 cancer _ht cancer smile cry give take love hate	2014-01-02	0	0	@Cancer	#Cancer		https://twitter.com/Tiana_Lucy/status/418612595252551680
