id	Username	Text	Date	Retweets	Favorites	Mentions	Hashtags	Geo	Permalink
466365185620729856	AdamClemens	 final linda clemens breast cancer foundation board meeting fridays big event lcbcf http instagramcompn mmmufby 	2014-05-13	0	0	@	#LCBCF		https://twitter.com/AdamClemens/status/466365185620729856
466343028450660352	_morgansmithhh	 cancer sucks	2014-05-13	0	0				https://twitter.com/_morgansmithhh/status/466343028450660352
466326225150279681	aardizzoia	 morning one dr ardizzoia world hes cancer researcher pm today two done	2014-05-13	0	0		#done		https://twitter.com/aardizzoia/status/466326225150279681
465646242341879808	LivinFast_	 pink_kittykatt looking like dammmm sexyyyyy thats cancer shit	2014-05-11	3	2	@Pink_KittyKatt			https://twitter.com/LivinFast_/status/465646242341879808
465555762576896000	Karasutakai	 wish could shave razor without getting face cancer	2014-05-11	0	0				https://twitter.com/Karasutakai/status/465555762576896000
465169286492082176	hannieegrace	 please pray mother two battling cancer expected survive serve god bigger physical illness	2014-05-10	1	4				https://twitter.com/hannieegrace/status/465169286492082176
465154849227952128	Adidiah	 wife besty walk park breast cancer proud her pictwittercomothdquxulg	2014-05-10	0	1				https://twitter.com/Adidiah/status/465154849227952128
465150251804815361	OneidaHealthCT	 cancer comfort http wpmep eiskie	2014-05-10	0	0				https://twitter.com/OneidaHealthCT/status/465150251804815361
465141936861745152	TasteMyCrown	 cancerfinatic cancer people innocent look seriously could get away murder angel face like cancer 	2014-05-10	0	1	@CancerFinatic	#Cancer #Cancer		https://twitter.com/TasteMyCrown/status/465141936861745152
465095825337491457	Master_Mind97	 cancer walk	2014-05-10	0	0				https://twitter.com/Master_Mind97/status/465095825337491457
464919387351552000	NMFathersLost	 know see kdorau th annual thejimmyfund golf classic you httpwww nomorefatherslostorg golf cancer	2014-05-09	2	2	@KDorau21 @TheJimmyFund	#golf #cancer		https://twitter.com/NMFathersLost/status/464919387351552000
464601688675201024	_errollv	 cancer really read person good af noticing fake friends do nd im always right	2014-05-08	0	0				https://twitter.com/_errollv/status/464601688675201024
464581608008597504	TasteMyCrown	 cancerfinatic cancer lot times come undecided know want final	2014-05-08	0	1	@CancerFinatic	#Cancer		https://twitter.com/TasteMyCrown/status/464581608008597504
464581403326545920	TasteMyCrown	 cancerfinatic cancer tells want know private people dont exploit business yesssssssssssss	2014-05-08	0	0	@CancerFinatic	#Cancer		https://twitter.com/TasteMyCrown/status/464581403326545920
464581241657098240	TasteMyCrown	 cancerfinatic cancer thinking heart got hurt past think thats dont completely open love	2014-05-08	0	1	@CancerFinatic	#Cancer		https://twitter.com/TasteMyCrown/status/464581241657098240
464580895115317248	TasteMyCrown	 cancerfinatic cancer always thinking something always bruhh its annoying	2014-05-08	1	1	@CancerFinatic	#Cancer		https://twitter.com/TasteMyCrown/status/464580895115317248
464519467821563904	verifiedtrill__	 livinfast_ biggest emotional cancer ever	2014-05-08	0	0	@LivinFast_			https://twitter.com/verifiedtrill__/status/464519467821563904
464519139831611392	verifiedtrill__	 cancers emotional me could never cancer 	2014-05-08	0	0				https://twitter.com/verifiedtrill__/status/464519139831611392
464392730676719618	Erik_H_Holmes	 im curing cancer non stop hits	2014-05-08	0	0				https://twitter.com/Erik_H_Holmes/status/464392730676719618
464230417562738688	RogerLev	 livestrong amercns dvelop skin cancer lifetime get fcts ths skincancer awareness month http lvstrng g b fq 	2014-05-07	1	1	@livestrong	#skincancer		https://twitter.com/RogerLev/status/464230417562738688
464103986329829377	ShortszStuffsz	 read article girl brain tumor cancer given months livethey injected polio tumor survived	2014-05-07	0	0				https://twitter.com/ShortszStuffsz/status/464103986329829377
464012388707340288	_errollv	 l veanddrugs cancer season coming wait	2014-05-07	0	0	@l0veanddrugs			https://twitter.com/_errollv/status/464012388707340288
463479113143951360	JasonNBCBoston	 promoting cancer awareness race relay river the river fm http instagramcompnorw uq rl	2014-05-05	0	0	@The			https://twitter.com/JasonNBCBoston/status/463479113143951360
463388312716460032	ValadLikeSaladx	 told alli probs cancer says good	2014-05-05	0	0				https://twitter.com/ValadLikeSaladx/status/463388312716460032
462359026945523712	montville57	 southpark dont worry kyle gettin little cancer 	2014-05-02	0	0	@SouthPark			https://twitter.com/montville57/status/462359026945523712
462114551241375744	Maxeightyeight	 travon cancer its bc allowed hate eat soul brought himself proud ask forgiveness ydanasmithdutra	2014-05-02	1	1	@Travon @YDanasmithdutra			https://twitter.com/Maxeightyeight/status/462114551241375744
461870588412588032	_errollv	 shyladelshutup could never date cancer theyre selfish cocky fuck buuuuuut nvm lol	2014-05-01	0	0	@shyladelshutup			https://twitter.com/_errollv/status/461870588412588032
461868942915407873	BrittNotSpears	 tf yall talking boyt cancer season gemini season comes first wait	2014-05-01	0	0				https://twitter.com/BrittNotSpears/status/461868942915407873
461664511511257088	_errollv	 justesourire_x cancer shit lol	2014-04-30	1	0	@justeSourire_x3			https://twitter.com/_errollv/status/461664511511257088
461515748142088192	anadagenais	 thing cancer makes whole world crash matter sec everything changes unknowns become haunting	2014-04-30	0	0				https://twitter.com/anadagenais/status/461515748142088192
461288097280716800	juliecorreira	 takell niggrish would think cancer though lmao dont understand	2014-04-29	0	0	@takell2niggrish			https://twitter.com/juliecorreira/status/461288097280716800
461223540709400576	juliecorreira	 takell niggrish lol said would died cancer 	2014-04-29	0	0	@takell2niggrish			https://twitter.com/juliecorreira/status/461223540709400576
461198848682360832	Erik_H_Holmes	 start spiral thoughts population boom perhaps cancer starts second leave womb	2014-04-29	0	0				https://twitter.com/Erik_H_Holmes/status/461198848682360832
461182719008210944	thatkidjoeyy	 nychealthy dyk chemicals cigarette smoke known cause cancer pictwittercomofyi hdjjw exactly quit	2014-04-29	1	0	@nycHealthy			https://twitter.com/thatkidjoeyy/status/461182719008210944
461141421219909632	endlessddreamer	 thecancerpage cancer women sensitive stronger think	2014-04-29	0	0	@TheCancerPage	#Cancer		https://twitter.com/endlessddreamer/status/461141421219909632
461111773199097857	paradisoins	 join celebration ethans day celebration four years cancer free pictwittercomonxy qx px	2014-04-29	0	0				https://twitter.com/paradisoins/status/461111773199097857
461083615661928448	paradisoins	 little buddy ethan celebrating four years cancer free its great day cancerfree pictwittercomccnji lxw	2014-04-29	0	1		#cancerfree		https://twitter.com/paradisoins/status/461083615661928448
460564970074169345	TasteMyCrown	 iammysign cancer girls sensitive stronger think preachhhhhh	2014-04-27	0	0	@iAmMySign	#Cancer		https://twitter.com/TasteMyCrown/status/460564970074169345
460538852965617665	sweetgauges	 punkrockqueer yep like nigga yall famous fuck still want money fucking cancer patient whos family prob broke	2014-04-27	0	0	@punkrockqueer			https://twitter.com/sweetgauges/status/460538852965617665
460537292059598848	sweetgauges	 one direction visited girl cancer sang her sent bill	2014-04-27	0	1				https://twitter.com/sweetgauges/status/460537292059598848
460121172047572992	_jamesclinton	 must got cancer dont want smoke	2014-04-26	2	0				https://twitter.com/_jamesclinton/status/460121172047572992
460104344298196992	migeazulj	 seor lamento informarle que tiene cncer de tero pero soy hombre hey tranquilo cerebrito que aqu el mdico del imss soy yo	2014-04-26	0	0				https://twitter.com/migeazulj/status/460104344298196992
460005235826491392	EmpressNard	 alfee_gee one guy mentions said mum jus got cancer depressing	2014-04-26	1	0	@Alfee_Gee			https://twitter.com/EmpressNard/status/460005235826491392
459541537291259904	AaronWing1	 ur like cancer	2014-04-24	0	0				https://twitter.com/AaronWing1/status/459541537291259904
459487144491618304	bcoe3	 half people completely disregard essence polar plunge intended benefit cancer facebook prestige rantoftheday	2014-04-24	1	2		#rantoftheday		https://twitter.com/bcoe3/status/459487144491618304
459170907559559168	Antoinette__x3	 absoversatile sucking women breast lowers risk breast cancer lemme suck titties	2014-04-23	1	1	@ABsoVersatile			https://twitter.com/Antoinette__x3/status/459170907559559168
459021621974822912	DaviaChrissy	 if youre team cancer quote selfie cancerareus zodiacareus july cancersdoitbetter pictwittercommmnn vweiz	2014-04-23	1	1	@CancerAreUs	#cancer #ZodiacAreUs #cancersdoitbetter		https://twitter.com/DaviaChrissy/status/459021621974822912
459009529368543232	HighlightFilm12	 x_topnotch_x cancer season way fuck cancers 	2014-04-23	0	1	@x_TOPNotch_x	#Cancer		https://twitter.com/HighlightFilm12/status/459009529368543232
458597126210330624	x_ricketts	 theemrsjackson fuck cancer season lol jk u day ur bday	2014-04-22	0	0	@theeMRSjackson			https://twitter.com/x_ricketts/status/458597126210330624
458418551574241281	Moriah_Monea	 seems like everyone cancer	2014-04-21	0	0				https://twitter.com/Moriah_Monea/status/458418551574241281
458406856864825344	Moriah_Monea	 jackie laughed didnt mother pass due cancer shit jackie would beat sunday ass	2014-04-21	0	0				https://twitter.com/Moriah_Monea/status/458406856864825344
458094960848666624	tylonhardy	 rt ur cancer 	2014-04-21	0	0				https://twitter.com/tylonhardy/status/458094960848666624
458068353731788800	monomiserable	 eating pussy causes throat cancer im dead man walking	2014-04-20	0	0				https://twitter.com/monomiserable/status/458068353731788800
458061430080958464	TasteMyCrown	 repursign cancer canceweare zodiacareus repursign pictwittercom mdogiecj real shit were clingy reason	2014-04-20	6	4	@Repursign	#cancer #canceweare #ZodiacAreUs #repursign		https://twitter.com/TasteMyCrown/status/458061430080958464
457889103057788928	TasteMyCrown	 repursign cancer cancerweare pictwittercoma kb s l a thats us bitches	2014-04-20	0	0	@Repursign	#cancer #cancerweare		https://twitter.com/TasteMyCrown/status/457889103057788928
457669317661032448	TasteMyCrown	 repursign everybody looks get hit sarcasm aries cancer capricorn repursign pictwittercomtw e t rwv 	2014-04-19	0	0	@Repursign	#Aries #Cancer #Capricorn #repursign		https://twitter.com/TasteMyCrown/status/457669317661032448
457576907329265665	httppvige	 uberfacts least day immune system destroys cell would become cancer lived thank immune system	2014-04-19	0	0	@UberFacts			https://twitter.com/httppvige/status/457576907329265665
457555784550088704	_lauralittle_	 check homemade cakes win fighting cancer ccrelay conncollegeis pictwittercom i v j 	2014-04-19	1	1	@CCRelay @ConnCollegeIS			https://twitter.com/_lauralittle_/status/457555784550088704
457512286316666880	Yaannelis	 los nios con cncer hoy se siente bien 	2014-04-19	0	1				https://twitter.com/Yaannelis/status/457512286316666880
457343820007739392	OhMyLove_x3	 zodiacfacts gemini love battlefield signs taurus cancer scorpio capricorn virgo pisces omg true	2014-04-18	0	0	@ZodiacFacts	#Gemini		https://twitter.com/OhMyLove_x3/status/457343820007739392
457312157781483520	kayyrgg	 damn la mayoria de las personas se estan muriendo de cancer 	2014-04-18	0	1				https://twitter.com/kayyrgg/status/457312157781483520
456890027700539392	KatieB968	 dasani onision never said okay every meat eater gets cancer	2014-04-17	0	0	@666dasani666 @Onision			https://twitter.com/KatieB968/status/456890027700539392
456660163605192704	Speedking37	 thecancerpage betraying cancer get ugly words like double edged blade	2014-04-17	0	0	@TheCancerPage			https://twitter.com/Speedking37/status/456660163605192704
456659600649891841	Speedking37	 astrologysex capricorn s cancer s r perfect match put together room hear boom boom boom nicki_crowned	2014-04-17	0	0	@Astrologysex @Nicki_Crowned	#Capricorn #Cancer		https://twitter.com/Speedking37/status/456659600649891841
456230528299962369	anadagenais	 cancer tear family apart love mom fight together	2014-04-15	0	1				https://twitter.com/anadagenais/status/456230528299962369
455708906774601728	endlessddreamer	 thecancerpage cancer doesnt like tested	2014-04-14	0	0	@TheCancerPage	#Cancer		https://twitter.com/endlessddreamer/status/455708906774601728
455360900493750274	Kalif0rnication	 idk happened like tanning beds anymore im already gonna get mesothelioma pass getting skin cancer too	2014-04-13	0	0				https://twitter.com/Kalif0rnication/status/455360900493750274
455011960455966721	RamRod761	 butch breath smell bad got breath cancer	2014-04-12	0	0				https://twitter.com/RamRod761/status/455011960455966721
454420698971525121	Kwam_E	 lmao im sayin rt germosen need we strain smoking rt kwam_e dude said weed cures cancer lmao	2014-04-10	0	0	@Germosen33 @Kwam_E			https://twitter.com/Kwam_E/status/454420698971525121
454415056671735808	Kwam_E	 dude said weed cures cancer lmao	2014-04-10	0	1				https://twitter.com/Kwam_E/status/454415056671735808
454265737230962688	kendallmetcalff	 yet another innocent person diagnosed cancer love laurie youre strongest woman know	2014-04-10	0	2				https://twitter.com/kendallmetcalff/status/454265737230962688
454247882712174593	BobbyPilatti	 espnnfl icymi jim kelly completed st rd chemotherapy battles cancer http espn myt nf pictwittercomg icxoon b 	2014-04-10	0	0	@ESPNNFL			https://twitter.com/BobbyPilatti/status/454247882712174593
454214113984393216	jezzynotjessica	 isnt definite cure cancer yet wtf	2014-04-10	2	1				https://twitter.com/jezzynotjessica/status/454214113984393216
454206733917777920	GonzalesX_3	 lot respect adrienne payne seeing sports center story cancer patient	2014-04-10	1	2				https://twitter.com/GonzalesX_3/status/454206733917777920
454163389582151680	LegiScanCT	 sb update act requiring health insurance coverage tomosynthesis breast cancer screenings http bitlycomvlykt 	2014-04-10	0	0				https://twitter.com/LegiScanCT/status/454163389582151680
454045338257870848	badBITCHshitx3	 takenotes_ cancer season soooooon come	2014-04-09	0	0	@Takenotes_18	#CANCER		https://twitter.com/badBITCHshitx3/status/454045338257870848
453946231417753600	Dennis_R_Bosse	 month blood work the helen harry gray cancer center http sqcomps k 	2014-04-09	0	0	@The			https://twitter.com/Dennis_R_Bosse/status/453946231417753600
453878942198665216	Sir_Riley22	 rip little rep michigan state laceyholsworth cancer years old	2014-04-09	0	0		#RIP #LaceyHolsworth #Cancer		https://twitter.com/Sir_Riley22/status/453878942198665216
453717955780812800	LegiScanCT	 hb update act requiring health insurance coverage fertility preservation cancer patients http bitlycomwgyeeo	2014-04-08	0	0				https://twitter.com/LegiScanCT/status/453717955780812800
453609221104611328	UConnPhiRho	 pm show flyer phone peachwave help american cancer society pictwittercomqje cgwrf	2014-04-08	3	0				https://twitter.com/UConnPhiRho/status/453609221104611328
453549099271593984	UConnPhiRho	 take break studying today grab froyo peachwave pm support american cancer society pictwittercom vxelosgkv	2014-04-08	2	0				https://twitter.com/UConnPhiRho/status/453549099271593984
453535263458074624	cutepinknpurple	 kannumanaktala cancer follow starnot datewat abt u	2014-04-08	0	0	@kannumanaktala			https://twitter.com/cutepinknpurple/status/453535263458074624
453526490362437632	LivinFast_	 bestofcancer cancer loves lovealways	2014-04-08	1	0	@BestofCancer	#Cancer		https://twitter.com/LivinFast_/status/453526490362437632
453396617165832192	_Cdelaire	 swear love gabrielle_x mentality tweets think swear its cancer thing believe	2014-04-08	1	2	@Gabrielle_x33			https://twitter.com/_Cdelaire/status/453396617165832192
453391124791824384	endlessddreamer	 team cancer quote selfie cancerareus zodiacareus july th pictwittercomundd t fau	2014-04-08	1	5	@CancerAreUs	#cancer #ZodiacAreUs		https://twitter.com/endlessddreamer/status/453391124791824384
453350416672382976	10debbiet	 luckylocketlove cancer your mom	2014-04-07	0	0	@luckylocketlove			https://twitter.com/10debbiet/status/453350416672382976
453317887395373056	Hannah_Westt	 even tho terrible relationship finding cancer sucks today worst day ever	2014-04-07	0	0				https://twitter.com/Hannah_Westt/status/453317887395373056
453004999380172800	kaybee711	 drjackiewalters thin breast cancer think its genetics anything married med fwiw offended well	2014-04-06	0	0	@DrJackieWalters	#Married2Med		https://twitter.com/kaybee711/status/453004999380172800
452967007575891968	paradisoins	 redbarnct true change grow folks http lnkdindj sbjf cancer changeisgood	2014-04-06	0	2	@RedBarnCT	#Cancer #changeisgood		https://twitter.com/paradisoins/status/452967007575891968
452946330823176193	_aiko0	 overthink way much thats cancer	2014-04-06	0	1				https://twitter.com/_aiko0/status/452946330823176193
452790624467439616	A_Dem23	 whattheffacts eating ketchup reduce chances getting cancer wtf eat foods http bitly lifknz random_walk 	2014-04-06	0	0	@WhatTheFFacts @Random_Walk1	#WTF		https://twitter.com/A_Dem23/status/452790624467439616
452444243303608320	jeffseyler	 kristy liz ready hit stairs fight lung cancer ty support lungne hartfordclimb pictwittercommapngybddc	2014-04-05	3	4	@LungNE	#hartfordclimb		https://twitter.com/jeffseyler/status/452444243303608320
452297494987558912	brendaDeJ	 cancer _ht cancer reading old conversations missing person damn	2014-04-05	0	0	@Cancer	#Cancer		https://twitter.com/brendaDeJ/status/452297494987558912
452138981690331136	w_pat_tc	 composition prostatic hyperplasia prostate cancer c g c g http wpattcwo a 	2014-04-04	0	0		#C08G #C08G63		https://twitter.com/w_pat_tc/status/452138981690331136
451915669681233921	valerierobin_24	 theculbert sad stupid long theres research theres money flow coming in people dying cancer 	2014-04-03	0	0	@TheCulbert12			https://twitter.com/valerierobin_24/status/451915669681233921
451868268014600192	LegiScanCT	 hb update act requiring health insurance coverage fertility preservation cancer patients http bitlycomwgyeeo	2014-04-03	0	0				https://twitter.com/LegiScanCT/status/451868268014600192
451867678442291200	ShortszStuffsz	 stayweirdlovato put dog yrs cancer worse day life	2014-04-03	0	0	@stayweirdlovato			https://twitter.com/ShortszStuffsz/status/451867678442291200
451440735603392513	Ash_Johnny	 cancer sucks	2014-04-02	1	5				https://twitter.com/Ash_Johnny/status/451440735603392513
451183672260329472	DominickAronson	 realharissh kidney cancer 	2014-04-01	0	0	@RealHarissh			https://twitter.com/DominickAronson/status/451183672260329472
451002893655887873	johnathonkuhn	 michellemalkin rt twitchyteam hope cancer kills soon tolerant left reaches julie boonstra http bitly i fuil sicko	2014-04-01	0	0	@michellemalkin @TwitchyTeam	#sicko		https://twitter.com/johnathonkuhn/status/451002893655887873
450658637028286464	CallitMarty	 youre like cancer heart	2014-03-31	1	0				https://twitter.com/CallitMarty/status/450658637028286464
450630097079648256	LegiScanCT	 sb update act requiring health insurance coverage tomosynthesis breast cancer screenings http bitlycomvlykt 	2014-03-31	0	0				https://twitter.com/LegiScanCT/status/450630097079648256
450368581533188096	TAYLs_OR_heads	 pretty much win kill kid cancer 	2014-03-30	0	3				https://twitter.com/TAYLs_OR_heads/status/450368581533188096
450077509523365889	angelachen16	 catherinefurman know doesnt girl get cancer something 	2014-03-29	0	0	@CatherineFurman			https://twitter.com/angelachen16/status/450077509523365889
449976473848659968	theremedy42	 uberfacts indoor tanning caused cases skin cancer smoking caused cases lung cancer jessicarebholz	2014-03-29	0	0	@UberFacts @JessicaRebholz			https://twitter.com/theremedy42/status/449976473848659968
449969248514097152	Izzyxoxo2	 rest peace scott never fight cancer again goodbye truly beautiful soul	2014-03-29	0	1				https://twitter.com/Izzyxoxo2/status/449969248514097152
449966218263683072	MechaBowie	 profits cancer drugs funded cancer research feel like cancer wouldnt thing anymore	2014-03-29	0	0				https://twitter.com/MechaBowie/status/449966218263683072
449946452727721984	shaney_conk	 todds drinking beer every town raise money childhood cancer follow ctpourtour charity pictwittercomh ajakzxyp	2014-03-29	0	0	@CTpourtour	#charity		https://twitter.com/shaney_conk/status/449946452727721984
449930753179414528	dcarcar10	 mosesthemessiah dude game would cause kinda stress causes cancer	2014-03-29	0	0	@MosestheMessiah			https://twitter.com/dcarcar10/status/449930753179414528
449889895683985408	peterkazibwe	 didnt even know cancer	2014-03-29	0	0				https://twitter.com/peterkazibwe/status/449889895683985408
449658700274597888	LegiScanCT	 hb update act requiring health insurance coverage fertility preservation cancer patients http bitlycomwgyeeo	2014-03-28	0	0				https://twitter.com/LegiScanCT/status/449658700274597888
449445426979422209	Doppz_25	 illness cancer eh smh worst prayforabidal prayforacancercure	2014-03-28	2	0		#PrayForAbidal #PrayForACancerCure		https://twitter.com/Doppz_25/status/449445426979422209
449445097130954752	Doppz_25	 ajalapilgrim cancer ting doh rest dawg	2014-03-28	0	0	@AjalaPilgrim			https://twitter.com/Doppz_25/status/449445097130954752
449287238942457856	saragordon_	 maddie get cancer dont know tell like im sorry jordan	2014-03-27	0	1				https://twitter.com/saragordon_/status/449287238942457856
449224300948901889	Royal2Real4U	 cant wait leave cancer ass office smh	2014-03-27	0	0				https://twitter.com/Royal2Real4U/status/449224300948901889
448887662326579200	kalford71	 yay went endocrine dr treatment cancer worked im remission ill take cn get	2014-03-26	0	2				https://twitter.com/kalford71/status/448887662326579200
448849440540217345	mollyburkhardt	 looking pictures breast cancer bio kid behind keeps whispering boobs	2014-03-26	0	6				https://twitter.com/mollyburkhardt/status/448849440540217345
448598499186454528	dannybotti	 girl shaved head friend cancer suspended school violating dress code ridiculous	2014-03-25	0	0				https://twitter.com/dannybotti/status/448598499186454528
448552451214696448	ShaneCanTweet	 men putting penises socks instagram cancer awareness so good httpwww buzzfeedcommjs menare puttingtheirpenisesinsocksoninstagramforcanc love_is_a_place	2014-03-25	0	0	@Love_Is_A_Place			https://twitter.com/ShaneCanTweet/status/448552451214696448
448544661431656448	ShaneCanTweet	 took picture wearing sock wouldnt good testicular cancer awareness anything really weirdlookingdudeawareness	2014-03-25	0	0		#weirdlookingdudeawareness		https://twitter.com/ShaneCanTweet/status/448544661431656448
448324849367543808	ImRegular	 im cancer leo makes perfect sense lol pictwittercomzmzhkknwao	2014-03-25	0	0				https://twitter.com/ImRegular/status/448324849367543808
448280444413702144	TasteMyCrown	 oh_thats_shan sarassh pisces aries taurus cancer libra virgo leo zodiacareus httpstwittercomsarassh status photo pictwittercomv mnlppd i cancer tho 	2014-03-24	0	0	@Oh_thats_Shan @sarassh66	#Pisces #aries #Taurus #cancer #libra #virgo #leo #ZodiacAreUs		https://twitter.com/TasteMyCrown/status/448280444413702144
448252262432124929	JimStearns88	 thatemt stan tell mother its fine im going catch little bit cancer	2014-03-24	0	1	@ThatEMT			https://twitter.com/JimStearns88/status/448252262432124929
448251637602480128	JimStearns88	 thatemt need cancer medical marijuana kind cancer catch ziggy marley concert boulder saturday	2014-03-24	0	1	@ThatEMT			https://twitter.com/JimStearns88/status/448251637602480128
448236848352342016	LegiScanCT	 sb update act requiring health insurance coverage tomosynthesis breast cancer screenings http bitlycomvlykt 	2014-03-24	0	0				https://twitter.com/LegiScanCT/status/448236848352342016
448229784632696834	adriii_2014	 abuela finally cancer free	2014-03-24	0	1				https://twitter.com/adriii_2014/status/448229784632696834
448173990482546689	MALfunctionnnn	 lucky finally able say shes cancer free couldnt blessed strong lady nana pictwittercomaxdanbii a	2014-03-24	1	11				https://twitter.com/MALfunctionnnn/status/448173990482546689
448133697074888704	DopeAssKyng	 s gay men massacred towns stop spreading gay cancer call today aids traces homosexuality	2014-03-24	0	0				https://twitter.com/DopeAssKyng/status/448133697074888704
447900224330399744	AshleyBlowers1	 amazing weekend till found grand mother cancer 	2014-03-23	0	2				https://twitter.com/AshleyBlowers1/status/447900224330399744
447886691358240768	_errollv	 cancer season soon wait	2014-03-23	11	0				https://twitter.com/_errollv/status/447886691358240768
447845700559446016	TasteMyCrown	 raybandzz__ zodiacareus cancer httpstwittercompaytyn_taylorstatus photo pictwittercoms qfzk mss 	2014-03-23	5	3	@RayBandzz__ @ZodiacAreUs	#Cancer		https://twitter.com/TasteMyCrown/status/447845700559446016
447799316443181056	eevangelineee	 saw post government hiding cure cancer 	2014-03-23	0	0				https://twitter.com/eevangelineee/status/447799316443181056
447507728320462848	jaelynvoigt_	 aunt annies breast cancer fundraiser	2014-03-22	1	0				https://twitter.com/jaelynvoigt_/status/447507728320462848
447104027135062018	ProbablePattern	 someone put light thousand suns elevator second ride emerge skin cancer 	2014-03-21	0	0				https://twitter.com/ProbablePattern/status/447104027135062018
447078770349187072	KaitlynKells_	 grandma officially cleared cancer 	2014-03-21	2	21				https://twitter.com/KaitlynKells_/status/447078770349187072
