id	Username	Text	Date	Retweets	Favorites	Mentions	Hashtags	Geo	Permalink
246012448673497088	EPelett	 check up skin cancer yay portland dermatology clinic http sqcomtulguc	2012-09-12	0	0	@Portland			https://twitter.com/EPelett/status/246012448673497088
240922949807382528	starzipan	 latest plan b makes feel little crazy saw aaron carasco last night adore him aunt dying cancer unrelated	2012-08-29	0	0				https://twitter.com/starzipan/status/240922949807382528
236262971129606144	dantich	 ousted raeann s mayor childrens cancer association foursquare http sqcom cdjsy	2012-08-16	0	0	@foursquare			https://twitter.com/dantich/status/236262971129606144
234775388717473792	klangphoto	 fyou sun id rather bad seats get skin cancer trek park http instagrampoppmxax p 	2012-08-12	0	0	@Trek			https://twitter.com/klangphoto/status/234775388717473792
233353012742090752	MariamLovejoy	 bay area industrial area residents higher risk cancer chevron largest polluter nytimes httpwww nytimescom us cancerratespursanxietyinindustrialbayareahtml chevronfire	2012-08-08	0	0		#ChevronFire		https://twitter.com/MariamLovejoy/status/233353012742090752
232952293492940801	elijahpopham	 hope cancer baby baby cancer portland	2012-08-07	0	0		#Portland		https://twitter.com/elijahpopham/status/232952293492940801
232845753247227904	MariamLovejoy	 rt pacificmoceans these deadly petroleum cancer causing chemicals settle air days bay area	2012-08-07	0	0	@PacificMoceans			https://twitter.com/MariamLovejoy/status/232845753247227904
228334301001940993	itsoinky	 fundraiser american cancer society someday lounge http sqcomsuzq 	2012-07-25	0	0	@Someday			https://twitter.com/itsoinky/status/228334301001940993
226018278835904512	AdamRawrence	 viydaschatz yea lets eliminate cancer aids were itits disease v	2012-07-19	0	0	@ViydaSchatz			https://twitter.com/AdamRawrence/status/226018278835904512
218377396250882049	mikeal	 biggest learning week scotus acronym supreme court rare form testicular cancer like thought	2012-06-28	7	1				https://twitter.com/mikeal/status/218377396250882049
217905571414810625	17_LOVERBOY	 xstrology beautiful moments cancer capricorn together brianalouzon	2012-06-27	0	0	@XSTROLOGY @BrianaLouzon	#Cancer #Capricorn		https://twitter.com/17_LOVERBOY/status/217905571414810625
217793107536789504	Birdsongs68	 celebrating two years cancer free thank jesus st headquarters http sqcomopvqet	2012-06-26	0	0	@S			https://twitter.com/Birdsongs68/status/217793107536789504
212589754833833984	stephensolo	 im childrens cancer association portland or http sqcommagsnm	2012-06-12	0	0				https://twitter.com/stephensolo/status/212589754833833984
211555658129096704	delightfuldave	 cancer bears	2012-06-09	0	0				https://twitter.com/delightfuldave/status/211555658129096704
209400720548560896	debbieherron	 livestrong happy national cancer survivors day shout outs million affected cancer life fightlikehell	2012-06-03	0	0	@LIVESTRONG	#FightLikeHell		https://twitter.com/debbieherron/status/209400720548560896
206464939257368576	lucperkins	 appstore definitely newsstand its cancer	2012-05-26	0	0	@AppStore			https://twitter.com/lucperkins/status/206464939257368576
205422324214792193	MunchingZombie	 man plan canal rectal cancer 	2012-05-23	0	0				https://twitter.com/MunchingZombie/status/205422324214792193
202979799327711233	FATBOYKIRKLAND	 th tweet goes grandma sticking cancer long gohard	2012-05-17	1	5		#gohard		https://twitter.com/FATBOYKIRKLAND/status/202979799327711233
198468381458960385	MunchingZombie	 fuck you cancer 	2012-05-04	0	0				https://twitter.com/MunchingZombie/status/198468381458960385
197921516686544896	HooliganLili	 night pouring plans find one friend broke several ribs another lost sister cancer perspectiveiseverything	2012-05-03	0	0		#perspectiveiseverything		https://twitter.com/HooliganLili/status/197921516686544896
195646065532354560	simplifysolve	 information fukushima radiation portland please let know cancer portland oregon thyroidcancer	2012-04-26	0	0		#cancer #Portland #oregon #thyroidcancer		https://twitter.com/simplifysolve/status/195646065532354560
195596130833272833	97209	 breast cancer survivor creates nonprofit connects women cancer resources http bitlyjdjmfi via http outsidein 	2012-04-26	0	0				https://twitter.com/97209/status/195596130833272833
195492877806206978	DrPRitchie	 dandunlop hospital asks couples combine date night cancer screenings http wpmepjexb sb 	2012-04-26	0	0	@dandunlop			https://twitter.com/DrPRitchie/status/195492877806206978
192063451391197184	FATBOYKIRKLAND	 unforgiveness unchecked leads cancer soul	2012-04-16	0	0				https://twitter.com/FATBOYKIRKLAND/status/192063451391197184
191696827865767936	MichaelUnruh3	 met woman named debbie airport heading east wa w dad cancer major surgery pray family	2012-04-15	0	0				https://twitter.com/MichaelUnruh3/status/191696827865767936
190884811357958144	megsdavid18	 somethingyouprobablydidnotknow born tumor hadnt spotted removed would cancer dead right	2012-04-13	0	0		#somethingyouprobablydidnotknow		https://twitter.com/megsdavid18/status/190884811357958144
189736750283886592	ihavequalities	 listening fat people smoking talking probably wont get cancer 	2012-04-10	0	0				https://twitter.com/ihavequalities/status/189736750283886592
186871010799267840	MunchingZombie	 bombing planned parenthood take breast cancer screening	2012-04-02	0	0				https://twitter.com/MunchingZombie/status/186871010799267840
185171300094980097	alyssasunseri	 fuck cancer 	2012-03-28	0	0				https://twitter.com/alyssasunseri/status/185171300094980097
181819397810298882	MunchingZombie	 glad stopped child soldiers cancer gayyouth suicides scores problems retweeting shit	2012-03-19	0	0				https://twitter.com/MunchingZombie/status/181819397810298882
180505115424333824	noahkleiman	 andreathegiant dont pass cancer kid hate you	2012-03-16	0	0	@andreathegiant			https://twitter.com/noahkleiman/status/180505115424333824
179722763303530497	Birdsongs68	 e doctors office lost pounds yes so celebration time cancer good go http sqcomxnw lp	2012-03-13	0	0				https://twitter.com/Birdsongs68/status/179722763303530497
179703552413941760	toodles61	 im northwest cancer specialists portland or http sqcomxd id	2012-03-13	0	0				https://twitter.com/toodles61/status/179703552413941760
177320414832365568	AndersonRia	 beyonce__knowle onewish one wish best cancer life live life way wantbigger wish its coming	2012-03-07	0	0	@Beyonce__Knowle	#OneWish		https://twitter.com/AndersonRia/status/177320414832365568
175711240767811586	ChrisXPPro	 ssaruhh good cant stand cancer beds	2012-03-02	0	0	@ssaruhh			https://twitter.com/ChrisXPPro/status/175711240767811586
170356342979178497	malambert	 cancer took another hero garycarter kid cancersucks mlb http instagramphf brlxtp	2012-02-16	0	0	@MLB	#GaryCarter #Kid #CancerSucks		https://twitter.com/malambert/status/170356342979178497
167705662854402048	PheniqueFennec	 surgery next month dunno bugs more cut open potential cancer 	2012-02-09	0	0				https://twitter.com/PheniqueFennec/status/167705662854402048
167344172754415617	PheniqueFennec	 cancer find march	2012-02-08	0	0				https://twitter.com/PheniqueFennec/status/167344172754415617
167125482637238272	farnellnewton	 good mine starting treatment breast cancer wanted make bra st johns neighborhood http instagrampgu je hgka	2012-02-08	0	0	@St			https://twitter.com/farnellnewton/status/167125482637238272
159433187687284737	97209	 providence cancer center nursing student starts beading circle northeast portland rai http bitlyykkwxg via http outsidein 	2012-01-17	0	0				https://twitter.com/97209/status/159433187687284737
157985399803871234	AndersonRia	 youtube show following teenage cancer life getting mostly positive feedback may happen	2012-01-13	0	0				https://twitter.com/AndersonRia/status/157985399803871234
156465739325390848	beyond_72	 pic swimming lancearmstrong morning nike congrats livestrong years fighting cancer pictwittercomximllwxj	2012-01-09	0	0	@lancearmstrong @Nike @LIVESTRONG			https://twitter.com/beyond_72/status/156465739325390848
153302420586381312	97205	 john buchanan helped transform portland art museum dies cancer age http bitlysnofyr via http outsidein 	2011-12-31	0	0				https://twitter.com/97205/status/153302420586381312
285403302227746816	MLBittinger	 mywishin find cure cancer ginger	2012-12-30	0	0		#MyWishIn2013		https://twitter.com/MLBittinger/status/285403302227746816
281652383610707969	Anthony_Bottaro	 b_marzz instead cursing dutch people wish cancer others factoftheday hahahaha harry told that	2012-12-20	0	0	@B_Marzz	#FactOfTheDay		https://twitter.com/Anthony_Bottaro/status/281652383610707969
280810217778864129	babymarvG_25	 think might skin cancer oh damn hope not	2012-12-17	0	0				https://twitter.com/babymarvG_25/status/280810217778864129
279665112837664769	PanCAN_Portland	 congrats pancan_nola purplestride event raises around k fund fight pancreatic cancer http bitlyrttyay fixed link	2012-12-14	0	0	@PanCAN_NOLA	#PurpleStride #Pancreatic #Cancer		https://twitter.com/PanCAN_Portland/status/279665112837664769
279661445577326592	PanCAN_Portland	 mystery rash saves mans life tipping docs rare pancreatic cancer http abcnwsqyvkgd	2012-12-14	0	0		#pancreatic #cancer		https://twitter.com/PanCAN_Portland/status/279661445577326592
279659237767016448	PanCAN_Portland	 congrats pancan_nola purplestride event raises around k fund fight pancreatic cancer http americanpresscomnewslocalpur 	2012-12-14	1	0	@PanCAN_NOLA	#PurpleStride #Pancreatic #Cancer		https://twitter.com/PanCAN_Portland/status/279659237767016448
279363021996969985	gracemillla	 many amputees cancer patients abused childrenanimals facebook feed	2012-12-13	0	0				https://twitter.com/gracemillla/status/279363021996969985
279278482872225792	PanCAN_Portland	 help us honor approximately diagnosed pancreatic cancer year http causescomcauses pa via causes	2012-12-13	2	0	@causes			https://twitter.com/PanCAN_Portland/status/279278482872225792
279099546506764289	PanCAN_Portland	 scientistmags follow pancan get information pancreatic cancer awareness	2012-12-13	0	0	@ScientistMags @PanCAN			https://twitter.com/PanCAN_Portland/status/279099546506764289
278525418557014017	LaraTigardluna	 today awesome day making blankets awesome kids cancer children lovemyjob	2012-12-11	0	1		#lovemyjob		https://twitter.com/LaraTigardluna/status/278525418557014017
276103262774632449	eyyyrissa	 taylorswifff cancer joke stop joking cancer look like im laughing nope jokes x ya go away	2012-12-04	0	0	@TaylorSwifff			https://twitter.com/eyyyrissa/status/276103262774632449
275785307574648832	margaretfmartin	 jim valvanos espy speech amazing ripjimmyv cancer cannot touch mind cannot touch heart cannot touch soul	2012-12-03	0	0		#amazing #RIPjimmyv		https://twitter.com/margaretfmartin/status/275785307574648832
273862194217766912	PanCAN_Portland	 curecancer all lets get hr passed http bitlyv c v cancer w yr survival rate bipartisanship possible congress 	2012-11-28	0	0	@curecancer4all	#Bipartisanship #Congress		https://twitter.com/PanCAN_Portland/status/273862194217766912
273587033564397568	Ashee503	 relieved way thank god isnt cancer 	2012-11-27	0	0				https://twitter.com/Ashee503/status/273587033564397568
269448376112783363	cr8tivejen	 men diagnosed w prostate cancer lifetime awareness waggedmo http bitlyu q et via katerichmond	2012-11-16	0	0	@katerichmond	#awareness #waggedmo		https://twitter.com/cr8tivejen/status/269448376112783363
268754343036059649	JENSANITY2211	 mike_tursi hes yuck besidea good rex would bench mark play tebow cancer eats team	2012-11-14	0	0	@Mike_Tursi			https://twitter.com/JENSANITY2211/status/268754343036059649
268543027889438720	Kylem471	 andreamayee well people ignore people die every day cancer	2012-11-13	0	0	@andreamayee			https://twitter.com/Kylem471/status/268543027889438720
268241043621822464	natesmithimprov	 cinemaminimal cancer might give time use wireless video game controllers	2012-11-13	0	0	@cinemaminimal			https://twitter.com/natesmithimprov/status/268241043621822464
267840191740379138	jackgordondo	 cancer kill	2012-11-11	0	2				https://twitter.com/jackgordondo/status/267840191740379138
261263484426264578	lovelpalmer7	 putting little bit pink timbersfc mls supporting fight breast cancer pictwittercomedchkhxg	2012-10-24	8	5	@TimbersFC @MLS			https://twitter.com/lovelpalmer7/status/261263484426264578
260897446631182338	topix_or	 tualatin valley fire rescue pair pink shirts turnouts breast cancer awareness http bitlysh ubu lakeoswego oregon	2012-10-23	0	0		#LakeOswego #Oregon		https://twitter.com/topix_or/status/260897446631182338
259069329436450817	NatalieNeu2	 pink day tomorrow wear pink support cancer 	2012-10-18	0	0				https://twitter.com/NatalieNeu2/status/259069329436450817
258364122998136833	DawnTaylor666	 surely im one finds breast cancer fundraisers using word boobies dumb objectifying iamold getoffmylawn	2012-10-16	0	0		#iamOld #getoffmylawn		https://twitter.com/DawnTaylor666/status/258364122998136833
256750063894790144	AyaMai	 jason hoffman came new way build computers http postxwvcmo medicine cancer doctor family vietnam worthreading	2012-10-12	0	0		#medicine #cancer #doctor #family #vietnam #WorthReading		https://twitter.com/AyaMai/status/256750063894790144
256094100103774208	CMpaugh	 lance armstrong used illegal drugs side effect drug use cancer deserve praise cancer awareness campaign	2012-10-10	0	0				https://twitter.com/CMpaugh/status/256094100103774208
254966789371473920	aliciaann80	 getting ready purplestride pancreatic cancer walk zoo	2012-10-07	0	0				https://twitter.com/aliciaann80/status/254966789371473920
252533072912850944	ElsaLuciaa	 bestofcancer cancer relieve stress cigarettes drink	2012-09-30	0	0	@BestofCancer	#Cancer		https://twitter.com/ElsaLuciaa/status/252533072912850944
250396829169111040	ronal1791	 marijuana illegal known cure cancer dont cause cancer cigarettes legal killer world causes cancer fact	2012-09-24	0	0		#1 #fact		https://twitter.com/ronal1791/status/250396829169111040
248826116712837120	yatown_news	 beaverton boy struggles cancer northwest cable news http yatowncomnewswhitford beavertonorbeavertonboystruggleswithcanceragainpbnorthwestcablenewslowhitford cbeaverton corsnsamdayandhismomlornawalkalonghallwaytheythoughtthey bdleftbehindforeveratthecancerunitofdoernbecherchildren bshospital bse che bsbeenoutoftviytibeavertonboystruggleswithcancer cagainxuhttp a f fwwwnwcncom fhome f ffid d fpath d fnews flocal fdomain d srctw whitford beaverton or	2012-09-20	0	0		#Whitford #Beaverton #OR		https://twitter.com/yatown_news/status/248826116712837120
248620867070881793	sbvegas	 ginabonfiglio _missmayflower_ wifemademetweet evanil kristinfl rogaine use negatively correlated prostate cancer so	2012-09-19	0	0	@GinaBonfiglio @_missmayflower_ @wifemademetweet @evanil2 @kristinfl0			https://twitter.com/sbvegas/status/248620867070881793
247608243029942272	Glittergiraffez	 tscpscorpio cancer scorpio give strength overcome one others weaknesses http bitlyidx bd aarikashley	2012-09-17	1	1	@TScpScorpio @aarikashley			https://twitter.com/Glittergiraffez/status/247608243029942272
245641535935352832	TrueBlueParten	 harveylevintmz total bsyou chose get divorced people dont choose get cancer tmzlive	2012-09-11	0	0	@HarveyLevinTMZ	#TMZLive		https://twitter.com/TrueBlueParten/status/245641535935352832
244982613843013632	JENSANITY2211	 aboveaveragea get her cancer glad ok	2012-09-09	0	0	@AboveAverageA			https://twitter.com/JENSANITY2211/status/244982613843013632
244279874712379394	devdevvrat	 donated find end cancer one live cancer istandupfor	2012-09-07	0	0		#istandupfor		https://twitter.com/devdevvrat/status/244279874712379394
244190657219002368	bridgetownkate	 su c standupfor sister deb died cancer september sister sue cancer survivor	2012-09-07	0	0	@SU2C	#standupfor		https://twitter.com/bridgetownkate/status/244190657219002368
244170211614400512	DawnTaylor666	 im looking forward inevitable news stories next year coconut milk kale give spleen cancer third arm	2012-09-07	0	1				https://twitter.com/DawnTaylor666/status/244170211614400512
241205311707422721	pfrazier	 police dropped charges bearded bridge men trying fight cancer yet mayorsamadams 	2012-08-30	0	0	@mayorsamadams			https://twitter.com/pfrazier/status/241205311707422721
237583704921341953	JENSANITY2211	 susietvaddict abc loved top gun days thunder bev cop think cancer	2012-08-20	0	0	@SusieTVaddict @abc7			https://twitter.com/JENSANITY2211/status/237583704921341953
237355611917012992	JMulletteBauer	 helluva party die say goodbye everyone carolynstraub fight cancer power might	2012-08-19	0	0		#CarolynStraub		https://twitter.com/JMulletteBauer/status/237355611917012992
236745458490425344	topix_or	 bargain shopper help fight breast cancer style http bitlynv ngm portland oregon	2012-08-18	0	0		#Portland #Oregon		https://twitter.com/topix_or/status/236745458490425344
236293906558492674	KrazyHorsee_	 angelalvarez fuck gay lion cancer kiss ass lmaooo teamscorpio	2012-08-16	0	0	@AngelAlvarez64	#TeamScorpio		https://twitter.com/KrazyHorsee_/status/236293906558492674
232952293492940801	elijahpopham	 hope cancer baby baby cancer portland	2012-08-07	0	0		#Portland		https://twitter.com/elijahpopham/status/232952293492940801
231295151736233984	LaurenGarrison7	 dont like fact kill give cancer act general kind sexy	2012-08-03	0	0				https://twitter.com/LaurenGarrison7/status/231295151736233984
228178633829793793	bredbaker	 rip chad everett lung cancer dead medicalcenter iplayadoctorontv	2012-07-25	0	0		#Chad #Everett #cancer #dead #medicalcenter #iplayadoctorontv		https://twitter.com/bredbaker/status/228178633829793793
227626719975186432	tvr0227	 what lol rt nba_source fluoride toothpaste causes bone mouth cancer 	2012-07-24	0	0	@NBA_Source			https://twitter.com/tvr0227/status/227626719975186432
227546496692793344	bredbaker	 rip sally ride first american woman space age cancer	2012-07-23	0	0		#Ride #cancer		https://twitter.com/bredbaker/status/227546496692793344
226018278835904512	AdamRawrence	 viydaschatz yea lets eliminate cancer aids were itits disease v	2012-07-19	0	0	@ViydaSchatz			https://twitter.com/AdamRawrence/status/226018278835904512
217738337853779970	thejameygates	 kristafrederick early lung cancer hahaha	2012-06-26	0	0	@kristafrederick			https://twitter.com/thejameygates/status/217738337853779970
216808563765542912	lila_ariana17	 maybe cuddling cure everything depression loneliness douche cancer one even considered thinkaboutit	2012-06-24	0	0		#ThinkAboutIt		https://twitter.com/lila_ariana17/status/216808563765542912
213101331878121473	tc_humble	 breathless buildup im fully expecting dreamteam cure cancer 	2012-06-13	0	0		#DreamTeam		https://twitter.com/tc_humble/status/213101331878121473
212823329281814528	TheBibleIsTrue	 glycoprotein selenium found human semen helps reduce breast cancer women almost ladies comeovernow 	2012-06-13	0	0		#comeoverNOW		https://twitter.com/TheBibleIsTrue/status/212823329281814528
211916534120071168	PallasByrne	 told god answer asked shit get answer god cancer ofwgkta	2012-06-10	0	0		#ofwgkta		https://twitter.com/PallasByrne/status/211916534120071168
208035060300001280	2c4tz	 coughed hard think gave cancer smoker	2012-05-30	0	0		#smoker		https://twitter.com/2c4tz/status/208035060300001280
199586662781681664	SteffyLA_Lakers	 wish cure cancer 	2012-05-07	0	0				https://twitter.com/SteffyLA_Lakers/status/199586662781681664
198200281308213248	Murrayhill_Vet	 may cancer awareness month http rcastiirl 	2012-05-03	0	0				https://twitter.com/Murrayhill_Vet/status/198200281308213248
197546628129894401	Murrayhill_Vet	 may cancer awareness month http rcastjl tqw	2012-05-02	1	0				https://twitter.com/Murrayhill_Vet/status/197546628129894401
195734028014460929	chal_tu	 bio test cancer test hc essay lit tomorrow death fml	2012-04-27	0	0		#tomorrow #death #fml		https://twitter.com/chal_tu/status/195734028014460929
195379487100256257	_MissMayFlower_	 pduckie believe me ive touched cancer many times make hate enough send love prayers family	2012-04-26	0	0	@PDuckie83			https://twitter.com/_MissMayFlower_/status/195379487100256257
192431452892303360	gbelle22	 wellmeaning people or friends familys bout cancer adviceyour story story	2012-04-17	0	0				https://twitter.com/gbelle22/status/192431452892303360
189949214443311105	OregonJoyce	 conducted telephone town hall tonight importance colorectal cancer screenings people thx dr lieberman ohsu 	2012-04-11	0	0		#OHSU		https://twitter.com/OregonJoyce/status/189949214443311105
188336385936211969	profen	 http bitlyi bdoi interesting minutes segment health risks sugar including new research suggests link cancer 	2012-04-06	0	0				https://twitter.com/profen/status/188336385936211969
186872534862540802	TenderDentist	 oral cancer strikes estimated americans year tigard tendercare dental pacific hwy tigard http flickrpbrc b	2012-04-02	0	0				https://twitter.com/TenderDentist/status/186872534862540802
185171300094980097	alyssasunseri	 fuck cancer 	2012-03-28	0	0				https://twitter.com/alyssasunseri/status/185171300094980097
182621909781979137	KrisKoivisto	 trail blazers hasheemthedream j_flynn hanging childrens cancer association kids pf http instagrampidd zxvgqf	2012-03-21	0	0	@HasheemTheDream @J_Flynn			https://twitter.com/KrisKoivisto/status/182621909781979137
180305029377429504	apeshapefit	 facebook like page fight cause follow help raise money little girl rare form cancer mma makeachange	2012-03-15	1	0		#cancer #MMA #MakeaChange		https://twitter.com/apeshapefit/status/180305029377429504
180089174249046016	brogmarie	 made comment bad shed picking hair top doctor cancer hair open mouth insert foot	2012-03-14	0	0				https://twitter.com/brogmarie/status/180089174249046016
179703552413941760	toodles61	 im northwest cancer specialists portland or http sqcomxd id	2012-03-13	0	0				https://twitter.com/toodles61/status/179703552413941760
175711240767811586	ChrisXPPro	 ssaruhh good cant stand cancer beds	2012-03-02	0	0	@ssaruhh			https://twitter.com/ChrisXPPro/status/175711240767811586
174142120360288256	JENSANITY2211	 mypinstripes found last night friend work poems cancer headed minn chemo stem cell treatment	2012-02-27	0	0	@MyPinstripes			https://twitter.com/JENSANITY2211/status/174142120360288256
174140796688273408	JENSANITY2211	 mike_tursi good morning you myfriend work needs prayers cancer called poemsand starting chemo stem cell minn	2012-02-27	0	0	@Mike_Tursi			https://twitter.com/JENSANITY2211/status/174140796688273408
172035487186436097	JENSANITY2211	 mypinstripes step mom cancer free follow five years	2012-02-21	0	0	@MyPinstripes			https://twitter.com/JENSANITY2211/status/172035487186436097
169298174543007744	tweet235anas	 hey feeling yuvsingh hope u fight cancer please reply back	2012-02-14	0	0	@yuvsingh09			https://twitter.com/tweet235anas/status/169298174543007744
167344172754415617	PheniqueFennec	 cancer find march	2012-02-08	0	0				https://twitter.com/PheniqueFennec/status/167344172754415617
162915547942617090	apeshapefit	 mikehasnolegs bro peeps like remind dont shit complain about makethemostofit mma cancer	2012-01-27	1	0	@mikehasnolegs	#makethemostofit #MMA #cancer		https://twitter.com/apeshapefit/status/162915547942617090
160224085882839040	fractal74	 mattjohnstonfg jsvandyke fire hawaiian place sounds sketchy owner cancer needed moneyor heard	2012-01-19	0	0	@MattJohnstonFG @jsvandyke13			https://twitter.com/fractal74/status/160224085882839040
158384944400437251	sophiamunzel	 franciemitchell read somewhere breast milk help prevent cancer buy you	2012-01-14	0	1	@franciemitchell			https://twitter.com/sophiamunzel/status/158384944400437251
157290438296993793	marnekat	 found aunt breast cancer please keep thoughts prayers	2012-01-11	0	0				https://twitter.com/marnekat/status/157290438296993793
264156116102029312	Madmoniker	 lynsielee real sorry mom mine fought cancer whole young life lost fight stay passionate friend turn	2012-11-01	0	0	@LynsieLee			https://twitter.com/Madmoniker/status/264156116102029312
251136471195602945	HannahGossack	 jocelynwelberg dont get cancer 	2012-09-26	0	0	@JocelynWelberg			https://twitter.com/HannahGossack/status/251136471195602945
246864236167454721	ctafadzwab	 wonder could cure cancer sinsubeans	2012-09-15	0	0		#sinsubeans		https://twitter.com/ctafadzwab/status/246864236167454721
242511049973178368	JHoops90	 sz t xiicrain sz aciidrain testicular cancer	2012-09-03	0	0	@Sz0T0XiiCRaiN @Sz0ACiiDRaiN			https://twitter.com/JHoops90/status/242511049973178368
234554975156576256	vivsdaddy	 bill gates rich hired cancer kill steve jobs realjeffreyross nevertoosoon jeffrossroastsamerica funnyfucker	2012-08-12	0	0	@realjeffreyross	#nevertoosoon #jeffrossroastsamerica #funnyfucker		https://twitter.com/vivsdaddy/status/234554975156576256
201095926708846595	Jackie_Elise	 found dog cancer loveyoubunt	2012-05-11	0	0		#loveyoubunt		https://twitter.com/Jackie_Elise/status/201095926708846595
200622858379079680	azzcatdesign	 walk humming anti cancer mantra every step friend undergoing surgery soontobecancerfree http camplusjnid	2012-05-10	0	0		#soontobecancerfree		https://twitter.com/azzcatdesign/status/200622858379079680
281050252209963008	stinalynn00	 rocking maroon way wrk rainsnow mix n snow got text sis niece passed away brain cancer 	2012-12-18	0	0	@maroon5			https://twitter.com/stinalynn00/status/281050252209963008
279072040990932992	JoeyCardinal44	 orion_ _ well yeah cancer dude	2012-12-12	0	0	@orion_31_			https://twitter.com/JoeyCardinal44/status/279072040990932992
270246953726664705	MunchingZombie	 rolandscahill shaved silhouette prostate cancer pubic hair pubgust	2012-11-18	0	0	@rolandscahill	#pubgust		https://twitter.com/MunchingZombie/status/270246953726664705
