id	Username	Text	Date	Retweets	Favorites	Mentions	Hashtags	Geo	Permalink
284189422860251136	madisonbeard	 praying grama whos cancer moved liver praying dad	2012-12-27	0	1		#praying		https://twitter.com/madisonbeard/status/284189422860251136
284174204738355200	kingtaay	 assuming tiny tiny tiny little black dot end nose skin cancer probably is	2012-12-27	0	0				https://twitter.com/kingtaay/status/284174204738355200
283838912852553728	bigant12	 peeking youll get kid cancer hahaha funny movie love ted	2012-12-26	0	0				https://twitter.com/bigant12/status/283838912852553728
283030579480518656	arrowood_autumn	 tasteliketacos arrowood_autumn tasteliketacos omfg nicki minaj gives cancer too u understand feels share feels	2012-12-23	0	0	@TastelikeTacos @arrowood_autumn @TastelikeTacos			https://twitter.com/arrowood_autumn/status/283030579480518656
283028712235073536	arrowood_autumn	 tasteliketacos omfg nicki minaj gives cancer 	2012-12-23	0	0	@TastelikeTacos			https://twitter.com/arrowood_autumn/status/283028712235073536
282231924276215810	MamaBradHag	 daughters close friend lost battle w cancer morning rip lisa recordu beautiful soul	2012-12-21	0	0				https://twitter.com/MamaBradHag/status/282231924276215810
281258267596955648	GarrettSmart	 jacck_bradford gotta puff cancer stick twist bub tweak life	2012-12-18	0	1	@jacck_bradford			https://twitter.com/GarrettSmart/status/281258267596955648
280793345259888640	EzBenjamins	 pink cup im supporting breast cancer pictwittercomw zr lo	2012-12-17	0	0				https://twitter.com/EzBenjamins/status/280793345259888640
279253041100759040	osu_rach	 sunz_chick mom breast cancer years ago relate couple levels maybe made stone lol mlhdesigner	2012-12-13	0	0	@Sunz_Chick @mlhdesigner			https://twitter.com/osu_rach/status/279253041100759040
278992560612077568	tashiii20	 cancer center hotdoctor	2012-12-12	0	1		#hotdoctor		https://twitter.com/tashiii20/status/278992560612077568
277995193767194624	delightfuldave	 dad doesnt cancer awesome	2012-12-09	0	1				https://twitter.com/delightfuldave/status/277995193767194624
277574005161086977	Jhaaby09	 dougstanhope think u might tom green cancer	2012-12-08	0	0	@DougStanhope			https://twitter.com/Jhaaby09/status/277574005161086977
276523278754009088	delightfuldave	 dad called tell kidney cancer old parents bummer zone	2012-12-05	0	0				https://twitter.com/delightfuldave/status/276523278754009088
275242303659061248	christinewojack	 lung cancer remission now last years tests treatments took heavy toll lupus survive 	2012-12-02	0	0				https://twitter.com/christinewojack/status/275242303659061248
274613289756012544	DrReggin	 coreykeyz funny great guy could please help us get taylormeetnat girl terminal cancer trending	2012-11-30	0	0	@CoreyKeyz	#TaylorMeetNat		https://twitter.com/DrReggin/status/274613289756012544
274414234388033537	DrReggin	 oprah please help nataliehill terminal cancer meet taylorswift inspiring beautiful girl taylormeetnat	2012-11-30	0	1	@Oprah @Nataliehill2014 @taylorswift13	#TaylorMeetNat		https://twitter.com/DrReggin/status/274414234388033537
274413349331152896	DrReggin	 bobatl please help nataliehill terminal cancer meet taylorswift inspiring beautiful girl taylormeetnat	2012-11-30	0	0	@bobatl @Nataliehill2014 @taylorswift13	#TaylorMeetNat		https://twitter.com/DrReggin/status/274413349331152896
274411117705576448	DrReggin	 miranda_lambert please help nataliehill terminal cancer meet taylorswift inspiring girl taylormeetnat	2012-11-30	0	0	@Miranda_Lambert @Nataliehill2014 @taylorswift13	#TaylorMeetNat		https://twitter.com/DrReggin/status/274411117705576448
274411049636216833	DrReggin	 chrisyoungmusic please help nataliehill terminal cancer meet taylorswift inspiring girl taylormeetnat	2012-11-30	0	0	@ChrisYoungMusic @Nataliehill2014 @taylorswift13	#TaylorMeetNat		https://twitter.com/DrReggin/status/274411049636216833
274410924708855809	DrReggin	 blakeshelton please help nataliehill terminal cancer meet taylorswift inspiring beautiful girl taylormeetnat	2012-11-30	0	0	@blakeshelton @Nataliehill2014 @taylorswift13	#TaylorMeetNat		https://twitter.com/DrReggin/status/274410924708855809
274401462912700417	DrReggin	 everyone please help make taylormeetnat happen taylorswift please beautiful girl terminal cancer 	2012-11-30	2	1	@taylorswift13	#TaylorMeetNat		https://twitter.com/DrReggin/status/274401462912700417
274195714085634050	tianadae	 its funny til someone gets skin cancer	2012-11-29	0	0				https://twitter.com/tianadae/status/274195714085634050
273994837294997505	Autumn123579	 drinking sperm lowers chances cancer obviously	2012-11-28	0	1				https://twitter.com/Autumn123579/status/273994837294997505
272853786882633728	_mylifeasAMANDA	 tattooed reason horoscope knows whats up zodiac cancer moonchild truth religion adtrology dailyhoroscopeapp numberone	2012-11-25	0	0		#horoscope #zodiac #Cancer #moonchild #truth #religion #adtrology #dailyhoroscopeapp #numberone		https://twitter.com/_mylifeasAMANDA/status/272853786882633728
271091564284100608	1LeesaLeft	 homerwhite thankslost dad cancer i miss sayingsso preachem boyslol	2012-11-20	0	0	@HomerWhite			https://twitter.com/1LeesaLeft/status/271091564284100608
270041636979998720	1LeesaLeft	 leesax fredzeppelin galtsgirl hunteramor cancer worseanymore getn by friend lost jobhome last yr	2012-11-18	0	0	@leesax6 @FredZeppelin12 @GaltsGirl @hunteramor			https://twitter.com/1LeesaLeft/status/270041636979998720
269513355373457408	allisonjean96	 cant cancer 	2012-11-16	0	0				https://twitter.com/allisonjean96/status/269513355373457408
268438502193127425	Zachary0_0Binks	 snatchketchum butt cancer 	2012-11-13	0	0	@snatchketchum			https://twitter.com/Zachary0_0Binks/status/268438502193127425
267687339638267904	nataliekbrenner	 hate cancer gnaws away heart corvallischurch	2012-11-11	0	0	@Corvallischurch			https://twitter.com/nataliekbrenner/status/267687339638267904
266315937064579072	EmmaFassihi	 think skin cancer paranoid	2012-11-07	0	0		#paranoid		https://twitter.com/EmmaFassihi/status/266315937064579072
265200742908956673	AceOfHearts86	 instead shaving raise awareness prostate cancer encouraging buddy check system awkwardandkindahomo	2012-11-04	2	0		#AwkwardAndKindaHomo		https://twitter.com/AceOfHearts86/status/265200742908956673
264884479049490432	BrookNie	 everything causes cancer seemslikeit	2012-11-03	2	0		#seemslikeit		https://twitter.com/BrookNie/status/264884479049490432
263001845285412865	ST0N3F0X	 smoking tanning causes cancer idea dumb shits	2012-10-29	0	1				https://twitter.com/ST0N3F0X/status/263001845285412865
262747676502790144	Jake_Denning	 awphotographs they got spaghetti every saturdayshe got cancer and diednow dude hangs sizzler romancefilms	2012-10-28	0	0	@awphotographs	#romancefilms		https://twitter.com/Jake_Denning/status/262747676502790144
262333071712452608	mama2mir	 peeps havent forgotten ill lost lot weight docs testing cancer ill let know me 	2012-10-27	1	0				https://twitter.com/mama2mir/status/262333071712452608
261650419082727424	allisonjean96	 brain cancer please tell 	2012-10-25	0	0				https://twitter.com/allisonjean96/status/261650419082727424
261537260242087936	Currynader	 justin bieber cancer girls going shave head	2012-10-25	0	0				https://twitter.com/Currynader/status/261537260242087936
261302664225230848	surrahnicole	 get wear jeans work next two days even purple shirt friday cancer itsthelittlethings 	2012-10-24	0	1		#ItsTheLittleThings		https://twitter.com/surrahnicole/status/261302664225230848
260852119031128064	TBrave	 enjoying view willamette valley cancer institute pic http sqcomqtbgc 	2012-10-23	0	0	@Willamette			https://twitter.com/TBrave/status/260852119031128064
258372437106913280	peterson_kacee	 awkward moment someone door tells kind cancer have scare you	2012-10-16	0	0				https://twitter.com/peterson_kacee/status/258372437106913280
258314722775035904	rrr97501	 blakeshelton please give thumbs lane goodwin family hes fighting cancer sadly loosing battle fb prayers lane goodwin	2012-10-16	0	0	@blakeshelton			https://twitter.com/rrr97501/status/258314722775035904
258245354275868672	BigDSully4	 think show breaking bad wouldnt work country gets cancer treatment would paid gov	2012-10-16	0	2				https://twitter.com/BigDSully4/status/258245354275868672
258085709724934144	BigDSully4	 research nfl makes money cancer awareness month make triple donate	2012-10-16	1	0				https://twitter.com/BigDSully4/status/258085709724934144
258046894943649792	SteelDoe	 nfl auctions pink equipment used players represent breast cancer earnings go breast cancer 	2012-10-15	0	2				https://twitter.com/SteelDoe/status/258046894943649792
257874890428919808	JessicaDwyer	 amandapalmer insurancepoll still owed nearly k insurance cancer surgery w full coverage still screwed billing	2012-10-15	0	0	@amandapalmer	#InsurancePoll		https://twitter.com/JessicaDwyer/status/257874890428919808
257048124143575041	ElinayNature	 fight cure aunt lost breast cancer lucky alive survive corvallis armory http instagrampqt ahzng x	2012-10-13	0	0	@Corvallis			https://twitter.com/ElinayNature/status/257048124143575041
256096022265225216	RowenVoris	 breast cancer awareness game field pm gonna good one	2012-10-10	0	0				https://twitter.com/RowenVoris/status/256096022265225216
255549258483240960	ST0N3F0X	 tonight din din cancer sandwich cigarette tan cigarette delicious	2012-10-09	0	0				https://twitter.com/ST0N3F0X/status/255549258483240960
254733150884864000	mgwalks	 theres rumor ducks wearing pink jerseys breast cancer awareness everything im seeing yellow hats green jerseys though	2012-10-06	0	0				https://twitter.com/mgwalks/status/254733150884864000
253365207714394112	DamonEstrada	 month dedicated wonderful aunt fought hard made breast cancer years ago muchlove	2012-10-03	1	3		#muchlove		https://twitter.com/DamonEstrada/status/253365207714394112
253282458458521600	_Oceanajohnson	 northwestkid its okay im checking cancer 	2012-10-02	0	0	@NorthWestKid541			https://twitter.com/_Oceanajohnson/status/253282458458521600
252549241325633537	ReDecypher	 replacement ear grows cancer patients arm rib cage cartilage http mnydailynewscom pmsl ide via nydailynews wow humans gr things	2012-09-30	0	0	@nydailynews			https://twitter.com/ReDecypher/status/252549241325633537
250778623643103232	Ossain_	 mcdonalds official restaurant olympics like smoking official medicine cancer 	2012-09-25	0	0				https://twitter.com/Ossain_/status/250778623643103232
249945998456147968	ST0N3F0X	 get high get skin cancer go home	2012-09-23	0	0				https://twitter.com/ST0N3F0X/status/249945998456147968
248802015122161665	christinewojack	 year lung cancer survivor oh happy day o	2012-09-20	0	0				https://twitter.com/christinewojack/status/248802015122161665
248588734545666048	JonathanAdams	 dballs ryro im scared cancer	2012-09-19	0	0	@dballs12 @ryro23			https://twitter.com/JonathanAdams/status/248588734545666048
248238017498722304	dominicmylove	 heart broken goodwin family losing fight cancer hard anyone losing childhoodcancer b worst	2012-09-18	0	0		#Goodwin #cancer #childhoodcancer		https://twitter.com/dominicmylove/status/248238017498722304
247888675021656066	MonaPinon	 wwe september childrencancerawarenessmonth color gold lot makeawish kids cancer please show support	2012-09-17	0	0	@WWE @MakeAWish	#childrencancerawarenessmonth #gold #cancer		https://twitter.com/MonaPinon/status/247888675021656066
247587846511280128	nancyFerreR98	 prayers tonight going harvey whose fight cancer 	2012-09-17	0	0				https://twitter.com/nancyFerreR98/status/247587846511280128
246911535308500992	AidenLong	 dont die liver failure lung cancer ima pissed	2012-09-15	0	0				https://twitter.com/AidenLong/status/246911535308500992
246092082144501760	chris_carp7	 lumpy boob thats cancer stephenrock funkyboobs isaiah sroom	2012-09-12	0	1	@stephenrock9	#funkyboobs #Isaiah		https://twitter.com/chris_carp7/status/246092082144501760
245927454261268480	Zachary0_0Binks	 fuck cancer	2012-09-12	3	0				https://twitter.com/Zachary0_0Binks/status/245927454261268480
245895732844969984	kbeaudry80	 captjohnathan thoughts prayers family cancer survivor myself hope woman gets deserves	2012-09-12	0	0	@captjohnathan			https://twitter.com/kbeaudry80/status/245895732844969984
245004126331744259	nailpro97401	 cancer sucks watching mother die changed forever doesnt deserve this nobody does	2012-09-09	0	0				https://twitter.com/nailpro97401/status/245004126331744259
244745959559540737	ST0N3F0X	 feel cancer yet pictwittercomc bc z	2012-09-09	0	1				https://twitter.com/ST0N3F0X/status/244745959559540737
244572881235869697	Murramos	 nothing amazing listening brooklins dreams the cancer goes away shes got optimism ppl kno	2012-09-08	0	1				https://twitter.com/Murramos/status/244572881235869697
244283938363826176	BowmanDidi79	 istandupfor twin brother remission intestinal cancer pray everyday stay way beautiful kids	2012-09-08	0	0		#IStandUpFor		https://twitter.com/BowmanDidi79/status/244283938363826176
244283375710511104	BowmanDidi79	 istandupfor grandparents grandpa passed first lung cancer grandma battled throat breast cancer rock	2012-09-07	0	0		#IStandUpFor		https://twitter.com/BowmanDidi79/status/244283375710511104
244282708174454784	BowmanDidi79	 istandupfor mom lost colon cancer yrs old greatly missed	2012-09-07	0	0		#IStandUpFor		https://twitter.com/BowmanDidi79/status/244282708174454784
239759849108410368	anniedub	 cuttin chips ovarian cancer research inn th http instagrampozdzrkndis	2012-08-26	0	0	@Inn			https://twitter.com/anniedub/status/239759849108410368
238204091363377154	allisonjean96	 gingerward family fighting grandma lung pancreatic cancer wont make much longer 	2012-08-22	0	0	@gingerward4			https://twitter.com/allisonjean96/status/238204091363377154
237643028590886914	THEonlyCwat	 well tell cancer iamcbass tguillen 	2012-08-20	0	0	@iamcbass @Tguillen1			https://twitter.com/THEonlyCwat/status/237643028590886914
237598270820593664	JessicaDwyer	 tony scott inoperable brain cancer makes sense doesnt make better	2012-08-20	0	0				https://twitter.com/JessicaDwyer/status/237598270820593664
237413799467053057	LarissaTheDino	 tell cancer im gonna shoot face gun bullet twice alone day everyday gonna go sleep wake up	2012-08-20	0	1				https://twitter.com/LarissaTheDino/status/237413799467053057
237306247618101248	topix_or	 oregon men skate portland ashland cancer http bitlyonr dc ashland oregon	2012-08-19	0	0		#Ashland #Oregon		https://twitter.com/topix_or/status/237306247618101248
235942586173493248	KatyNiallHoran	 plasticbieber stop niallofficial little girl cancer hes great perfect would never fan	2012-08-15	0	0	@PlasticBieber @NiallOfficial			https://twitter.com/KatyNiallHoran/status/235942586173493248
234333860438093825	MikiMikayyy	 firstworldfacts tanning give cancer kill you tans damaged skin cells oopps	2012-08-11	0	0	@firstworldfacts			https://twitter.com/MikiMikayyy/status/234333860438093825
228981355193716736	mckenna_coppel	 cannot wait relayforlife tonight work time kick cancer ass uncle herm	2012-07-27	0	0		#relayforlife		https://twitter.com/mckenna_coppel/status/228981355193716736
228237679320526849	Jbozeman541	 uberfacts forgiveness actually health benefits reduce risk heart attacks slow spread cancer forgive 	2012-07-25	0	0	@UberFacts	#forgive		https://twitter.com/Jbozeman541/status/228237679320526849
228129055755624448	mckenna_coppel	 everybody go dutchbros today drinks goes towards relay lifeamerican cancer society	2012-07-25	0	0	@DutchBros			https://twitter.com/mckenna_coppel/status/228129055755624448
227182764234006528	RealMosesOwens	 id rather go mouth cancer rather car accident stubbornhabits	2012-07-22	0	0		#StubbornHabits		https://twitter.com/RealMosesOwens/status/227182764234006528
224409505163780096	97469	 gentlemen bras raise cancer funds http bitlynpzsp via http outsidein 	2012-07-15	0	0				https://twitter.com/97469/status/224409505163780096
224133918910197760	97470	 gentlemen bras raise cancer funds http bitlynwsmtc via http outsidein 	2012-07-14	0	0				https://twitter.com/97470/status/224133918910197760
222831096935620609	JessicaDwyer	 mruff im scared change jobs cancer go another job w dif carrier preexist comes back	2012-07-10	6	1	@Mruff221			https://twitter.com/JessicaDwyer/status/222831096935620609
222213951029657600	swellnomad	 mr_flenner skin cancer makes yolo awfully short justsayin	2012-07-09	0	1	@Mr_Flenner	#YOLO #justsayin		https://twitter.com/swellnomad/status/222213951029657600
222053077279195137	NicoleeSisco	 met guy cancer sign tatooed wedding ring asked cancer said wifes sign toocute	2012-07-08	0	0		#toocute		https://twitter.com/NicoleeSisco/status/222053077279195137
220466114642194432	jendoe79	 spittyp emotional sensitivity strong people insis cancer http bitlyyk b m oops kinda	2012-07-04	0	0	@SpittyP	#kinda		https://twitter.com/jendoe79/status/220466114642194432
220466004902424576	jendoe79	 spittyp emotional sensitivity strong people insis cancer http bitlyyk b m yer kondw sensitive	2012-07-04	0	0	@SpittyP			https://twitter.com/jendoe79/status/220466004902424576
216720011715280898	photojoseph	 roller derby breast cancer fundraising combo medford armory http instagrampmpwtmtzarj	2012-06-23	0	0	@Medford			https://twitter.com/photojoseph/status/216720011715280898
216632571432407041	JoCoRelay	 according acs estimated of new cancer patients tweetforacure	2012-06-23	0	0		#of #tweetforacure		https://twitter.com/JoCoRelay/status/216632571432407041
215660492683870208	alden_mary	 july best month hear baby cancer	2012-06-21	0	0		#Cancer		https://twitter.com/alden_mary/status/215660492683870208
212206855873769474	yatown_news	 demand sparks cancer center growth the registerguard http yatowncomnewsfoxhollo weugeneordemandsparkscancercentergrowthpbtheregisterguardlofoxhollow ceugene corsnbysherriburi mdash bmcdonalddrdavidfryefield coneofthefoundersofthewillamettevalleycancerinstituteandresearchcenter cremembershowdifficultitwastocoordinateserviceviytidemandsparkscancercentergrowthxuhttp a f fwwwregisterguardcom fweb fnewslocalnews f fcentercancerpatientsresearchcarehtmlcspsrctw foxhollow eugene or	2012-06-11	0	0		#FoxHollow #Eugene #OR		https://twitter.com/yatown_news/status/212206855873769474
203110549528129536	topix_or	 west linn teen named community hero childrena cancer association http bitlyjydwqy westlinn oregon	2012-05-17	0	0		#WestLinn #Oregon		https://twitter.com/topix_or/status/203110549528129536
201381188001210368	topix_or	 cancer survivor holds benefit research others need help http bitlyiqtc x ashland oregon	2012-05-12	0	0		#Ashland #Oregon		https://twitter.com/topix_or/status/201381188001210368
201291119013793792	prostatediaries	 cancer survivor holds benefit research others need help september saturday frank dalzi http bitlyjqc xa	2012-05-12	0	0				https://twitter.com/prostatediaries/status/201291119013793792
200821528387002368	trinitypromo	 fxckcancer lost grandfather cancer beat twice third time got ripwoodybray fuckcancer	2012-05-11	1	0	@FxCKCANCER	#ripwoodybray #fuckcancer		https://twitter.com/trinitypromo/status/200821528387002368
200741129719779329	ikesplace	 oben phil_hellmuth ryankennedy yearold brain cancer wish trend twitter	2012-05-10	1	0	@oben02 @phil_hellmuth	#RyanKennedy		https://twitter.com/ikesplace/status/200741129719779329
200708923269971969	__tarafirma	 carsonmckeecase its fake youre still getting cancer premature wrinkles	2012-05-10	0	0	@CarsonMcKeeCase			https://twitter.com/__tarafirma/status/200708923269971969
197163573598879744	tiaraniicolee	 fuck complaining about like cancer	2012-04-30	2	0				https://twitter.com/tiaraniicolee/status/197163573598879744
196150476406919169	tiaraniicolee	 cancer sucks	2012-04-28	2	0				https://twitter.com/tiaraniicolee/status/196150476406919169
195817987402506240	AlexanderJRoth	 congrats russ glad hear brothers mom beat cancer 	2012-04-27	0	0				https://twitter.com/AlexanderJRoth/status/195817987402506240
195108920262533120	97469	 roseburg man succumbs cancer http bitlyitow u via http outsidein 	2012-04-25	0	0				https://twitter.com/97469/status/195108920262533120
194932353968246784	97470	 roseburg man succumbs cancer http bitlyio nhx via http outsidein 	2012-04-24	0	0				https://twitter.com/97470/status/194932353968246784
192699630595743744	yo_powe	 brand usually attacked creating negative body images rt good barbie going bald comfort kids cancer http bitlyilvwuc	2012-04-18	0	0	@GOOD			https://twitter.com/yo_powe/status/192699630595743744
192273381813518336	yatown_news	 rower regains pull cancer osu beavers http yatowncomnewscalloway corvallisorrowerregainspullaftercancerpbosubeaverslocalloway ccorvallis corsncorvallis coreoregonstatesophomoreannataylorwasfeaturedinthemostrecenteditionoftheoregonstater cwhichchronicledherjourneytocomebackfromacancerdiagnosisandonceagainraceinavarsityshellviytirowerregainspullaftercancerxuhttp a f fwwwosubeaverscom fsports fwrowing fspecrel f aaahtmlimhttp a f fgrfxcstvcom fphotos fschools forst fsports fwrowing fauto_action f jpegsrctw calloway corvallis or	2012-04-17	0	0		#Calloway #Corvallis #OR		https://twitter.com/yatown_news/status/192273381813518336
188672568969011200	yatown_news	 cancer awareness month high definition pet ct scanning kdrv http yatowncomnewsmedfordo rcancerawarenessmonthhighdefinitionpetandctscanningpbkdrvlomedford corsnbyashleyhall mdash bmedford coreapriliscancerawarenessmonthsoallmonth cnewswatch willbringyouthelatestadvancementsincancerdiagnosis ctreatment candcareviyticancerawarenessmonth ahighdefinitionpetandctscanningxuhttp a f fkdrvcom fnews flocal f imhttp a f fkdrvcom ffiles fimages f f f fpetscanspreviewjpgsrctw medford or	2012-04-07	0	0		#Medford #OR		https://twitter.com/yatown_news/status/188672568969011200
186114081252585472	dontblink33	 help mary kay foundation stop breast cancer domestic violence text ft teamup please retweet	2012-03-31	0	0				https://twitter.com/dontblink33/status/186114081252585472
186113369093324800	dontblink33	 help mary kay foundation stop breast cancer domestic violence text ft teamup funds go directly research	2012-03-31	0	0				https://twitter.com/dontblink33/status/186113369093324800
183973210834997248	johnmcropper	 wife beats cancer man photographs pink tutu across country hilarious http feedproxygooglecomrpetapixel rkqqgzslxeo 	2012-03-25	1	0				https://twitter.com/johnmcropper/status/183973210834997248
179831024614768641	PDX_Nick	 joeymcm dont think cancer randy moss ruin team id least thinking it	2012-03-14	0	0	@JoeyMcM93			https://twitter.com/PDX_Nick/status/179831024614768641
172139684426809344	yatown_news_pm	 man faces felony charges allegedly faking cancer seeking donati the registerguard http yatowncomnewscedarfla tspringfieldormanfacesfelonychargesforallegedlyfakingcancerseekingdonationspbtheregisterguardlocedarflat cspringfield corsnbywriternamea mdash bspringfieldmanaccusedoffakingterminalcancerlastyeartobilkfellowchurchmembersandthepublicwasbookedintothelanecountyjailtuesdayonfivefelonytheftchargesviytimanfacesfelonychargesforallegedlyfakingcancer cseekingdonationsxuhttp a f fwwwregisterguardcom fweb fupdates f ftheftdegreeembletonlanespringfieldhtmlcspimhttp a f fkezicom ffiles fimages f f f f cancerhearing_imagepreviewjpgsrctw cedarflat springfield or	2012-02-21	0	0		#CedarFlat #Springfield #OR		https://twitter.com/yatown_news_pm/status/172139684426809344
170802606921355265	97469	 volunteers aid cancer patients http bitlyx lh n via http outsidein 	2012-02-18	0	0				https://twitter.com/97469/status/170802606921355265
170667206496104450	97470	 volunteers aid cancer patients http bitlywvmpr via http outsidein 	2012-02-17	0	0				https://twitter.com/97470/status/170667206496104450
169916749674844161	chaseg30	 congrats tonygwynn successful jaw cancer surgery thoughts road recovery staystrong	2012-02-15	0	0		#TonyGwynn #staystrong		https://twitter.com/chaseg30/status/169916749674844161
168510276839280640	Its_Kimmay	 headache relief warning side effects blood clots itchy skin hair loss depression cancer vomiting giving bigger headache	2012-02-11	0	0				https://twitter.com/Its_Kimmay/status/168510276839280640
167050716236623872	StellaNai	 question class does anal sex cause cancer bahahah	2012-02-07	0	0				https://twitter.com/StellaNai/status/167050716236623872
164235711699095552	kristenliberty	 minor medical ailments sent spiraling crippling depression get cancer im unsurviving boohoo	2012-01-31	0	0		#boohoo		https://twitter.com/kristenliberty/status/164235711699095552
163801768659140609	CVOBikes	 oregonlive gail achterman portland lawyer lifelong public servant bike advocate dies cancer http bitlyygrlls	2012-01-29	0	0				https://twitter.com/CVOBikes/status/163801768659140609
159031711336890368	WhiteWasht	 cigarettes sharpen senses clear mind give cancer 	2012-01-16	0	0				https://twitter.com/WhiteWasht/status/159031711336890368
158351675076263938	velascoev	 met cancer survivor lucy boston terrier sweetest pup les schwab http sqcomwf qnc	2012-01-14	0	0	@Les			https://twitter.com/velascoev/status/158351675076263938
157386511040524288	97415	 bruin basketball teams cancer awareness night raise funds fight dise http bitlyzafafu via http outsidein 	2012-01-12	0	0				https://twitter.com/97415/status/157386511040524288
156435615137796096	topix_or	 salem artist shows cancer paintings albany http bitlyaowrgc albany oregon	2012-01-09	0	0		#Albany #Oregon		https://twitter.com/topix_or/status/156435615137796096
154219180604915712	topix_or	 former ashlander bryant recovers cancer surgery http bitlyuvlrle ashland oregon	2012-01-03	0	0		#Ashland #Oregon		https://twitter.com/topix_or/status/154219180604915712
285514513388818432	Darkalex_	 uso de aceite recalentado puede causar gastritis cncer http nlarahostcom jzv z noticias teamfollowback	2012-12-30	0	0		#Noticias #TeamFollowBack		https://twitter.com/Darkalex_/status/285514513388818432
