id	Username	Text	Date	Retweets	Favorites	Mentions	Hashtags	Geo	Permalink
285211503513198592	Darkalex_	 marquina dice que el cncer que padece chvez es incurable http nlarahostcom jp rl noticias teamfollowback	2012-12-29	0	0		#Noticias #TeamFollowBack		https://twitter.com/Darkalex_/status/285211503513198592
284029472032833536	Darkalex_	 alcohol aumenta el riesgo de cncer heptico en pacientes con cirrosis http nlarahostcom hzvcs noticias teamfollowback	2012-12-26	0	0		#Noticias #TeamFollowBack		https://twitter.com/Darkalex_/status/284029472032833536
279001862617849857	Mistress_Jan	 huffingtonpost california governor announces cancer http hufftotvur q rick simpson oil	2012-12-12	0	0	@HuffingtonPost			https://twitter.com/Mistress_Jan/status/279001862617849857
278033197911138304	topix_or	 breast cancer overdiagnosed http bitlyrtzdjj bend oregon	2012-12-10	0	0		#Bend #Oregon		https://twitter.com/topix_or/status/278033197911138304
276194074141282304	HellaRachMitch	 scorpioterms cancer best person fun scorpio taylorcissney duh me	2012-12-05	1	0	@ScorpioTerms @taylorcissney	#Cancer #Scorpio		https://twitter.com/HellaRachMitch/status/276194074141282304
276053578655858689	Mistress_Jan	 rt ommpeddie rs oil cures cancer http freemygreenpdxcomindexphptop ic rsoilcurescanceragain 	2012-12-04	3	1	@ommpeddie			https://twitter.com/Mistress_Jan/status/276053578655858689
259905430615105536	Darkalex_	 la masturbacion evita el cncer http nlarahostcom lyxrl noticias teamfollowback	2012-10-21	1	0		#Noticias #TeamFollowBack		https://twitter.com/Darkalex_/status/259905430615105536
259808170912935937	MarieMBabyyy	 cancer females motherly caring comforting personify word woman	2012-10-20	0	0		#Cancer		https://twitter.com/MarieMBabyyy/status/259808170912935937
256842200858644480	MarieMBabyyy	 hate cancer 	2012-10-12	0	0				https://twitter.com/MarieMBabyyy/status/256842200858644480
255165488806637568	MarieMBabyyy	 last night cancer s party heads party party hard	2012-10-08	0	0				https://twitter.com/MarieMBabyyy/status/255165488806637568
253375245392678912	MarieMBabyyy	 think pink pink can big small save all fuck cancer breastcancerawarenessmonth	2012-10-03	0	0		#BreastCancerAwarenessMonth		https://twitter.com/MarieMBabyyy/status/253375245392678912
253374203699531778	MarieMBabyyy	 overly creative kylebaca would pumped see decked friday breast cancer awareness day pictwittercomyuatfqdr	2012-10-03	0	1	@KyleBaca10			https://twitter.com/MarieMBabyyy/status/253374203699531778
253121694288461824	Darkalex_	 entender el cncer reto de la medicina personalizada para la prxima dcada http nlarahostcom fmdq noticias teamfollowback	2012-10-02	0	0		#Noticias #TeamFollowBack		https://twitter.com/Darkalex_/status/253121694288461824
252079164545462272	PlexusSlim_WFtx	 october breast cancer month check breast cream self exam kit would also make great gifts show care	2012-09-29	0	0				https://twitter.com/PlexusSlim_WFtx/status/252079164545462272
250476238286774273	Darkalex_	 an hacen pblica vacuna contra el cncer http nlarahostcom chvws noticias teamfollowback	2012-09-25	0	0		#Noticias #TeamFollowBack		https://twitter.com/Darkalex_/status/250476238286774273
246497785950662656	Blazersrule88	 coachmattturner sounds like cancer diabetes love child	2012-09-14	0	0	@CoachMattTurner			https://twitter.com/Blazersrule88/status/246497785950662656
241036930123456512	Darkalex_	 inslito engaaban con curar hasta el cncer video http nlarahostcom r mt noticias teamfollowback	2012-08-30	0	0		#Noticias #TeamFollowBack		https://twitter.com/Darkalex_/status/241036930123456512
239132386321891330	llbfisher	 zodiacposts its easy fall love cancer gentle polite courteneyfish classicmarshall	2012-08-24	0	0	@ZodiacPosts @courteneyfish @ClassicMarshall	#Cancer		https://twitter.com/llbfisher/status/239132386321891330
239117193290342400	llbfisher	 zodiacposts cancer s creative mind win affection courteneyfish classicmarshall	2012-08-24	0	0	@ZodiacPosts @courteneyfish @ClassicMarshall	#Cancer		https://twitter.com/llbfisher/status/239117193290342400
235186520720543744	yatown_news	 skating cancer bend bulletin http yatowncomnewsbendors katingagainstcancerpbbendbulletinlobend corsnfromleft aandymcintosh c cofbend bryanblake c cofberkeley ccalif bchrislewis c cofashland bandkyleohlson c cofencinitascalif cskateboarddownnortheastviytiskatingagainstcancerxuhttp a f fwwwbendbulletincom farticle f fnews f fsrctw bend or	2012-08-13	0	0		#Bend #OR		https://twitter.com/yatown_news/status/235186520720543744
235052102156693505	yatown_news	 bend walkers relaying night cure cancer ktvz http yatowncomnewsalfalfab endorbendwalkers relaying allnighttocurecancerpbktvzloalfalfa cbend corsnbend coreacureforcancerwasthegoalofsaturday bsrelayforlifeeventinbend ccontinuingthroughtuesdaymorningviytibendwalkers brelaying ballnighttocurecancerxuhttp a f fwwwktvzcom fnews fbendwalkersrelayingallnighttocurecancer f f f f f c j f findexhtmlsrctw alfalfa bend or	2012-08-13	0	0		#Alfalfa #Bend #OR		https://twitter.com/yatown_news/status/235052102156693505
235002329219354625	topix_or	 skating cancer http bitlyntbzuj bend oregon	2012-08-13	0	0		#Bend #Oregon		https://twitter.com/topix_or/status/235002329219354625
233805890199879680	ZanderRobert	 marlonlwayans marlon cares let like cancer	2012-08-10	0	0	@MARLONLWAYANS			https://twitter.com/ZanderRobert/status/233805890199879680
233025137820200963	BaileySimone25	 tanzilicious jacksonthein charlisiegner cancer picture 	2012-08-07	0	0	@tanzilicious4 @JacksonThein @CharliSiegner			https://twitter.com/BaileySimone25/status/233025137820200963
230320843018883072	ZanderRobert	 stephenasmith stevep_ to cancer locker room would fit jets circus	2012-07-31	0	0	@stephenasmith @SteveP_201			https://twitter.com/ZanderRobert/status/230320843018883072
187323108074594304	pat1944	 owillis would worse cancer m lives threatened narrow minded gop	2012-04-03	0	0	@owillis			https://twitter.com/pat1944/status/187323108074594304
278369592097783808	yodeletay	 lmao its true lildipdanyelly xstrology make bed want impress cancer works yodeletay 	2012-12-11	0	0	@LilDipDanyelly @XSTROLOGY @yodeletay	#Cancer		https://twitter.com/yodeletay/status/278369592097783808
277562931212861443	_dontgiveafck	 cup filled pink im supporting breast cancer	2012-12-08	0	1				https://twitter.com/_dontgiveafck/status/277562931212861443
251241757575114752	AundreaStreet	 join largest display support cancer survivors history every message livestrongday survivors httpwww livestrongdayorgutm_sourceif gutm_mediumcpcutm_campaignlsday ifgs_srcbpis_subsrcifg 	2012-09-27	0	1		#LIVESTRONGday		https://twitter.com/AundreaStreet/status/251241757575114752
184849784190939137	topix_or	 threemonth screening campaign targets colorectal cancer http bitlyhdvblc summerville oregon	2012-03-27	0	0		#Summerville #Oregon		https://twitter.com/topix_or/status/184849784190939137
184825730545364993	topix_or	 threemonth screening campaign targets colorectal cancer http bitlyhdapcg lagrande oregon	2012-03-27	0	0		#LaGrande #Oregon		https://twitter.com/topix_or/status/184825730545364993
158115287189823488	97814	 cancer convenience http bitlyxwqte via http outsidein 	2012-01-14	0	0				https://twitter.com/97814/status/158115287189823488
278051762886303744	gordonrichie	 sneaksndastreet bbs breast cancer elites tonight pictwittercomffgiahwm	2012-12-10	0	0	@SneaksNDaStreet			https://twitter.com/gordonrichie/status/278051762886303744
252941467688001537	alishamercdes	 excited game tomorrow cancer awareness night centrallinn digpink homegame lovemygirlss	2012-10-01	2	1		#centrallinn #digpink #homegame #lovemygirlss		https://twitter.com/alishamercdes/status/252941467688001537
230328326877765632	alishamercdes	 sweet old man comes frequently cancer doesnt long live still smiles like forever breaks heart 	2012-07-31	0	0				https://twitter.com/alishamercdes/status/230328326877765632
218007477575368704	yatown_popular	 sunday profile cancer survivor leah lyons brings passion fun http yatowncompost a fa e d dd srctw read neighbors pleasanthome gresham	2012-06-27	0	0		#PleasantHome #Gresham		https://twitter.com/yatown_popular/status/218007477575368704
218003231303925760	yatown_news_am	 sunday profile cancer survivor leah lyons brings passion fundr statesman journal http yatowncomnewspleasant homegreshamorsundayprofilecancersurvivorleahlyonsbringsherpassiontofundraisingpbstatesmanjournallopleasanthome cgresham corsnshewastooheavytowalktothemailboxandstruggledtoclimbthetwostepsinherhomeshetookthreetofourmedicationsaday cbattleddiabetes csufferedchronicpainandkneesthatbuckledunderherweightviytisundayprofile acancersurvivorleahlyonsbringsherpassiontofundraisingxuhttp a f fwwwstatesmanjournalcom farticle f fnews f fsundayprofilecancersurvivorleahlyonsbringsherpassionfundraisingcause fodyssey dtab ctopnews ctext cnewssrctw pleasanthome gresham or	2012-06-27	0	0		#PleasantHome #Gresham #OR		https://twitter.com/yatown_news_am/status/218003231303925760
188644552909914113	Mar_hamini	 bar derbarbie ya ups skin damage factor points hello wrinkles skin cancer 	2012-04-07	0	0	@Bar10derBarbie			https://twitter.com/Mar_hamini/status/188644552909914113
187763224786112512	topix_or	 artist mural activist joe cotter dies cancer http bitlyhgh g estacada oregon	2012-04-05	0	0		#Estacada #Oregon		https://twitter.com/topix_or/status/187763224786112512
165985709050695680	97055	 feb fundraiser set boring fire operations chief fighting cancer http bitlyytgf x via http outsidein 	2012-02-04	0	0				https://twitter.com/97055/status/165985709050695680
278953637806493696	KRISTibob	 hollymcrae b praying btw daughter sr project nxt yr kids w cancer effects schooling wd use u	2012-12-12	0	0	@hollymcrae			https://twitter.com/KRISTibob/status/278953637806493696
274807757062955008	guliejl	 would never date cancer rt geminisweare gemini cancer cusp known as cusp magic	2012-12-01	0	0	@GeminisWeAre	#Gemini #Cancer		https://twitter.com/guliejl/status/274807757062955008
273895889272197120	Logan_Rosalez	 looks like big sis told grandma surgery cancer shesnotready	2012-11-28	0	0		#Cancer #ShesNotReady		https://twitter.com/Logan_Rosalez/status/273895889272197120
273739718733230080	Logan_Rosalez	 today big sis gonna tell grandma cancer condition hope things go well	2012-11-28	0	0		#Cancer		https://twitter.com/Logan_Rosalez/status/273739718733230080
271446519918505984	topix_or	 early breast cancer screening shows small benefit advanced disease http bitlyuojgce bend oregon	2012-11-21	0	0		#Bend #Oregon		https://twitter.com/topix_or/status/271446519918505984
270742700398104576	guliejl	 team rt alexposts retweet youre aries taurus gemini cancer leo virgo go follow bugattibeez gain oo 	2012-11-19	0	0	@AlexPosts @BugattiBeez			https://twitter.com/guliejl/status/270742700398104576
269003106682040320	Karely_93	 holidays come up miss grandma more stupid cancer take away us rip abuelita angelita	2012-11-15	0	0				https://twitter.com/Karely_93/status/269003106682040320
268976286964264960	guliejl	 makes sense darn capricorns rt geminisweare signs give capricorn headache gemini cancer leo sagittarius aquarius	2012-11-15	0	0	@GeminisWeAre	#Capricorn #Gemini #Cancer #Leo #Sagittarius #Aquarius		https://twitter.com/guliejl/status/268976286964264960
268589064423350273	mbressler13	 trailblazinpdx dont man its like cancer 	2012-11-14	0	0	@TrailBlazinPDX			https://twitter.com/mbressler13/status/268589064423350273
265673465670029312	NewMoon7609	 scoronaluvsledd silver lining prostate cancer 	2012-11-05	0	0	@SCoronaLuvsLeDD			https://twitter.com/NewMoon7609/status/265673465670029312
262081712635392000	Logan_Rosalez	 sorry took long chatting friend anyways myhoroscope cancer remind lucky have	2012-10-27	0	0		#MyHoroscope #Cancer		https://twitter.com/Logan_Rosalez/status/262081712635392000
261233102263832576	topix_or	 izgara bar grill forest grove raises money yearold cancer patient http bitlyrkbnch forestgrove oregon	2012-10-24	0	0		#ForestGrove #Oregon		https://twitter.com/topix_or/status/261233102263832576
260293808569327616	Logan_Rosalez	 myhoroscope cancer today cheer put smile interesting time others	2012-10-22	0	0		#MyHoroscope #Cancer		https://twitter.com/Logan_Rosalez/status/260293808569327616
260292361823858689	Logan_Rosalez	 myhoroscope cancer for yesterday youve immersed something negative steer away look light done 	2012-10-22	0	0		#MyHoroscope #Cancer #Done		https://twitter.com/Logan_Rosalez/status/260292361823858689
260253449457922049	IndyTrollsAlot	 haiiibrianna lung cancer	2012-10-22	0	0	@haiiibrianna			https://twitter.com/IndyTrollsAlot/status/260253449457922049
260252516233646080	IndyTrollsAlot	 haiiibrianna have cancer	2012-10-22	0	0	@haiiibrianna			https://twitter.com/IndyTrollsAlot/status/260252516233646080
259158343766138880	Logan_Rosalez	 myhoroscope cancer smile whenever think something soon mine afraid	2012-10-19	0	0		#MyHoroscope #Cancer		https://twitter.com/Logan_Rosalez/status/259158343766138880
258994433222131713	CesarAnguiano1	 cancer evil one deserves it	2012-10-18	0	0		#Cancer		https://twitter.com/CesarAnguiano1/status/258994433222131713
257556088797396992	Logan_Rosalez	 myhoroscope cancer im associated mystic powers universe start making recipe success	2012-10-14	0	0		#MyHoroscope #Cancer		https://twitter.com/Logan_Rosalez/status/257556088797396992
255118536530358272	skylersativasmi	 like james dean sure fresh death sick cancer lanadelray bluejeans	2012-10-07	0	0		#lanadelray #bluejeans		https://twitter.com/skylersativasmi/status/255118536530358272
253616136191614977	Faith_Ellis3	 c never smoke cigarette promised grandma wouldnt dead lung cancer smoking	2012-10-03	0	0				https://twitter.com/Faith_Ellis3/status/253616136191614977
249667699045699584	kylilamonica	 fuck cancer 	2012-09-22	2	0				https://twitter.com/kylilamonica/status/249667699045699584
243095472657534976	GirlsGoinGlobal	 jauronamo whoa dont put business like nd its either cancer gonna feel like ass soon die	2012-09-04	0	0	@jauronamo			https://twitter.com/GirlsGoinGlobal/status/243095472657534976
239022606039273473	Tr3vorCurtis	 espn_colin cancer patients survivors often use steroids help recovery lance different	2012-08-24	0	0	@ESPN_Colin			https://twitter.com/Tr3vorCurtis/status/239022606039273473
238678281434591232	yatown_news	 team save racks walk weekend breast cancer awareness oregonlivecom http yatowncomnewsschollsh illsboroorteamsavetherackswillwalkthisweekendforbreastcancerawarenesspboregonlivecomloscholls chillsboro corsnschollsresidentandteamcocaptainstacieroundtree c candseveralofherteammatesgatheredsundaytoreminisceaboutrelayspastandshareintheexcitementoftheupcomingrelayviytiteamsavetherackswillwalkthisweekendforbreastcancerawarenessxuhttp a f fwwworegonlivecom fhillsboro findexssf f f fteam_save_the_racks_will_walkhtmlimhttp a f fmediaoregonlivecom fhillsboro_news fphoto f largejpgsrctw scholls hillsboro or	2012-08-23	0	0		#Scholls #Hillsboro #OR		https://twitter.com/yatown_news/status/238678281434591232
237366267449835520	Deftonesleep	 danecook nephew brain cancer joke hes months old heres link munro id _rdr	2012-08-19	0	0	@danecook			https://twitter.com/Deftonesleep/status/237366267449835520
233279459954917376	Tezbaseball	 judah dallas thought thing hes head case hes cancer seahawks need	2012-08-08	0	0	@judah612			https://twitter.com/Tezbaseball/status/233279459954917376
228617072551276544	BrittniDLeback	 hospital best friend cancer get shit	2012-07-26	0	0				https://twitter.com/BrittniDLeback/status/228617072551276544
223855541204697088	Tezbaseball	 game yakima tonight cancer awareness weekend fireworks weekend games game times 	2012-07-13	0	0				https://twitter.com/Tezbaseball/status/223855541204697088
223608506329202689	DEndea	 miss personality energy daily helped get cancer treatment thank blessings family always	2012-07-12	0	2				https://twitter.com/DEndea/status/223608506329202689
212297357080014849	Hanna_Olivares	 skiiin cancer wasssup	2012-06-11	0	0				https://twitter.com/Hanna_Olivares/status/212297357080014849
210124361473069056	Hanna_Olivares	 getting skin cancer 	2012-06-05	1	0				https://twitter.com/Hanna_Olivares/status/210124361473069056
203591106032713729	sdale32	 genaleenolin calehulse someone thyroid cancer twice yr ago went back took lymph nodes ty postingwill watch	2012-05-18	1	0	@GenaLeeNolin @calehulse32			https://twitter.com/sdale32/status/203591106032713729
203377103293521921	withloveVL	 want find organization could join aid cancer 	2012-05-18	0	0				https://twitter.com/withloveVL/status/203377103293521921
196130481782259713	topix_or	 brutal battle cancer robert lisac graduate from http bitlyiqifhx mcminnville oregon	2012-04-28	0	0		#McMinnville #Oregon		https://twitter.com/topix_or/status/196130481782259713
180518919788957696	GetNurEducaJobs	 nurse practitioner cancer astoria http tinyurlcom tpkdg get nurse educator jobs nurseeducator jobs job getalljobs	2012-03-16	0	0		#Astoria #NurseEducator #jobs #job #GetAllJobs		https://twitter.com/GetNurEducaJobs/status/180518919788957696
163045393960144896	rjfrizz	 charleston firefighterparamedic brian wildman lost battle cancer morning missed dearly	2012-01-27	0	0				https://twitter.com/rjfrizz/status/163045393960144896
162031976856043520	thejoshwoods	 judging one another cancer community gdoug vwlr pictwittercomufto nhd	2012-01-24	1	0	@gdoug	#vwlr		https://twitter.com/thejoshwoods/status/162031976856043520
156572445376122883	KRISTibob	 cottrelltravis bethmoorelpm sandipattyp amandamojo misfitz marygraham pastor chuck smith lung cancer please pray him	2012-01-09	0	0	@cottrelltravis @BethMooreLPM @SandiPattyP @AmandaMoJo @MisFitz77 @marygraham			https://twitter.com/KRISTibob/status/156572445376122883
284920466592907264	yearswillgoby	 rachel really biggest fear cancer mine horses priorities obviously whack	2012-12-29	0	0	@Rachel3434			https://twitter.com/yearswillgoby/status/284920466592907264
283918560735162369	Rustybutterknif	 idea whether craziness even justified isnt cancer 	2012-12-26	0	0				https://twitter.com/Rustybutterknif/status/283918560735162369
282298478510608385	SaltyMeg	 fsad five years cancer free today ive written experiences publicly first time http fsadowskiblogspotcom you rock	2012-12-21	0	0	@fsad800			https://twitter.com/SaltyMeg/status/282298478510608385
282219529944326144	lefiddleback	 the way stop bad cancer good cancer the nra doctor	2012-12-21	0	0	@NRA			https://twitter.com/lefiddleback/status/282219529944326144
274605551537762305	spacecadetjon	 hate like cancer pit stomach affects everything say	2012-11-30	0	0				https://twitter.com/spacecadetjon/status/274605551537762305
269610285256564736	BJMendelson	 aaronstrout chuckhemann jasonfalls explained book short version breast cancer awareness tour twitter promoted account	2012-11-16	0	0	@AaronStrout @chuckhemann @jasonfalls			https://twitter.com/BJMendelson/status/269610285256564736
269501370434977792	tauscherdesign	 hats mustachioed gentleman zibapdx great project prostate cancer awareness month movember pictwittercomfazpcwaa	2012-11-16	0	1	@zibapdx	#Movember		https://twitter.com/tauscherdesign/status/269501370434977792
268188867423793152	AJ_Johnson95	 im wearing purple tomorrow disrespect tons people die cancer	2012-11-12	0	2				https://twitter.com/AJ_Johnson95/status/268188867423793152
267046241152692224	AmatoDesignInc	 incredible day wincredible client honored team w generous talent creating childrens cancer associations new headquarters	2012-11-09	0	0				https://twitter.com/AmatoDesignInc/status/267046241152692224
266391390282477568	khenningsen12	 im proud older sister alicia displays unimaginable strength courage fight cancer myrolemodel	2012-11-07	0	2		#myrolemodel		https://twitter.com/khenningsen12/status/266391390282477568
264799508804808704	2c4tz	 im trying get cancer like whaddup	2012-11-03	0	1				https://twitter.com/2c4tz/status/264799508804808704
264257749012078594	DjPopDaddyDownz	 biggest so hundreds cancer patients dad treat last years hardest job dad proudson	2012-11-02	0	3		#ProudSon		https://twitter.com/DjPopDaddyDownz/status/264257749012078594
264223384202776577	ZBurbank	 instead revolving everything around guy trend fightforcancer cancer patients special hashtags fightformatt	2012-11-02	0	0		#FightForCancer #fightformatt		https://twitter.com/ZBurbank/status/264223384202776577
262351795400110080	philipmgance	 light night cancer walk oregon convention center w others http sqcomrbznd 	2012-10-27	0	0	@Oregon			https://twitter.com/philipmgance/status/262351795400110080
261977155406278656	gerrrace	 someone tricked j biebs fans thinking cancer thousands shaved heads support omfg hahahahaha	2012-10-26	0	1				https://twitter.com/gerrrace/status/261977155406278656
261469888672067584	benjohnsonn_	 t_vollen lincoln grad got diagnosed cancer yesterday	2012-10-25	0	0	@t_vollen07			https://twitter.com/benjohnsonn_/status/261469888672067584
261263484426264578	lovelpalmer7	 putting little bit pink timbersfc mls supporting fight breast cancer pictwittercomedchkhxg	2012-10-24	8	5	@TimbersFC @MLS			https://twitter.com/lovelpalmer7/status/261263484426264578
260780458739105793	vino_veritastic	 im dreaming something schoolers cancer http weavrsvmlu 	2012-10-23	0	0		#schoolers #cancer		https://twitter.com/vino_veritastic/status/260780458739105793
260577490702069762	vino_veritastic	 tropic cancer http weavrsre nit	2012-10-22	0	0				https://twitter.com/vino_veritastic/status/260577490702069762
259854012411703296	kelleybruggere	 sweet stepmother breast cancer survivor thank osu beaver football honoring mostly female cause xoxo kelley gobeavs	2012-10-20	0	0		#GoBeavs		https://twitter.com/kelleybruggere/status/259854012411703296
259383625500483584	PTStandTogether	 breast cancer awareness month mlsworks soccerkickscancer jtbendik jgleeson rkawulok ajeanbaptiste pictwittercomawur xnr	2012-10-19	8	7	@MLSWORKS @Jtbendik @Jgleeson20 @RKawulok @ajeanbaptiste92	#SoccerKicksCancer		https://twitter.com/PTStandTogether/status/259383625500483584
257906139348467713	finitor	 portland sketchbook sidewalk outside good samaritan cancer center guy mohawk biker jacket f train tee stumptown traveller	2012-10-15	1	1				https://twitter.com/finitor/status/257906139348467713
257212588675452928	savvymargaret	 breast cancer awarness month pink hair pictwittercomuhhkhky 	2012-10-13	0	1		#pink		https://twitter.com/savvymargaret/status/257212588675452928
256820893882404864	BWJones	 cancer robot http flickrpdj t a	2012-10-12	0	0				https://twitter.com/BWJones/status/256820893882404864
255787922417131520	raven_herring	 coffee cancer yologoingfaster caffeineaddict 	2012-10-09	1	1		#YOLOgoingFaster #CaffeineAddict #		https://twitter.com/raven_herring/status/255787922417131520
255778788938510336	BWJones	 science cancer research http flickrpdiitz 	2012-10-09	0	0				https://twitter.com/BWJones/status/255778788938510336
255021955126804481	angelinasimone	 pancreatic cancer walk memory grandma 	2012-10-07	0	1				https://twitter.com/angelinasimone/status/255021955126804481
254998741222830080	aliciaann80	 the zoo fighting cancer 	2012-10-07	0	0	@the			https://twitter.com/aliciaann80/status/254998741222830080
254842815031439360	CPScanlon	 shitgirlssay i drink diet coke id rather get cancer later fat now	2012-10-07	0	0	@shitgirlssay			https://twitter.com/CPScanlon/status/254842815031439360
254357336771149824	AyaMai	 major porn site donate money breast cancer charity every boob video watch touching offer http postsdf vo	2012-10-05	0	0				https://twitter.com/AyaMai/status/254357336771149824
254069838400606208	CineMotionEdit	 drinking beer breast cancer savelives cancer merica deschutes brewery public house http instagrampqyvyiiyxxt	2012-10-05	0	0	@Deschutes	#savelives #cancer #merica		https://twitter.com/CineMotionEdit/status/254069838400606208
253496227314933760	ElsaLuciaa	 xstrology cancer crying min ready whip ass next still love thru all gastocas	2012-10-03	0	0	@XSTROLOGY @Gastocas	#Cancer		https://twitter.com/ElsaLuciaa/status/253496227314933760
253275344474357760	CineMotionEdit	 young man matt fights cancer go nickelodeon breastcancerawareness somewhere rainbow http instagrampqtf gyxy 	2012-10-02	0	0	@Somewhere	#cancer #nickelodeon #breastcancerawareness		https://twitter.com/CineMotionEdit/status/253275344474357760
252590060891942913	ElsaLuciaa	 xstrology cancer relieve stress cigarettes drink healthy ones yoga hahah ive never done yoga	2012-09-30	0	0	@XSTROLOGY	#Cancer		https://twitter.com/ElsaLuciaa/status/252590060891942913
252231394875543552	MarkReinoso	 danimarmora pure opinion results speak themselves statism collectivism cancer its killing world	2012-09-29	0	0	@danimarmora			https://twitter.com/MarkReinoso/status/252231394875543552
252083492786155520	ElsaLuciaa	 xstrology cancer s excellent dirty dancing lol	2012-09-29	0	0	@XSTROLOGY	#Cancer		https://twitter.com/ElsaLuciaa/status/252083492786155520
251855314431918080	bcoe93	 year old family friend cancer wish something could	2012-09-28	0	0				https://twitter.com/bcoe93/status/251855314431918080
251504993738317824	ElsaLuciaa	 xstrology cancer s touch feelings make great songwriters need learn play guitar	2012-09-27	0	0	@XSTROLOGY	#Cancer		https://twitter.com/ElsaLuciaa/status/251504993738317824
249579063138725888	brentkepfer	 checking art helping childrens cancer association fuckcancer aphro portland art museum http instagrampp cafjmnx	2012-09-22	0	0	@Portland	#fuckcancer #aphro		https://twitter.com/brentkepfer/status/249579063138725888
248909875638321152	ElsaLuciaa	 xstrology ever need reminded beautiful amazing are find cancer shell tell you hahaha wont	2012-09-20	0	0	@XSTROLOGY	#Cancer		https://twitter.com/ElsaLuciaa/status/248909875638321152
247687964828774401	ElsaLuciaa	 xstrology cancer women sweet bitch its called for lol true	2012-09-17	0	0	@XSTROLOGY	#Cancer		https://twitter.com/ElsaLuciaa/status/247687964828774401
