id	Username	Text	Date	Retweets	Favorites	Mentions	Hashtags	Geo	Permalink
255484483212570625	yourDOsomeday	 nfl look disgusting pink available promote breast cancer awareness	2012-10-08	0	0				https://twitter.com/yourDOsomeday/status/255484483212570625
254096840021114880	DidierJulia	 emileehop least dont throat cancer 	2012-10-05	0	0	@EmileeHop			https://twitter.com/DidierJulia/status/254096840021114880
253727502734876672	yourDOsomeday	 two_scoopsof pink shit doesnt fight breast cancer shout dance fun	2012-10-04	0	0	@Two_ScoopsOf83			https://twitter.com/yourDOsomeday/status/253727502734876672
253720928427597824	yourDOsomeday	 two_scoopsof grandma died breast cancer fuck pink helmets	2012-10-04	0	0	@Two_ScoopsOf83			https://twitter.com/yourDOsomeday/status/253720928427597824
245077491499294720	OhShiala	 itsfunnylife post gave cancer	2012-09-10	0	0	@ItsFunnyLife			https://twitter.com/OhShiala/status/245077491499294720
244116223183446017	mrcharmingme	 im cancer free oshu	2012-09-07	0	0		#oshu		https://twitter.com/mrcharmingme/status/244116223183446017
243805698566262784	mrcharmingme	 people twitter annoncement guys care gf cancer legs tmrrw chemotherapy wish mr luck	2012-09-06	0	0				https://twitter.com/mrcharmingme/status/243805698566262784
236825954050273280	Free2bMeTmarie	 fuckinghate cancer fuckcancer bad days itll get better sooni hope im long overdue one good days	2012-08-18	0	0		#fuckinghate #fuckcancer		https://twitter.com/Free2bMeTmarie/status/236825954050273280
235554531776290816	OBYEWON	 childrens cancer association dinner the oregon golf club http instagrampovlinaotcg	2012-08-14	0	0	@The			https://twitter.com/OBYEWON/status/235554531776290816
226592783077613568	Free2bMeTmarie	 even tho surgery remove adrenal gland gall bladder tumor still cancer metastasized lymph nodes cure	2012-07-21	0	0				https://twitter.com/Free2bMeTmarie/status/226592783077613568
226591577840181250	Free2bMeTmarie	 neuroendocrine cancer	2012-07-21	0	1				https://twitter.com/Free2bMeTmarie/status/226591577840181250
224921276525981698	TraciMom	 lauritaelise story aunt except started wbreast cancer hugs	2012-07-16	0	0	@LauritaElise			https://twitter.com/TraciMom/status/224921276525981698
220418197386575872	Free2bMeTmarie	 steve wigan happy th u well im hanging nfighting nd bought cancer outcome promising time	2012-07-04	0	0	@steve1Wigan			https://twitter.com/Free2bMeTmarie/status/220418197386575872
210179521058578433	topix_or	 donations sought families battling cancer http bitlyke lmv gladstone oregon	2012-06-05	0	0		#Gladstone #Oregon		https://twitter.com/topix_or/status/210179521058578433
166438056386232320	Hitmehn_	 ss_true yeah time stage testicular stomach cancer	2012-02-06	0	0	@ss_True			https://twitter.com/Hitmehn_/status/166438056386232320
161198781466034176	duxfan9	 bowl cancer milwaukie bowl http sqcomziw ig	2012-01-22	0	0	@Milwaukie			https://twitter.com/duxfan9/status/161198781466034176
155939466438131712	alexxandersonnn	 hear songs remind cat cancer start bawliing pathetic reallove	2012-01-08	0	0		#pathetic #reallove		https://twitter.com/alexxandersonnn/status/155939466438131712
284480042539560961	OSUBeaverFan	 puppy years cancer great dog going make final days awesome matter long	2012-12-27	0	0				https://twitter.com/OSUBeaverFan/status/284480042539560961
277817799198527488	_Cejaaa	 dad said get cancer dont eat daily time	2012-12-09	0	0				https://twitter.com/_Cejaaa/status/277817799198527488
254666299773448192	0ItsFrankie0	 bestofcancer cancer female rather stay home tend home go adventures you wroooooong	2012-10-06	0	0	@BestofCancer	#Cancer		https://twitter.com/0ItsFrankie0/status/254666299773448192
211569871748739072	helloiamarfy	 cabeenet claremonster nobody would lie cancer	2012-06-09	0	0	@CaBEEnet @Claremonster			https://twitter.com/helloiamarfy/status/211569871748739072
190627363049050113	SuchlikeQuill5	 mission goin hospital heard pretty good news impossible omars cancer went away _o	2012-04-12	0	0				https://twitter.com/SuchlikeQuill5/status/190627363049050113
158038606307524608	highimpal	 siikerr dad mom got home hella crying doctors told dad cancer aww thats saaad im really sorry c	2012-01-13	1	0	@siikerr			https://twitter.com/highimpal/status/158038606307524608
282009149271846912	araceliguzman_	 xstrology cancer s know exactly good bad everyone else around them	2012-12-21	0	0		#Cancer		https://twitter.com/araceliguzman_/status/282009149271846912
274760570144714752	LibbyBatlan	 sending love thoughts linda hormbuckle fighting cancer salem elsinore missed year the road bethlehem xmas	2012-12-01	0	0		#xmas		https://twitter.com/LibbyBatlan/status/274760570144714752
175605998990540800	AlzGrandaughter	 alzfacts weve seen decline cancer aids death rate alzheimers risen since needs change	2012-03-02	1	0		#AlzFacts		https://twitter.com/AlzGrandaughter/status/175605998990540800
284372339850899457	sourpixiestix	 rt kelly regrets pancreaticcancer possibly become nd leading cause cancer death us http pancanorg pancan 	2012-12-27	0	0	@Kelly2632 @PanCAN	#2012regrets #PancreaticCancer		https://twitter.com/sourpixiestix/status/284372339850899457
276172604367331328	topix_or	 epa look salem cancer cases http bitlytgidlh salem oregon	2012-12-04	0	0		#Salem #Oregon		https://twitter.com/topix_or/status/276172604367331328
273024268571385856	topix_or	 parents seek test answer cancer questions http bitlys b vf salem oregon	2012-11-26	0	0		#Salem #Oregon		https://twitter.com/topix_or/status/273024268571385856
267501362806419456	Kay_PeezyXO	 alexus_todd its better cancer tho think like 	2012-11-11	0	0	@Alexus_Todd			https://twitter.com/Kay_PeezyXO/status/267501362806419456
259116638182469633	topix_or	 keizer firefighters raise money breast cancer research http bitlyrllrsg keizer oregon	2012-10-18	0	0		#Keizer #Oregon		https://twitter.com/topix_or/status/259116638182469633
255539964056571905	NastyNate_93	 kayann_ surprisingly didnt say breast cancer 	2012-10-09	0	0	@KayAnn_			https://twitter.com/NastyNate_93/status/255539964056571905
254397919313154048	OregonMJW	 waswhaler kidscrafts vickie common form skin cancer metastasize generally fairly easily treatable d	2012-10-05	0	0	@waswhaler @kidscrafts @vickie812			https://twitter.com/OregonMJW/status/254397919313154048
253802319832035328	topix_or	 firefighters salem keizer support fight breast cancer http bitlyvygndf keizer oregon	2012-10-04	0	0		#Keizer #Oregon		https://twitter.com/topix_or/status/253802319832035328
252713536655093760	topix_or	 touched fate cluster bone cancer cases among west salem children raises concerns http bitlyru apr salem oregon	2012-10-01	0	0		#Salem #Oregon		https://twitter.com/topix_or/status/252713536655093760
245369608423501826	minesweeper95	 jokes cancer jokes make ugly stop	2012-09-10	0	1				https://twitter.com/minesweeper95/status/245369608423501826
243111686561730560	sunshynebarbi	 bestofcancer cancer woman get pregnant easily tits hell naaaah	2012-09-04	0	1	@BestofCancer	#Cancer		https://twitter.com/sunshynebarbi/status/243111686561730560
231515926258917376	SalemAction	 kaybee bald people thought cancer one really minded hair	2012-08-03	0	0	@KayBee1970			https://twitter.com/SalemAction/status/231515926258917376
231222867155640321	aaronIR	 lcchurch staff meeting starting w reports healings cancer weve praying for godisgood revival http sqcomm fowu	2012-08-02	0	0		#LCchurch #GodIsGood #Revival		https://twitter.com/aaronIR/status/231222867155640321
231062793741287425	yatown_news	 relay life salemkeizer bivouacs battle cancer statesman journal http yatowncomnewskeizeror relayforlifesalemkeizerbivouacsinbattleagainstcancerpbstatesmanjournallokeizer corsnrelayforlife adanydesantis cofteampurpleposse csprayspinkandpurplepaintintothehairofteamdevelopmentcochairchrissmith cattherelayforlifesalem fkeizerviytirelayforlifesalem fkeizerbivouacsinbattleagainstcancerxuhttp a f fwwwstatesmanjournalcom farticle f fupdate f frelaylifesalemkeizerbivouacsbattleagainstcancer fodyssey dtab ctopnews ctext cnewssrctw keizer or	2012-08-02	0	0		#Keizer #OR		https://twitter.com/yatown_news/status/231062793741287425
221451514470858755	NastyNate_93	 toast dead children cancer aids cure exists couldve saved	2012-07-06	1	0				https://twitter.com/NastyNate_93/status/221451514470858755
214855214128304128	NoelleNorthwest	 sittin sun puffin cancer stick 	2012-06-18	0	0				https://twitter.com/NoelleNorthwest/status/214855214128304128
214579095219085312	AnabelEatsSouls	 justinbieber could read last tweet give prayer find cure cancer please father died years ago 	2012-06-18	0	0	@justinbieber			https://twitter.com/AnabelEatsSouls/status/214579095219085312
214578812598493184	AnabelEatsSouls	 time death father years ago happy fathers day daddy hope one day find cure types cancer	2012-06-18	0	0				https://twitter.com/AnabelEatsSouls/status/214578812598493184
197205163197480960	NastyNate_93	 mnlgrb ncalep yall niggas want lung cancer huh	2012-05-01	0	1	@Mnlgrb @ncalep			https://twitter.com/NastyNate_93/status/197205163197480960
180722162389352448	gmann49ers	 erinandrews thats great news dad cancer cancer free sense	2012-03-16	0	0	@ErinAndrews			https://twitter.com/gmann49ers/status/180722162389352448
173306989554831360	tywyatt17	 mrcodybond bobbers folks die skin cancer folks	2012-02-25	0	0	@Mrcodybond @bobbers14			https://twitter.com/tywyatt17/status/173306989554831360
164824236773474305	OregonMJW	 gwbs pals susan b komen fund decide breast cancer screening poor women worthwhile mitt doesnt care poor gop theme	2012-02-01	0	0				https://twitter.com/OregonMJW/status/164824236773474305
154570455825661952	gmann49ers	 dpaulson hard would get chip write friend get well letter cancer would make day	2012-01-04	0	0	@dpaulson22			https://twitter.com/gmann49ers/status/154570455825661952
179810393563205632	yaychrissyyay	 hot dogs cause butt cancer lol news funny	2012-03-14	0	0				https://twitter.com/yaychrissyyay/status/179810393563205632
159503487007342592	_DrizzyBadger_	 rattlesnake venom curing cancer thatssexyashell c__williams hammerthrowa	2012-01-18	1	1	@c__williams @hammerthrowa	#ThatsSexyAsHell		https://twitter.com/_DrizzyBadger_/status/159503487007342592
247113758407802880	SarahCCarter	 deacon roo hate cancer son best fightcancer beatcancer cancersucks salem http instagramppnuar qbs 	2012-09-15	0	0	@Salem	#fightcancer #beatcancer #cancersucks		https://twitter.com/SarahCCarter/status/247113758407802880
214579095219085312	AnabelEatsSouls	 justinbieber could read last tweet give prayer find cure cancer please father died years ago 	2012-06-18	0	0	@justinbieber			https://twitter.com/AnabelEatsSouls/status/214579095219085312
214578812598493184	AnabelEatsSouls	 time death father years ago happy fathers day daddy hope one day find cure types cancer	2012-06-18	0	0				https://twitter.com/AnabelEatsSouls/status/214578812598493184
195085992418480129	gamma1309	 giulianarancic happy you thanks sharing cancer fight cervical cancer beg women get paps regularly	2012-04-25	0	0	@GiulianaRancic			https://twitter.com/gamma1309/status/195085992418480129
283894211256922112	WhiteWasht	 hope steve harvey gets terminal cancer 	2012-12-26	0	0				https://twitter.com/WhiteWasht/status/283894211256922112
282298478510608385	SaltyMeg	 fsad five years cancer free today ive written experiences publicly first time http fsadowskiblogspotcom you rock	2012-12-21	0	0	@fsad800			https://twitter.com/SaltyMeg/status/282298478510608385
281410694589595648	avnoviello	 done eating turned said how cancer tacos aggressive	2012-12-19	0	0				https://twitter.com/avnoviello/status/281410694589595648
281250851153141761	avnoviello	 express concern order dinner sister responds everything causes cancer live sin eat it nice	2012-12-18	1	0				https://twitter.com/avnoviello/status/281250851153141761
278348102954524674	IanJFischer1	 well thats amazing leaukemia hiv cancer httpwww msnbcmsncomid ns healthcancertnewleukemiatreatmentexceedswildestexpectations 	2012-12-10	1	0		#leaukemia #hiv #cancer		https://twitter.com/IanJFischer1/status/278348102954524674
276437101480910848	Free2bMeTmarie	 ct scan check cancer providence professional plaza http sqcomwjzrfw	2012-12-05	0	0	@Providence			https://twitter.com/Free2bMeTmarie/status/276437101480910848
275408344146137089	lastbelcher_	 havent heard that im new cancer 	2012-12-02	0	0				https://twitter.com/lastbelcher_/status/275408344146137089
269610285256564736	BJMendelson	 aaronstrout chuckhemann jasonfalls explained book short version breast cancer awareness tour twitter promoted account	2012-11-16	0	0	@AaronStrout @chuckhemann @jasonfalls			https://twitter.com/BJMendelson/status/269610285256564736
269501370434977792	tauscherdesign	 hats mustachioed gentleman zibapdx great project prostate cancer awareness month movember pictwittercomfazpcwaa	2012-11-16	0	1	@zibapdx	#Movember		https://twitter.com/tauscherdesign/status/269501370434977792
269319424434110464	_jacko24	 charlies mom cancer alwayssunny	2012-11-16	0	0		#AlwaysSunny		https://twitter.com/_jacko24/status/269319424434110464
266443189953626112	notjosh	 silpeen regular butt cancer butt butt cancer 	2012-11-08	0	0	@silpeen			https://twitter.com/notjosh/status/266443189953626112
266439088398295040	notjosh	 silpeen imagine cancer 	2012-11-08	0	0	@silpeen			https://twitter.com/notjosh/status/266439088398295040
262351795400110080	philipmgance	 light night cancer walk oregon convention center w others http sqcomrbznd 	2012-10-27	0	0	@Oregon			https://twitter.com/philipmgance/status/262351795400110080
260780458739105793	vino_veritastic	 im dreaming something schoolers cancer http weavrsvmlu 	2012-10-23	0	0		#schoolers #cancer		https://twitter.com/vino_veritastic/status/260780458739105793
259854012411703296	kelleybruggere	 sweet stepmother breast cancer survivor thank osu beaver football honoring mostly female cause xoxo kelley gobeavs	2012-10-20	0	0		#GoBeavs		https://twitter.com/kelleybruggere/status/259854012411703296
256115419616780288	w_pat_tc	 wo a gene expression predictors cancer prognosis c q c q http wpattcwo a 	2012-10-10	0	0		#C12Q #C12Q1		https://twitter.com/w_pat_tc/status/256115419616780288
255787922417131520	raven_herring	 coffee cancer yologoingfaster caffeineaddict 	2012-10-09	1	1		#YOLOgoingFaster #CaffeineAddict #		https://twitter.com/raven_herring/status/255787922417131520
255074161628700672	pcurtain	 fund raiser lung cancer victims live music raffles glad walked in moon sixpence http sqcomuwrzkb	2012-10-07	0	0	@Moon			https://twitter.com/pcurtain/status/255074161628700672
253484906234146816	MasterJeffPDX	 mental disorder cancer scorpio pisces likely have depression well explains it	2012-10-03	1	1		#Cancer #Scorpio #Pisces		https://twitter.com/MasterJeffPDX/status/253484906234146816
252231394875543552	MarkReinoso	 danimarmora pure opinion results speak themselves statism collectivism cancer its killing world	2012-09-29	0	0	@danimarmora			https://twitter.com/MarkReinoso/status/252231394875543552
249239746474283008	brogmarie	 ive always said someone close family fight breast cancer id get pink ribbon tattoo looks like time	2012-09-21	0	0				https://twitter.com/brogmarie/status/249239746474283008
247179556476317696	Libby_Rood	 cancerterms cancer needs feel like never leave otherwise subject sabotage relationships true	2012-09-15	0	0	@CancerTerms	#cancer		https://twitter.com/Libby_Rood/status/247179556476317696
247179451945865216	Libby_Rood	 cancerterms cancer needs reassuring constantly need reminded mean you often soooooo true	2012-09-15	0	0	@CancerTerms	#cancer		https://twitter.com/Libby_Rood/status/247179451945865216
245730862983958529	notjosh	 gandtlondon interesting someone know i cancer im always curious im well im us now bonsoy 	2012-09-11	0	0	@gandtlondon			https://twitter.com/notjosh/status/245730862983958529
243911130840440832	FeistySicilian	 sexfactsoflife man climaxes average twice week greatly reduce risk colon cancer get boysliterally	2012-09-06	0	0	@SexFactsOfLife			https://twitter.com/FeistySicilian/status/243911130840440832
243904980782821376	alexism34	 higginator mom cancer 	2012-09-06	0	0	@Higginator			https://twitter.com/alexism34/status/243904980782821376
242651355834093568	chrishophoto	 thanks twitter search cancer got bunch fking astrology crap useful	2012-09-03	0	0		#cancer		https://twitter.com/chrishophoto/status/242651355834093568
241042838878568448	Allyson13	 rt kgwnews burnside bridge close due bearded men camo with assault rifle going breast cancer awareness photo shoot	2012-08-30	0	0	@KGWNews			https://twitter.com/Allyson13/status/241042838878568448
240922949807382528	starzipan	 latest plan b makes feel little crazy saw aaron carasco last night adore him aunt dying cancer unrelated	2012-08-29	0	0				https://twitter.com/starzipan/status/240922949807382528
240272214673461249	Allyson13	 rt breakingnews pianist van cliburn suffering advanced bone cancer spokesman says nytimes http nytimsoqax y	2012-08-27	0	0	@BreakingNews @nytimes			https://twitter.com/Allyson13/status/240272214673461249
239153034310078464	CMpaugh	 mbergh theres also scientists saying cancer reported side effect drugs allegedly abused	2012-08-24	0	0	@mbergh22			https://twitter.com/CMpaugh/status/239153034310078464
239151730279993344	CMpaugh	 rodlurie hmm perhaps however scientists say cancer potential side effect drugs allegedly abused	2012-08-24	0	0	@RodLurie			https://twitter.com/CMpaugh/status/239151730279993344
238888970077995008	TheRadavist	 wife helped trough cancer left year old yellowjerseys	2012-08-24	9	1		#7yellowjerseys		https://twitter.com/TheRadavist/status/238888970077995008
238867971353763840	swaagnitz	 cancer stick smoke laser pointer sick light show auntie keely uncle bryans home http instagramposulxqb_lx	2012-08-24	0	0	@Auntie			https://twitter.com/swaagnitz/status/238867971353763840
236262971129606144	dantich	 ousted raeann s mayor childrens cancer association foursquare http sqcom cdjsy	2012-08-16	0	0	@foursquare			https://twitter.com/dantich/status/236262971129606144
234364767509295104	cj_anderson	 kicking cancer s butt relayforlife portland christian jr sr high school http instagrampomugfciok 	2012-08-11	1	0	@Portland	#relayforlife		https://twitter.com/cj_anderson/status/234364767509295104
232631983283523584	stephieee9	 cancer word sentence praying	2012-08-06	0	0		#praying		https://twitter.com/stephieee9/status/232631983283523584
232552390602133506	stephieee9	 mom wakes tell someone important life cancer sadtweet	2012-08-06	0	1		#Sadtweet		https://twitter.com/stephieee9/status/232552390602133506
231050740741853184	heartsmartkids	 nature reports cancer stem sells tracked httpwww naturecomnewscancerst emcellstracked 	2012-08-02	0	0				https://twitter.com/heartsmartkids/status/231050740741853184
228419797845688321	YoChibis	 uberfacts forgiveness actually health benefits reduce risk heart attacks slow spread cancer 	2012-07-26	0	0	@UberFacts			https://twitter.com/YoChibis/status/228419797845688321
228334301001940993	itsoinky	 fundraiser american cancer society someday lounge http sqcomsuzq 	2012-07-25	0	0	@Someday			https://twitter.com/itsoinky/status/228334301001940993
227686145172049921	CheetahFanatic	 breakingnews sally ride first american woman fly space dies cancer age sallyridesci http bitlysqjqet sad	2012-07-24	0	0	@BreakingNews @SallyRideSci			https://twitter.com/CheetahFanatic/status/227686145172049921
225258332582195201	CMpaugh	 st peregrine saint catholic christian grotto portland cancer the grotto http instagrampnmbz jfzum	2012-07-17	0	0	@The	#saint #catholic #Christian #grotto #Portland #cancer		https://twitter.com/CMpaugh/status/225258332582195201
218377396250882049	mikeal	 biggest learning week scotus acronym supreme court rare form testicular cancer like thought	2012-06-28	7	1				https://twitter.com/mikeal/status/218377396250882049
217487323967922177	vino_veritastic	 cancer i cancer zodiac sign belly beads set waist jewelry attracts luck intuition psychic development moo http weavrsq ci 	2012-06-26	0	0				https://twitter.com/vino_veritastic/status/217487323967922177
212589754833833984	stephensolo	 im childrens cancer association portland or http sqcommagsnm	2012-06-12	0	0				https://twitter.com/stephensolo/status/212589754833833984
209884685889843200	GabeBoehmerWF	 bloombergtv reporting buffett diagnosed stage prostate cancer	2012-06-05	0	0	@BloombergTV	#Buffett		https://twitter.com/GabeBoehmerWF/status/209884685889843200
207333180003467264	delightfuldave	 everything cancer scabs good time	2012-05-29	0	0				https://twitter.com/delightfuldave/status/207333180003467264
205422324214792193	MunchingZombie	 man plan canal rectal cancer 	2012-05-23	0	0				https://twitter.com/MunchingZombie/status/205422324214792193
204261683949080577	topix_or	 ny judge cancer makes case marijuana http bitlykymobl brooklyn portland oregon	2012-05-20	0	0		#brooklyn #Portland #Oregon		https://twitter.com/topix_or/status/204261683949080577
203932559325925377	SamAdamsWRI	 get shaved help cure childrens cancer thx stbaldricks in fb oaks dance pavilion pic http sqcomm jyrx	2012-05-19	4	2	@stbaldricks @Oaks	#in #fb		https://twitter.com/SamAdamsWRI/status/203932559325925377
200710387736391681	Free2bMeTmarie	 go providence cancer center http sqcomm wbtr	2012-05-10	0	0	@Providence			https://twitter.com/Free2bMeTmarie/status/200710387736391681
199236240678191105	baileylisa	 listenung dr brian druker developed gleevec treat leukemia knight cancer care center http sqcomkfh w 	2012-05-06	0	0	@Knight			https://twitter.com/baileylisa/status/199236240678191105
198976228802306048	AviationGin	 distiller getting end breast cancer pictwittercomsahdkj j	2012-05-05	0	0				https://twitter.com/AviationGin/status/198976228802306048
198955417592799232	AviationGin	 lilleboutique fighting good fight breast cancer pretty ladies house jolie s pictwittercom ypzabsc	2012-05-05	0	1	@lilleboutique			https://twitter.com/AviationGin/status/198955417592799232
198893583904944128	bkopetti	 ryankennedy year old boy fighting cancer adopted oakland u baseball team get trending	2012-05-05	0	0		#ryankennedy		https://twitter.com/bkopetti/status/198893583904944128
198473963242930176	pdx_pedicab	 sad day today rip adam yauch voice dearly missed fuck cancer 	2012-05-04	0	0				https://twitter.com/pdx_pedicab/status/198473963242930176
198468381458960385	MunchingZombie	 fuck you cancer 	2012-05-04	0	0				https://twitter.com/MunchingZombie/status/198468381458960385
197848653879193600	CO_EQ	 mlevchin question as want hear you todays biggest unsolved yet imminently solvable problems cancer	2012-05-02	0	0	@mlevchin			https://twitter.com/CO_EQ/status/197848653879193600
195646065532354560	simplifysolve	 information fukushima radiation portland please let know cancer portland oregon thyroidcancer	2012-04-26	0	0		#cancer #Portland #oregon #thyroidcancer		https://twitter.com/simplifysolve/status/195646065532354560
194881936081174529	prm_dallasl	 please pray prm volunteer diagnosed advanced pancreatic cancer fb	2012-04-24	0	0		#fb		https://twitter.com/prm_dallasl/status/194881936081174529
192494809628426241	topix_or	 ohsu offers free head neck cancer screenings april http bitlyi fadq portland oregon	2012-04-18	0	0		#Portland #Oregon		https://twitter.com/topix_or/status/192494809628426241
192002253572419585	97216	 karinas cancer story http bitlyih yu via http outsidein 	2012-04-16	0	0				https://twitter.com/97216/status/192002253572419585
190862345675866112	DaniFiahra	 youre fresh death sick ca cancer	2012-04-13	0	0				https://twitter.com/DaniFiahra/status/190862345675866112
189773401949339648	cbglacier	 skin cancer obliterated ohsu center health healing http sqcomheng e	2012-04-10	0	0	@OHSU			https://twitter.com/cbglacier/status/189773401949339648
189736750283886592	ihavequalities	 listening fat people smoking talking probably wont get cancer 	2012-04-10	0	0				https://twitter.com/ihavequalities/status/189736750283886592
189482133876768768	timcam	 guess livestrong gear bald head makes pretty obvious cancer	2012-04-09	0	0	@LIVESTRONG	#cancer		https://twitter.com/timcam/status/189482133876768768
186871010799267840	MunchingZombie	 bombing planned parenthood take breast cancer screening	2012-04-02	0	0				https://twitter.com/MunchingZombie/status/186871010799267840
185866569971286018	kevinrhansenjr	 erikolson cancer too	2012-03-30	0	0	@erikolson100			https://twitter.com/kevinrhansenjr/status/185866569971286018
185241607707172865	dudleydew	 scherilyn dear friend cervical cancer needs strength family id like think r one big family	2012-03-29	0	0	@Scherilyn			https://twitter.com/dudleydew/status/185241607707172865
183650146578481153	lonniebruhn	 night u r portland go event star theater raising money comedian ron shocks cancer storytellers magic	2012-03-24	1	0				https://twitter.com/lonniebruhn/status/183650146578481153
181819397810298882	MunchingZombie	 glad stopped child soldiers cancer gayyouth suicides scores problems retweeting shit	2012-03-19	0	0				https://twitter.com/MunchingZombie/status/181819397810298882
180505115424333824	noahkleiman	 andreathegiant dont pass cancer kid hate you	2012-03-16	0	0	@andreathegiant			https://twitter.com/noahkleiman/status/180505115424333824
179409181982457856	97215	 florida state lead coaches vs cancer field http bitlyxtbj via http outsidein 	2012-03-12	0	0				https://twitter.com/97215/status/179409181982457856
179028989556441088	imtysonx2	 ronalynnn test lol see get skin cancer lol	2012-03-11	0	0	@ronalynnn808			https://twitter.com/imtysonx2/status/179028989556441088
179027350913159169	imtysonx2	 ronalynnn yes can cause youre brown doesnt mean anything lol anyone get skin cancer sun even black people	2012-03-11	0	0	@ronalynnn808			https://twitter.com/imtysonx2/status/179027350913159169
179009126687457280	imtysonx2	 ronalynnn get cancer lol	2012-03-11	0	0	@ronalynnn808			https://twitter.com/imtysonx2/status/179009126687457280
