id	Username	Text	Date	Retweets	Favorites	Mentions	Hashtags	Geo	Permalink
375039647879290880	DarienneFaith	 pray surgery goes well tomorrow dad brain tumor isnt cancerous please	2013-09-03	1	8				https://twitter.com/DarienneFaith/status/375039647879290880
355982968663179264	alexcaterpillar	 averagecharles amen left gas station myself idk would without cancerous lifesavers ps ily	2013-07-13	0	0	@AverageCharles			https://twitter.com/alexcaterpillar/status/355982968663179264
345576179589345280	haliiijo	 doesnt look cancerous thankyoulord	2013-06-14	0	0		#ThankYouLord		https://twitter.com/haliiijo/status/345576179589345280
338688026056204290	boomersoonertwt	 mlbreports mattingly stay thats good baseballthe cancerous selfish spoiled players play go	2013-05-26	0	0	@MLBreports			https://twitter.com/boomersoonertwt/status/338688026056204290
308801469589639168	TruckerSamF	 paulazinger paul im months post moms death uhhfrankly life holei still dont understand death cancerous liver tumour	2013-03-04	0	0	@PaulAzinger			https://twitter.com/TruckerSamF/status/308801469589639168
393224289958117377	MarioDwayne	 mean its like rots teeth makes holes gums cheeks gives cancerous tumors somethinglike big yall	2013-10-23	3	4				https://twitter.com/MarioDwayne/status/393224289958117377
