id	Username	Text	Date	Retweets	Favorites	Mentions	Hashtags	Geo	Permalink
355291612114452482	badBITCHshitx3	 cancerareus tell cancer anything without fear getting passed on	2013-07-11	0	0	@CancerAreUs	#Cancer		https://twitter.com/badBITCHshitx3/status/355291612114452482
355158720747024384	badBITCHshitx3	 would fellow cancer relax livinfast_	2013-07-10	0	0	@LivinFast_			https://twitter.com/badBITCHshitx3/status/355158720747024384
355115999172894723	paula_7070	 every time boob hurts think breast cancer 	2013-07-10	2	2				https://twitter.com/paula_7070/status/355115999172894723
354795443143708673	Redheadgirlyy18	 daddy goes doctor tomorrow morning find its cancer please pray find time	2013-07-09	0	0				https://twitter.com/Redheadgirlyy18/status/354795443143708673
354601568965890049	Attah_Agyemang	 setz sportscenter yearold ohio state fan grant reed nicknamed cancer tumor brain michigan beat it	2013-07-09	0	2	@Setz3 @SportsCenter			https://twitter.com/Attah_Agyemang/status/354601568965890049
354590516370878464	YungANDumb	 wasnt cancer heart attack fact eat baked foods vegetables fruit natural stuff confuses	2013-07-09	0	0				https://twitter.com/YungANDumb/status/354590516370878464
354590004988751873	YungANDumb	 momcallsmedom its crazy people take care body still get cancer 	2013-07-09	0	0	@MomCallsMeDom			https://twitter.com/YungANDumb/status/354590004988751873
354284024321163264	shabbatheresa	 skypelunchdate big guy new london cancer center http sqcom t kzy	2013-07-08	0	0	@New			https://twitter.com/shabbatheresa/status/354284024321163264
353936540143071233	dugan_downs	 go internet phone website up asian flush red glad skin cancer 	2013-07-07	0	1				https://twitter.com/dugan_downs/status/353936540143071233
353184090540883969	djbonez88	 big happy birthday shout fellow cancer _itsabyrdthing	2013-07-05	1	0	@_itsabyrdthing	#Cancer		https://twitter.com/djbonez88/status/353184090540883969
353164625648422912	jer2665	 fuck cancer hoffman gun center http instagramcompby fgatn m	2013-07-05	1	0	@Hoffman			https://twitter.com/jer2665/status/353164625648422912
353136147452555264	shabbatheresa	 oh gooodddthe parking lot empty new london cancer center http sqcom pp m	2013-07-05	0	0	@New			https://twitter.com/shabbatheresa/status/353136147452555264
352873157398511618	StephanyyR	 bestofcancer cancer smart know youre to true shit	2013-07-04	0	0	@BestofCancer	#Cancer		https://twitter.com/StephanyyR/status/352873157398511618
352541957198864384	shabbatheresa	 yup still here new london cancer center pic http sqcom he qk	2013-07-03	0	0	@New			https://twitter.com/shabbatheresa/status/352541957198864384
352271712424955905	EditorEdge	 dickie v cancer free digger favorite tweet night ta resigning close nd aa g memphis stand up grizznation 	2013-07-02	0	0	@aa000G9	#GrizzNation		https://twitter.com/EditorEdge/status/352271712424955905
352246148137881602	EditorEdge	 beautiful dickiev gr news call digger phelps cancer gone cancer free happy family	2013-07-02	6	0	@DickieV			https://twitter.com/EditorEdge/status/352246148137881602
352155037964840960	Haze_Head	 wanna see bleeding wanna see gaspin watch die slow like suffering cancer	2013-07-02	0	0				https://twitter.com/Haze_Head/status/352155037964840960
352040960533880832	shabbatheresa	 half hour early thinking meditating im afraid ill fall asleep new london cancer center http sqcom ius p	2013-07-02	0	0	@New			https://twitter.com/shabbatheresa/status/352040960533880832
351888808389771265	BellaaFoxx	 scientists able turn stem cells in sperm sex couples kids artificial wombs hey scientists wheres cure cancer 	2013-07-01	0	0				https://twitter.com/BellaaFoxx/status/351888808389771265
351779421675470848	emmalouielou	 strongest women know mommy grammy sharing hair aunt battling breast cancer pictwittercomgceahvq h 	2013-07-01	0	4				https://twitter.com/emmalouielou/status/351779421675470848
351753357964214272	Sumthinbouttiff	 gullyempress s lol love u cancer bitch	2013-07-01	0	0	@Gullyempress12S			https://twitter.com/Sumthinbouttiff/status/351753357964214272
351720285487132672	shabbatheresa	 go go gooooo wohoooo new london cancer center http sqcom yz za	2013-07-01	0	0	@New			https://twitter.com/shabbatheresa/status/351720285487132672
351555906128977922	findyourchilll	 cancers suck like would want cancer willingly	2013-07-01	0	0				https://twitter.com/findyourchilll/status/351555906128977922
350361923759521792	robbiesebastiao	 know theres god theres results penis cancer google	2013-06-27	0	0				https://twitter.com/robbiesebastiao/status/350361923759521792
350357768789704705	tillyandme	 fuck cancer	2013-06-27	1	1				https://twitter.com/tillyandme/status/350357768789704705
349936436927135746	Bon_VoydaJ	 its cancer season since st rt dook_dope xox_tia cancer season right around corner 	2013-06-26	3	1	@Dook_Dope @xox_Tia			https://twitter.com/Bon_VoydaJ/status/349936436927135746
349917455268855811	ElissaBass	 great meeting today friends terri brodeur breast cancer foundation patch sava http instagramcompbbx qjrge 	2013-06-26	0	0	@Sava	#Patch		https://twitter.com/ElissaBass/status/349917455268855811
349551050262450178	BriannaPromise	 cancerareus virgo s best mate cancer lmfao bet	2013-06-25	0	0	@CancerAreUs	#Virgo #Cancer		https://twitter.com/BriannaPromise/status/349551050262450178
349504889224839168	Irregula_BooGie	 cancers moody rt tweetme_asiam give fuck virgo season cancer season babe	2013-06-25	0	0	@TweetMe_AsIAM			https://twitter.com/Irregula_BooGie/status/349504889224839168
349188907788816385	TK221122	 know whats weird dont hear grandparents grandparents ever dying cancer kno tests fairly new	2013-06-24	0	0				https://twitter.com/TK221122/status/349188907788816385
349006362384150528	badBITCHshitx3	 staytru yahself ju knowwwww its cancer thangggggg	2013-06-23	1	0	@StayTru2Yahself			https://twitter.com/badBITCHshitx3/status/349006362384150528
349005712740990977	badBITCHshitx3	 cancer birthday few yes boo pink_kittykatt know its tun time happy early bday baby chelsea love	2013-06-23	1	1	@Pink_KittyKatt			https://twitter.com/badBITCHshitx3/status/349005712740990977
348987331367297024	TrippyAssGoblin	 love newports dying cancer	2013-06-23	0	0				https://twitter.com/TrippyAssGoblin/status/348987331367297024
348940724148002816	CPitozzol	 hiaimallie levi said got cancer hair shed leave	2013-06-23	0	0	@HiaimAllie @Levi2488			https://twitter.com/CPitozzol/status/348940724148002816
348345168333783042	NappleDutchies	 xstrology cancer always help friend need become crabby return favor	2013-06-22	0	0	@XSTROLOGY	#Cancer		https://twitter.com/NappleDutchies/status/348345168333783042
348179757424316417	shabbatheresa	 ready get frog outta here biggitty bounce new london cancer center http sqcom sijxo	2013-06-21	0	0	@New			https://twitter.com/shabbatheresa/status/348179757424316417
347912842139275264	HannaPelly	 leah_noelle ill get skin cancer saving lives	2013-06-20	0	1	@leah_noelle12			https://twitter.com/HannaPelly/status/347912842139275264
347902958006067201	brrbnsn83	 good luck amazing father tomorrow colon cancer aint got nothing	2013-06-20	0	1				https://twitter.com/brrbnsn83/status/347902958006067201
347512625657176065	Jill_upthehill	 im trying raise smilow cancer hospital riding miles im already help reach goal http closertofree kinteraorgjillcollins 	2013-06-19	0	0				https://twitter.com/Jill_upthehill/status/347512625657176065
347433756308697091	dabrams24	 travelers championship great job charity todays charity tournament helps hole wall gang camp kids cancer 	2013-06-19	0	0				https://twitter.com/dabrams24/status/347433756308697091
347003765817241600	She_CuteXXI	 mom cancer	2013-06-18	0	0				https://twitter.com/She_CuteXXI/status/347003765817241600
346837192427044864	Elnicki3955	 yeah luck upcoming doctors appointment stomach would result cancer homiedontplaythat scared nervous	2013-06-17	0	0		#homiedontplaythat #scared #nervous		https://twitter.com/Elnicki3955/status/346837192427044864
346076472500436992	oncaprn	 whether cancer patient disaster victim redcross lifeline redcrossgala	2013-06-15	0	0		#redcross #redcrossgala		https://twitter.com/oncaprn/status/346076472500436992
345995757897261057	CocainePie_Rex	 dice games killed niggas cancer	2013-06-15	0	0				https://twitter.com/CocainePie_Rex/status/345995757897261057
344656568027054081	itserinbitch_	 kidding one abby talking pets getting cancer making cry thinking rupert	2013-06-11	0	0				https://twitter.com/itserinbitch_/status/344656568027054081
344584160192634880	Alykat5925	 cancerterms loved cancer never stop working make feel special bobby everyday	2013-06-11	0	0	@CancerTerms	#Cancer		https://twitter.com/Alykat5925/status/344584160192634880
344558251335090178	shabbatheresa	 extremely ready day end new london cancer center http sqcom jroxo	2013-06-11	0	0	@New			https://twitter.com/shabbatheresa/status/344558251335090178
344461128983789568	Alykat5925	 cancerterms cancer cancerian women manipulative subtle way ahaha yup	2013-06-11	1	1	@CancerTerms	#Cancer		https://twitter.com/Alykat5925/status/344461128983789568
344253788615495680	NoLackin_Lexi	 oral sex causes throat cancer 	2013-06-10	0	0				https://twitter.com/NoLackin_Lexi/status/344253788615495680
343834521042550785	bindirae	 bestofcancer cancer moody bitch whatever	2013-06-09	0	0	@BestofCancer	#Cancer		https://twitter.com/bindirae/status/343834521042550785
343826249715683330	briandesigns128	 single dad lesson apparently magic eraser work although probably contains chemicals eventually give cancer	2013-06-09	0	0		#97		https://twitter.com/briandesigns128/status/343826249715683330
343463370554482688	topix_ct	 going bald beloved firefighter colleague fighting cancer http bitly nqlwg uncasville connecticut	2013-06-08	0	0		#Uncasville #Connecticut		https://twitter.com/topix_ct/status/343463370554482688
343191918144004097	bindirae	 xstrology everyone turns cancer sign share problems aint truth	2013-06-07	0	0	@XSTROLOGY	#Cancer		https://twitter.com/bindirae/status/343191918144004097
343054075627180032	harleighdana	 fuck cancer rip	2013-06-07	0	0				https://twitter.com/harleighdana/status/343054075627180032
342723391574396928	Alykat5925	 airickuhmoody least sign isnt crab called cancer	2013-06-06	0	0	@AirickuhMoody			https://twitter.com/Alykat5925/status/342723391574396928
342648023857377280	leynalenes	 fil s fia qu bonito sera que la palabra cncer sea algn da solo un smbolo del zodiaco	2013-06-06	0	0	@FIL0S0FIA			https://twitter.com/leynalenes/status/342648023857377280
342473109305171968	robbiesebastiao	 dont want web md its going tell cancer im going die	2013-06-05	1	0				https://twitter.com/robbiesebastiao/status/342473109305171968
342341598367076352	LegiScanCT	 sb update act requiring health insurance coverage lung cancer screening http bitlycomyerlha	2013-06-05	0	0				https://twitter.com/LegiScanCT/status/342341598367076352
342082195348926465	TheKyleHardy	 public bathrooms make feel like im getting cancer	2013-06-04	0	0				https://twitter.com/TheKyleHardy/status/342082195348926465
341782917984436224	LegiScanCT	 sb update act requiring health insurance coverage lung cancer screening http bitlycomyerlha	2013-06-04	0	0				https://twitter.com/LegiScanCT/status/341782917984436224
341600433095184385	robbiesebastiao	 michael douglas says cunnilingus gives cancer ive gotten boners	2013-06-03	0	1				https://twitter.com/robbiesebastiao/status/341600433095184385
341588653925085184	TheKyleHardy	 leenabobina cure cancer well	2013-06-03	0	1	@LeenaBoBina			https://twitter.com/TheKyleHardy/status/341588653925085184
341368991316602880	dannybotti	 cancer never sleeps	2013-06-02	0	3				https://twitter.com/dannybotti/status/341368991316602880
341273319552716800	RogerLev	 its national cancer survivors day give shout cancer survivor life stillstrong sister diane livestrong	2013-06-02	0	0		#STILLSTRONG #LIVESTRONG		https://twitter.com/RogerLev/status/341273319552716800
341234871814995968	CMroczkaWxman	 chuckperks best study ever conducted says squeezing breasts could prevent cancer http nowmsncomsqueezingbrea stscanstopcancer 	2013-06-02	0	0	@chuckperks			https://twitter.com/CMroczkaWxman/status/341234871814995968
340984488110718976	bindirae	 bestofcancer dont miss chance babies cancer one best signs raise kids uhhh	2013-06-01	0	0	@BestofCancer	#Cancer		https://twitter.com/bindirae/status/340984488110718976
340983905819701248	bindirae	 truthrt xstrology cancer associates friends	2013-06-01	0	0	@XSTROLOGY	#Cancer		https://twitter.com/bindirae/status/340983905819701248
340975068005949440	RogerLev	 celebrate survivor tmrw national cancer survivors day stats say know one livestrong survivorsday httpwww ncsdorg 	2013-06-01	0	0	@SurvivorsDay	#LIVESTRONG		https://twitter.com/RogerLev/status/340975068005949440
340825453667426304	mickc82	 breast cancer walk bushnell park w others http sqcom wgvbx	2013-06-01	0	0	@Bushnell			https://twitter.com/mickc82/status/340825453667426304
340801940806062080	laurbent	 susan komen k cure breast cancer 	2013-06-01	0	2				https://twitter.com/laurbent/status/340801940806062080
340784180730396672	bindirae	 cancerfollowers cancer put phone silent missed calls turns volume loudest nobody calls day truth	2013-06-01	0	0	@CancerFollowers	#Cancer		https://twitter.com/bindirae/status/340784180730396672
340506706108895232	shabbatheresa	 lunch break mat today new london cancer center pic http sqcom basdy	2013-05-31	0	0	@New			https://twitter.com/shabbatheresa/status/340506706108895232
340444529473748992	Mcgriddlegang	 bet get mouth cancer guize pictwittercom uaenwz og	2013-05-31	0	2				https://twitter.com/Mcgriddlegang/status/340444529473748992
340442713382060034	lennbc	 cool cause teen raising cancer getting sponsors fish caught httpwww hookedforacureorg http instagramcompzdbl igmm	2013-05-31	0	0	@	#Cool #cause #teen #cancer		https://twitter.com/lennbc/status/340442713382060034
339931599342825472	findyourchilll	 if cure cancer trapped inside head someone couldnt afford education	2013-05-29	0	1				https://twitter.com/findyourchilll/status/339931599342825472
339918664742629376	stilesk1980	 theellenshow dad diagnosed w prostate cancer treatment w radioactive seeds prostate levels dropped dramatically beatcancer	2013-05-29	0	0	@TheEllenShow	#beatcancer		https://twitter.com/stilesk1980/status/339918664742629376
339865256371318784	MemorylampsCT	 breast cancer relay life thur may calla lilys rt vernon ct pm pm	2013-05-29	0	0				https://twitter.com/MemorylampsCT/status/339865256371318784
339804113963470848	topix_ct	 canton high school students fundraiser youth fighting cancer http bitly tncnt andover connecticut	2013-05-29	0	0		#Andover #Connecticut		https://twitter.com/topix_ct/status/339804113963470848
339593635442077696	dirtydreadlockz	 back reality cancer suck	2013-05-29	0	0		#cancer		https://twitter.com/dirtydreadlockz/status/339593635442077696
339148788558082048	itserinbitch_	 please let rupert okay dogs way much last thing want cancer back	2013-05-27	0	0				https://twitter.com/itserinbitch_/status/339148788558082048
338362289742823424	nowayyyJOSE	 and mariah kid passed away cancer 	2013-05-25	0	0	@and1mariah			https://twitter.com/nowayyyJOSE/status/338362289742823424
338339761628512256	dmmcneice24	 east windsor police department lost member family cancer today rest peace dispatcher sharon bourke miss smile	2013-05-25	0	1				https://twitter.com/dmmcneice24/status/338339761628512256
337818530869288960	topix_ct	 reader submitted roses legacy helping find cure breast cancer http bitlyz rdc wethersfield connecticut	2013-05-24	0	0		#Wethersfield #Connecticut		https://twitter.com/topix_ct/status/337818530869288960
337804204330586112	bindirae	 truth bestofcancer cancer builds hard shell around soft heart	2013-05-24	0	0	@BestofCancer	#Cancer		https://twitter.com/bindirae/status/337804204330586112
337376350421778432	DavittFox	 piersmorgan worthless piece shit hasnt heart attack pancreatic cancer blessed world yousuck	2013-05-22	0	0	@piersmorgan	#yousuck		https://twitter.com/DavittFox/status/337376350421778432
336892401241178113	shabbatheresa	 holy humidity batman new london cancer center http sqcom zowa 	2013-05-21	0	0	@New			https://twitter.com/shabbatheresa/status/336892401241178113
336876982996443138	h_lovinit	 lmao siciliankiss_xo lies rt xstrology cancer love love love	2013-05-21	0	0	@siciliankiss_xo @XSTROLOGY	#Cancer		https://twitter.com/h_lovinit/status/336876982996443138
336583027859783681	TheRealK_Reed	 youre sitting quicklube everyone smoking cancer sticks ugh	2013-05-20	0	0				https://twitter.com/TheRealK_Reed/status/336583027859783681
336580108674551809	matthewlarsen	 year checkup danafarber thursday really cancer hard even believe now memories fuzzy	2013-05-20	0	0	@DanaFarber	#cancer		https://twitter.com/matthewlarsen/status/336580108674551809
336517881074429953	KevinNathanNBC	 tonight begin series interviews jim calhoun upcoming cancer challenge ride interest politics uconn bb	2013-05-20	7	0				https://twitter.com/KevinNathanNBC/status/336517881074429953
336474678350721024	shabbatheresa	 stoplight chat old cars older gentleman good way start workday new london cancer center http sqcom oo ta	2013-05-20	0	0	@New			https://twitter.com/shabbatheresa/status/336474678350721024
336185268879110146	djbonez88	 _thuglifetre cancerareus cancer always remember first love	2013-05-19	1	0	@_ThugLifeTre @CancerAreUs	#Cancer		https://twitter.com/djbonez88/status/336185268879110146
336172881178394626	DCTViper89	 kid work told going tanning lunch break fun skin cancer 	2013-05-19	0	0				https://twitter.com/DCTViper89/status/336172881178394626
335225254605619201	dalemissy23	 lost dear close friend called mom died cancer hate word rip pagie love u	2013-05-16	0	0				https://twitter.com/dalemissy23/status/335225254605619201
334858267085897728	dalemissy23	 angieeverhart u keep fighting dam fuckin cancer one deal cancer 	2013-05-15	0	0	@angieeverhart			https://twitter.com/dalemissy23/status/334858267085897728
334857626879938560	dalemissy23	 angieeverhart hope u get well soon ill keep u n prayers god bless u hate cancer mom n dad died cause much love 	2013-05-15	0	0	@angieeverhart			https://twitter.com/dalemissy23/status/334857626879938560
334801540382593024	LovingMyadore	 looking lyke cancer patent	2013-05-15	0	0				https://twitter.com/LovingMyadore/status/334801540382593024
334716987899002880	shabbatheresa	 minutes miles bad lunch break clip new london cancer center http sqcom vkkhx	2013-05-15	0	0	@New			https://twitter.com/shabbatheresa/status/334716987899002880
334276884483416064	AshleyBoasso	 zoraidacnn several women close breast cancer thrilled tell survivors	2013-05-14	0	0	@ZoraidaCNN			https://twitter.com/AshleyBoasso/status/334276884483416064
334072147196641280	RogerLev	 eucerinus million people diagnosed annually skin cancer rt spread skincancerawareness skinfirst 	2013-05-13	0	0	@EucerinUS	#SkinCancerAwareness #SkinFirst		https://twitter.com/RogerLev/status/334072147196641280
333733273190682624	sunshine_cas	 mikebrad thats myth dude prevents cancer blocks vitamin production sun get darker	2013-05-12	0	0	@mikebrad25			https://twitter.com/sunshine_cas/status/333733273190682624
333577528927203329	DeeeJ10	 happy mothers day cancer survivor loveyoumom	2013-05-12	0	5		#LoveYouMom		https://twitter.com/DeeeJ10/status/333577528927203329
333575057609740289	4thFloorWalkUp	 little patient get stitches today cancer scare well world of http instagramcompznqj vvxpq	2013-05-12	0	0				https://twitter.com/4thFloorWalkUp/status/333575057609740289
333568735505944576	DavidYeboah33	 wear pink today people like lost moms cancer	2013-05-12	1	17				https://twitter.com/DavidYeboah33/status/333568735505944576
333295527200452611	AnitaAGupta	 future rock_health mathematical models outperform doctors predicting cancer patients responses treatment httpwww sciencedailycomreleases htmutm_sourcefeedlyutm_mediumfeedutm_campaignfeedsciencedailysciencedailylatestsciencenews 	2013-05-11	0	0	@Rock_Health			https://twitter.com/AnitaAGupta/status/333295527200452611
333029262909132800	dcarcar10	 lebron could talking curing cancer would still come like condescending dick	2013-05-10	0	2				https://twitter.com/dcarcar10/status/333029262909132800
331970132865867777	DeeeJ10	 jcaponi_ sorry mom stomach cancer barely move couch shewould gotten yeah guess im gayer now	2013-05-07	0	0	@JCaponi_5			https://twitter.com/DeeeJ10/status/331970132865867777
331808990205968384	SEXYNESS1109	 xstrology cancer woman cherish cater every need dont ever take granted church	2013-05-07	0	0	@XSTROLOGY	#Cancer #		https://twitter.com/SEXYNESS1109/status/331808990205968384
331428233721552896	rachelksadlon	 another cancer versary celebrate medical office building retreat ave http sqcom qre	2013-05-06	0	1	@Medical			https://twitter.com/rachelksadlon/status/331428233721552896
331221180776321024	860_Gasper	 russia_chell aka natural order world technology ruins it therfor cancer comes about babys retarded	2013-05-05	0	1	@Russia_Chell			https://twitter.com/860_Gasper/status/331221180776321024
330435984678326272	saraharvey4	 someone close cancer lost hair would certainly shave head support them	2013-05-03	1	0				https://twitter.com/saraharvey4/status/330435984678326272
329938244668112896	Orseenee401	 lost grandmother cancer bitch woke morning fuck mad broke joke get ass	2013-05-02	0	1				https://twitter.com/Orseenee401/status/329938244668112896
329804345531043840	eevangelineee	 literally even conversation gives brain cancer like fucking iq painful	2013-05-01	0	0				https://twitter.com/eevangelineee/status/329804345531043840
329442099625873408	tmarch16	 th tweet goes fighting cancer fighting war fighting everyday struggles keep strong	2013-04-30	0	1				https://twitter.com/tmarch16/status/329442099625873408
329441614642700289	tmarch16	 cant retweet this httpstwittercomearthpixstatus photo pictwittercomnazjjf hpe cancer baby precious	2013-04-30	1	0		#cancer #baby #precious		https://twitter.com/tmarch16/status/329441614642700289
329264446625157120	RebeccaGNews	 everyone read moms latest article published huffington post breast cancer httpwww huffingtonpostcommobileweblori sokolbreastcancervaccine_b_ html 	2013-04-30	0	2				https://twitter.com/RebeccaGNews/status/329264446625157120
329055784434556929	calball4life	 phil jackson cancer 	2013-04-29	0	0				https://twitter.com/calball4life/status/329055784434556929
329026091434012674	DannyGannon	 nice walking car tonightuntil walk cancer infested cigarette smoking area death	2013-04-29	0	0				https://twitter.com/DannyGannon/status/329026091434012674
328551706893889536	Najiahhhhx3	 birthday way cancer	2013-04-28	0	0		#Cancer		https://twitter.com/Najiahhhhx3/status/328551706893889536
328232441150062592	terrygoldman	 theres much smoke casino im going leave lung cancer long dont die meeting reba couple hours	2013-04-27	0	1	@reba			https://twitter.com/terrygoldman/status/328232441150062592
327918383406391297	AdeelJZeb	 relay life beat cancer inshaallah trinity college trinity commons http instagramcompyldylqrih 	2013-04-26	0	0	@Trinity @Trinity	#Relay4Life		https://twitter.com/AdeelJZeb/status/327918383406391297
327497092555739137	shabbatheresa	 one daaayyyy happy thursday new london cancer center http sqcom hc cb	2013-04-25	0	0	@New			https://twitter.com/shabbatheresa/status/327497092555739137
327116439557402624	Bill_Becker6	 bobdevito rbeckerct legislative aid sen ayala touched cancer diagnosis asked sen support continued 	2013-04-24	2	0	@bobdevito @rbeckerct			https://twitter.com/Bill_Becker6/status/327116439557402624
326972525600989185	topix_ct	 sails up maritime art show benefit cancer care http bitlyzo cyh ledyard connecticut	2013-04-24	0	0		#Ledyard #Connecticut		https://twitter.com/topix_ct/status/326972525600989185
326951040807206913	topix_ct	 sails up maritime art show benefit cancer care http bitly g fsn glastonbury connecticut	2013-04-24	0	0		#Glastonbury #Connecticut		https://twitter.com/topix_ct/status/326951040807206913
326490461579653120	KingKaseKardash	 magowan_ xstrology its easy fall love cancer gentle polite pictwittercomgagn n mvo	2013-04-22	1	1	@Magowan_24 @XSTROLOGY	#Cancer		https://twitter.com/KingKaseKardash/status/326490461579653120
325765204317188096	Judy_mascolo	 stevenertelt know abortion associated increased premature birth http bitlysbyu o increase breast cancer	2013-04-20	0	0	@StevenErtelt			https://twitter.com/Judy_mascolo/status/325765204317188096
325467287798824961	JOEzQUINN	 zacmeng smoked beers got cancer	2013-04-20	0	1	@ZacMeng			https://twitter.com/JOEzQUINN/status/325467287798824961
325329025860001792	PoppaStayFlexin	 pink_kittykatt didnt know cancer lol cancers right	2013-04-19	1	0	@Pink_KittyKatt			https://twitter.com/PoppaStayFlexin/status/325329025860001792
325202060670795777	bearmyheart1973	 catcookghes cathy mom dead died couple years ago breast cancer	2013-04-19	0	0	@catcookghes			https://twitter.com/bearmyheart1973/status/325202060670795777
325005213373186051	Zrawww	 wow pirlos son passed cancer rip respect	2013-04-18	0	0		#RIP #Respect		https://twitter.com/Zrawww/status/325005213373186051
324987483379089408	_lickme69	 cancerterms emotionally committed whatever cancer turns success true	2013-04-18	0	0	@CancerTerms	#Cancer		https://twitter.com/_lickme69/status/324987483379089408
324347674063171586	JustCallMeGian	 its cancer cancer youre gonna die	2013-04-16	0	0				https://twitter.com/JustCallMeGian/status/324347674063171586
323873268509597696	RobSilver4	 dickiev rt follow fastpitchcure softball event raising funds fight pancreatic cancer june vernon ct	2013-04-15	0	0	@DickieV @Fastpitchcure			https://twitter.com/RobSilver4/status/323873268509597696
323652296842039296	themancarella	 manlyasshole wifes tits saggy breast cancer spread shoes never lold long	2013-04-15	0	0	@ManlyAsshole			https://twitter.com/themancarella/status/323652296842039296
