id	Username	Text	Date	Retweets	Favorites	Mentions	Hashtags	Geo	Permalink
341247505394188289	Hestia626	 cancerterms cancer together conquer world thy open other	2013-06-02	0	0	@CancerTerms	#Cancer		https://twitter.com/Hestia626/status/341247505394188289
341244862529679360	Hestia626	 cancerfollowers cancer smiling close tears screaming one hears	2013-06-02	0	0	@CancerFollowers	#Cancer		https://twitter.com/Hestia626/status/341244862529679360
341234871814995968	CMroczkaWxman	 chuckperks best study ever conducted says squeezing breasts could prevent cancer http nowmsncomsqueezingbrea stscanstopcancer 	2013-06-02	0	0	@chuckperks			https://twitter.com/CMroczkaWxman/status/341234871814995968
341187307367456769	Hestia626	 cancerterms cancer cancer women emotionally secure sympathetic relationships	2013-06-02	0	0	@CancerTerms	#Cancer		https://twitter.com/Hestia626/status/341187307367456769
341186565743202304	Hestia626	 cancerareus cancer stronger people realize	2013-06-02	0	0	@CancerAreUs			https://twitter.com/Hestia626/status/341186565743202304
341186481190223872	Hestia626	 cancerareus cancer male treat like queen public sheets truly shines	2013-06-02	0	0	@CancerAreUs	#Cancer		https://twitter.com/Hestia626/status/341186481190223872
341186414131703808	Hestia626	 cancerareus zodiac signs like make others happy even means giving something so scorpio cancer 	2013-06-02	0	0	@CancerAreUs	#Scorpio #Cancer		https://twitter.com/Hestia626/status/341186414131703808
340990432727150592	Hestia626	 cancerterms dont miss chance babies cancer one best signs raise kids	2013-06-01	0	0	@CancerTerms	#Cancer		https://twitter.com/Hestia626/status/340990432727150592
340975068005949440	RogerLev	 celebrate survivor tmrw national cancer survivors day stats say know one livestrong survivorsday httpwww ncsdorg 	2013-06-01	0	0	@SurvivorsDay	#LIVESTRONG		https://twitter.com/RogerLev/status/340975068005949440
340836319905337344	Yungslimpickens	 anything follow back pls follow back need followers live got follow back cancer dont follow die	2013-06-01	2	1				https://twitter.com/Yungslimpickens/status/340836319905337344
340825453667426304	mickc82	 breast cancer walk bushnell park w others http sqcom wgvbx	2013-06-01	0	0	@Bushnell			https://twitter.com/mickc82/status/340825453667426304
340801940806062080	laurbent	 susan komen k cure breast cancer 	2013-06-01	0	2				https://twitter.com/laurbent/status/340801940806062080
340784180730396672	bindirae	 cancerfollowers cancer put phone silent missed calls turns volume loudest nobody calls day truth	2013-06-01	0	0	@CancerFollowers	#Cancer		https://twitter.com/bindirae/status/340784180730396672
340442713382060034	lennbc	 cool cause teen raising cancer getting sponsors fish caught httpwww hookedforacureorg http instagramcompzdbl igmm	2013-05-31	0	0	@	#Cool #cause #teen #cancer		https://twitter.com/lennbc/status/340442713382060034
339931599342825472	findyourchilll	 if cure cancer trapped inside head someone couldnt afford education	2013-05-29	0	1				https://twitter.com/findyourchilll/status/339931599342825472
339918664742629376	stilesk1980	 theellenshow dad diagnosed w prostate cancer treatment w radioactive seeds prostate levels dropped dramatically beatcancer	2013-05-29	0	0	@TheEllenShow	#beatcancer		https://twitter.com/stilesk1980/status/339918664742629376
339893943732936704	KinzlyBrandon	 muhreeaaaa retrospidey riddled cancer	2013-05-29	0	0	@muhREEaaaa @RetroSpidey			https://twitter.com/KinzlyBrandon/status/339893943732936704
339214726921846785	MidChocolate	 chemistry teacher starts selling meth finance cancer treatment get experience moral decay empathizing	2013-05-27	0	0				https://twitter.com/MidChocolate/status/339214726921846785
339103064525004800	mbou_	 hope everyone whos posting pics tanning gets skin cancer 	2013-05-27	0	0				https://twitter.com/mbou_/status/339103064525004800
338797120503033856	jenstruk_	 attending relay life saturday june memory dad john a struk help stomp types cancer pictwittercome ng ma s 	2013-05-26	0	0				https://twitter.com/jenstruk_/status/338797120503033856
338688109447348224	John_Will_I_Am	 cancer sickness heaven leads one repentance coming god abouna bishoy kamel familyconvention 	2013-05-26	0	2		#FamilyConvention2013		https://twitter.com/John_Will_I_Am/status/338688109447348224
338339761628512256	dmmcneice24	 east windsor police department lost member family cancer today rest peace dispatcher sharon bourke miss smile	2013-05-25	0	1				https://twitter.com/dmmcneice24/status/338339761628512256
337818530869288960	topix_ct	 reader submitted roses legacy helping find cure breast cancer http bitlyz rdc wethersfield connecticut	2013-05-24	0	0		#Wethersfield #Connecticut		https://twitter.com/topix_ct/status/337818530869288960
337804204330586112	bindirae	 truth bestofcancer cancer builds hard shell around soft heart	2013-05-24	0	0	@BestofCancer	#Cancer		https://twitter.com/bindirae/status/337804204330586112
337791856043769857	Jody_lovett	 oh true cancer _ sex apart love cancer 	2013-05-24	0	0	@Cancer69_	#cancer		https://twitter.com/Jody_lovett/status/337791856043769857
337778476998348800	topix_ct	 results pratt brain cancer study released tonight public meeting planned http bitly mvbyz rockyhill connecticut	2013-05-23	0	0		#RockyHill #Connecticut		https://twitter.com/topix_ct/status/337778476998348800
337376350421778432	DavittFox	 piersmorgan worthless piece shit hasnt heart attack pancreatic cancer blessed world yousuck	2013-05-22	0	0	@piersmorgan	#yousuck		https://twitter.com/DavittFox/status/337376350421778432
337329340918419457	Niiiicole__	 seriously fuck cancer	2013-05-22	0	0				https://twitter.com/Niiiicole__/status/337329340918419457
336580108674551809	matthewlarsen	 year checkup danafarber thursday really cancer hard even believe now memories fuzzy	2013-05-20	0	0	@DanaFarber	#cancer		https://twitter.com/matthewlarsen/status/336580108674551809
336517881074429953	KevinNathanNBC	 tonight begin series interviews jim calhoun upcoming cancer challenge ride interest politics uconn bb	2013-05-20	7	0				https://twitter.com/KevinNathanNBC/status/336517881074429953
336185268879110146	djbonez88	 _thuglifetre cancerareus cancer always remember first love	2013-05-19	1	0	@_ThugLifeTre @CancerAreUs	#Cancer		https://twitter.com/djbonez88/status/336185268879110146
336172881178394626	DCTViper89	 kid work told going tanning lunch break fun skin cancer 	2013-05-19	0	0				https://twitter.com/DCTViper89/status/336172881178394626
336130087135105024	DDeoliveira96	 picture kid xxochelseaa sent me aweee glad kid cancer free	2013-05-19	0	0	@xxochelseaa			https://twitter.com/DDeoliveira96/status/336130087135105024
335956993292505088	Jody_lovett	 cancer _ its struggle cancer get proper amount sleepthe trueth way	2013-05-18	0	0	@Cancer69_	#cancer		https://twitter.com/Jody_lovett/status/335956993292505088
335956693269745664	Jody_lovett	 cancer _ cancer would night sex session rather quickie times	2013-05-18	0	0	@Cancer69_	#cancer		https://twitter.com/Jody_lovett/status/335956693269745664
335798294242525185	tarakristenn	 whyd matt get that cancer kristen quick make dead mom joke weresomeantoeachother roomies	2013-05-18	0	2		#weresomeantoeachother #roomies		https://twitter.com/tarakristenn/status/335798294242525185
335269970067996673	Yungslimpickens	 blood coming ass pretardeded wtf cancer rt runratrun aids aint real rt yungslimpickens aids cancer 	2013-05-17	2	0	@pretardeded @RunRatRun @Yungslimpickens			https://twitter.com/Yungslimpickens/status/335269970067996673
335269777473953792	Yungslimpickens	 till catch runratrun aids aint real rt yungslimpickens aids cancer 	2013-05-17	1	1	@RunRatRun @Yungslimpickens			https://twitter.com/Yungslimpickens/status/335269777473953792
335269442789441536	Yungslimpickens	 aids cancer 	2013-05-17	0	0				https://twitter.com/Yungslimpickens/status/335269442789441536
335225254605619201	dalemissy23	 lost dear close friend called mom died cancer hate word rip pagie love u	2013-05-16	0	0				https://twitter.com/dalemissy23/status/335225254605619201
335198401182445568	machado	 imranpoladi fuck cancer 	2013-05-16	0	0	@imranpoladi			https://twitter.com/machado/status/335198401182445568
334858267085897728	dalemissy23	 angieeverhart u keep fighting dam fuckin cancer one deal cancer 	2013-05-15	0	0	@angieeverhart			https://twitter.com/dalemissy23/status/334858267085897728
334857626879938560	dalemissy23	 angieeverhart hope u get well soon ill keep u n prayers god bless u hate cancer mom n dad died cause much love 	2013-05-15	0	0	@angieeverhart			https://twitter.com/dalemissy23/status/334857626879938560
334801540382593024	LovingMyadore	 looking lyke cancer patent	2013-05-15	0	0				https://twitter.com/LovingMyadore/status/334801540382593024
334643051840540672	lepxo	 good luck mommy doctors appointment today hope youre still cancer free	2013-05-15	2	7				https://twitter.com/lepxo/status/334643051840540672
334427261447045120	RecapNews	 cancer able makeawish would get sethgreen follow become fan cartoon recapnews cancer free	2013-05-14	0	0	@sethgreen	#makeAwish #recapnews		https://twitter.com/RecapNews/status/334427261447045120
334335931924488194	billykowarik	 zvolo dcop shes cancer long time took turn worse like month ago	2013-05-14	0	0	@Zvolo75 @DCop23			https://twitter.com/billykowarik/status/334335931924488194
334333822537703424	billykowarik	 rachael_proctor sick long time hospital while type cancer	2013-05-14	0	0	@rachael_proctor			https://twitter.com/billykowarik/status/334333822537703424
334329321764306944	audra_leigh95	 thisisdreday no cancer removed boobs lol didnt get bigger smaller	2013-05-14	0	0	@ThisisDreDay121			https://twitter.com/audra_leigh95/status/334329321764306944
334072147196641280	RogerLev	 eucerinus million people diagnosed annually skin cancer rt spread skincancerawareness skinfirst 	2013-05-13	0	0	@EucerinUS	#SkinCancerAwareness #SkinFirst		https://twitter.com/RogerLev/status/334072147196641280
334049556092317696	mikaelaobrien14	 learned skin cancer today health way go tanning	2013-05-13	0	7				https://twitter.com/mikaelaobrien14/status/334049556092317696
333733273190682624	sunshine_cas	 mikebrad thats myth dude prevents cancer blocks vitamin production sun get darker	2013-05-12	0	0	@mikebrad25			https://twitter.com/sunshine_cas/status/333733273190682624
333568735505944576	DavidYeboah33	 wear pink today people like lost moms cancer	2013-05-12	1	17				https://twitter.com/DavidYeboah33/status/333568735505944576
333376097855090688	aireee711	 xstrology cancer extremely intuitive frequently vivid dreams tell future yup	2013-05-11	0	0	@XSTROLOGY	#Cancer		https://twitter.com/aireee711/status/333376097855090688
333246401242861568	OliviaaOhhh	 please remember women men children arent us anymore cancer decided take lives away	2013-05-11	0	1				https://twitter.com/OliviaaOhhh/status/333246401242861568
333187232913563648	jmoynihan13	 breast cancer k day runningintherain raceinthepark 	2013-05-11	0	0		#runningintherain #raceinthepark		https://twitter.com/jmoynihan13/status/333187232913563648
333029262909132800	dcarcar10	 lebron could talking curing cancer would still come like condescending dick	2013-05-10	0	2				https://twitter.com/dcarcar10/status/333029262909132800
332689702199115777	mikaelaobrien14	 way fight dodgeball cancer 	2013-05-09	0	2				https://twitter.com/mikaelaobrien14/status/332689702199115777
332409386981007360	topix_ct	 race raises money breast cancer http bitly tqgr newbritain connecticut	2013-05-09	0	0		#NewBritain #Connecticut		https://twitter.com/topix_ct/status/332409386981007360
332124694385930241	Austinflynn95	 george karl overcoming cancer winning coach year great	2013-05-08	1	2				https://twitter.com/Austinflynn95/status/332124694385930241
331428233721552896	rachelksadlon	 another cancer versary celebrate medical office building retreat ave http sqcom qre	2013-05-06	0	1	@Medical			https://twitter.com/rachelksadlon/status/331428233721552896
331097269686378496	Tata_X0	 turn legally things youve since lol cancer summerbaby	2013-05-05	0	0		#Cancer #SummerBaby		https://twitter.com/Tata_X0/status/331097269686378496
330936719585206273	MORTGARCON	 weed makes risk cancer decrease 	2013-05-05	0	0				https://twitter.com/MORTGARCON/status/330936719585206273
330156661182435329	ZaddySef	 fucking yes lemonade strawberry beverage drank ironman im pinkforcancer cancer shell gas http instagramcompy xisno th	2013-05-02	0	0	@Shell	#lemonade #strawberry #beverage #drank #ironman3 #im3 #pinkforcancer #cancer		https://twitter.com/ZaddySef/status/330156661182435329
330067515038384129	Shqipe_4Life	 best delivery guy ct said year old girl cancer hope get better	2013-05-02	0	0				https://twitter.com/Shqipe_4Life/status/330067515038384129
329973255073046528	Grillweezy	 pregnancy periods breast cancer rape harrassment abuse females go lot women strong	2013-05-02	9	0				https://twitter.com/Grillweezy/status/329973255073046528
329135182902878208	topix_ct	 reader submitted know someone bladder cancer http bitlyyigbfs barkhamsted connecticut	2013-04-30	0	0		#Barkhamsted #Connecticut		https://twitter.com/topix_ct/status/329135182902878208
329026091434012674	DannyGannon	 nice walking car tonightuntil walk cancer infested cigarette smoking area death	2013-04-29	0	0				https://twitter.com/DannyGannon/status/329026091434012674
328551706893889536	Najiahhhhx3	 birthday way cancer	2013-04-28	0	0		#Cancer		https://twitter.com/Najiahhhhx3/status/328551706893889536
328243342804672512	_lenaaabeanaaa	 cancerfollowers cancer s often lot stress life	2013-04-27	0	0	@CancerFollowers	#Cancer		https://twitter.com/_lenaaabeanaaa/status/328243342804672512
327918383406391297	AdeelJZeb	 relay life beat cancer inshaallah trinity college trinity commons http instagramcompyldylqrih 	2013-04-26	0	0	@Trinity @Trinity	#Relay4Life		https://twitter.com/AdeelJZeb/status/327918383406391297
327819004687298560	_lenaaabeanaaa	 cancerareus talk cancer humor lively conversation lighten spirit	2013-04-26	0	0	@CancerAreUs	#Cancer		https://twitter.com/_lenaaabeanaaa/status/327819004687298560
327816157165936640	_lenaaabeanaaa	 xstrology cancer s weakness fear past repeating	2013-04-26	0	0	@XSTROLOGY	#Cancer		https://twitter.com/_lenaaabeanaaa/status/327816157165936640
327393638571196416	Peralta_Design	 ruthpurple cancer fungus cancer devastating its terrible disease http bitly bj dn just lost uncle cancer 	2013-04-25	0	0	@ruthpurple			https://twitter.com/Peralta_Design/status/327393638571196416
327129806300934144	ChillSheGotIt	 cancerfollowers cancer cant stand looking people break trustrt	2013-04-24	0	0	@CancerFollowers	#Cancer		https://twitter.com/ChillSheGotIt/status/327129806300934144
327129266800185344	ChillSheGotIt	 cancerfollowers sometimes people think cancer holding grudge weve actually lost interest	2013-04-24	0	0	@CancerFollowers	#Cancer		https://twitter.com/ChillSheGotIt/status/327129266800185344
327116439557402624	Bill_Becker6	 bobdevito rbeckerct legislative aid sen ayala touched cancer diagnosis asked sen support continued 	2013-04-24	2	0	@bobdevito @rbeckerct			https://twitter.com/Bill_Becker6/status/327116439557402624
327077535504531456	liz_forsyth	 smile could end wars cure cancer	2013-04-24	0	0				https://twitter.com/liz_forsyth/status/327077535504531456
325846147811930112	raeof_sunshinee	 zodiacfacts best zodiac signs taurus cancer virgo capricorn pisces its meant be poohbabyyy	2013-04-21	0	0	@ZodiacFacts @poohbabyyy	#Taurus		https://twitter.com/raeof_sunshinee/status/325846147811930112
325765204317188096	Judy_mascolo	 stevenertelt know abortion associated increased premature birth http bitlysbyu o increase breast cancer	2013-04-20	0	0	@StevenErtelt			https://twitter.com/Judy_mascolo/status/325765204317188096
325329025860001792	PoppaStayFlexin	 pink_kittykatt didnt know cancer lol cancers right	2013-04-19	1	0	@Pink_KittyKatt			https://twitter.com/PoppaStayFlexin/status/325329025860001792
324987483379089408	_lickme69	 cancerterms emotionally committed whatever cancer turns success true	2013-04-18	0	0	@CancerTerms	#Cancer		https://twitter.com/_lickme69/status/324987483379089408
324574591974526977	Grillweezy	 im ill enough kill cancer baby im kemo	2013-04-17	0	0				https://twitter.com/Grillweezy/status/324574591974526977
324219698176729088	MichaelMyers91	 guy espn_firsttake carichampion sbowl champ cancer survivorhero joeandruzzifndn pictwittercomoeetmoepn 	2013-04-16	0	0	@ESPN_FirstTake @CariChampion @joeandruzzifndn			https://twitter.com/MichaelMyers91/status/324219698176729088
324004760275542018	NicoleCoviello	 jess someone broke im stole puppies me steals puppys thats like stealing cancer jess conversations gold	2013-04-15	0	0		#gold		https://twitter.com/NicoleCoviello/status/324004760275542018
323652296842039296	themancarella	 manlyasshole wifes tits saggy breast cancer spread shoes never lold long	2013-04-15	0	0	@ManlyAsshole			https://twitter.com/themancarella/status/323652296842039296
323528149767954432	ChillSheGotIt	 xstrology cancer woman know secret language men	2013-04-14	0	0	@XSTROLOGY	#Cancer		https://twitter.com/ChillSheGotIt/status/323528149767954432
323290928951480322	Gatologic	 cancer ive got list songs ive heard many times also list excuses dont want hear anymore	2013-04-14	0	0				https://twitter.com/Gatologic/status/323290928951480322
323067039860264960	vanilla_sky_x3	 cancerareus cancer never truly happy unless heshe lives near water amen	2013-04-13	0	0	@CancerAreUs	#Cancer		https://twitter.com/vanilla_sky_x3/status/323067039860264960
322140672356388864	findyourchilll	 really need find cure cancer 	2013-04-10	1	1				https://twitter.com/findyourchilll/status/322140672356388864
322124446376787968	stamfordctnews	 health notes duck painting cancer screening addiction support more griffin pharmacy http bitlyymdmor stamford topix	2013-04-10	0	0		#stamford #topix		https://twitter.com/stamfordctnews/status/322124446376787968
322121979584995329	_astandish	 member redsox nation keeping jerry_remy thoughts rediagnosed cancer 	2013-04-10	0	0	@RedSox @Jerry_Remy			https://twitter.com/_astandish/status/322121979584995329
322105865912066048	topix_ct	 health notes duck painting cancer screening addiction support http bitly tjreg bridgeport connecticut	2013-04-10	0	0		#Bridgeport #Connecticut		https://twitter.com/topix_ct/status/322105865912066048
322032223823994880	jglazee	 go get buzzed donate money toward kids cancer outside sc pm camprisingsun http instagramcompx patupjep	2013-04-10	1	0		#camprisingsun		https://twitter.com/jglazee/status/322032223823994880
321970162913910784	OC_Quan	 also dream aunt cought cancer 	2013-04-10	0	0				https://twitter.com/OC_Quan/status/321970162913910784
321936728984260608	beagleboxer	 dont feel like cooking tonight come naugatuck portuguese club nvsls annual pasta dinner benefit american cancer	2013-04-10	0	0				https://twitter.com/beagleboxer/status/321936728984260608
321349817592848385	MaybeEricBrown	 parents praise sister every little thing could find cure cancer theyd like oh cool	2013-04-08	0	0				https://twitter.com/MaybeEricBrown/status/321349817592848385
321276662534770688	FuckYeahOctavia	 noticed time year msbeloin cancer gets really bad remember th grade left around time last year	2013-04-08	0	0				https://twitter.com/FuckYeahOctavia/status/321276662534770688
321267397573091329	FuckYeahOctavia	 kay_rodrigo cancer wins again cant believe th grade english teacher died actually liked 	2013-04-08	0	2	@kay_rodrigo			https://twitter.com/FuckYeahOctavia/status/321267397573091329
321266026547400704	FuckYeahOctavia	 msbeloin english teacher makes sad fuck cancer man fuck it see face mind right rip	2013-04-08	0	1		#rip		https://twitter.com/FuckYeahOctavia/status/321266026547400704
321262684131696640	FuckYeahOctavia	 gina_sebastiano oh god cancer probably came back english teacher	2013-04-08	0	0	@Gina_Sebastiano			https://twitter.com/FuckYeahOctavia/status/321262684131696640
321086573749874689	OC_Quan	 bitches want summer get skin cancer 	2013-04-07	0	0				https://twitter.com/OC_Quan/status/321086573749874689
320984203154042881	HeIsGLEN	 turned junk yard high way gonna catch cancer driving hoe 	2013-04-07	1	0				https://twitter.com/HeIsGLEN/status/320984203154042881
320964927416307715	Mandyyy______	 neverknownfacts bananas protect bodies cancer love bananas	2013-04-07	0	0	@neverknownfacts			https://twitter.com/Mandyyy______/status/320964927416307715
320776551270608896	RogerLev	 unbelievable storythe nebraska football prgram gves yr old pediatric cancer patient chnce score tchdwn httpwww cornnationcom inspiringcancerfighterjackhoffmanscoresatdinnebraskaspring 	2013-04-07	0	0				https://twitter.com/RogerLev/status/320776551270608896
320748141957742593	jake_martel	 footballtweets yr old cancer patient jack hoffman scores touchdown nebraskas spring game amazing http glmorenebvid 	2013-04-07	0	0	@Footballtweets3	#AMAZING		https://twitter.com/jake_martel/status/320748141957742593
320561601243656192	_StephMHughes	 the signs leo s catalysts better life cancer virgo shannonhughes 	2013-04-06	0	1	@The12Signs @shannonhughes11	#Leo #Cancer #Virgo		https://twitter.com/_StephMHughes/status/320561601243656192
320187025787584512	NeceyMarie1989	 scorpioareus pisces soulmate connection cancer amp scorpio im find sherealreckless pisces	2013-04-05	0	0	@ScorpioAreUs @SheRealReckless	#Pisces		https://twitter.com/NeceyMarie1989/status/320187025787584512
319969755916300288	Kschmith13	 done w cancer sticks bc cardiac arrest	2013-04-04	0	0				https://twitter.com/Kschmith13/status/319969755916300288
319947807333158913	MoiButUKnewThat	 pray cancer cure real dont think could handle another loss	2013-04-04	1	0				https://twitter.com/MoiButUKnewThat/status/319947807333158913
319644396435947520	Livmtyler	 found cure cancer	2013-04-03	0	0				https://twitter.com/Livmtyler/status/319644396435947520
319526409531949056	rebeccaguerrera	 course time favorite resident would get cancer spots lord 	2013-04-03	0	0				https://twitter.com/rebeccaguerrera/status/319526409531949056
319472485731024896	tonyscottkern	 factswikipedia sharks animals never get sick even immune every known disease including cancer badasses	2013-04-03	0	1	@FactsWikipedia			https://twitter.com/tonyscottkern/status/319472485731024896
319215669805731840	bindirae	 bestofcancer whoever coined expression the truth hurts probably conversation cancer my favorite line	2013-04-02	0	0	@BestofCancer	#Cancer		https://twitter.com/bindirae/status/319215669805731840
318906605573922816	RogerLev	 cancer takes another rip jack pardee http mychicagotribunecomsection ar ticlep p 	2013-04-01	0	0		#section		https://twitter.com/RogerLev/status/318906605573922816
318514625534627841	Crazy_bw0y97	 dicepticon know weed slows spread cancer 	2013-03-31	0	0	@dicepticon2013			https://twitter.com/Crazy_bw0y97/status/318514625534627841
317965827410382848	DonaldsonESPN	 really nice piece grahamspiers interview rangers legend cancer sufferer sandy jardine herald http bitly zuptm 	2013-03-30	2	0	@GrahamSpiers			https://twitter.com/DonaldsonESPN/status/317965827410382848
317836287405088768	_astandish	 bitterness like cancer eats upon host anger like fire burns clean pictwittercoma gryxcnvg httpstwittercom_astandishstatus radiopromoguy acupuncture new milford hospital regional cancer center http sqcom cl new httpstwittercomradiopromoguystatus nothinglikebows bestofcancer regardless fact cancer s quiet hate nothing ignored bestofcancer cancer httpstwittercomnothinglikebowsstatus nothinglikebows bestofcancer dont take personal cancer moody its moon cant help it bestofcancer cancer httpstwittercomnothinglikebowsstatus nothinglikebows bestofcancer cancer wont lie you might avoid telling truth ugh cancerprobs bestofcancer cancer cancerprobs httpstwittercomnothinglikebowsstatus naturalbeautydc peppermintluv yesss was wait get clear blong chick sister girlfriend died cancer peppermintluv httpstwittercomnaturalbeautydcstatus laurenbrav cancerareus cancer never forgets cancerareus cancer httpstwittercomlaurenbravstatus hakunamarciea sexstrology scorpio cancer tough act follow bucknastybuns	2013-03-27	0	0	@SEXSTROLOGY @BuckNastyBuns	#Scorpio #Cancer		https://twitter.com/HakunaMarciea/status/316764399421509632
316608775131893762	zaklange	 im going get cancer like years pictwittercomejbcjw sju	2013-03-26	0	1				https://twitter.com/zaklange/status/316608775131893762
316355925550170113	brinap20	 scott h o get jakemillermusic getedtojakemiller cause hes fighting cancer jakes inspiration doesnt long live	2013-03-25	0	0	@scott2h2o @jakemillermusic	#getedtojakemiller		https://twitter.com/brinap20/status/316355925550170113
315454418822782977	Gatologic	 cancer family oriented cereal giant box cheerios enjoy	2013-03-23	0	0				https://twitter.com/Gatologic/status/315454418822782977
315192989536370688	Heyitsjoshhhh	 alliej its control cough making vomit more drug give cancer patience well antibiotic	2013-03-22	0	0	@alliej90			https://twitter.com/Heyitsjoshhhh/status/315192989536370688
315004002796466177	raeof_sunshinee	 kind want get tanning membership im like dont really want skin cancer idk thestruggle	2013-03-22	1	2		#thestruggle		https://twitter.com/raeof_sunshinee/status/315004002796466177
314976253235040257	LoveAndDrugz	 need find cancer see works lol	2013-03-22	0	0				https://twitter.com/LoveAndDrugz/status/314976253235040257
314416654341771265	CharlesJBau	 talk ratchet giving cancer 	2013-03-20	0	1				https://twitter.com/CharlesJBau/status/314416654341771265
314207926971670528	NeceyMarie1989	 scorpioareus cancer best person fun scorpio sherealreckless	2013-03-19	0	0	@ScorpioAreUs @SheRealReckless	#Cancer #Scorpio		https://twitter.com/NeceyMarie1989/status/314207926971670528
