id	Username	Text	Date	Retweets	Favorites	Mentions	Hashtags	Geo	Permalink
295844725104197632	fameuniversity	 i_ cancer cancers really good making partners feel theyre taken care of cancers make excellent lovers	2013-01-28	0	0	@i_	#cancers #Cancers		https://twitter.com/fameuniversity/status/295844725104197632
295750030684479490	Jimbo3420	 emmacaulfield even cornered lance still maneuvering beat cancer thought invincible	2013-01-27	0	0	@emmacaulfield			https://twitter.com/Jimbo3420/status/295750030684479490
295636518926692353	epitomeoflazy	 cancer deez nuts rt toibelle_ fact rt cancerareus cancer really ignores you makes feel guilty	2013-01-27	0	0	@TOiBelle_ @CancerAreUs	#Cancer		https://twitter.com/epitomeoflazy/status/295636518926692353
295164006002466816	MikeMagsCBS12	 polar plunge pics follow west haven breast cancer awareness research	2013-01-26	0	0				https://twitter.com/MikeMagsCBS12/status/295164006002466816
295160692934324224	theWeatherlord	 heading west beach polar plunge cancer wxedge	2013-01-26	0	0		#wxedge		https://twitter.com/theWeatherlord/status/295160692934324224
294901502546427904	theWeatherlord	 hey tomorrow polar plunge cancer west write quick article it danburyweather	2013-01-25	0	0	@danburyweather			https://twitter.com/theWeatherlord/status/294901502546427904
294067416995069952	Catiepleasee	 im smilow cancer hospital new haven ct http sqcomuu hb 	2013-01-23	0	0				https://twitter.com/Catiepleasee/status/294067416995069952
293694784051245057	Ms_Kris_10	 early morning walk workjesus knew needed kid inspiration i smilow cancer hospital http instagrampuysniuuryj	2013-01-22	0	0	@Smilow			https://twitter.com/Ms_Kris_10/status/293694784051245057
293648880195739648	proudprgirl	 khloekardashian man thats true lol cancerfollowers cancer difficult zodiac understand off_hiatus	2013-01-22	0	0	@KhloeKardashian @CancerFollowers @Off_hiatus	#Cancer		https://twitter.com/proudprgirl/status/293648880195739648
293080121848516609	rnormfoto	 crazyass bitch self absorbed wacko lies tells cancer snatch groom abc claimed cancer 	2013-01-20	0	0	@ABC2020	#2020		https://twitter.com/rnormfoto/status/293080121848516609
292669811102724096	meandcoffeetoo	 rumor could last visit weeks smilow cancer hospital http sqcomwrhsox	2013-01-19	0	0	@Smilow			https://twitter.com/meandcoffeetoo/status/292669811102724096
292471654964133889	Kirababexo	 cancer check oh wat fun nightyy night xd	2013-01-18	0	0				https://twitter.com/Kirababexo/status/292471654964133889
292411261940031489	meandcoffeetoo	 need stop meeting like this smilow cancer hospital http sqcom fdi l	2013-01-18	0	0	@Smilow			https://twitter.com/meandcoffeetoo/status/292411261940031489
292237982633713664	theWeatherlord	 today marks one year since idol dr mel lost battle cancer never forget learned you ripdrmel wxedge	2013-01-18	0	2		#RIPDRMEL #wxedge		https://twitter.com/theWeatherlord/status/292237982633713664
292115010631651328	VotreCheriAmour	 crying email raise money cancer patients ct planet fitnessman bastards know get u using kids really	2013-01-17	0	0				https://twitter.com/VotreCheriAmour/status/292115010631651328
291716214235996161	deevazquezxo	 lol rtd mad cancer tweets shrugs teamcancer	2013-01-16	0	0		#TeamCancer		https://twitter.com/deevazquezxo/status/291716214235996161
291699271521153024	meandcoffeetoo	 meet again smilow cancer hospital http sqcomw t p	2013-01-16	0	0	@Smilow			https://twitter.com/meandcoffeetoo/status/291699271521153024
291375348015300608	Ummm_ItsChris	 duelwith_mahmud ctfuu one asked yuh shitty ass comment fuck yu mean gave yu cancer yu sound stupid hop shit 	2013-01-15	0	0	@duelwith_mahmud			https://twitter.com/Ummm_ItsChris/status/291375348015300608
291235007438147586	meandcoffeetoo	 hopefully next time wont ride elevator fun smilow cancer hospital http sqcom fsc	2013-01-15	0	0	@Smilow			https://twitter.com/meandcoffeetoo/status/291235007438147586
290528486634975232	meandcoffeetoo	 looks like ill lot father law smilow cancer hospital w rantandrave http sqcomy idjp	2013-01-13	0	0	@Smilow @rantandrave			https://twitter.com/meandcoffeetoo/status/290528486634975232
290319077220687873	_AngelaFusco	 rt cancerareus cancer s sensitive sign	2013-01-12	0	0	@CancerAreUs	#Cancer		https://twitter.com/_AngelaFusco/status/290319077220687873
289722090360287232	liz_babie	 _itsmookie may need grit teeth whats expected cancer http bitlyyk b m im tired waitting	2013-01-11	0	0	@_itsMOOKIE			https://twitter.com/liz_babie/status/289722090360287232
289604139388907521	jaackieee_m8	 tear like cancer were different makes sick	2013-01-11	0	0				https://twitter.com/jaackieee_m8/status/289604139388907521
288694954212077568	lippert	 head examined smilow cancer hospital w others http sqcomuu bav	2013-01-08	0	0	@Smilow			https://twitter.com/lippert/status/288694954212077568
288677463746301953	_Choffo	 im smilow cancer hospital new haven ct http sqcomxhu v	2013-01-08	0	0				https://twitter.com/_Choffo/status/288677463746301953
288548630774820865	Morg_Ashley	 well youre repulsive kelsykardashian guns shouldnt banned fat cunts cuz wat use kill cancer patients then	2013-01-08	0	0	@KelsyKardashian			https://twitter.com/Morg_Ashley/status/288548630774820865
288123399446867968	MIZCAREYBABY	 ironic last name butts colon cancer lol savebutts	2013-01-06	0	0		#saveButts		https://twitter.com/MIZCAREYBABY/status/288123399446867968
288120812391768066	MIZCAREYBABY	 march colon cancer awareness month march st wear blue support savebutts	2013-01-06	0	0		#saveButts		https://twitter.com/MIZCAREYBABY/status/288120812391768066
287221977624764416	JayPelletier	 hate smell place like dog freaking vet smilow cancer hospital http sqcomrwbviw	2013-01-04	0	0	@Smilow			https://twitter.com/JayPelletier/status/287221977624764416
286614709342449664	thisguy194	 mythsmymomusedtotellme dont look microwave long youll get cancer 	2013-01-02	0	0		#MythsMyMomUsedToTellMe		https://twitter.com/thisguy194/status/286614709342449664
286594448312397824	BrandNewTay85	 xstrology cancer communicate easily its tough speaking bottom heart tru u see ytruetomyself st	2013-01-02	0	0	@XSTROLOGY @TRUEtoMYSELF1st	#Cancer		https://twitter.com/BrandNewTay85/status/286594448312397824
416686961974575104	emilyshiffman	 paid someones meal olive garden anonymously manager thought sweet since child cancer paid meal	2013-12-27	0	10				https://twitter.com/emilyshiffman/status/416686961974575104
413142895651471361	gmlzi	 reallybillklein youre fabulous couple stay strong husband cancer last year know youre going through	2013-12-17	0	0	@ReallyBillKlein			https://twitter.com/gmlzi/status/413142895651471361
413136399597305857	Mike__Ficano	 cancer take away physical abilities cannot touch mind cannot touch heart cannot touch soul jimmy v	2013-12-17	3	10				https://twitter.com/Mike__Ficano/status/413136399597305857
410094177884844032	raxm0017	 spencer_skb love story bro way kick cancer s ass teammutant	2013-12-09	0	1	@Spencer_SKB	#TeamMUTANT		https://twitter.com/raxm0017/status/410094177884844032
409452161303855104	Tiana_Lucy	 cancerterms cancer s wont give relationship smh true	2013-12-07	0	0	@CancerTerms	#Cancer		https://twitter.com/Tiana_Lucy/status/409452161303855104
407894561617629184	JackBouffard	 givingtuesday helps young adult survivor cancer pay prescription keep healthy http bitlysamfundgivingt uesday 	2013-12-03	0	1		#GivingTuesday		https://twitter.com/JackBouffard/status/407894561617629184
407673448207761408	alexis_branco	 fuck cancer	2013-12-02	0	0				https://twitter.com/alexis_branco/status/407673448207761408
406850780743094272	Mjritch91	 peeking else youll get kid cancer	2013-11-30	0	0				https://twitter.com/Mjritch91/status/406850780743094272
406484133037502464	feed_the_gods	 rickygervais pretty silly comparison choose religion would hope wouldnt choose cancer 	2013-11-29	0	0	@rickygervais			https://twitter.com/feed_the_gods/status/406484133037502464
406138687744139264	shardimanxo	 greatest news ever pop finallly cancer free thankful	2013-11-28	0	5				https://twitter.com/shardimanxo/status/406138687744139264
405953219849125888	alj757_	 _rosaaac died cancer 	2013-11-28	0	0	@_rosaaac			https://twitter.com/alj757_/status/405953219849125888
405472299706376192	vbjenn	 cancer sucks	2013-11-26	0	1				https://twitter.com/vbjenn/status/405472299706376192
404029790916984832	Elewis914	 ninastrong kick cancer s butt	2013-11-22	0	1		#NinaStrong		https://twitter.com/Elewis914/status/404029790916984832
403129590966910976	lifeisthepitz	 cancer _ht cancers speak sarcasm fluently even little bit	2013-11-20	0	0	@Cancer	#Cancers		https://twitter.com/lifeisthepitz/status/403129590966910976
402607022950318080	JackBouffard	 wouldve nice read study six years ago cancer researchers dont get cancer http onioncom ez yy	2013-11-18	0	1				https://twitter.com/JackBouffard/status/402607022950318080
402231037818068992	MediumLisaJones	 love energy kris_carr woke husband died cancer quit cpa career help others wake up bless you	2013-11-17	0	1	@Kris_Carr			https://twitter.com/MediumLisaJones/status/402231037818068992
400087009383161856	Michellee029	 back breast cancer awareness day pictwittercomkg fx bhb	2013-11-11	0	0				https://twitter.com/Michellee029/status/400087009383161856
398615229166534656	Roberta87	 mnhospitals icymi inspiring music video uofmamplatz staffers young cancer patients get brave http youtuben xnlkykgse 	2013-11-07	0	1	@MNhospitals @UofMAmplatz			https://twitter.com/Roberta87/status/398615229166534656
394857126587531264	Braziliasct	 fabulous time last night supporting fashion cure fashion catwalk breast cancer http instagramcompgbgabgzpto	2013-10-28	0	0				https://twitter.com/Braziliasct/status/394857126587531264
394494715137363968	abbyanders0n	 thugnasty_mercs cheering breast cancer walk lol	2013-10-27	0	0	@ThugNasty_Mercs			https://twitter.com/abbyanders0n/status/394494715137363968
394418687652139010	DMFrascone	 went bed am am breast cancer walk early am lets this peaceoutcancer thiscoldtho	2013-10-27	0	1		#peaceoutcancer #thiscoldtho		https://twitter.com/DMFrascone/status/394418687652139010
393929489199431680	mommatopia	 long day sitting w bff goes thru cancer drillsoptionstreatments day nearly long hers staff bpthosp amazing	2013-10-25	0	0	@BPTHOSP			https://twitter.com/mommatopia/status/393929489199431680
392052022452965376	JackBouffard	 ive lost three friends cancer month may lights lindsey smith angie suttes sandy denesowicz shine forever	2013-10-20	1	0				https://twitter.com/JackBouffard/status/392052022452965376
391911918359031808	yogapata	 happy part great day great cause breast cancer today westport yoga green catch mitchels class pm	2013-10-20	0	0				https://twitter.com/yogapata/status/391911918359031808
390848980755972097	amandakaraqi	 bestofcancer cancer works hard finish goals inspired feelings aint feeling it aint getting done	2013-10-17	0	0	@BestofCancer	#Cancer		https://twitter.com/amandakaraqi/status/390848980755972097
390681059761065984	kmdesrosiers5	 rnstudentlife hope everyone wonderful breast cancer awareness month dont forget get your pictwittercomwiiqevwbpo 	2013-10-16	0	2	@RNStudentLife			https://twitter.com/kmdesrosiers5/status/390681059761065984
390635025177509888	Mike__Ficano	 wants wear pink tomorrow junior ring breakfast support breast cancer 	2013-10-16	0	3				https://twitter.com/Mike__Ficano/status/390635025177509888
390574434677170176	Digggey	 everyone please support martin family donating httpwww youcaringcommedicalfundra isersupportreni abreee s mom battling cancer anything helps 	2013-10-16	0	1	@abreee			https://twitter.com/Digggey/status/390574434677170176
390287389840924673	e_bravo_88	 lilduval rick ross promoting breast cancer awareness lol	2013-10-15	0	0	@lilduval			https://twitter.com/e_bravo_88/status/390287389840924673
390229379479248897	JackBouffard	 im never getting mayorship back praxair cancer center http sqcom any q	2013-10-15	0	0	@Praxair			https://twitter.com/JackBouffard/status/390229379479248897
388480540514742272	PHSJungle	 shoutout fockey ladies victory playing honor tim cremin tucker gowen breast cancer pictwittercomeoes i ddh	2013-10-10	2	32				https://twitter.com/PHSJungle/status/388480540514742272
388135406015115264	alfromct	 republicans throwing away millions us funds interest payments due shutdown denied food cancer treatment children	2013-10-09	0	0				https://twitter.com/alfromct/status/388135406015115264
388059880957173760	nildarocato	 soccer game supporting breast cancer awareness month good job fabricio_rocato henry abbott tech http instagramcompfqyr uifxb	2013-10-09	0	0	@Henry			https://twitter.com/nildarocato/status/388059880957173760
387992504840515585	morgodell	 random guy quad wants tweet launch water balloons raise money cancer research since cash	2013-10-09	0	0				https://twitter.com/morgodell/status/387992504840515585
386937673983983616	JackBouffard	 nfl switches allpink mri machines breast cancer awareness month http onioncom humzt 	2013-10-06	0	0				https://twitter.com/JackBouffard/status/386937673983983616
385966591688450050	jaquezdoris	 wendy_wfans please wendy gonna one years breast cancer survivor want clbre going show	2013-10-03	0	0	@Wendy_Wfans			https://twitter.com/jaquezdoris/status/385966591688450050
385913887276957696	mickyzilberg	 keep fighting breast cancer grandma shelly	2013-10-03	0	0				https://twitter.com/mickyzilberg/status/385913887276957696
385573380570619904	JenBollman	 harry reid sick twisted evil little man hope one wants help gets cancer harryreid harryreidsshutdown	2013-10-02	0	0		#HarryReid #HarryReidsShutdown		https://twitter.com/JenBollman/status/385573380570619904
385502156058808320	romduck	 ridgefield ct firefighters pink breast cancer awareness even training pic http sqcom y l 	2013-10-02	0	0		#firefighters		https://twitter.com/romduck/status/385502156058808320
385204948767883264	Roberta87	 hard see man whos taken good care dealt blow cancer again cancer isnt something celebrated	2013-10-01	0	0				https://twitter.com/Roberta87/status/385204948767883264
385203767224070144	Roberta87	 appt today w doc lumpectomy stricken w cancer yrs ago im fine cancer its back	2013-10-01	0	0				https://twitter.com/Roberta87/status/385203767224070144
385107070363914240	delovely__	 zodiacfacts cancer scorpio and pisces want librasgeminisand aquarius sensitive compassionate caring uh yes libra	2013-10-01	0	0	@ZodiacFacts	#Cancer #Scorpio #Pisces		https://twitter.com/delovely__/status/385107070363914240
385106503948312576	delovely__	 zodiacfacts cancer forgiving naturebut never forget bring time time true	2013-10-01	0	0	@ZodiacFacts	#Cancer		https://twitter.com/delovely__/status/385106503948312576
385034401375342593	taylertorres6	 october breast cancer awareness month beautiful grandma diagnosed past july still fighting thinkpink	2013-10-01	0	0		#thinkPink		https://twitter.com/taylertorres6/status/385034401375342593
385013222543491072	itsybitsymissy	 breast cancer awareness month savethetatas	2013-10-01	0	0		#SaveTheTatas		https://twitter.com/itsybitsymissy/status/385013222543491072
384883540665856000	Catiepleasee	 going sound horrible guys know theres kinds cancers breast cancer right months	2013-09-30	0	0				https://twitter.com/Catiepleasee/status/384883540665856000
384862516788355072	jaquezdoris	 h ha jermainedupri angela yee breast cancer campaign please rt support breast cancer awareness pictwittercom to zekpjc 	2013-09-30	1	0	@H4HA1 @jermainedupri			https://twitter.com/jaquezdoris/status/384862516788355072
384861516706885632	jaquezdoris	 h ha cancer patient	2013-09-30	1	1	@H4HA1			https://twitter.com/jaquezdoris/status/384861516706885632
384681113081614336	revdionneb	 liturgicallife thanks major areas awareness oct breast cancer dom violence recognize gether apart	2013-09-30	0	0	@LiturgicalLife			https://twitter.com/revdionneb/status/384681113081614336
384012745026600960	Roberta87	 adamslisa found women work diag wbreast cancer told check blog twitter feed	2013-09-28	0	0	@AdamsLisa			https://twitter.com/Roberta87/status/384012745026600960
383210741043843072	sassygessika	 youre smoking waiting shuttle stand big crowd people one wants fucking cancer	2013-09-26	0	1				https://twitter.com/sassygessika/status/383210741043843072
382623674073088000	anajara_usa	 sister fighting bone cancer mom support hermoms love stronger http instagramcompeqkw yoat 	2013-09-24	0	0				https://twitter.com/anajara_usa/status/382623674073088000
381619095088943104	Tyleds	 uberfacts people consume pizza may actually decreasing risk cancer stoolpresidente	2013-09-21	0	0	@UberFacts @stoolpresidente			https://twitter.com/Tyleds/status/381619095088943104
379618812360130560	_JenCruz12	 alwayszodiac cancer class friends quiet work overlooked position right nowawkward lol	2013-09-16	0	0	@AlwaysZodiac	#Cancer		https://twitter.com/_JenCruz12/status/379618812360130560
378606754692857857	Bill_Becker6	 preliminary bone scan results new cancer spotsill take now	2013-09-13	0	1				https://twitter.com/Bill_Becker6/status/378606754692857857
377840057337782272	nanieex0	 cancerareus dont ever hide anything cancer feel something aint right even dont say something know	2013-09-11	0	0	@CancerAreUs	#cancer		https://twitter.com/nanieex0/status/377840057337782272
376824312424300545	_eavyn	 idk man want birthday galaxy mercurials customized breast cancer hypervenoms	2013-09-08	0	0				https://twitter.com/_eavyn/status/376824312424300545
376703045138399232	nanieex0	 cancerareus cancer s like things done way	2013-09-08	0	0	@CancerAreUs	#Cancer		https://twitter.com/nanieex0/status/376703045138399232
376141286388289536	Roberta87	 previous treatment breast cancer found polyps removed put yr plan luckyme	2013-09-06	0	0		#luckyme		https://twitter.com/Roberta87/status/376141286388289536
376109470453346304	estefanyyy_p	 cancerareus cancer hit town light night beauty always	2013-09-06	0	0	@CancerAreUs	#Cancer		https://twitter.com/estefanyyy_p/status/376109470453346304
375766727340355584	Roberta87	 heatherwgaona one every years ive treated breast cancer oh well worth stay healthy	2013-09-05	0	0	@heatherwgaona			https://twitter.com/Roberta87/status/375766727340355584
375415545761632256	jtpags12	 years ago today wife tricia_pagano diagnosed cancer today infinitely proud things help others	2013-09-04	2	10	@tricia_pagano			https://twitter.com/jtpags12/status/375415545761632256
374576394397028352	taylertorres6	 missing lovely grandma week looks good diagnosed cancer weeks ago mybestfriend pictwittercomfrjyuqbiam	2013-09-02	0	1		#mybestfriend		https://twitter.com/taylertorres6/status/374576394397028352
372960312393490432	nanieex0	 cancerareus cancer s need constant reassurance text call good enough face face interaction hard	2013-08-29	0	0	@CancerAreUs			https://twitter.com/nanieex0/status/372960312393490432
372789623883579392	aplastiikheart	 uberfacts orgasms lower womans risk heart disease breast cancer stroke depression	2013-08-28	0	0	@UberFacts			https://twitter.com/aplastiikheart/status/372789623883579392
372012159854972928	Royaltyfan	 im praxair cancer center danbury ct http sqcom bygd 	2013-08-26	0	0				https://twitter.com/Royaltyfan/status/372012159854972928
368397541899251712	Nelly0623	 cancer _ cancer tries avoid confrontation force become cut throat matter seconds	2013-08-16	0	0	@Cancer69_	#Cancer		https://twitter.com/Nelly0623/status/368397541899251712
368397188772429824	Nelly0623	 true lol cancerfollowers hardest thing ever cancer controlling laughter serious times	2013-08-16	0	0	@CancerFollowers	#Cancer		https://twitter.com/Nelly0623/status/368397188772429824
368190584306954240	MinisterBrandon	 happy k name cancer pictwittercomm oxntpsbv	2013-08-15	0	0				https://twitter.com/MinisterBrandon/status/368190584306954240
368156857225191424	Roberta87	 nantucketgal thank you husband yrs st headneck cancer keep moving forward focus next thing	2013-08-15	0	0	@NantucketGal			https://twitter.com/Roberta87/status/368156857225191424
368156036349591552	Roberta87	 localterri thanks much happened since test strength husbands st headneck cancer yrs out strength	2013-08-15	0	0	@localterri	#strength		https://twitter.com/Roberta87/status/368156036349591552
368155183458422784	Roberta87	 cranberrycorner thanks cant believe its long since husband survived st headneck cancer yrs out strength	2013-08-15	0	0	@cranberrycorner	#strength		https://twitter.com/Roberta87/status/368155183458422784
368151538126319616	Roberta87	 so years ago today lumpectomy r breast remove tissue beg wks rad trtmnt early st breast cancer 	2013-08-15	0	0				https://twitter.com/Roberta87/status/368151538126319616
367986728591978496	jadorekristenx9	 lyss_xo want ride jail side lung cancer 	2013-08-15	0	0	@lyss_xo97			https://twitter.com/jadorekristenx9/status/367986728591978496
366908932641390593	JackBouffard	 yippie praxair cancer center http sqcom p huk	2013-08-12	0	0	@Praxair			https://twitter.com/JackBouffard/status/366908932641390593
366770804500865026	MEGTRN1	 canabis cures cancer protects brain damages	2013-08-11	0	1				https://twitter.com/MEGTRN1/status/366770804500865026
366746465743290369	levanooo	 kathrynsunn theres tv show cancer stricken meth producing murdering drug lord youre watching cartoon	2013-08-11	1	2	@kathrynsunn			https://twitter.com/levanooo/status/366746465743290369
366247075547066368	nikkicibu	 stop harassing let smoke cancer stick	2013-08-10	1	7				https://twitter.com/nikkicibu/status/366247075547066368
366030574210662401	Nelly0623	 sure lol cancerfollowers cancer s remember everything good bad youve done them	2013-08-09	0	0	@CancerFollowers	#Cancer		https://twitter.com/Nelly0623/status/366030574210662401
365998733558677504	Roberta87	 adamslisa felt guilty husbands cancer every time hear mortar pestle kills me reminds g tube	2013-08-09	0	0	@AdamsLisa			https://twitter.com/Roberta87/status/365998733558677504
365872995996151811	mickyzilberg	 hair inches fuck cut it oh ya cancer	2013-08-09	0	0				https://twitter.com/mickyzilberg/status/365872995996151811
365830236350341120	JustinRenda79	 im praxair cancer center danbury ct http sqcom gvmd 	2013-08-09	0	0				https://twitter.com/JustinRenda79/status/365830236350341120
362959151984422912	ASHLEExJULIA	 nuclear medicine check in im gonna get cancer sitting waiting room thefuck dangerous radiation	2013-08-01	0	0		#thefuck #dangerous #radiation		https://twitter.com/ASHLEExJULIA/status/362959151984422912
362637373181394944	__samxo	 thank everyone love support its safe say officially cancer free healing quickly fuckcancer	2013-07-31	0	12		#fuckcancer		https://twitter.com/__samxo/status/362637373181394944
359881856960823297	KeepCalmAndRise	 cancer ugly disease	2013-07-23	1	0				https://twitter.com/KeepCalmAndRise/status/359881856960823297
359506024383774721	DykeAmanda	 rip snowy missed cancer cant hurt anymore love much vca http instagramcompcf ywdvi	2013-07-22	0	0	@VCA			https://twitter.com/DykeAmanda/status/359506024383774721
357509568617644032	Matt_Stevens_	 listening jim calhoun talk colin cowherd espn fight cancer moving jimmyv espn	2013-07-17	0	0		#JimmyV #ESPN		https://twitter.com/Matt_Stevens_/status/357509568617644032
357305424908787712	KeepCalmAndRise	 better yet wish cancer never existed	2013-07-16	0	0				https://twitter.com/KeepCalmAndRise/status/357305424908787712
357305262224322560	KeepCalmAndRise	 wish cure cancer 	2013-07-16	0	0				https://twitter.com/KeepCalmAndRise/status/357305262224322560
352563097157910529	LaflinHannah	 cant believe its long without you cancer took early age good person huge heart rip	2013-07-03	0	0				https://twitter.com/LaflinHannah/status/352563097157910529
351879599107485698	LennyLeonardi	 lotto winner left k tip owner diner whose daughter diagnosed cancer http gawkrzadvran payitforward	2013-07-01	0	0		#PayItForward		https://twitter.com/LennyLeonardi/status/351879599107485698
347831748341678081	_jazmynlovesyou	 know someone whos dying sporadic brain cancer im officially terrified	2013-06-20	0	0				https://twitter.com/_jazmynlovesyou/status/347831748341678081
347350275608158208	JustinRenda79	 im praxair cancer center danbury ct http sqcom mz fg	2013-06-19	0	0				https://twitter.com/JustinRenda79/status/347350275608158208
347126253331030017	Nelly0623	 cancerfollowers cancer seem heartless now cared much	2013-06-18	0	0	@CancerFollowers	#Cancer		https://twitter.com/Nelly0623/status/347126253331030017
345255373567037440	Nelly0623	 lol cancerareus cancer s arent moody good emotional multitasking	2013-06-13	0	0	@CancerAreUs	#Cancer		https://twitter.com/Nelly0623/status/345255373567037440
343766966177234944	topix_ct	 relay life thousands step fight cancer http bitly p a c fairfield connecticut	2013-06-09	0	0		#Fairfield #Connecticut		https://twitter.com/topix_ct/status/343766966177234944
343137863413665792	Nelly0623	 cancerareus cancer intense dreams especially horny	2013-06-07	0	0	@CancerAreUs	#Cancer		https://twitter.com/Nelly0623/status/343137863413665792
343137762964303872	Nelly0623	 aint true mindofthecancer cancer forgives never forgets quick cut people dont act right	2013-06-07	0	0	@MindOfTheCancer	#Cancer		https://twitter.com/Nelly0623/status/343137762964303872
343136184572190720	OXOXArelis	 relay life american cancer society trumbull high school http sqcomzwhfag	2013-06-07	0	0	@Trumbull			https://twitter.com/OXOXArelis/status/343136184572190720
341693401604947969	AdamFknWinne	 huffingtonpost michael douglas says oral sex caused throat cancer http huffto k vdi youre fucked robbycegielski	2013-06-03	0	2	@HuffingtonPost @RobbyCegielski			https://twitter.com/AdamFknWinne/status/341693401604947969
341691665666437120	OG_Earpp	 michael douglas said oral sex gave cancer nigga much eat	2013-06-03	2	0				https://twitter.com/OG_Earpp/status/341691665666437120
