id	Username	Text	Date	Retweets	Favorites	Mentions	Hashtags	Geo	Permalink
148835857544130560	GetAdvSalesJobs	 medford or diabetes s medford http tinyurlcom vujrpu get advertising sales jobs advertisingsales jobs job getalljobs	2011-12-19	0	0		#Medford #AdvertisingSales #jobs #job #GetAllJobs		https://twitter.com/GetAdvSalesJobs/status/148835857544130560
143899220506714113	GetInsSalesJobs	 eugene or diabetes sales s eugene http tinyurlcombrj acu get insurance sales jobs insurancesales jobs job getalljobs	2011-12-05	0	0		#Eugene #InsuranceSales #jobs #job #GetAllJobs		https://twitter.com/GetInsSalesJobs/status/143899220506714113
138433261952172033	GetHeaEducaJobs	 diabetes educator rn grantspass http tinyurlcom uvedfz get health educator jobs healtheducator jobs job getalljobs	2011-11-20	0	0		#GrantsPass #HealthEducator #jobs #job #GetAllJobs		https://twitter.com/GetHeaEducaJobs/status/138433261952172033
137499143970103296	80DeepBeats	 techn ne somebody plz help mama got problem diabetes dont seem healthy everything deponds ninna fame hittin dantez sr	2011-11-18	0	0	@TechN9ne			https://twitter.com/80DeepBeats/status/137499143970103296
136123973128822784	gunsandbows	 wearing blue today honor international diabetes awareness day	2011-11-14	0	0				https://twitter.com/gunsandbows/status/136123973128822784
131392934808526848	MaddieSuller	 type diabetes always feel hungry	2011-11-01	0	0		#diabetes		https://twitter.com/MaddieSuller/status/131392934808526848
130651903410454528	GetHeaEducaJobs	 diabetes educator rn medford http tinyurlcom x dgac get health educator jobs healtheducator jobs job getalljobs	2011-10-30	0	0		#Medford #HealthEducator #jobs #job #GetAllJobs		https://twitter.com/GetHeaEducaJobs/status/130651903410454528
126079392035254273	brianagirly	 also heart attack flavorrt noreservations misread paula deen selling diabetes flavored lip balm http mylocmenazni	2011-10-17	0	0	@NoReservations			https://twitter.com/brianagirly/status/126079392035254273
115979086836416513	Dezcrez	 type diabetes could precursor alzheimers scary	2011-09-19	0	0				https://twitter.com/Dezcrez/status/115979086836416513
109309671784976385	kateAmitch	 thumbs up baileyeckert chubby isnt cute leads type diabetes billboard ga keepinitreal 	2011-09-01	0	0	@baileyeckert	#KeepinItReal		https://twitter.com/kateAmitch/status/109309671784976385
107536282141470720	rasaveli	 diabetes life laughing planet caf http instagramplbj_j	2011-08-27	0	0	@Laughing			https://twitter.com/rasaveli/status/107536282141470720
86099249762283520	GetHeaEducaJobs	 diabetes nurse educator siletz httptinyurlcom woewbd get health educator jobs healtheducator jobs job getalljobs	2011-06-29	0	0		#Siletz #HealthEducator #jobs #job #GetAllJobs		https://twitter.com/GetHeaEducaJobs/status/86099249762283520
77586389222428672	ElyMakaveli	 sex least per week lower mans risk heart disease stroke diabetes sextistics	2011-06-06	0	0		#Sextistics		https://twitter.com/ElyMakaveli/status/77586389222428672
76072314806091776	KisakiW	 two preceptors information materials smoking cessation alternative medications hopefully diabetes take bp sweet	2011-06-01	0	0				https://twitter.com/KisakiW/status/76072314806091776
62358401090461697	drewaspinwall	 type ii diabetes come and total httptwitpiccom p xu 	2011-04-24	0	0				https://twitter.com/drewaspinwall/status/62358401090461697
50728518694354944	Alainabelles	 chickabee diabetes apparently cant control myself	2011-03-23	0	0	@chickabee22			https://twitter.com/Alainabelles/status/50728518694354944
50489347430035457	VonQuale	 latenight diabetes supply commercials and meter even talks your blood glucose level is robotic good night mr 	2011-03-23	0	0				https://twitter.com/VonQuale/status/50489347430035457
40520834887979008	kirbly	 someone called repeatedly regards james diabetes mom said james cant wake up shes evil	2011-02-23	0	0				https://twitter.com/kirbly/status/40520834887979008
32147375233433600	97404	 nutrientdense foods rescue diabetes epidemic httpbitlygz xna	2011-01-31	0	0				https://twitter.com/97404/status/32147375233433600
27494523030474752	KisakiW	 got approved stick someone elses finger besides glucose meter diabetes screencool go ossp meeting hhmmm	2011-01-18	0	0				https://twitter.com/KisakiW/status/27494523030474752
24641557298679809	KisakiW	 take little nap afternoon since latestudying diabetes ophthalmic drugs rice crackers cheese yum	2011-01-10	0	0				https://twitter.com/KisakiW/status/24641557298679809
34225141126795264	topix_or	 bmc offers type diabetes screening family httpbitlyf jt bend oregon	2011-02-06	0	0		#Bend #Oregon		https://twitter.com/topix_or/status/34225141126795264
80425075504975872	MedicalBrief	 wapost medical mystery alcoholism didnt cause mans diabetes cirrhosis medical emergency shor httpwapostk j 	2011-06-13	0	0		#diabetes		https://twitter.com/MedicalBrief/status/80425075504975872
151418103786512385	BigDSully4	 thatsahnowchick would diabetes get quicker hahaha	2011-12-26	0	0	@ThatSahnowChick			https://twitter.com/BigDSully4/status/151418103786512385
138689407992602624	umselenur	 math questions stupid theyre like if chocolate bars eat have dont know diabetes maybe	2011-11-21	0	0				https://twitter.com/umselenur/status/138689407992602624
86099249762283520	GetHeaEducaJobs	 diabetes nurse educator siletz httptinyurlcom woewbd get health educator jobs healtheducator jobs job getalljobs	2011-06-29	0	0		#Siletz #HealthEducator #jobs #job #GetAllJobs		https://twitter.com/GetHeaEducaJobs/status/86099249762283520
31638228880596992	jawss41198	 thank following me check wwwgenomedcom know anyone type diabetes contact dr moskowitz	2011-01-30	0	0				https://twitter.com/jawss41198/status/31638228880596992
148576880398839808	GetAdvSalesJobs	 portland or diabetes portland http tinyurlcom wehnhq get advertising sales jobs advertisingsales jobs job getalljobs	2011-12-18	0	0		#Portland #AdvertisingSales #jobs #job #GetAllJobs		https://twitter.com/GetAdvSalesJobs/status/148576880398839808
148130972037165057	GetTelemarkJobs	 portlandor diabetes sales portland http tinyurlcomd lygpp get telemarketing jobs telemarketing jobs job getalljobs	2011-12-17	0	0		#Portland #Telemarketing #jobs #job #GetAllJobs		https://twitter.com/GetTelemarkJobs/status/148130972037165057
139415955938885632	hkevp66	 erinandrews thats got diabetes	2011-11-23	0	0	@ErinAndrews			https://twitter.com/hkevp66/status/139415955938885632
131180507978412032	Linnea207	 probably develop earlyonset diabetes dont get trickortreaters soon candyoverload halloween	2011-10-31	0	0		#candyoverload #halloween		https://twitter.com/Linnea207/status/131180507978412032
131119715161612291	JordanRPDX	 travis redrobinburgers trick get type diabetes 	2011-10-31	0	0	@travis0728 @redrobinburgers			https://twitter.com/JordanRPDX/status/131119715161612291
123520928297648128	GetHeaEducaJobs	 diabetes health educator portland http tinyurlcom zoevn get health educator jobs healtheducator jobs job getalljobs	2011-10-10	0	0		#Portland #HealthEducator #jobs #job #GetAllJobs		https://twitter.com/GetHeaEducaJobs/status/123520928297648128
121076546025955329	GetHeaEducaJobs	 registered nurse diabetes portland http tinyurlcom r jnga get health educator jobs healtheducator jobs job getalljobs	2011-10-04	0	0		#Portland #HealthEducator #jobs #job #GetAllJobs		https://twitter.com/GetHeaEducaJobs/status/121076546025955329
120128022199271424	GetHeaEducaJobs	 registered nurse diabetes portland http tinyurlcom pvegyd get health educator jobs healtheducator jobs job getalljobs	2011-10-01	0	0		#Portland #HealthEducator #jobs #job #GetAllJobs		https://twitter.com/GetHeaEducaJobs/status/120128022199271424
119993653237256192	GetHeaEducaJobs	 registered nurse diabetes portland http tinyurlcom o yl f get health educator jobs healtheducator jobs job getalljobs	2011-10-01	0	0		#Portland #HealthEducator #jobs #job #GetAllJobs		https://twitter.com/GetHeaEducaJobs/status/119993653237256192
106150533106110465	LilMelch_	 hahahaha cyber bullying commercial got cut diabetes commercial fatassdiabetics cyberbullyingfats	2011-08-23	0	0		#fatassdiabetics #cyberbullyingfats		https://twitter.com/LilMelch_/status/106150533106110465
102497958431424513	geo_feil	 ezmobius diagnosed carbohydrate intolerance years ago cutting sugar white flour helped prevent diabetes 	2011-08-13	0	0	@ezmobius			https://twitter.com/geo_feil/status/102497958431424513
96998684822216704	Allyson13	 diabetes numbers look good doc thinks nausea meds knee made appt ortho omw work tgif	2011-07-29	0	0		#diabetes #TGIF		https://twitter.com/Allyson13/status/96998684822216704
92753018491125760	GetHeaEducaJobs	 resource nurse diabetes e portland httptinyurlcom z gr v get health educator jobs healtheducator jobs job getalljobs	2011-07-17	0	0		#Portland #HealthEducator #jobs #job #GetAllJobs		https://twitter.com/GetHeaEducaJobs/status/92753018491125760
81386668661280768	rafia_dental	 type diabetes nasal vaccine horizon httpbitlyl un fb	2011-06-16	1	0		#fb		https://twitter.com/rafia_dental/status/81386668661280768
80720540175839233	OregonAGD	 rt amdiabetesassn living type diabetes program newly diagnosed brings free info support http bitlymqwv k fb	2011-06-14	0	0	@AmDiabetesAssn	#fb		https://twitter.com/OregonAGD/status/80720540175839233
80628671727140864	Raisin_chickens	 unhealthy marketing kfc buy halfgallon soda buck goes juvenile diabetes research foundation http hufftomruonj	2011-06-14	0	0		#KFC		https://twitter.com/Raisin_chickens/status/80628671727140864
77875602509660161	97225	 beaverton briefs trade schools raleigh hills community fair dogs diabetes httpbitlykyjasl via httpoutsidein 	2011-06-06	0	0				https://twitter.com/97225/status/77875602509660161
68404931727601664	randybossert1	 lechugajs least diabetes gone	2011-05-11	0	0	@lechugajs			https://twitter.com/randybossert1/status/68404931727601664
55901122644291584	bailey_griffith	 diabetes hurts http yfrogcomh g zzdj	2011-04-07	0	0				https://twitter.com/bailey_griffith/status/55901122644291584
54309301547831296	tundranaut	 good news certain loved one tells diabetes my imagination	2011-04-02	0	0				https://twitter.com/tundranaut/status/54309301547831296
51337870979506176	Mathiesj	 im hopped caffeine humming disney songsgo me ohsu schnitzer diabetes health center pic http sqcomfzsg h	2011-03-25	0	0	@OHSU			https://twitter.com/Mathiesj/status/51337870979506176
39395025045569536	tundranaut	 jackiebaisa its compounded antiscience partner doesnt seem think diabetes real disease real symptoms	2011-02-20	0	0	@JackieBaisa			https://twitter.com/tundranaut/status/39395025045569536
32550451241033728	marginalchaos	 sitting phe bored teacher refuses see link gluten type ii diabetes	2011-02-01	0	0				https://twitter.com/marginalchaos/status/32550451241033728
30047810720112641	Redjakk	 catastrophic heart disease diabetes rates symptoms freedom get kitchen michelle obama	2011-01-25	0	0				https://twitter.com/Redjakk/status/30047810720112641
29984421587193856	tundranaut	 doctor today diabetes leads heart disease causes death want avoid death death bloodsugar	2011-01-25	0	0		#Death #BloodSugar		https://twitter.com/tundranaut/status/29984421587193856
29788544469831680	TheScottCSmith	 nigel called us curious cocktail inbreeding type diabetes psych	2011-01-25	0	0		#psych		https://twitter.com/TheScottCSmith/status/29788544469831680
120485358847799297	annusashanneb	 yeah its morning im up diabetes walk volunteer know gotta time hooray iguess	2011-10-02	0	0		#hooray #iguess		https://twitter.com/annusashanneb/status/120485358847799297
120360540265660416	annusashanneb	 yaaayyyy diabetes walk tomorrow curediabetes	2011-10-02	0	0		#curediabetes		https://twitter.com/annusashanneb/status/120360540265660416
106150533106110465	LilMelch_	 hahahaha cyber bullying commercial got cut diabetes commercial fatassdiabetics cyberbullyingfats	2011-08-23	0	0		#fatassdiabetics #cyberbullyingfats		https://twitter.com/LilMelch_/status/106150533106110465
77875602509660161	97225	 beaverton briefs trade schools raleigh hills community fair dogs diabetes httpbitlykyjasl via httpoutsidein 	2011-06-06	0	0				https://twitter.com/97225/status/77875602509660161
77875601662414849	97223	 beaverton briefs trade schools raleigh hills community fair dogs diabetes httpbitlym txrl via httpoutsidein 	2011-06-06	0	0				https://twitter.com/97223/status/77875601662414849
30055580093644800	anthonypants	 rt redjakk catastrophic heart disease diabetes rates symptoms freedom get kitchen michelle obama	2011-01-25	0	0	@Redjakk			https://twitter.com/anthonypants/status/30055580093644800
78201626648772608	97222	 health news flavorful glutenfree foods debated diabetes risk diet draws scrutiny httpbitlykf yfb via httpoutsidein 	2011-06-07	0	0				https://twitter.com/97222/status/78201626648772608
119648253414350848	andyfoxsays	 chrisdelia whitneycummings show makes want die diabetes thanks	2011-09-30	0	0	@chrisdelia @whitneycummings			https://twitter.com/andyfoxsays/status/119648253414350848
149581391615623168	Locabella01	 veryrudetweets diabetes another way saying became fat bastard longer trusted mayonaise lmfao	2011-12-21	0	0	@VeryRudeTweets			https://twitter.com/Locabella01/status/149581391615623168
132649630612729856	Allyson13	 rt eonstweets november national diabetes awareness month http dldbzax tx	2011-11-04	0	0	@EonsTweets			https://twitter.com/Allyson13/status/132649630612729856
132509358381731840	Allyson13	 doc appt went well eliminating glyberide morn keep night lantus morn diabetes	2011-11-04	0	0		#diabetes		https://twitter.com/Allyson13/status/132509358381731840
131119715161612291	JordanRPDX	 travis redrobinburgers trick get type diabetes 	2011-10-31	0	0	@travis0728 @redrobinburgers			https://twitter.com/JordanRPDX/status/131119715161612291
129611662289412096	Allyson13	 insulin meeting went well dont need anymore follow ups whee diabetes	2011-10-27	0	0		#diabetes		https://twitter.com/Allyson13/status/129611662289412096
120525038716850176	icwhite01	 juvenile diabetes walk oaks amusement park http sqcomnizaqe	2011-10-02	0	0	@Oaks			https://twitter.com/icwhite01/status/120525038716850176
120507488662585345	annusashanneb	 lets find cure diabetes today http yfrogcomkhr wzlej	2011-10-02	0	0				https://twitter.com/annusashanneb/status/120507488662585345
113415398107529217	Allyson13	 blood glucose dinner hopefully indicates downward trend diabetes	2011-09-12	0	0		#diabetes		https://twitter.com/Allyson13/status/113415398107529217
96998684822216704	Allyson13	 diabetes numbers look good doc thinks nausea meds knee made appt ortho omw work tgif	2011-07-29	0	0		#diabetes #TGIF		https://twitter.com/Allyson13/status/96998684822216704
95603531578474496	mrkoffee	 jacthong follow youd like dm ask anything diabetes research project	2011-07-25	0	0	@jacthong	#diabetes		https://twitter.com/mrkoffee/status/95603531578474496
78620810469838848	Allyson13	 gyn appt over irritation possibly menopause diabetes prescribed topical steroid follow two weeks	2011-06-08	0	0				https://twitter.com/Allyson13/status/78620810469838848
72714861993402369	SkylorPowell	 okay pdx getting vitamin d deficiency correlated diabetes arthritis ms among others httpbitlylpnzof	2011-05-23	0	0		#pdx		https://twitter.com/SkylorPowell/status/72714861993402369
64476875803738112	brianmario	 order diabetes go voodoo doughnut httpinstagrampduw h	2011-04-30	0	0	@Voodoo			https://twitter.com/brianmario/status/64476875803738112
55901122644291584	bailey_griffith	 diabetes hurts http yfrogcomh g zzdj	2011-04-07	0	0				https://twitter.com/bailey_griffith/status/55901122644291584
54309301547831296	tundranaut	 good news certain loved one tells diabetes my imagination	2011-04-02	0	0				https://twitter.com/tundranaut/status/54309301547831296
39395025045569536	tundranaut	 jackiebaisa its compounded antiscience partner doesnt seem think diabetes real disease real symptoms	2011-02-20	0	0	@JackieBaisa			https://twitter.com/tundranaut/status/39395025045569536
35871226874306561	RedPilledRebel	 national get diabetes day starbucks customers want little coffee syrup sugarbucks fb	2011-02-10	0	0	@Starbucks	#sugarbucks #fb		https://twitter.com/RedPilledRebel/status/35871226874306561
31949757299564544	michaelavishay	 sex diabetes predicament lives snowcatrawrr	2011-01-31	0	1	@snowcatrawrr			https://twitter.com/michaelavishay/status/31949757299564544
29984421587193856	tundranaut	 doctor today diabetes leads heart disease causes death want avoid death death bloodsugar	2011-01-25	0	0		#Death #BloodSugar		https://twitter.com/tundranaut/status/29984421587193856
29788544469831680	TheScottCSmith	 nigel called us curious cocktail inbreeding type diabetes psych	2011-01-25	0	0		#psych		https://twitter.com/TheScottCSmith/status/29788544469831680
152466943151050752	irishboyblu	 im legacy mount hood wound diabetes clinic se stark st troutdale troutdale http sqcomrfjagv	2011-12-29	0	0		#201		https://twitter.com/irishboyblu/status/152466943151050752
151417164270809088	irishboyblu	 im legacy mount hood wound diabetes clinic se stark st troutdale troutdale http sqcomrupgx 	2011-12-26	0	0		#201		https://twitter.com/irishboyblu/status/151417164270809088
150341698705293314	irishboyblu	 im legacy mount hood wound diabetes clinic se stark st troutdale troutdale http sqcomuln tv	2011-12-23	0	0		#201		https://twitter.com/irishboyblu/status/150341698705293314
149611841843245056	irishboyblu	 im legacy mount hood wound diabetes clinic se stark st troutdale troutdale http sqcomurmbsg	2011-12-21	0	0		#201		https://twitter.com/irishboyblu/status/149611841843245056
148869310671106048	irishboyblu	 im legacy mount hood wound diabetes clinic se stark st troutdale troutdale http sqcomuaiygn	2011-12-19	0	0		#201		https://twitter.com/irishboyblu/status/148869310671106048
147794892100337664	irishboyblu	 im legacy mount hood wound diabetes clinic se stark st troutdale troutdale http sqcomtbp px	2011-12-16	0	0		#201		https://twitter.com/irishboyblu/status/147794892100337664
147062217936867328	irishboyblu	 im legacy mount hood wound diabetes clinic se stark st troutdale troutdale http sqcomuq b a	2011-12-14	0	0		#201		https://twitter.com/irishboyblu/status/147062217936867328
147062217551003648	irishboyblu	 became mayor legacy mount hood wound diabetes clinic foursquare http sqcomufawwc	2011-12-14	0	0	@foursquare			https://twitter.com/irishboyblu/status/147062217551003648
145287491337981952	irishboyblu	 im legacy mount hood wound diabetes clinic se stark st troutdale troutdale http sqcomt qcpw	2011-12-09	0	0		#201		https://twitter.com/irishboyblu/status/145287491337981952
115900451009986560	SocksWthSandals	 mewie history diabetes family	2011-09-19	0	0	@Mewie			https://twitter.com/SocksWthSandals/status/115900451009986560
149581391615623168	Locabella01	 veryrudetweets diabetes another way saying became fat bastard longer trusted mayonaise lmfao	2011-12-21	0	0	@VeryRudeTweets			https://twitter.com/Locabella01/status/149581391615623168
